"uuid","repository link","title","author","contributor","publication year","abstract","subject topic","language","publication type","publisher","isbn","issn","patent","patent status","bibliographic note","access restriction","embargo date","faculty","department","research group","programme","project","coordinates"
"uuid:1099fc42-31f3-442e-959e-1ae7ba7cd0a5","http://resolver.tudelft.nl/uuid:1099fc42-31f3-442e-959e-1ae7ba7cd0a5","Biosensor based on enzyme labeling and redox cycling","Ruijg, J.M.","van Turnhout, J. (mentor); Grüll, H. (mentor); Megens, M. (mentor); Hagen, W.R. (mentor)","2003","Molecular diagnostics (MDx) covers the analysis of bio-molecules to screen, diagnose and monitor human health and to assess potential health risks. It refers to sub-cellular, in some cases cellular, technologies that use different kind of biomolecules, e.g. proteins, DNA, RNA, or hormones for diagnostic testing. Commonly, MDx techniques exploit the strong and specific interaction of biomolecules, where for example antibody-antigen interaction or the hybridization of two complementary nucleic acid molecules are mostly used. In the past MDx was dominated by immunoassays to measure protein markers or hormone levels. Most protein and hormone based markers, which are routinely used today, have in blood concentrations in the µmol/L to pmol/L range. This concentration range can be reliably measured with today's MDx technology in centralized laboratories. However, clinical research indicates that many more biomolecules with a concentration in the range of pmol/L to fmol/L or even lower may be of clinical relevance as markers for certain diseases. This low concentration range is not directly assessable with current biomolecular detection technology…","","en","master thesis","","","","","","","","","Applied Sciences","Chemical Technology / Biotechnology","","","",""
"uuid:d9bf549e-f1a3-4a9d-ad42-bd03bf9d7857","http://resolver.tudelft.nl/uuid:d9bf549e-f1a3-4a9d-ad42-bd03bf9d7857","Testing in a Component Based Development Environment. An effective approach to the testing process of component based software systems.","Boerema, T.E.J.","Wagenaar, R.W. (mentor); Dahanayake, A.N.W. (mentor); Van den Berg, W.G. (mentor); CMG (contributor)","2003","","","","master thesis","","","","","","","Campus only","","Technology, Policy and Management","","","","",""
"uuid:bce747a8-6025-406a-91a9-6ba09eb1d7c1","http://resolver.tudelft.nl/uuid:bce747a8-6025-406a-91a9-6ba09eb1d7c1","Competition in International Mobile Roaming","Hylkema, R.","Dik, W. (mentor); Ubacht, J. (mentor); Cunningham, S.W. (mentor); OPTA (contributor)","2003","","","","master thesis","","","","","","","","","Technology, Policy and Management","","","","",""
"uuid:f69f8047-73ec-463b-ab77-2314cdc14f1e","http://resolver.tudelft.nl/uuid:f69f8047-73ec-463b-ab77-2314cdc14f1e","Uitvoeringsrisico¿s van de bouwkuipwanden onder Amsterdam","Van der Sloot, M.","Vrijling, J.K. (mentor); Van den Berg, A.A.N. (mentor); Everts, H.J. (mentor); Van Gelder, P.H.A.J.M. (mentor); Ten Hove, T.D. (mentor); De Vries, G.B. (mentor)","2003","In de complexe situatie van een groot openbaar vervoersknooppunt en de aanwezigheid van een monumentaal stationsgebouw worden er zeer hoge eisen gesteld aan het ontwerp en de uitvoering van de bouwkuip ten behoeve van de Noord/Zuidlijn onder het Amsterdam Centraal Station. In deze bouwkuip zal er een tunnelelement invaren en afgezonken worden, die dienst zal doen als metrotunnel. Door het uitvoeren van een risicoanalyse zijn de bedreigingen van het ontwerp en de uitvoering geentariseerd en is er de onderlinge samenhang van de risicos binnen het systeem onderzocht. Hieruit bleek dat er zeer veel bedreigingen gerelateerd zijn aan de waterdichtheid van de bouwkuipwanden. Het besteksontwerp van de buispalenwanden onder het emplacement is vanwege de risicos met betrekking tot de waterremmendheid vervangen is door een alternatieve, innovatieve uitvoeringsmethode. Deze nieuw ontwikkelde uitvoeringstechniek, de microtunnellingmethode, is nog niet eerder op deze wijze toegepast: met behulp van een verticaal opgestelde schildboormachine worden de buispalen op diepte gebracht. Deze alternatieve buispalenwand is daarom geanalyseerd met een Monte Carlo model, waarbij het aantal optredende lekkages bepaald wordt. De kern van de waterkerendheid van de buispalenwand is de stalen slotverbinding die zich tussen de buispalen bevindt. In het Monte Carlo model worden de toleranties van het slot getoetst aan de hand van plaatsafwijkingen en scheefstand van de individuele buispalen. Het verwachte aantal lekkages in de gehele buispalenwand wordt geschat op drie. Evan de belangrijkste aannamen van het model is het onafhankelijke gedrag van de buispalen tijdens het aanbrengen. In werkelijkheid zullen deze elkaar wel beloeden als gevolg van geleiding van de paal tijdens het inbrengen door de koppelsloten en de aanpassing van de paalplaats aan de reeds geplaatste aansluitende palen. De verwachtingswaarde voor het aantal gaten zal dan lager uitkomen. Ondanks dat de microtunnellingmethode een nieuwe, innovatieve uitvoeringstechniek is die nog niet toegepast is op deze wijze, lijkt de buispalenwand aangebracht middels deze microtunnellingmethode volgens het Monte Carlo-model veelbelovend om op deze wijze toe te passem onder het Amsterdam Centraal Station, mits er nog een aantal zaken onderzocht worden, zoals de slottoleranties, de beheersbaarheid van de buisrotatie en de afhankelijke plaats van de mannelijke buispalen in het model. Op basis van de gevoeligheidsanalyse van de getoetste variabelen in het model, wordt aanvullend onderzoek om de microtunnellingmethode te verbeteren aanbevolen voor de volgende twee parameters: de mogelijkheden voor controleerbaarheid en stuurbaarheid van de rotatie van de buispaal om zijn eigen as De slotsterkte en geleidingseigenschappen zijn niet in het model getoetst. In deze parameters zit nog reservecapaciteit, zoals (plastische) vervorming, totdat er daadwerkelijk functieverlies van de slotverbinding optreedt. Deze slottoleranties zouden nog verder onderzocht moeten worden. Ook zal het model aangepast moeten worden met betrekking tot de plaatsing van de mannelijke buispalen die afhankelijk zijn van de aansluitende vrouwelijke buispalen om tot een betere kansbenadering van het aantal lekkages te komen. Daarnaast dienen er een aantal noodscenarios opgesteld te worden om de gevolgen van een lekkage, die zich onverhoopt tijdens van de verschillende fases kan voordoen, te beperken, waarbij vooral aandacht besteed moet worden aan de positie van de pontons tijdens het afzinken.","","nl","master thesis","TU Delft, Faculty of Civil Engineering and Geosciences, Hydraulic Engineering","","","","","","","","Civil Engineering and Geosciences","","","","",""
"uuid:498a254f-9985-4838-a6a7-c6fce725b046","http://resolver.tudelft.nl/uuid:498a254f-9985-4838-a6a7-c6fce725b046","Duinveiligheid van de kust van Noord-Holland, nabij het zeegat van Texel: Een probalistische uitwerking volgens de methode ""De Haan""","Mus, A.D.","Stive, M.J.F. (mentor); Van Gelder, P.H.A.J.M. (mentor); Cleveringa, J. (mentor); Elias, E.P.L. (mentor); Huisman, P. (mentor)","2003","In Nederland bestaat 81% van de primaire waterkeringen uit duinen. Deze duinen worden in de huidige praktijk beoordeeld op veiligheid aan de hand in 1984 opgestelde 'Leidraad voor de beoordeling van de veiligheid van duinen als waterkering' [TAW, 1984], welke de ontwerp-duinafslag met een overschrijdingsfrequentie van eens per 100.000 jaar berekend. Door toegenomen inzichten in duinafslagbepalende factoren blijkt deze leidraad belangrijke factoren te verwaarlozen. Stormduur, piekperiode en tijdsafhankelijkheid van de processen worden niet meegenomen in de berekening. Tevens wordt in de praktijk geen rekening gehouden met de aanwezigheid van een platen en geulengebied voor de kust en wordt gerekend met diep-water randvoorwaarden. De doelstelling van dit rapport is het berekenen van de veiligheid van de duinen nabij het zeegat van Texel, waarbij de bezwaren van de huidige leidraad weggenomen worden. Er wordt daarbij gebruik gemaakt van de probabilistische methode 'De Haan' [van Marle, J.G.A., 2000] om de frequentieverdeling van de duinafslag te bepalen. Deze methode wordt thans gebruikt om dijken te ontwerpen. De basis van de methode De Haan is een dataset van simultaan gemeten stormparameters op diep water, bestaande uit windsnelheid, golfhoogte, waterstand en piekperiode. Door het aantonen van asymptotische afhankelijkheid tussen de stormparameters is het mogelijk om deze stormparameters te extrapoleren naar extreme waarden. Doordat er een opdeling is gemaakt naar stormrichting zijn er verbanden aangetoond tussen stormduren en de overige parameters zodat ook de stormduur meegenomen wordt in de uitwerking volgens 'De Haan'. De uitwerking is een case-studie waarbij een buitendelta aanwezig is. Het golfveld dat ter plaatse tijdens extreme situaties optreedt is berekend met het golfmodel SWAN [Holthuijsen, L.H., e.a., 2000]. De duinafslag is vervolgens berekend met het tijdsafhankelijke duinafslagprogramma DUROSTA [Steetzel, H.J., 1993]. De volgende conclusies zijn getrokken: De veiligheid van de duinen, berekend met de methode De Haan, is groter dan de wet vereist. De duinen ter plaatse zijn breed en hoog genoeg om stormen te kunnen weerstaan met een overschrijdingsfrequentie die kleiner is dan eens per 100.000 jaar. De invloed van de buitendelta op het golfveld is groot. Ten opzichte van diep water is de significante golfhoogte nabij de kust met zon 50% afgenomen. De methode 'De Haan' is een bruikbare methode om een duinverdediging te toetsen. De resultaten geven helder de duinafslag weer bij elke overschrijdingsfrequentie. Door het gebruik van het tijdsafhankelijke duinafslagmodel DUROSTA is het mogelijk om de stormduur in de berekening op te nemen, welke een belangrijke duinafslagbepalende factor is.","","nl","master thesis","TU Delft, Faculty of Civil Engineering and Geosciences, Hydraulic Engineering","","","","","","","","Civil Engineering and Geosciences","Hydraulic Engineering","","","",""
"uuid:32a11123-0ba1-4691-b83f-8fe5c39d974c","http://resolver.tudelft.nl/uuid:32a11123-0ba1-4691-b83f-8fe5c39d974c","Schade veroorzaakt door boegschroeven van manoeuvrerende schepen bij verticale kademuren","De Jong, M.","Verhagen, H.J. (mentor); Fontijn, H.L. (mentor)","2003","","","nl","master thesis","TU Delft, Faculty of Civil Engineering and Geosciences, Hydraulic Engineering","","","","","","","","Civil Engineering and Geosciences","","","","",""
