"uuid","repository link","title","author","contributor","publication year","abstract","subject topic","language","publication type","publisher","isbn","issn","patent","patent status","bibliographic note","access restriction","embargo date","faculty","department","research group","programme","project","coordinates"
"uuid:eb91db81-587c-48f5-a570-321666a7dc75","http://resolver.tudelft.nl/uuid:eb91db81-587c-48f5-a570-321666a7dc75","Comparison of optical inter-domain routing protocols in the presence of wavelength converters","Huy, T.D.","Beshir, A.A. (mentor); Kuipers, F.A. (mentor)","2009","The success of optical technology has introduced a new future for the Internet. With the many advantages of optical technology, multimedia applications which require strict quality of service(QoS) are able to be guaranteed in an optical network. Unfortunately, the optical technology still have some limits in setting up a connection. One of these limits is that a lightpath must use the same wavelength on all the links along its path from source to destination in an optical network without wavelength converters. This limit influents the resource utilization. In an optical network, wavelength converters are used to overcome this limit so they will help to improve the efficiency of the resource utilization. However, because of their expensiveness, a limited number of wavelength converters are usually used at some routers in optical networks. Many researchers have been working on multi-domain routing protocol for optical networks. In this thesis, we will implement and evaluate the performance of three optical inter-domain protocols in an optical network with wavelength converters. In particular three protocols which are discussed in dept are: Optical Border Gateway Protocol (OBGP), Optical Border Gateway Protocol Plus (OBGP+) and IDRA-based Routing Protocol (IDRA protocol). By building the simulations for each protocol in OPNET, we compare the performance of the three protocols based on two metrics: the blocking ratio of inter-domain lightpath requests and the overall number of routing messages to archive this blocking ratio. Moreover, we also evaluate the efficiency of wavelength converters in an optical network.","optical networks; wavelength converters; optical inter-domain routing protocol","en","master thesis","","","","","","","","2009-06-30","Electrical Engineering, Mathematics and Computer Science","Computer Engineering","","","",""
"uuid:5e801af7-b006-478d-8b13-3f6f55ecff6a","http://resolver.tudelft.nl/uuid:5e801af7-b006-478d-8b13-3f6f55ecff6a","Study on optimal Trajectories and Energy Management Capabilities of a Winged Re-Entry Vehicle during the Terminal Area","De Ridder, S.","Mooij, E. (mentor)","2009","The unpowered entry of a winged re-entry vehicle, such as the HORUS-2B, consists of a hypersonic atmospheric re-entry phase, a Terminal Area Energy Management (TAEM) phase and a approach and landing phase. The TAEM is the subject of this thesis study. During the TAEM, the vehicle is brought to the correct interface position with the landing phase, on the extension of the centerline of the runway with the correct amount of energy and the correct heading. The most characteristic feature of the TAEM phase is the so-called Heading Alignment Cylinder (HAC). The vehicle performs a turn around the HAC to align with the runway. During actual re-entry flights, flight conditions at the beginning of the terminal area will not always be nominal and several variations in entry position, energy, heading angle and flight-path angle can occur. Therefore, the main question of this thesis work is formulated as: Can the safe return of a winged re-entry vehicle through the terminal area be guaranteed for a wide range of initial conditions?","TAEM; genetic algorithm; Energy management; winged re-entry vehicle; optimal trajectories","en","master thesis","","","","","","","","2009-10-01","Aerospace Engineering","Earth Observation and Space Systems","","","",""
"uuid:f98d2c87-e564-4cf4-a9ab-aeeccceefa38","http://resolver.tudelft.nl/uuid:f98d2c87-e564-4cf4-a9ab-aeeccceefa38","Fault Detection for the Delfi Nanosatellite Programme","Cornejo, N.E.B.","Gaydadjiev, G. (mentor); Bertels, K. (mentor); Verhoeven, C. (mentor); Wong, S. (mentor); Amini, R. (mentor)","2009","","","en","master thesis","","","","","","","","","Electrical Engineering, Mathematics and Computer Science","Computer Engineering","","","",""
"uuid:035517dd-c0f0-4f58-afa5-8b1bc672fc5c","http://resolver.tudelft.nl/uuid:035517dd-c0f0-4f58-afa5-8b1bc672fc5c","Low Frequency Waves in the Shoaling and Nearshore Zone","Daly, C.J.","Roelvink, J.A. (mentor); Van Dongeren, A.R. (mentor); Van Thiel de Vries, J.S.M. (mentor); McCall, R.T. (mentor); Labeur, R.J. (mentor); Stive, M.J.F. (mentor)","2009","It has been found by many researchers that low frequency (LF) waves dominate the wave energy spectrum in very shallow water. Given that many longshore and cross-shore morphological processes are located within this zone, LF waves play an important role in determining morphological change, especially dune erosion and overwash during storm events. The numerical model, XBeach [Roelvink et al. (2008)], has been developed to simulate such morphological processes which are influenced by LF waves. For hydrodynamics, it utilizes the wave forcing determined from a second generation wave module to drive linearized shallow water equations within a flow module. The objective of this thesis focuses on validating the hydrodynamics of XBeach with particular attention paid to the estimated LF waves. This is particularly important to correctly estimate morphological changes, as it is highly dependent on the accurate representation of waves and currents. In the validation study, XBeach is used to replicate the flume experiment of van Noorloos [2003] in which bichromatic and irregular wave conditions are imposed on a plane sloping beach. The advantage of using this experiment is that measurements have a high spatial resolution, allowing for decomposition into incoming and outgoing wave components. Group-varying time-averaged short wave parameters are used to investigate the accuracy of the short wave module in XBeach, while at the same time the relationship between the short waves and LF waves are determined by looking at the energy transfer to and from the LF components. The results confirm many previous findings, such as the plus 180 degree phase difference between the short wave envelope and the bound LF wave, the dominance of LF wave energy in shallow water and the ability of LF waves to extend their reach to the uppermost parts on a beach. Given the limitations of the assumptions based on linear wave theory, the short wave results from XBeach are quite good, especially when using a newly modified breaker parameterization of Battjes and Janssen [1978] by Roelvink [Pers. Com. 2009]. The main shortfall of the model is that it tends to overestimate the bound LF wave heights in shallow water for irregular waves. This is believed to be partly due to the overestimation of the energy and radiation stresses contained in the short waves in this region. In reality, as waves approach breaking, the non-linearities present in the waves increase, which, during breaking, effectively redistributes energy within the wave spectrum. Since frequency dependent shoaling of short waves is not currently enabled in XBeach, the energy within the HF band may tend to encourage continued shoaling of the LF waves in the surf zone. As such, it is recommended that the current wave action conservation scheme be improved to allow for either reduction or redistribution of the short wave energy during shoaling. Wave run-up as modelled with the linearized shallow water equations is shown to over-steepen the front of the LF wave in the swash zone. This effect is a likely result of the numerical scheme used, which tends to limit the maximum run-up height based on a minimum depth for which a computational grid cell is determined to be wet. In general, XBeach has shown that it is capable of modelling both quantitatively and qualitatively the short wave energy flux and LF wave shoaling and reflection quite will without inducing serious errors from the linear simplifications in the wave module. Wave-current interaction, which was not considered in the modelling, can most likely give even better results if it is successfully incorporated in the model.","low frequency waves; infragravity waves; wave shoaling; wave breaking; energy transfer","en","master thesis","","","","","","","","","Civil Engineering and Geosciences","Hydraulic Engineering","","CoMEM - Coastal and Marine Engineering and Management","",""
"uuid:bfaf4c51-1234-4eff-a5c0-12c982faa8f6","http://resolver.tudelft.nl/uuid:bfaf4c51-1234-4eff-a5c0-12c982faa8f6","Reflection and Diffraction Around Breakwaters","Boshek, M.R.","Verhagen, H.J. (mentor); Van Vledder, G. (mentor); Van Os, J. (mentor); Stive, M.J.F. (mentor)","2009","Diffraction diagrams are frequently utilized by engineers within the feasibility and early design phases of a project. These helpful graphics, based on directional spreading and wavelength, can be used for a number of layouts and angles of incidence. In spite of the tendency to design breakwaters for the fullest dissipation of wave energy, current diffraction diagrams in use are for full reflection. They have a very strict view of the breakwaters themselves; solely an infinitely thin, fully reflecting, vertical breakwater without any transmission or overtopping. This study focuses on the changes to the diffraction patterns once construction aspects related to breakwater reflection are considered. The alteration to diffraction coefficients due to wave spectra variations, both directional and frequency, is examined through the use of theory and advanced modeling systems. It is found that the directional spectrum causes large changes while frequency variation is negligible. This primary driving component is than related to breakwater layout and incident angles. A study of literature related to breakwater reflection is used in advanced computer models to determine where and how much this characteristic contributes to the diffraction pattern. Two separate types of models, phase-resolving and phase-averaging, are used to test breakwater reflection in diffraction modeling. This comparison confirms theoretical assumptions, finds possible faults in current diffraction diagrams, and creates new questions about breakwater tip physics. The full analysis shows that breakwater reflectivity causes little change to the diffraction pattern beyond the area closest to the breakwater. The areas of greatest influence are located at the breakwater tips, which can be associated with reflection off the breakwater’s front face, and along the leeside of the breakwater, which can be attributed to the absorption of the leeside’s reduced reflectivity. Therefore, the need for new, updated diffraction diagrams based on reflectivity is unnecessary. As a secondary objective of this study, the usefulness of using the SWAN modeling program for diffraction studies was examined. This topic is of importance as SWAN is an efficient alternative to more computationally intensive modeling programs. In addition, it is a free software which is universally available. Believed to be incapable of computing rapidly changing wave environments near breakwaters or in harbor situations, SWAN performed diffraction remarkably well for broad directional waves. More narrow directionally spread waves had good accuracy throughout with only minor scaling differences. SWAN, within this study, was unable to replicate the effects of reflection on both sides of a breakwater and therefore was not used for the primary objective.","Diffraction; Reflection; SWAN","en","master thesis","","","","","","","","","Civil Engineering and Geosciences","Hydraulic Engineering","","","",""
"uuid:0fcd09e9-0a0f-4d23-a155-fb03aa8dcbcc","http://resolver.tudelft.nl/uuid:0fcd09e9-0a0f-4d23-a155-fb03aa8dcbcc","A fully differential switched capacitor wavelet filter","Grashuis, M.A.","Serdijn, W.A. (mentor)","2009","","","en","master thesis","","","","","","","","2009-07-04","Electrical Engineering, Mathematics and Computer Science","Microelectronics & Computer Engineering","","","",""
"uuid:cb7b9532-bfd7-4167-ab80-f15f6e65906c","http://resolver.tudelft.nl/uuid:cb7b9532-bfd7-4167-ab80-f15f6e65906c","Médiathèque St. Lazare: Herbestemming voormalig gevangenisziekenhuis uit 1834 naar mediatheek te Parijs","Bulten, W.","Hermkens, A.W. (mentor); Koopman, F.W.A. (mentor)","2009","Herbestemming van een voormalig gevangenisziekenhuis binnen een complexe stedenbouwkundige situatie. Kernpunten: herinrichten stedenbouwkundige context, nieuwe functie in gebouw, synergie oud en nieuw.","Architectuur; Herbestemming; Mediatheek","nl","master thesis","","","","","","","","","Architecture","RMIT","","","",""
"uuid:90b53801-5138-4089-9727-451620c54aef","http://resolver.tudelft.nl/uuid:90b53801-5138-4089-9727-451620c54aef","Architecture of Process: Towards a Theory of Interrelated Processes in Architecture and Music","Ter Weel, T.","Kaminer, T. (mentor); Hauptmann, D. (mentor); Radman, A. (mentor); Sohn, H. (mentor); Robles-Durán, M. (mentor)","2009","How could we grasp the complexity of interrelated processes in space and time in order to intervene in it? How to distinguish elements without losing their relation to others and the whole? These questions reach far beyond the field of architecture and music, however, the isomorphism between music and architecture could reveal some of this before mentioned complexity.","rhythmanalysis; process","en","master thesis","","","","","","","","2009-08-25","Architecture","Urban Asymmetries / Delft School of Design","","","",""
"uuid:c5367f25-b918-4314-a844-3b2073ce73fa","http://resolver.tudelft.nl/uuid:c5367f25-b918-4314-a844-3b2073ce73fa","Brussels Mundaneum: Public Pools","López Andrade, J.E.","Riedijk, M. (mentor); Geers, K. (mentor); Deboutte, N. (mentor); Riedijk, M. (mentor)","2009","Urban Reaction The thesis proposal comes out as a result of seeing the City of Brussels as a Mundaneum. At the beginning of the process, an analysis of the two main axis of the city revealed that the area that is in direct relation with the canal and the actual Harbour is not defined. Which is why, this area was choose as a possible site for the project. Historically speaking, the canal and all the infrastructure that relates with it had been remove in several occasions along time. At present days, the harbour is intended to be moved once again, leaving this area as a vacant space, creating a hole in the city. As an urban reaction, the idea is to keep this empty space which will be generated and give it to the city, creating a new park in the area which will include this location in the structure of parks of Brussels. Furthermore, the project proposes the generation of a new primary element which will border the park in order to avoid the city to invade the space. Public Pools Program The Mundaneum was a project proposed by Paul Oulet, considered as a building that would hold together all the knowledge of the world. As a first reaction to the problem of Mundaneum, it is intended for the primary element to act as a counter project for the other parks of the city. In one hand, all the other important parks are located in the highest points of the topography while the project is proposed for the lowest part of it. Also, the other parks contain buildings that are in direct relation with the expression of power, either political or religious. The thesis proposed a project that will hold a program that is not related with power, but a project for people. As long as one of the main elements of the site is the presence of water, and, that public baths since Roman Empire had always been considered as monuments for people. It was decided that this program was the most suitable for the proposed building. Design Infrastructures are primary elements per excellence because they either can accelerate or retard the urban process. In order to create a primary element in this point it was decided to create a new infrastructure which at the same time will provide a service for the city, it will work with the canal and hold the public program. In order to do this, the thesis proposed to merge in one single element architecture and infrastructure. In this sense, the thesis creates a water treatment plant merged with the program of a public pool. The building takes the water from the canal, purifies it and uses it for the pools, giving the building the spirit of machine that creates its own elemental basis to generate leisure for people. The Building is composed by system of steel truss frame structures created by the repetition and placement of a basic element of 7,5 by 7,5 m, which allows to create a mega structure of 600m long by 260m wide capable to save long distances without support and hold the machinery needed for the infrastructure and to generate the spaces needed for the program. This steel structure composes the main load bearing system, which is revealed in the façade, giving the building the expression of a giant industrial machine. Furthermore, the main load bearing system holds together a serious of substructures that contain the inside spaces and are based on modular systems that come out from the dimensions of the main structure. The substructures change in scale from outside to inside, maintaining the monumentality of the infrastructure to the outside and transforming it to the scale of a building to the inside. At the inside, the process of water purification is revealed becoming part of the public program of the building. Metaphor The expression that was looked for the building is the expression of an old fabric in which the pools become a piece of purified water inside an space which may not be considered as a proper environment for this type of program, the purified pools come as a result of a process of the re use of the polluted water from the canal, as an analogy of how infrastructures generate the base for societies to work. This analogy becomes a metaphor of a Mundaneum, because there is no need for the project to stack pieces of knowledge production because society is the one that produces knowledge demonstrating that it can also be a project devoted for people as long as it creates an absolute outbreak in our traditional way of life, and this project creates that outbreak in an urban, architectural, and programmatic levels.","Mundaneum; Public Pools","en","master thesis","","","","","","","","2009-08-31","Architecture","Architecture","","","",""
"uuid:6ece41e5-3609-45b5-902e-11b4aeca68c9","http://resolver.tudelft.nl/uuid:6ece41e5-3609-45b5-902e-11b4aeca68c9","The Effectiveness of Mangroves in Attenuating Cyclone- induced Waves","Narayan, S.","Ranasinghe, R. (mentor); Suzuki, T. (mentor); Verhagen, H.J. (mentor); Ursem, W.N.J. (mentor); Stive, M.J.F. (mentor)","2009","A study of the effectiveness of mangroves in attenuating cyclone- induced waves was done using the SWAN 40.55MOD numerical model. Hydraulic parameters during extreme events and local mangrove vegetation parameters were estimated for the Kanika Sands mangrove island near the upcoming Dhamra Port in Orissa, India. Simplified generic analyses were first conducted to obtain insights into the characteristics and behaviour of the model and the system. These were used to select relevant scenarios for simulations of actual conditions at the case-study site. The mangroves were found to be effective in reducing wave heights at the port behind the island though the effectiveness is limited by its geometry and distance from the port. The presence of vegetation has a marked effect though the effect of a variation in vegetation density is limited. An optimum cross-shore width range for maximum protection was quantified. The required size of the mangrove patch for maximum wave attenuation under all conditions is 300 to 800 m in the cross-shore direction and around 6 km in the alongshore direction. At present the vegetation is 1.5 km cross-shore by a 4 km alongshore at a maximum with a shape that is slightly different from the optimum. Given the conditions of the area northward expansion is considered more relevant. Vegetation strips around the island seem to be an effective option though the effects of density reductions become important in this case. Model characteristics such as the sensitivity trend of hydraulic parameters and the comparative effects of emergent and submergent vegetation were also investigated. Conclusions regarding model and system characteristics observed during the study were also drawn. Finally, based on the work done recommendations were made regarding mangrove management options for the port and directions for future research in case of further numerical modeling, physical modeling and field studies.","Mangroves; Cyclone; Wave Attenuation; Dhamra Port; Kanika Sands; SWAN","en","master thesis","","","","","","","","","Civil Engineering and Geosciences","Hydraulic Engineering","","CoMEM - Coastal and Marine Engineering and Management","",""
"uuid:f149589e-38c9-4b33-a1b9-b1b96b460e0e","http://resolver.tudelft.nl/uuid:f149589e-38c9-4b33-a1b9-b1b96b460e0e","Urban Asymmetries: ECATEPEC. Proposing alternative urbanities","Lühl, P.","Sohn, H. (mentor); Robles-Duran, M. (mentor); Gremmen, B. (mentor)","2009","Ecatepec, Mexico City presents the challenge of uniform, low-density peri-urban sprawl in the form of privately developed gated communities for the lower income groups. The main objective of this project is to propose alternatives to low-income housing, amplifying local skills and cultural consciousness, facilitating autonomy through local production and trade, as well as creating the possibilities of political manifestation through the strengthening of communal facilities. The wasteland in between the Las Americas gated community and the dried-out Lake Caracol is zoned for industrial use as in its current condition, it is not fit for housing developments due to soil and dust pollution. The proposal is to improve the environmental condition by making the 900 ha former lake productive through water-based agriculture with related processing facilities along its border. The proposed agricultural model is based on chinampas, a pre-Hispanic agricultural system with productive fields within a large body of water, which is still practiced in contemporary Mexico City. This will allow to urbanize the wasteland in order to propose an alternative model for urbanization with 14 000 units, approximately the same as Las Americas. The aim of the architectural design proposal is to develop a new model for urbanization that will counter previously mentioned urban problematics, based on higher urban density, meaning not only volumetric built density, but also mixed functions, less open space and rather more usable public space which will ultimately lead to an increase in density of social relations. Specifically, housing typologies will be developed that relate closely to the production and processing project mentioned above as well as other small-scale commercial activities. Seeing the low density and the mono-functionality of Las Americas, densification and introduction of new planned land uses within its suburban fabric becomes a key strategy. As the priority given to cars is what provides this low density, the proposal is to invade excessive public space of roads through the addition of housing as well as commercial functions. The final objective is to link the existing suburban fabric to the new mid-high density urban development that is proposed above.","urban; mexico; sustainable; social; process","en","master thesis","","","","","","","","","Architecture","Delft School of Design","","","",""
"uuid:11768aa5-d920-4635-bfee-b5909d1480ba","http://resolver.tudelft.nl/uuid:11768aa5-d920-4635-bfee-b5909d1480ba","Availability and Producibility of OPEC Oil","De Groot, P.C.","Groenewegen, J.P.M. (mentor); Correljé, A.F. (mentor); Dijkema, G.P.J. (mentor)","2009","","","","master thesis","","","","","","","Campus only","","Technology, Policy and Management","","","","",""
"uuid:3e08c2fa-3536-4b39-b32f-4a11b2a20f3f","http://resolver.tudelft.nl/uuid:3e08c2fa-3536-4b39-b32f-4a11b2a20f3f","IJ plein grammar","Van der Schans, R.M.","Stuhlmacher, M. (mentor); De Vylder, J. (mentor); Van de Voort, J. (mentor)","2009","a design for a grammar school in Amsterdam-noord","IJ plein; Amsterdam-Noord; School","en","master thesis","","","","","","","","","Architecture","Interiors, buildings and cities","","","",""
