"uuid","repository link","title","author","contributor","publication year","abstract","subject topic","language","publication type","publisher","isbn","issn","patent","patent status","bibliographic note","access restriction","embargo date","faculty","department","research group","programme","project","coordinates"
"uuid:f874600f-7cf3-468e-b6e7-fdadc3441077","http://resolver.tudelft.nl/uuid:f874600f-7cf3-468e-b6e7-fdadc3441077","An experimental and computational investigation of a diffuser augmented wind turbine: With an application of vortex generators on the diffuser trailing edge","Ten Hoopen, P.D.C.","Van der Heiden, K. (mentor); Van Bussel, G.J.W. (mentor)","2009","The Diffuser Augmented Wind Turbine (DAWT) has been studied periodically over the last five decades. It has already been established by the scientific community that the DAWT is superior to conventional bare wind turbines. In spite of this, the DAWT has not gained popularity worldwide due to high manufacturing cost of the diffuser. There are two possibilities to make a DAWT more lucrative; lowering the manufacturing cost or increasing the performance. The present thesis is concerned with the second approach and considers the hypothesis that the generating power of a DAWT can be increased by turbulent mixing of the wake and free stream flow. This mechanism should decrease the diffuser’s exit pressure and consequently increase the mass flow and power. In the present investigation this turbulent mixing is established by placing vortex generators on the diffuser trailing edge. The hypothesis was tested through a series of full scale wind tunnel experiments. The experiments were conducted in the open jet facility of Delft University of Technology in collaboration with Donqi Urban Windmills. It was found that the application of vortex generators on the diffuser trailing edge lead to an increase in power of 9%. Furthermore, in the pursuit of a better understanding of the flow behavior, an inviscid singularity model was formulated. The model uses a surface vorticity technique to simulate the behavior of the diffuser, supplemented with a lifting line approach to model the rotor. It was found that the inviscid model did capture the behavior of the DAWT reasonably well, although when compared to the measurement results it was observed tobe overly optimistic.","Windenergy","en","master thesis","","","","","","","","","Aerospace Engineering","AEWE - Windenergy","","","",""
"uuid:a2463c12-cb30-4052-a5e0-d93b5958b637","http://resolver.tudelft.nl/uuid:a2463c12-cb30-4052-a5e0-d93b5958b637","Kostenoverschrijding bij nieuwbouwprojecten van onderwijsinstellingen voor het primaire onderwijs","Swart, M.A.","Bijleveld, S.W. (mentor); Arkesteijn, M.H. (mentor)","2009","Een onderzoek naar het ontstaan van budgetoverschrijdingen en financiële tekorten, welke de afgelopen jaren hebben geleidt tot kostenoverschrijding bij de nieuwbouw van basisscholen in samenhang met de organisatieprestatie.","kostenoverschrijding basisscholen","nl","master thesis","","","","","","","","2009-10-30","Architecture","Real Estate & Housing","","Real Estate Management","",""
"uuid:28c651a4-b958-4ae5-bf11-7d6d56ceb2cb","http://resolver.tudelft.nl/uuid:28c651a4-b958-4ae5-bf11-7d6d56ceb2cb","A multifunctional energy centre on the Afsluitdijk","Raat, P.A.","Lassen, A.K. (mentor); Tjallingii, S.P. (mentor); Nillesen, A.L. (mentor)","2009","A design for a multifunctional Energy Centre located on the Afsluitdijk based on innovative and experimental technologies on hydraulic engineering and energy. The energy centre on the Afsluitdijk, the separation between salt- and fresh water, is the perfect showcase to show the world the newest possibilities on sustainable technology and dealing with climate change.","","en","master thesis","","","","","","","","","Architecture","Architecture","","","",""
"uuid:6b704757-d85e-4a9f-a60f-0359be407353","http://resolver.tudelft.nl/uuid:6b704757-d85e-4a9f-a60f-0359be407353","Floating Olympic Stadium 2028: The Olympic Games in the Netherlands","Verhaar, G.V.A.","Nillesen, A. (mentor)","2009","research questions: -How can you develop a compact Olympic Games that also can be reused or redeveloped for the period after the Olympics? -How can you create a (sport) accommodation that can be used for multiple functions (and on different locations) by using the water as an advantage and quality?","Stadium; Floating; Olympic Games","en","master thesis","","","","","","","","2009-11-18","Architecture","Architecture - Climate Adaptation Lab","","","",""
"uuid:a05db92c-eb01-4dff-9597-a0330c9665cf","http://resolver.tudelft.nl/uuid:a05db92c-eb01-4dff-9597-a0330c9665cf","WaterWonen: Waterbestendig wonen in het nederlandse landschap","Heimensen, K.P.","Van Dooren, E. (mentor); Nillessen, A.L. (mentor)","2009","Waterbestendig wonen als architectonische uitwerking van de aanbevelingen van het Delta Rapprt van Commisie Veerman 2. Onderzoek en ontwerp voor waterbestendige woningen in de verschillende delta landschappen van nederland en die zich tevens onderscheiden in dynamiek, waterbiotoop, techniek, doelgroep en woonbeleving. Doel is te komen tot een nieuwe woonvorm die Nederland een hoogwaardige leef- en woonomgeving kan geven in de toekomstige delt rekening houdend met de klimaatveranderingen.","Waterwonen","nl","master thesis","","","","","","","","2009-11-30","Architecture","Architecture","","Climate Adaptation Lab","",""
"uuid:2cbdc888-d651-4c89-9f51-cfaffb6d1bba","http://resolver.tudelft.nl/uuid:2cbdc888-d651-4c89-9f51-cfaffb6d1bba","Universiteit van Amsterdam, Roeterseilandencomplex","Hanemaaijer, A.M.","Mihl, H. (mentor); Vermeulen, P. (mentor)","2009","Hybride gebouw voor de UvA te Amsterdam op het Roeterseilandencomplex. De bestaande campus bevat veel ongedefinieerde ruimte en veel rommelige achterkanten zonder enige coherentie. In de nieuwe situatie zijn de ruimte gedefinieerd en is er op verschillende schaalniveaus een logische samenhang tussen deze gedefinieeerde ruimten ontstaan, waardoor er alleen nog maar voorkanten zijn.","coherentie","nl","master thesis","","","","","","","","2009-10-30","Architecture","Architecture","","Hybrid Buildings","",""
"uuid:35911bd1-7284-485c-99c5-6ba73ea2b7af","http://resolver.tudelft.nl/uuid:35911bd1-7284-485c-99c5-6ba73ea2b7af","Multifunctional Waterdefending Architecture - a spa in Vlissingen","Sven Rens Jaspers, S.R.","Nillessen, A. (mentor); Larssen, A.K. (mentor); Van der Pol, J. (mentor); Vittner, D. (mentor)","2009","Multifunctional Waterdefending Architecture After research about levy structures in The Netherlands it seems attracting to multifunctionally design levy's that protect high density areas. At these places, high costs can be covered by developing interesting architecture with views over the water and over the city. In Vlissingen, a spa is designed in the old city center by Sven Jaspers. The spa is added to this part of town to attract a whealthy kind of tourist throughout the year, instead of having summer tourism only. Vlissingen. The building creates a smooth connection between the Green boulevard (levy) and the town. It contributes to the reputation of the city and secures against the water.","Multifunctional; Water; Defence; Border; Levy; Climate; Adaptation; Vlissingen; Zeeland; Spa; Sauna; Welnesscenter; Westerschelde; Land; Water","en","master thesis","","","","","","","","2009-11-12","Architecture","Architecture","","Climate adaptation Lab","",""
"uuid:73ffa055-c46d-43f6-9a1a-747e0af16f43","http://resolver.tudelft.nl/uuid:73ffa055-c46d-43f6-9a1a-747e0af16f43","IWEX: Mapping on current high performance architectures","Thomas, A.","Van Genderen, A. (mentor); Bertels, K.L.M. (mentor)","2009","IWEX stands for Invers Wavefield Extrapolation and is commonly used in seismic exploration. Niels Pörtzgen[15] showed that this technique can also be used for inspection of welds. This thesis describes two domains in which the IWEX algorithm can be calculated. The time domain which has a quantization problem and the frequency domain which is computation intensive. The computation requirements run up to 5.5 TFLOPS(typical) for the frequency domain. To decrease the execution time of the frequency domain algorithm three platforms are explored: GPUs, the Cell processor and FPGAs. GPUs are originally designed for the game market to render 3D images, but over the last couple of years the GPU has become much more usable for general purpose computing. One of the latest GPUs has 240 scalar processors and has a theoretical 933 GFLOPS[14]. The Cell processor has eight light weight cores and one power processor on one chip. With a theoretical 204.8 GFLOPS also a powerful device[5]. The third platform is the FPGA. The floating point performance of the FPGA is lower than the other two platforms but if fix-point computations are used the FPGA is expected to execute the IWEX algorithm the quickest(4.9 s) of the three platforms. The GPU is expected to execute the algorithm in 14.5 seconds, and the Cell processor in 26.8 seconds. We implemented the algorithm on the GPU platform with the result that one image takes 15.1 seconds which indicates 184 GFLOPS. This implies an efficiency of 19.7%. But the implementation has a speedup of 20 compared to a quad-core CPU based implementation.","GPU; FPGA; cell; performance","en","master thesis","","","","","","","","","Electrical Engineering, Mathematics and Computer Science","Microelectronics & Computer Engineering","","","",""
"uuid:b460bb32-0d80-42a7-925c-16f0bc1b1dc4","http://resolver.tudelft.nl/uuid:b460bb32-0d80-42a7-925c-16f0bc1b1dc4","Strategy for Hobaho Alternative Supply Chain Roles to Enhance Lily Bulb Export to China","Li, R.","Wang, J. (mentor); Hultink, E.J. (mentor)","2009","Hobaho as the second largest intermediary company in the flower bulb business has been suffering from stagnant and declining development in recent three years. Its broker business with lily bulb market has decreased more seriously comparing to other bulb species, which dropped from 27% to 20% in recent three year. Due to the frustrated marketing share Hobaho decide to investigate the possible future strategy from the supply chain perspective in order to save its lily business. This master thesis focuses on Chinese lily bulb market as Hobaho’s target supply chain destination in terms of the marvelous development in floriculture in China. The goal of this project is to find out the most effective and efficient supply chain role for Hobaho in the lily bulb export-import process into China and then strategy and implement will be develop which fits Hobaho’s mission and vision. The process of this project consist of five phases, there are namely: analysis internal & external bulb business; research of bulb supply chain; design performance-risk measurement tools; application tools on developed different scenarios; implementing optimal scenario After designed a supply chain measurement tool, the current roles of Hobaho and four scenarios have been evaluated and compared. Ultimately to be an intermediary with Chinese bulb stakeholder has been top one scenario to develop according to Hobaho’s current consideration and capacity. Based on the chosen scenario, the main strategy to facilitate Chinese bulb stakeholder is offering one stop service to their clients. A potential clients list has been offered accompany with some feasible implement plans which based on time-phase. Moreover some new thoughts of future Chinese bulb market have been present for Hobaho future opportunities.","lily bulb; supply chain measurement; Yunnan; China","en","master thesis","","","","","","","Campus only","","Industrial Design Engineering","Product Innovation Management","","Strategic Product Design","",""
"uuid:c98a6d67-0140-4442-8ed4-cc82943e93e0","http://resolver.tudelft.nl/uuid:c98a6d67-0140-4442-8ed4-cc82943e93e0","Centre for Music Makers - music box","Van Beurden, T.","Poiesz, P. (mentor); Meijs, M. (mentor); Garritzmann, U. (mentor)","2009","Design for a bundelled music excersize building. A cross-breed of a conservatorium and a hotel.","music; centre; box","en","master thesis","","","","","","","","2009-10-30","Architecture","Interiors, Buildings & Cities","","The decorated diagram","",""
"uuid:030feb8c-0277-42b2-804b-6428f66fa9e7","http://resolver.tudelft.nl/uuid:030feb8c-0277-42b2-804b-6428f66fa9e7","Bio Inspired Design of a Scooter Body","Mul, E.J.","Flipsen, S.F.J. (mentor); Brezet, J.C. (mentor)","2009","Development of an electric scooter body by developing and applying the Bio Inspired Design method for Industrial Design Engineers.","bio inspired design; electric scooter body","en","master thesis","","","","","","","Campus only","","Industrial Design Engineering","Design Engineering","","","",""
"uuid:a5fca46e-36cd-4d4f-8619-a6bd3236b81c","http://resolver.tudelft.nl/uuid:a5fca46e-36cd-4d4f-8619-a6bd3236b81c","Reservoir Geology and Modelling of Carboniferous Coal-bearing marginal Marine and Fluvial Deposits of Eastern Kentucky and Implications for Hydrocarbon Exploration and Development","Were, P.","Bachmann, R. (mentor); Dekker, M. (mentor); Hoogendoorn, R.M. (mentor); Moscariello, A. (mentor); Luthi, S.M. (mentor); Weltje, G.J. (mentor)","2009","Successful search and exploitation for hydrocarbons form the subsurface demands the acquisition of a thorough understanding of the basin’s geology, attainable by analyzing critically the stratigraphic framework and facies architecture of analog outcrops and mature fields with a dense network of wells. In this study Petrel was used to construct such a conceptual facies model for the Breathitt Group in the Central Appalachian Basin, with the aim of investigating the pattern of depositional environments and how they influenced the vertical and lateral distribution of facies in the foreland basin. The model provides excellent guidelines to the distribution of depositional energies in analogous subsurface progradational coastal-plain and fluvial-deltaic reservoir sequences. The study area is an appropriate analogue used by many oil and gas companies to understand and solve stratigraphic problems in subsurface coal mines and coal-bearing hydrocarbon reservoirs. Cored borehole data from 12 quadrangles in Eastern Kentucky was loaded into Petrel to generate vertical sedimentological logs. The logs were correlated using extensive coal seams and marine flooding surfaces to obtain stratigraphic columns of the strike and dip sections of the basin. 3D stratigraphic surfaces and isochore maps, embedded with pie-charts, were generated to quantify the proportions of lithofacies along every well that wholly penetrates any given isochore, including the determination, prediction and interpretation of lateral and vertical distribution of facies, depositional energies and paleo-environments. Basic principles of sequence stratigraphy were applied to explain the role and interactions of tectonics, subsidence and eustasy in the evolution of the delta system in the foreland basin. Results show that differential subsidence, including active tectonics (orogenesis) and quiescence gave rise to two broad depositional systems. The upper system, which is predominantly composed of immature sediments, was deposited by braided and meandering streams from the tectonically active thrust-front in the southeast toward the northwest in a fluvial-deltaic environment, whilst the lower system is composed of mature sediments whose deposition was mainly influenced by waves/storms and tides from the sea in the northwest that frequently transgressed the subsiding basin during the long periods of tectonic quiescence. The stratigraphy further shows a tendency to increase slope inclination and a series of anticlinal and synclinal structures, mainly in the upper system, which may provide reservoir traps or control the dynamics of fluid flow in the basin. The analysis shows that the fluvial-deltaic system has better reservoirs with a good vertical and lateral connectivity than reservoirs in the lower coastal-plain system, where vertical connectivity and permeability, is hindered by the thin laterally extensive shales between units. Nevertheless, this system could provide a good source region for the generation of hydrocarbons, due to its high content of organic matter and depth of burial, offering optimal pressures and kitchen (enough heat energy) for the generation of hydrocarbons. Facies analysis using isochores and pie-charts may be applied during both frontier exploration and exploitation phase to provide a simple and quick method of reserves estimates based on the predicted geometrical dimensions of reservoirs and non reservoirs. The method yields important petrophyical parameters that can assist reservoir engineers to design simulation models required for optimal well spacing and positioning, well numbers and better enhanced oil recovery (EOR) methods.","breathitt group; Appalachian basin; Eastern Kentucky; Foreland basin; fluvial-deltaic deposits; four corners formation","en","master thesis","","","","","","","","","Civil Engineering and Geosciences","Geotechnology","","","",""
"uuid:448a52e0-8b9b-4c67-8263-127526a75850","http://resolver.tudelft.nl/uuid:448a52e0-8b9b-4c67-8263-127526a75850","A Network of Typologies: Redefining of and giving quality to the public space network as an urban restructuring element in order to permeate the borders of La Victoria and reconnect to the regional and metropolitan scale.","Van den Heuvel, S.","Sohn, H. (mentor); Sepulveda, D. (mentor); Bruyns, G. (mentor); Robles-Duran, M. (mentor)","2009","The development of a methodology for analyzing and restructuring the public space network of Santiago de Chile, aiming at the permeation of borders within the municipality Pedro Aguirre Cerda.","typologies; nodes; public space network; methodology","en","master thesis","","","","","","","","","Architecture","Urbanism","","DSD Urban Asymmetries Santiago","",""
"uuid:9e46eacc-c2fa-4208-8e64-b6ca31629ed0","http://resolver.tudelft.nl/uuid:9e46eacc-c2fa-4208-8e64-b6ca31629ed0","Creative Cube","Bonnemayer, M.B.C.","Komossa, S. (mentor); Marzot, N. (mentor); Fokkinga, J. (mentor)","2009","","","en","master thesis","","","","","","","","","Architecture","Architecture","","Public Realm","",""
"uuid:141efd3e-4151-435e-88d1-ca0afc691d9a","http://resolver.tudelft.nl/uuid:141efd3e-4151-435e-88d1-ca0afc691d9a","Time-Resolved PIV Analysis of a Shock Wave/Boundary Layer Interaction","Jöbsis, A.J.P.","Scarano, F. (mentor)","2009","The interaction between a shock wave and a turbulent boundary layer (SWBLI) is a phenomenon encountered in compressible fluid dynamics that is of particular relevance to high speed flight. In transonic and supersonic flight the SWBLI is present on different parts of an airplane. Often the interaction involves local separation of the boundary layer and large scale oscillations of the reflected shock. The unsteady nature of the interaction is accompanied by an increased heat transfer level and wall-pressure fluctuations, that may cause fatigue damage to the structure.","","en","master thesis","","","","","","","","","Aerospace Engineering","","","","",""
"uuid:533cc94a-afb4-4f81-af47-e838a964d9d5","http://resolver.tudelft.nl/uuid:533cc94a-afb4-4f81-af47-e838a964d9d5","Building a portfolio based on consumer needs in products filled with air for Blofield","Van Slooten, R.F.M.S.","Talke, K.S.S. (mentor); Mugge, R. (mentor)","2009","Blofield has an interesting product: the Chesterfield sofa and armchair. However, they lack insight and a structured approach to build their portfolio based on this. Consumer research formed the base in this report for the development of concepts and a proposal for the implementation of new product development. Consumer research shows that the current product does not offer a clear categorization. It is seen as a fun product that can be used on the side and is versatile. Mobility is not a unique selling point and consumers are unsure where to place it. However, the most potential and fit lies in the outdoor category. With adjustments to the current product and new products that fit this category, consumers will be able to categorize Blofield as an outdoor brand. After generating ideas, eight concepts passed a filter based on fit and feasibility. Combining feedback from consumers, Blofield and strategic fit three concepts were selected for further development. A time path for development was presented and Blofield can start right away on the development of these new products. Simultaneously to development of these products Blofield should work on generating new concepts.","new product development; focus group; consumer research; portfolio management","en","master thesis","","","","","","","Campus only","","Industrial Design Engineering","Product Innovation Management","","","",""
"uuid:cc4cda07-8191-40c3-a25a-c9558eb34dbb","http://resolver.tudelft.nl/uuid:cc4cda07-8191-40c3-a25a-c9558eb34dbb","Case Study Westergouwe: Financial feasibility study of water-designs in lowland polders","Holst, E.","Bijleveld, S.W. (mentor); Van der Toorn Vrijthoff, W. (mentor)","2009","Financial feasibility study of urban development in lowland polders in the Netherlands, where different spatial designs are evaluated for the Westergouwe. In the near future, the competing demand for new housing and water storage in the Randstad have to be met, whilst guaranteeing the safety against rising sea level and extreme weather conditions.","urban area development; climate change; lowland polders; flood risk","en","master thesis","","","","","","","","2009-10-29","Architecture","Real Estate & Housing","","Urban Area Development","",""
"uuid:c787dd65-db8b-44a6-9fe7-a82b75daa7da","http://resolver.tudelft.nl/uuid:c787dd65-db8b-44a6-9fe7-a82b75daa7da","Allocation of Opportunistic Spectrum for Cognitive Radio Ad hoc Networks","Rao, V.S.","Prasad, R.V. (mentor); Niemegeers, I.G.M.M. (mentor)","2009","Cognitive Radios (CRs) address the problems of spectrum scarcity and under-utilization of the spectrum. However, realizing a CR network is neither easy nor straight-forward. The link layer in CR Ad hoc Networks is responsible for allocating suitable channels, out of the currently available channels. It is also responsible for setting up communication between nodes. Further, the spectrum efficiency should be maximized in a fair way. The problem of spectrum allocation can be modeled as a graph-theoretic problem. The selection of channels amongst the CR nodes in the network is an NP class problem. We prove this is, in fact, an NP complete problem. We propose a time-slotted system. In such a system, the schedule length needs to be kept to a minimum for higher spectrum utilization. We analyze the problem to determine conditions for an optimal allocation. We use edge coloring as a tool to analyze and propose heuristics. In ad hoc networks, distributed solutions are preferred due to the lack of infrastructure. We propose two distributed algorithms: (i) clique based, and (ii) localized heuristic algorithms. We compare the results of these heuristics with the algorithm proposed in literature. We also find the worst case bounds for these algorithms. For efficiency purposes, it is required to have a constant number of slots per frame. In such cases, producing a valid schedule is not enough since unfairness of allocation will eventually arise. To address this issue, we modify the edge coloring and clique based heuristics to produce valid fair schedules. Finally, we briefly consider the advantages of having a joint spectrum sensing-allocation scheme at the link layer. When the spectrum sensing scheme at the PHY layer is not completely reliable, a link layer scheme can help in reducing the false alarms and miss-detections. We, further constrain the system by limiting the number of channels that can be sensed within a frame. We present the spectrum utilization with this joint sensing-allocation policy.","cognitive radio; graph theory; allocation problem; ad hoc networks; opportunistic spectrum access; fairness","en","master thesis","","","","","","","","2009-11-25","Electrical Engineering, Mathematics and Computer Science","Telecommunications","","Wireless and Mobile Communications","",""
"uuid:53f577d0-12c9-4a53-8d41-fdff8113aa02","http://resolver.tudelft.nl/uuid:53f577d0-12c9-4a53-8d41-fdff8113aa02","The Stitch","Huijs, A.","Marzot, N. (mentor); Komossa, S. (mentor)","2009","Dealing with the densification in the Weena area of Rotterdam","vertical city","en","master thesis","","","","","","","","","Architecture","Architecture","","Public Realm","",""
"uuid:851ec3bb-c8fa-4252-84e4-3b754b7e5163","http://resolver.tudelft.nl/uuid:851ec3bb-c8fa-4252-84e4-3b754b7e5163","Historical Museum Lublin","Puszcz, T.","Sobota, M. (mentor); Biloria, N. (mentor); Bier, H. (mentor)","2009","A project of a historical museum within a historically diverse surrounding. Situated in Lublin, Poland, the project thrives on the views around the site as well as proposes a new kind of routing system aimed at higher degree of connectivity between different sections of the exhibition.","museum; poland; steel; public building; public space","en","master thesis","","","","","","","","2009-11-06","Architecture","Architecture","","","",""
"uuid:393ba2ea-7d5f-4a7f-80fa-fe86bdac3adf","http://resolver.tudelft.nl/uuid:393ba2ea-7d5f-4a7f-80fa-fe86bdac3adf","Interactief drukvlak","Tiggeler, L.","Stouffs, R. (mentor); Borgart, A. (mentor)","2009","Creation of an interactive thrust surface. Goal is to get a better insight in the mechanical behaviour of shells.","thrust surface; shells","nl","master thesis","","","","","","","","","Architecture","Building Technology","","","",""
