"uuid","repository link","title","author","contributor","publication year","abstract","subject topic","language","publication type","publisher","isbn","issn","patent","patent status","bibliographic note","access restriction","embargo date","faculty","department","research group","programme","project","coordinates"
"uuid:5b89932f-b676-497a-8333-b41875b7eda9","http://resolver.tudelft.nl/uuid:5b89932f-b676-497a-8333-b41875b7eda9","Mediatheque @ Zeeburgerpad","Emid, J.H.","Alturk, E. (mentor); Cavallo, R. (mentor); Maratilova, R. (mentor)","2009","The graduation project is a public building, a mediatheque in Amsterdam, and is placed at the beginning of the small, elongated in between two canals. The entrance of the building is located towards the Zeeburgerplein, a square which forms an urban catalyst between the city centre and the new developments of the Zeeburgerpad. The building opens up towards the city through it’s big windows and shows the public functions of the mediatheque; the auditorium, the library, the audio-visual sections, and the central atrium in the heart of the building acting as a public square. The different sections are visually connected and functionally separated from each other by several voids.","Zeeburgerplein; mediatheek; centrale vide","en","master thesis","","","","","","","","","Architecture","Hybrid Buildings","","","",""
"uuid:c023041b-dec0-4e69-b278-7618674027e8","http://resolver.tudelft.nl/uuid:c023041b-dec0-4e69-b278-7618674027e8","Sustainable impact in developing rural areas through business creation","Marijnissen, M.C.J.M.","Verbraeck, A. (mentor); Kolfschoten, G.L. (mentor); Van Duin, J.H.R. (mentor); Barjis, J. (mentor); Muniafu, S. (mentor); Maritz, J. (mentor)","2009","","","","master thesis","","","","","","","","","Technology, Policy and Management","","","","",""
"uuid:f66a8e28-9fa0-4722-a89b-75892b1bb737","http://resolver.tudelft.nl/uuid:f66a8e28-9fa0-4722-a89b-75892b1bb737","Wave Physics in a Tidal Inlet - Part I: On the time scales of wave processes. Part II: Depth-induced breaking: a comparison on the performance of three models","Van der Ham, P.J.","Holthuijsen, L.H. (mentor); Van Vledder, G.P. (mentor); Zitman, T.J. (mentor); Van der Westhuysen, A.J. (mentor); Stelling, G.S. (mentor)","2009","Part I: On the time scales of wave processes. To systematically improve the SWAN model a study on the wave physics in a tidal inlet was carried out. The third-generation SWAN model was used to compute the wave processes in a tidal inlet for storm conditions. The computed wave processes are propagation (shoaling, refraction and frequency shifting), generation (wind input), non-linear wave-wave interactions (quadruplet wave-wave interactions and triad wave-wave interactions), dissipation (white capping, depth induced breaking and bottom friction), and the work done by the currents against the radiation stresses. The results were normalised, which resulted in the time scales of all wave processes. The time scales were of the order 100s – 1,000s, except for the work done by the currents against the radiation stresses, which is of the order of 1,000s – 10,000s. Part II: Depth-induced breaking: A comparison of the performance of three models. Depth-induced breaking is a subject that has been widely studied, resulting in many scalings on the Battjes and Janssen model. The Battjes and Janssen model, the biphase scaling and the Nelson scaling were selected to compare results in terms of significant wave height. The parameter of interest is the model coefficient . The models were tested with the SWAN model on three different test cases; two reef cases and one sloping bottom profile. The wave period appeared to have a strong influence on the prediction of the significant wave height, in particular on the biphase scaling. The best model over the three test cases statistically is the Nelson scaling.","waves; physics; breaking; SWAN","en","master thesis","","","","","","","","","Civil Engineering and Geosciences","hydraulic engineering - Environmental Fluid Mechanics","","","",""
"uuid:516b60b1-1204-495c-9548-70073235aa24","http://resolver.tudelft.nl/uuid:516b60b1-1204-495c-9548-70073235aa24","Technisch geologisch onderzoek naar CO2-opslag in het Barendrecht veld: aan de hand van vragen geuit door omwonenden en de (lokale) politiek","Holt, S.; Vasmel, M.L.","Van Hemert, P. (mentor); Wolf, K.H.A.A. (mentor)","2009","An underground CO2 storage project is proposed under the village of Barendrecht, involving two nearly depleted gasfields. Because of the lack of sufficient knowledge of these kinds of storage projects, by the general public and also by the local politicians, several questions about the technical and geological aspects have been raised. In this report an effort is made to answer specific questions about the subsurface and its reaction to a CO2 storage project in a clear manner. These answers lead the reader through general CO2 information, followed by site specific details and also new calculations on the possibility and rate of CO2, that might escape from the reservoir in case of a dramatic subsurface failure. Based on our findings, as well as on previous research, we conclude that the threat of an accident is almost non-existent.","CO2; Barendrecht; Koolstofdioxide; Opslag; Carbon dioxide; Storage; Gasfield; Gasveld","nl","bachelor thesis","","","","","","","","2009-08-25","Civil Engineering and Geosciences","Geotechnology","","","",""
"uuid:0a6eaf21-c6de-4703-9cf5-b7633a272b9c","http://resolver.tudelft.nl/uuid:0a6eaf21-c6de-4703-9cf5-b7633a272b9c","Ant Dispersion Routing for Traffic Optimization","Alves, D.G.A.","Van Ast, J. (mentor); Babuska, R. (mentor)","2009","","","en","master thesis","","","","","","","","","Mechanical, Maritime and Materials Engineering","Delft Center for Systems and Control","","","",""
"uuid:feebc541-8245-407e-886b-7961dfb2f7b6","http://resolver.tudelft.nl/uuid:feebc541-8245-407e-886b-7961dfb2f7b6","Urban Permeation","Zveibil Idan, I.Z.","Robles-Duran Miguel, M.R.D. (mentor)","2009","Urban permeation and local integration of socioeconomic relations in Sector 4 & 5 in the municipality of Ecatepec de Morelos","","en","master thesis","","","","","","","","","Architecture","DSD - Urban Asymmetries","","","",""
"uuid:d95779b6-e3a3-4e14-b475-5f34078e4ebb","http://resolver.tudelft.nl/uuid:d95779b6-e3a3-4e14-b475-5f34078e4ebb","The abuse of architectonics by decorating in an era after deconstructivism: Deconstruction of the tectonic structure as a way of decoration","Gerritsen, P.","Moraes Zarzar, K. (mentor); Milinovic, S. (mentor)","2009","With criteria based on Derrida's principles for deconstruction early and recent projects of deconstructists as Eisenman, Libeskind and Hadid are compared. The conclusions imply how much in those projects tectonic elements are used to create a style reminiscent to the original objectives of deconstruction and by doing so have become a decoration.","Architectural Thinking; Architectural Theory; Deconstructivism; Tectonics; Gehry; Libeskind; Derrida; Eisenman; Decoration; Hadid","en","master thesis","","","","","","","","2009-07-20","Architecture","Interiors; Studio Back to School","","","",""
"uuid:73a0123d-d2cc-4f67-b299-fbe5d5b51458","http://resolver.tudelft.nl/uuid:73a0123d-d2cc-4f67-b299-fbe5d5b51458","Delft, for knowledge and people: Connecting the Knowledge City with its citizens","De Koning, C.M.","Rocco, R. (mentor); Aalbers, K.P.M. (mentor); Harteveld, M.G.A.D. (mentor)","2009","In the last decades of the 20th century, there has been a shift from the industrial towards the knowledge and service economy. Cities also join this trend, by presenting themselves as ‘knowledge cities’. The Knowledge City is “a city that was purposefully designed to encourage the nurturing of knowledge”. The city of Delft presented itself from the beginning of the 1990s as a ‘knowledge city’. Delft Kennisstad pays a lot of attention to the business climate, but tends to forget about the people climate. The goal of the graduation project was to create a new sustainable strategy for the city of Delft, based on knowledge, but in a way that all citizens of Delft can benefit from it. The Schie Canal Banks in Delft were redesigned, based on the theories of the sustainable Knowledge City. The final products were a study on the planning requiremenst of the Knowledge City and a comparison with the sustainable city; an analysis of Delft and the Schie Canal Banks; and a final design for Delft and the Schie Canal Banks.","knowledge city; Schieoevers; Schie canal banks","en","master thesis","","","","","","","","","Architecture","Urbanism","","","",""
"uuid:a9007a76-11c8-4a2f-8478-81641c1b86d1","http://resolver.tudelft.nl/uuid:a9007a76-11c8-4a2f-8478-81641c1b86d1","The urban hospital in the public realm","De Nooijer, J.M.","Wagenaar, C. (mentor); Westgeest, A.T.M. (mentor); Avermaete, T.L.P. (mentor); Harteveld, M.G.A.D. (mentor)","2009","The design of a highly accessible medical setting what is mixed with urban everyday life, and thus embedded in its context","hospital; public building","en","master thesis","","","","","","","","2009-08-22","Architecture","Architecture & Urbanism","","","",""
"uuid:a8ea88cc-efe4-44e2-ac07-1986d9cb21c0","http://resolver.tudelft.nl/uuid:a8ea88cc-efe4-44e2-ac07-1986d9cb21c0","Science Resort Delft","Eilander, N.J.","Van Bennekom, H. (mentor); Kaan, K. (mentor)","2009","Dit publieke gebouw moet enerzijds een stimulans worden voor de ontwikkeling van het hoogwaardige en kennisintensieve bedrijven park Technopolis, anderzijds een plek zijn waar het bedrijfsleven en wetenschappers elkaar kunnen ontmoeten om informatie uit te wisselen over de nieuwste technologieën teneinde wederzijds inspiratie op te doen voor innovatieve ideeën.","Science","nl","master thesis","","","","","","","","2009-07-07","Architecture","Materialisation","","","",""
"uuid:a8f6363b-5362-4c9b-a928-3a4542bf4774","http://resolver.tudelft.nl/uuid:a8f6363b-5362-4c9b-a928-3a4542bf4774","PRAGMA: A Partial-Reconfigurable Audio Platform","Krijgsman, S.","Wong, J.S.S.M. (mentor)","2009","As the area of applications for Field Programmable Gate Arrays, or FPGAs, continues to expand, designers are searching for new methods to enhance the flexibility and efficiency of these devices. A technique called Dynamic Partial Reconfiguration is based on a principle of reconfiguring a small region of the FPGA, while the remainder of the device remains operational. This thesis will investigate the current status of the field of dynamic partial reconfiguration and select the most promising technique for implementation. A proof-of-concept system will be designed and implemented using the selected technique in order to clearly uncover the properties and possibilities of dynamic partial reconfiguration. The implemented system is an audio processor, capable of manipulating sound through the use of several filters. All filters can be replaced while the system remains functional by performing partial reconfiguration. As such, this system also provides a platform upon which new filters can be designed and tested. The MOLEN polymorphic processor is a processor architecture that supports the notion of partial reconfiguration. The technique for partial reconfiguration selected in this thesis will be tested for compatibility with the existing implementation of the MOLEN processor.","","en","master thesis","","","","","","","","","Electrical Engineering, Mathematics and Computer Science","Microelectronics & Computer Engineering","","","",""
"uuid:c2d528a4-4015-4c00-a9dd-687da1aea79d","http://resolver.tudelft.nl/uuid:c2d528a4-4015-4c00-a9dd-687da1aea79d","Accommodation for the craft of education: Secondary school for crafts education in Amsterdam North","Gerritsen, P.","Stuhlmacher, M.E. (mentor); Schreurs, E.P.N. (mentor); Van de Voort, J.A. (mentor)","2009","The assignment was to choose a location in A’dam North for a school with extra-ordinary attention to crafts. The department for Horti Culture and for Cooking+Restaurant provide an opportunity to relate to the Florapark nearby the location and to bring in the public from the neighbourhoods nearby. The departments for Carpentry and Metalworking relate to the crafts which were present at the location during the shipbuilding’s era. The building, with its face to the market square of the Mosplein, is placed on an axis which slices the riverbanks of the IJ and the residential and public/green areas. At the same time an axis, the inner street, is introduced in the design of the school. Public facilities as the restaurant are situated at both ends of this axis as an attempt to connect a compact building, as introvert as an school can be, to the rest of the city.","school; architecture; interiors; mosplein; amsterdam; amsterdam north; mosveld; craft; axis; inner street","en","master thesis","","","","","","","","2009-07-21","Architecture","Interiors; Studio Back to School","","","",""
"uuid:b006910f-01fa-4932-9058-cf44024be7d3","http://resolver.tudelft.nl/uuid:b006910f-01fa-4932-9058-cf44024be7d3","Water transversal network","Bizzarri, S.B.","Sohn, H.S. (mentor); Robles Duran, M. (mentor)","2009","Ecatepec, Mexico city. Through the analysis of the water process the WTN will be able to effects social and built environment.","water","en","master thesis","","","","","","","","","Architecture","Urbanism","","","",""
"uuid:b203ead5-72fe-4564-b17b-331f0f02c890","http://resolver.tudelft.nl/uuid:b203ead5-72fe-4564-b17b-331f0f02c890","Art academy NDSM-Wharf","Osinga, S.","Alturk, E. (mentor); Cavallo, R. (mentor); Mihl, H. (mentor); Maratilova, R.K. (mentor)","2009","","","en","master thesis","","","","","","","","","Architecture","Architecture","","","",""
"uuid:3779048c-dd5d-4a74-a37e-43c214b3c424","http://resolver.tudelft.nl/uuid:3779048c-dd5d-4a74-a37e-43c214b3c424","Space for Everyone: A new craft school in Amsterdam Noord","De Warle, E.","Schreurs, E. (mentor); Van de Voort, J. (mentor); Stuhlmacher, M. (mentor)","2009","","","en","master thesis","","","","","","","","","Architecture","Interiors, Buildings and Cities","","","",""
"uuid:cd332194-7a4b-477e-99d7-0f39d21dbe19","http://resolver.tudelft.nl/uuid:cd332194-7a4b-477e-99d7-0f39d21dbe19","Digital Review: Final Project Report, Final report on the project of developing the Digital Review Application","Van den Berg, J.J.J.; Weijers, J.; Westerveld, B.B.","Hendriks, E.A. (mentor)","2009","SKION is a foundation that facilitates research of children with cancer. The research consists of investigating slides and other material gotten from the treating hospitals at SKION. The results of these investigations are saved into a database, while other information gathered by SKION through forms is stored in another database. Four times a year, Dutch oncologists from all around the country meet in real life to review several slides. This is a very inefficient way of working, since all participants have to come to a central location. As a solution, Martijn Tijsma introduced the possibilities of a Digital Review. This requires an application that stores forms and combines data from the two databases and merges them on screen for all participants of the review to see. The goal of this project was to create a proof that such an application can be build (Proof of concept).","SKION; PHP","en","bachelor thesis","","","","","","","","","Electrical Engineering, Mathematics and Computer Science","Software Technology","","","",""
"uuid:885bd83c-3367-4a05-99e8-3ae0f52997ae","http://resolver.tudelft.nl/uuid:885bd83c-3367-4a05-99e8-3ae0f52997ae","Een iPhone-webapplicatie voor Greetinq Voicemail","Van Tulder, G.; Heinrichs, R.","Stronkman, R. (mentor); Rothkrantz, L.J.M. (mentor)","2009","Ter afsluiting van de bachelor TI is in het bachelorproject een iPhone-webapplicatie ontworpen voor Greetinq Voicemail.","iPhone; Voicemail","nl","bachelor thesis","","","","","","","","2012-01-01","Electrical Engineering, Mathematics and Computer Science","Media and Knowledge Engineering","","","",""
"uuid:2a430c48-393e-4a9c-9b94-7b2725bfea42","http://resolver.tudelft.nl/uuid:2a430c48-393e-4a9c-9b94-7b2725bfea42","Coastal flood risk assessment and coastal zone management: A case study of Seberang Perai and Kuantan Pekan in Malaysia","Ho, J.C.","Stive, M.J.F. (mentor); Clarke, D. (mentor)","2009","The rise of sea level increases the risk of coastal flooding by increasing the probability of occurrence of flood event at a given height. The essence of coastal planning and management in the future relies on an accurate coastal flood risk assessment with regards to sea level rise. Through the set up of flood risk assessment model in Geographic Information System (GIS) using Shuttle Radar Topography Mission (SRTM) elevation data, flood height data, and sea level rise estimate based on IPCC high emission scenario, areas at risk of inundation at Seberang Perai (highly developed area) and Kuantan-Pekan (less developed area) in Malaysia were identified. Flood maps were produced subsequently. Damage costs associated with a given flood event were calculated through the identification land value of different land use categories. Four flood management tools had been utlisied in the study. They include “Do nothing”, “Flood insurance”, “No development” and “Hold the line”. The costeffectiveness of these flood management tools was evaluated over a course of 200-year based on a 1 in 200-year flood event for both study locations. Results from the study show that the effectiveness of flood management tools varies with location and land use pattern. However, in both locations, “Flood insurance” is concluded to be the most economically viable option for coastal zone management in Malaysia in the future as the damage cost incurred from a flood event is effectively reduced via the implementation of “Flood insurance” policy. Flood insurance is currently not a common practice in Malaysia. However, in order to reduce the uncertaities resulted from flood risk assessment, the study recommends more accurate elevation data to be captured for future analysis. Besides, it is also recognised that there is a need for Malaysia to maintain long term measurement of sea level.","flood risk; climate change; Malaysia; sea level rise; IPCC","en","master thesis","","","","","","","","","Civil Engineering and Geosciences","Hydraulic Engineering","","CoMEM - Coastal and Marine Engineering and Management","",""
"uuid:c1d8aed2-09a0-4c86-9042-7fe20eb35027","http://resolver.tudelft.nl/uuid:c1d8aed2-09a0-4c86-9042-7fe20eb35027","RubbleViewer: Communicating for situation awareness in the urban search and rescue domain","Van Zomeren, M.","Oomes, A.H.J. (mentor); Neerincx, M. (mentor)","2009","The current way of communicating situation awareness through sketches has been found not sufficient as is seen during exercises of usar.nl. The proposed solution RubbleViewer presents the personnel with a 3d map where they can annotate information on. This map of a collapsed building is calculated by running photogrammetric algorithms on an image dataset captured by a sUAV flown over a real disaster area. RubbleViewer is found useful during an evaluation with usar.nl personnel.","USAR; Situation Awareness; situated Cognitive Engineering; UAV; Photosynth","en","master thesis","","","","","","","","2009-07-01","Electrical Engineering, Mathematics and Computer Science","Man Machine Interaction","","","",""
"uuid:4c9685ac-3f76-41c0-bae5-a2a96f4d757e","http://resolver.tudelft.nl/uuid:4c9685ac-3f76-41c0-bae5-a2a96f4d757e","Optimal Thrust Allocation Methods for Dynamic Positioning of Ships","De Wit, C.","Van der Woude, J.W. (mentor); Gachet, M. (mentor)","2009","The first Dynamic Positioning (DP) systems emerged in the 1960's from the need for deep water drilling by the offshore oil and gas industry, as conventional mooring systems, like a jack-up barge or an anchored rig, can only be used in shallow waters. GustoMSC has been developing DP drill ships since the early 1970's and it is still one of their core businesses. DP systems automatically control the position and heading of a ship subjected to environmental and external forces, using its own actuators. The thrust allocator of a DP system is responsible for the thrust distribution over the actuators of the ship. Apart from minimizing the power consumption an ideal thrust allocator can also take other aspects into account, such as forbidden/spoil zones and thruster relations. Because the Lagrange multiplier method, used inhouse by GustoMSC for thrust allocation, cannot accurately describe fullscale DP systems with rudders and forbidden/spoil zones, new methods need to be explored. Various optimal thrust allocation methods for dynamic positioning of ships are considered and their practical use is tested with DP capability calculations and time domain simulations with online optimization routines. The shortcomings of Lagrange multiplier methods are illustrated and quadratic programming methods combined with disjunctive programming techniques are used to present a more elaborate solution to optimal thrust allocation problems. Using disjunctive programming each actuator is modeled by a finite union of convex polygons representing the attainable thrust region. This approach allows combinations of non-rotatable thrusters, rotatable azimuth thrusters with forbidden/spoil zones and main propeller/rudder pairs to be used. As a consequence the allocation problem decomposes into a finite number of subproblems that all need to be solved separately in order to find the optimal solution of the main problem. For time domain simulations the dynamic limitations of the thrusters are taken into account by adding more convex thrust regions to the problem. Briefly, the potential use of linear matrix inequalities for optimal thrust allocation problems is treated. The obtained results are discussed and conclusions are given.","Dynamic Positioning; Thrust Allocation; Lagrange multiplier; Optimal Thrust Allocation; Quadratic Programming; Disjunctive Programming; DP Capability Plot","en","master thesis","","","","","","","","","Electrical Engineering, Mathematics and Computer Science","Delft Institute of Applied Mathematics","","","",""
"uuid:26713203-5eef-476d-99b8-d47c55037025","http://resolver.tudelft.nl/uuid:26713203-5eef-476d-99b8-d47c55037025","Valuing rail infrastructure performance in a multi actor context","Brinkman, P.","Van Wee, G.P. (mentor); Kroesen, M. (mentor); Hermans, L.M. (mentor); Fischer, R.H.l (mentor); Luiten, T. (mentor); ProRail (contributor)","2009","","","","master thesis","","","","","","","","","Technology, Policy and Management","","","","",""
"uuid:6c9b9838-5303-4969-9c6a-bc990657e8f0","http://resolver.tudelft.nl/uuid:6c9b9838-5303-4969-9c6a-bc990657e8f0","The Dutch shopping place 2 be, clever city branding or just good luck?","Aarts, S.","Kooijman, D.C. (mentor); Lousberg, L.H.M.J. (mentor)","2009","This thesis is concerned with the use of retail in city branding. The research objective is outlining the role of retail in the positioning of Dutch inner-cities, to gain insight in the opportunities to brand a city as a shopping destination.","Retail; City branding; Dutch inner-cities; City brand; positioning","en","master thesis","","","","","","","","2009-07-01","Architecture","Real Estate & Housing","","","",""
"uuid:8e598f60-4f27-4fed-b5ab-16327e0c516b","http://resolver.tudelft.nl/uuid:8e598f60-4f27-4fed-b5ab-16327e0c516b","Oscillations and stability of a mass-varying system","De Gier, J.M.","Van Horssen, W.T. (mentor)","2009","In this paper the stability properties of the vibrations of a singular degree of freedom oscillator with a periodically and multi-stepwise time-varying mass are studied. The free vibrations and the vibrations due to two types of forcing are investigated.","stability; mass-varying","en","bachelor thesis","","","","","","","","2011-07-01","Electrical Engineering, Mathematics and Computer Science","Applied mathematics","","","",""
