"uuid","repository link","title","author","contributor","publication year","abstract","subject topic","language","publication type","publisher","isbn","issn","patent","patent status","bibliographic note","access restriction","embargo date","faculty","department","research group","programme","project","coordinates"
"uuid:08005275-5330-4246-afdd-2e79ff3c474c","http://resolver.tudelft.nl/uuid:08005275-5330-4246-afdd-2e79ff3c474c","""Uncertainty and Future Market Analysis of Concentrated Solar Power in the U.S.A""","Rahimian, S.","Ravesteijn, W. (mentor); Quist, J.N. (mentor); Enserink, B. (mentor); Kwakkel, J. (mentor); Rop, P.S. (mentor); Mulder, K. (mentor)","2009","There has been an ever growing concern over addressing the issue of climate change and reducing the green house gas emissions (GHG) in the whole world and especially in the U.S. Many measurements are being taken into account for reducing the adverse effects of the GHG emissions as well as making equilibrium between climate security and energy security which further paves the way for moving forward to a more green economy. Also energy independence is playing an increasing role in the political landscape. Concentrated Solar Power (CSP) technology as one kind of solar renewable energy technology has gained significant momentum in recent years. CSP is gaining acknowledgement for its potential to produce large volumes of power where it can be considered as an alternative source of energy which competes with the conventional fossil fuels. The main advantage of CSP is that its required energy is abundant and free, i.e. solar radiation. Characteristic for a CSP power plant is its industrial size based on heat transfer. Since NEM is a company active in the power business with expertise in the heat transfer equipment, it wants to pursue the new business opportunities in the CSP market. There exist different CSP market potential locations around the globe which can be considered for development of CSP project. The U.S. is perceived to be one of the main competitors-along with Spain-in the close future which is expected to gain a lion share of this solar energy market. However, the U.S. electricity market is subject to many uncertainties and thus investors in the electricity sector may be reluctant to take up technologies which involve higher risks. In essence, this research pursued to study the associated uncertainties that are embedded in the U.S. CSP energy market and investigated the directions in which this market can grow in the future term. In this research at first, the CSP technology assessment has been carried out. This includes elaboration on the basic characteristics and functionalities of three types of CSP technology which includes Parabolic Trough, Power Tower (or central receiver) and Liner Fresnel technology. Further, major key components which are of great importance both from the perspective of the market viability as well as shaping the U.S. CSP energy market are introduced. Next, the research builds on its methodological grounds for studying and analyzing the concept of uncertainty which is the focal point of this thesis. In essence, literature review on the concept of uncertainty and its background is performed. In order to profoundly come up with a valid and comprehensive framework for uncertainty analysis, it was crucial to study and discuss the most two important dimensions of uncertainty, that is the typology of sources and types of uncertainty. According to this sort of classification, an uncertainty-analysis framework was ultimately developed which encompassed all the aforementioned concepts. Furthermore, the methods and tools that can be used in dealing with uncertainty are presented. In fact, numerous methods can be found in the scientific literature, both qualitatively and quantitatively for reducing the issue of uncertainty. However in the framework of this research, scenarios -mainly from the policy analysis perspectivewas chosen to deal with the associated uncertainties in projection of the U.S. solar CSP market. Finally in the last phase of the research, the developed “uncertainty-scenario” framework is applied. The results from this step of the research indicate that the U.S. CSP energy market is highly reliant and impacted by couple of major uncertain forces which can be categorized as economic and financial, legal and political and finally social and behavioral forces. Further amid these identified forces and system changes, the research underlined three highly uncertain factors which have high impact on the renewable energy system namely as governmental regulatory regimes and supporting schemes, project financing (or the availability of money) and energy consumption. On the other hand, the current credit crisis has also been identified as a major force and cause of system change which affects almost all of these forces which has rippled through almost all renewable energy market sectors including CSP. Nevertheless, according to these identified highly uncertain forces which can cause great deals of impact on the system, scenarios for depicting plausible futures of the U.S CSP market are explored. These qualitative scenarios are created in a way to encompass different extremes on how the CSP future market can unfold namely as the base-case scenario, the low-case scenario and the high-growth case scenario. In the last step of this research, according to each of the derived scenarios relevant recommendation to NEM is provided. These recommendations are presented from two perspectives. In first place, recommendations for per-case developed scenario are provided. Next, recommendations in a more general perspective are presented. These mainly include acknowledging the kinds of decisions that should be taken where insufficient knowledge exists in connection to the development of technologies, such as CSP.","","en","master thesis","","","","","","","","2009-10-09","Technology, Policy and Management","Values and Technology Department","","","",""
"uuid:edef6f1c-95f6-44f9-988b-66c39ac4fe99","http://resolver.tudelft.nl/uuid:edef6f1c-95f6-44f9-988b-66c39ac4fe99","Eneco Gasspeicher: Underground gas storage in salt cavern","Noordoven, Q.A.L.V.","De Ruiter, J. (mentor); Van der Kleijn, P. (mentor)","2009","The Dutch national energy company Eneco is in the process of implementing a large project involving the storage of gas in salt caverns in Epe, Germany. For short-term gas trading and flexibility in the gas market Eneco intend to lease two caverns till 2030 with an option to lease till 2060. Salzgewinnungs Geselschaft Westfalen (SGW) leaches the caverns. This company has produced brine from this area since the 1972. The wells are drilled as cluster wells. The two caverns will have a geometrical volume of 500 000 m3 and 400 000 m3, and will be operated between 40 and 210 bar, resulting in a working gas volume of 170 million m3. In the wells exists temperature fluctuations; the temperature has to be monitored to prevent gas hydrates. The behavior of caverns and mines can only be understood and predicted by taking into account the creep and other aspects of salt. But the mechanical behaviour of salt is of a very hard complexity, and several aspects of it are still open to discussion. Eneco expects the project to contribute to an increased security of supply and liquidity of the northwest European gas market. To complete this project, Eneco Gasspeicher team asked me to give a complete overview of the project. And to give all parameters involved in this project. This report will describe the project in some more detail.","salt cavern; gas storage","en","bachelor thesis","","","","","","","","2012-12-01","Civil Engineering and Geosciences","Design & Construction","","","",""
"uuid:e2093132-9db7-4cba-bc68-9355f93cb9e3","http://resolver.tudelft.nl/uuid:e2093132-9db7-4cba-bc68-9355f93cb9e3","An Enterprise Ontology based approach to Model-Driven Engineering","Den Haan, J.","Albani, A. (mentor); Dietz, J.L.G. (mentor)","2009","Because of the lack of a significant increase of productivity in the last 20 years we are still in a huge need for increasing the return a company derives from its software development effort. Model-Driven Engineering (MDE) aims to raise the level of abstraction in application modeling and increase automation in application development, thereby increasing the productivity in software development. The Model-Driven Architecture tries to define an MDE approach, but is mainly focused on technical variability and lacks formalism. Other approaches, using Domain-Specific Languages, do not define a process or framework at all. Research in this area is focused on language engineering and multi-modeling. Literature on formalizing MDE is focused on defining the concepts and assets needed to construct an MDE framework. We only know one attempt on formulating an end-to-end (from business model to IT implementation) MDE approach, but the resulting framework does not have a theoretical foundation. Concluding we can state that no end-to-end MDE approach exists describing abstraction layers, models, modeling languages, and transformations, based on a formal, theoretical foundation. This thesis presents an MDE approach based on a sound theoretical foundation, providing end-to-end guidance to refine and transform an organization model into an IT system supporting that organization.","DEMO; Model-Driven Engineering; Enterprise Ontology; MDE; MDA; MDD","en","master thesis","","","","","","","","","Electrical Engineering, Mathematics and Computer Science","Information Systems","","","",""
"uuid:aa97db6d-a2be-4043-b5d9-eb15777ee2ee","http://resolver.tudelft.nl/uuid:aa97db6d-a2be-4043-b5d9-eb15777ee2ee","Youth meeting point of the future","Van Nuland, W.P.","Van Rijn, H. (mentor); Jongert, M.W.A. (mentor); Hekkert, P.P.M. (mentor)","2009","Introduction You only have to read the paper or watch the evening news to understand the problems local hang-out youth is causing recently. Last year, Mayor Mr. Cohen called youth-molestation one of the biggest problems of the city of Amsterdam. Humiliation of the youth, safety cameras, the Mosquito1 and gathering restriction orders; in recent discussions, nothing is too much to control youth which is hanging out on the streets. This graduation assignment will give a positive solution for the Youth Meeting Point of the Future. Context To understand the meeting adolescents in the public space, the first step of the process, was to build up the current context by a questionnaire (left behind at youth forums), observation (of meeting points), generative techniques (with more structural hangout youth) and literature research. It seemed that the adolescence phase of life is very important in the process of creating an own identity. Part of this process is belonging to different groups of cliques and seeking for sensation (risky behaviour). The youth’s transition from dependence to independence happens in different adolescence arenas. Home and school are the most common arenas. Some adolescents have to cope with a lot of stress in these scenes, because the internal structure of schools cannot stimulate them and the financial situation of their parents is not sufficient. A relatively new arena is the virtual world, which is, especially during adolescence, important to get and maintain social contacts. The fourth arena is the public space, which is for 80 percent of the (Dutch) youth a place the meet friends and escape from supervision. Future Context In a world that is becoming more stressful (by an economic recession), more crowded (bigger cities) and more individual (lack of religion, leisure planning), youth will be pushed towards the Boy’s Room Culture (having all the technical and social possibilities, which is being conducted behind closed doors) or the Street Culture (being excessive assertive/ aggressive, driven by the lack of success experiences, financial pressure and low self-esteem). In both situations, youth does experience an individuality, which does not work for all adolescents. Either way, youth has to self-explore their values, education, leisure time and social interactions. Vision In order to provide the adolescents and others in the neighbourhood of the social interactions they need for creating their own identity, the statement I would like to make is: I want to enable adolescents to express their social and explorative behaviour, in such a way, that it stimulates the participation of strangers. Product The product that fulfills this statement consists of LED-tiles integrated with pressure censors. The configuration of the tiles is, that it provides the adolescents of a place to meet their friends (see figure). While meeting, users will be challenged to hit tiles, that spontaneous light up. When users doing extremely good, they will be rewarded by, for example, an entire floor that starts blinking. To find out what really happened, or to achieve the same result, youngsters will become active. The exploring, searching, doubting and trying, create an interaction that can be called vulnerable, which makes the situation more approachable for strangers. Since the configuration has a boundless character, it also invites by-passers to hit a certain tile. The result is a social interaction between the different users of the public space. Test To find out if the concept worked out as described, a prototype has been built to execute a usability test. The prototype consisted of seven interactive tiles (tiles with a lighting heart and four switches) and one remote control, which was necessary to tune in certain programs. The usability test was nothing more than the placement of the prototype in an environment that was suitable for youth meeting each other (place of retreat and interaction). In total three groups of youth were observed during their exploration with the prototype. The interaction with the product could be described as active and vulnerable. According to the youth itself, the concept was inviting and challenging. Some by-passers stopped to look at the action that was going on.","Vision in Product Design; contextmapping; youth/ adolescence; public space","en","master thesis","","","","","","","Campus only","","Industrial Design Engineering","Industrial Design","","","",""
"uuid:8add2640-47a1-4a59-9184-35e22837ac89","http://resolver.tudelft.nl/uuid:8add2640-47a1-4a59-9184-35e22837ac89","A Roadmap for the Transition from Paper to Digital Records","Badal, V.R.","Nannes, F. (mentor); Magnee, E. (mentor); Dietz, J.L.G. (mentor)","2009","Nowadays there are a lot of innovative activities going on in the youth care sector. One of the innovations is using digital client records instead of paper client records and in the future online access to digital records for clients. Before an organisation can make client records accessible through the internet, they have to professionalize and organize the digital client records and their own organisation. Thus when introducing a new working method in an organisation, organisations have to deal with organisational and technical changes. This thesis describes a roadmap which describes the process for transiting from paper to digital records in a youth care organisation where the organisational and technical issues will be taken into account. The DEMO methodology is used to model the organisation undergoing the change. The organisational model produced using this methodology, gives the management a good overview of how the care taking process takes place at the moment and can be used to improve this process if necessary. This model also helps to identify the roles and responsibilities of the actors involved in the organisation. Furthermore this model gives additional contribution to the concept of the Alares ‘knowledge environment’ which is also used the organisation according to its four components.","DEMO; paper records; digital records; digital signature; digital archiving; organisational change; organisation analysis; transition roadmap; transition process","en","master thesis","","","","","","","","2009-10-12","Electrical Engineering, Mathematics and Computer Science","Software Technology","","","",""
"uuid:5e2f5262-8e03-40cf-bc5d-346295c64dfd","http://resolver.tudelft.nl/uuid:5e2f5262-8e03-40cf-bc5d-346295c64dfd","A Numerical Study on Design of Normal and T-Head Coastal Groins","Eslami Arab, S.","Van Rijn, L.C. (mentor); Walstra, D.J.R. (mentor); Luijendijk, A.P.A. (mentor); Zijlema, M. (mentor); Stive, M.J.F. (mentor)","2009","Groins are old and intuitive means of reducing erosion and are found along the coast worldwide, although according to CEM (Coastal Engineering Manual 2003), “they are probably the most misused and improperly designed of all coastal structures”. The original purpose of groins was to reduce local erosion, that is, to hold the width of beach in their vicinities. Despite the simplicity of groins, their interaction with the beach is complex, and existing functional design guidance is limited. On the other hand, over the past decade there have been significant advances in understanding of coastal sediment processes, predictive modeling capability, and field measurements. Therefore, with the existing numerical tools the current study will be conducted in order to achieve better insight into this specific topic, to find some design criteria for normal groins and T-shape groins. The first step in this research is to do a wide literature review to find some reliable data regarding wave height and current velocities in a groin field. An irregular wave field must be studied, since regular wave fields concentrate energy around a single frequency, so they produce exaggerated offshore bar and strong rip currents (Hulsbergen et al 1978). On the other hand, the abilities of Delft3D numerical model must be validated for modeling currents and morphological interaction of littoral zone and structures for the case. Once we comprehend the current models are capable of modeling different phenomena, a sensitivity analysis will be carried out to find some design rules for these structures.","groin; erosion; numerical simulation; coastal protection","en","master thesis","","","","","","","","","Civil Engineering and Geosciences","Hydraulic Engineering","","Coastal Engineering","",""
"uuid:17e80d25-36d0-41c5-8a18-f5e7a6976a1b","http://resolver.tudelft.nl/uuid:17e80d25-36d0-41c5-8a18-f5e7a6976a1b","Database guided detection of anatomical landmark points in 3D images of the heart","Karavides, T.","Leung, K.Y.E. (mentor); Hendriks, E. (mentor); Bosch, J.G. (mentor); Reinders, M.J.T. (mentor)","2009","Automated landmark detection may prove important for the examination and automatic analysis of real-time three-dimensional (3D) echocardiograms. By detecting 3D anatomical landmark points, the standard anatomical views can be extracted automatically in 3D ultrasound images of left ventricle, for better standardization and objective diagnosis. Furthermore, the landmarks can serve as an initialization for other analysis methods, such as segmentation. In this thesis we describe an algorithm that iteratively applies landmark detection in perpendicular planes of the 3D dataset. The landmark detection exploits a large database of expert annotated images, using an extensive set of Haar wavelet-like features for classification, resulting in fast detection times suitable for real-time applications. The detection is performed using two cascades of Adaboost classifiers, that work in different 2D planes, in a coarse to fine scheme. The method is evaluated by measuring the total detection error for the landmark points between the detected positions and the manual ones.","classification; pattern recognition; ultrasound","en","master thesis","","","","","","","","2010-02-18","Electrical Engineering, Mathematics and Computer Science","Information and Communication Theory Group","","Media and Knowledge Engineering","",""
"uuid:7ae2ade8-3848-410e-b86e-bbd43cda7af5","http://resolver.tudelft.nl/uuid:7ae2ade8-3848-410e-b86e-bbd43cda7af5","Validatie Micro-Simulatiemodellen voor Railverkeer: Kalibratie en Validatie van OpenTrack","Agricola, M.","Hansen, I.A. (mentor); Goverde, R. (mentor); Baggen, J.H. (mentor); Weits, E. (mentor); Van der Meer, D. (mentor)","2009","Het doel van het onderzoek is het kalibreren en valideren van OpenTrack. Hierbij is gebruik gemaakt van de performance parameter van OpenTrack. Deze parameter heeft een sterke invloed op de gesimuleerde rijtijden in OpenTrack en is hierdoor geschikt om de uiteenlopende aard van de rijtijden te ondervangen in OpenTrack. De uitkomst van het onderzoek is dat een kalibratie van OpenTrack op basis van realisatiedata mogelijk is. Bij korte trajecten is de minimale rijtijd volgens OpenTrack te hoog ten opzichte van de minimale rijtijd uit de realisatiegegevens. Hierdoor zijn de kalibraties op korte trajecten van lagere kwaliteit. Een oorzaak kan zijn dat de matericelkarakteristieken te conservatief in het model zijn opgenomen, hier is verder onderzoek naar noodzakelijk. De instelling van de performance parameter loopt per traject zeer uiteen. Zeer waarschijnlijk is dit afhankelijk van de lengte van het traject en/of van het ingezette materieel. Hierdoor is een betrouwbare generieke valide instelling van OpenTrack niet mogelijk. Toekomstig onderzoek over verscheidende trajecten en diverse materieelsoorten is nodig om meer inzicht te krijgen in hoeverre een generieke validatie mogelijk is. De implementatie van de performance parameter sluit niet aan bij de praktijk. Aan bevolen wordt om uitrollen in de toekomst ook te ondersteunen in OpenTrack. Behalve het machinistengedrag inzake uitrollen, ook het remgedrag een verklaring zijn voor de uiteenlopende resultaten.","","en","master thesis","","","","","","","","","Civil Engineering and Geosciences","Transport & Planning","","","",""
