"uuid","repository link","title","author","contributor","publication year","abstract","subject topic","language","publication type","publisher","isbn","issn","patent","patent status","bibliographic note","access restriction","embargo date","faculty","department","research group","programme","project","coordinates"
"uuid:e0898d6d-fd0e-4359-9774-8b93a93cb18f","http://resolver.tudelft.nl/uuid:e0898d6d-fd0e-4359-9774-8b93a93cb18f","Private residential domains in the Netherlands: A research on the causes and effects of an increase of private neighbourhoods in urban areas","Verhoek, E.M.","Van Dorst, M.J. (mentor); Harteveld, M.G.A.D. (mentor)","2012","The number of enclosed residential domains (ERDs) in the Netherlands has seen a remarkable increase over the past twenty years. Roughly half of these projects are located in urban areas. This raises the question what the impact of large scale privatisation is on the city. Knowledge regarding the Dutch case is scarce. In particular, the relation between spatial aspects of ERDs and their effect on Dutch cities is a key aspect missing in the body of knowledge. In order to assemble and add relevant knowledge on this subject, this graduation project aims at answering the following question: How can the spatial design of private residential domains enhance the living quality in Dutch urban areas for both residents aswell as the public? The project focuses on the scenario of an increase of private residential domains in urban areas. The project is roughly divided into three phases. In the research part the problem is analysed and tools for analysis and design are developed. This is followed by the design phase in which the tools are applied and a privatised neighbourhood is designed. A large scale scenario featuring multiple ERDs in an urban area is simulated since there is a lack of such cases in reality to study. In order to define the properties of ERDs affecting the city a vision tool is developed considering the juridical, social and spatial properties. An ERD can be seen as a combination of different layers of segregation on top of the built environment, namely the accessibility of the area (spatial and social), the communities (social), the liabilities for the area (social and juridical) and the rights of ownership (juridical). To relate social, juridical and spatial properties of ERDs to future urban design, a literature research regarding the possible effects of an increase of ERDs on the Dutch public realm has been made. This research resulted in three recommendations for designing an ERD area. First, maintain a dense network accessible to the public. Second, the addition of expression of identity in space can have a positive influence on the role of public space. Third, homogeneity of a neighbourhood should be prevented. The quality of ERDs for the dwellers is defined by research on the reasons to live in a Dutch ERD, abstracted from literature research and media analysis of real estate agent advertisements of Dutch urban ERDs. For each layer different choices can be made, each affecting the others. Which properties form the starting point for an urban plan depends on the approach of the ERD project. An urban designer’s approach starts with the built environment, the accessibility and the right of ownership. The liabilities and the community are a consequence of the choices made in the urban plan. In contrast, an urban strategy approach starts with focussing on the social and juridical part. As a result, the built environment and accessibility are a consequence thereof. In order to focus on the effects of the spatial properties the urban designer’s approach is chosen. The design process was a test case of large scale privatisation for residential purposes in an urban area. The location chosen is Rivierenbuurt Noord in the Hague. The first assumption is that in the coming years the municipality will hand over this area to private actors. After that the desired level of accessibility and density in the area is determined with respect to the influences of the surrounding city scape. For further design, the accessibility in the area is set to meet the recommendation of having a dense urban network in private space. The next step is to test the possibilities for the built environment based on the density and the diversity of the neighbourhood. This includes a supply of different living environments, the diversity of resident groups and their possibilities to express identity and a diversity in accessible spaces for the public. The design process is a continuous process whereby choices for one property affected decisions made on other properties. The application of developed tools is a side product of this process. A ‘quality monitor tool’ developed during the research phase is used to compare the design with existing ERDs. The conclusion of this research is: ERDs can be of an added value for both the public and the public in a Dutch city in one urban plan by integrating the qualities for both. New types of living environments created by private residential domains provide new demands on the housing market, without necessarily having a negative impact on Dutch cites. But in order to design ERDs in Dutch urban areas, it is of high importance to decide first what the accessibility plan of the area would be on both publicly and privately ownded space, considering the value of the spaces for the public domain of the city. Living quality in private domains are supported by the input initiators of projects add and the role municipalities have as inspirators and projectmanagers of the privatisation projects. It is also possible to transform current publicly owned space into collectively owned space while adding value for all users. A remark is that the current juridical ownership structures in Dutch law are insufficient to provide large scale longterm privatisation processes at the moment.","privatisation; enclosed residential domains; gated communities; accessibility; public; private; Dutch urban area; segregation; living quality; spatial design","en","master thesis","","","","","","","","","Architecture","Urbanism","","Environmental Design and Urban design / Design as politics","",""
"uuid:9f3a4450-77df-4d38-b403-8125f6cee8cd","http://resolver.tudelft.nl/uuid:9f3a4450-77df-4d38-b403-8125f6cee8cd","Het eeuwige gebouw","De Freitas, F.G.","Andeweg, M. (mentor); Bijleveldt, S.W. (mentor); Nottrot, R. (mentor); Van de Voort, J. (mentor)","2012","Dual graduation Study: Housing lab: Study into the financial desirability of a new building concept, the Solids, for the Commercial real estate investor. Dwelling: Realisation of a Solid design","solids; DCF; NCF; financieel; haalbaarheid; dierbaarheid; veranderbaarheid","nl","master thesis","","","","","","","","2012-04-25","Architecture","Real Estate & Housing+ Architecture","","Housing + Dwelling","",""
"uuid:afe7efc0-8ccd-415a-9d6d-6f8a48480457","http://resolver.tudelft.nl/uuid:afe7efc0-8ccd-415a-9d6d-6f8a48480457","Op zoek naar een nieuw ruraal ideaal","Koopmans, U.R.; Keizer, W.J.","Schrijver, L.S. (mentor); Heintz, J.L. (mentor); Van de Voort, J. (mentor)","2012","De titel ‘Op zoek naar een nieuw ruraal ideaal’ staat voor een strategie met als doel een zelfstandige en duurzame dorpsgemeenschap te scheppen bestaande uit oorspronkelijke bewoners en nieuwkomers. De strategie is toegespitst op het aansporen en betrekken van de lokale bevolking en omvat drie elementen; een reizende kermis als initiator, een ambitiekaart als communicatiemiddel en multifunctionele gebouwen als instrumenten.","ruraal; platteland; krimp; gemeenschap; opblaasbare architectuur; idylle; agritecture","nl","master thesis","","","","","","","","2012-04-30","Architecture","Architecture","","Explore lab","",""
"uuid:773c796c-8cfe-4f6d-bdf5-f3b9821e7b31","http://resolver.tudelft.nl/uuid:773c796c-8cfe-4f6d-bdf5-f3b9821e7b31","Business development in the Dutch residential solar panel market","Vellinga, D.","Scholten, V.E. (mentor)","2012"," An extensive literature review provided this research with useful theories; a framework to assess business models (Osterwalder,2005) and a systematic process to analyze the sector and the business environment.  The electricity production sector is in transition; this comes with opportunities for new entrants into the market. The business environment indicates that such opportunities can be found in the residential market for solar panels, especially in countries with relatively high consumer electricity prices.  Confidential: Bullet excluded  Confidential: bullet excluded  The participation in the exploration and development of a business model in the real life of a Dutch start-up company has provided a very valuable basis for the empirical part of this thesis. It has given me the opportunity to reflect on the tools and theorems that I found in scientific literature and that I used in the development of a framework of analysis.  The Osterwalder Framework turned out to be a practicable and fruitful tool in this process. However I do recommend further research to identify and apply more elaborate tools and concepts for the complex matter of developing a business model for a start-up company entering an emerging market.","business models; PV; residential solar","en","master thesis","","","","","","","Campus only","2013-04-19","Technology, Policy and Management","TSE","","MOT","",""
"uuid:b1ad9907-76e1-4f6b-b1cc-688c4795bf5d","http://resolver.tudelft.nl/uuid:b1ad9907-76e1-4f6b-b1cc-688c4795bf5d","RMIT Zevenaar","Van Broekhuijsen, H.L.","Hermkens, A.W. (mentor); Koopman, F.W.A. (mentor)","2012","Onderzoek Waardestelling Masterplan Architectonisch ontwerp Bouwtechnische uitwerking","Herbestemming; Restauratie; Duurzaam; Masterplan; Architectuur; Bouwtechniek; Warm Bouwen; Maquette; RMIT","nl","master thesis","","","","","","","","","Architecture","RMIT","","","",""
"uuid:3b59880a-d523-4d88-8d6b-b41bb94295aa","http://resolver.tudelft.nl/uuid:3b59880a-d523-4d88-8d6b-b41bb94295aa","Reviving the Cultural Identity of Kea","Evangelou, D.","Nottrot, R.J. (mentor); Van de Voort, J.A. (mentor); Heintz, J.L. (mentor)","2012","This is a project for the small greek island of Kea. In order to help its economical development in sustainable way, a culture & trading center is offered to the island where locals can sell traditional products and promote their culture.","Greece; culture; Slow; island","en","master thesis","","","","","","","","2012-04-25","Architecture","Architecture","","ExploreLab","",""
"uuid:b6245dd1-064e-452b-8781-7a718c0ce244","http://resolver.tudelft.nl/uuid:b6245dd1-064e-452b-8781-7a718c0ce244","Improving the operations of the Facing & Cancelling Department in the sorting centre during the reorganization","Hueting, E.H.","Lukszo, Z. (mentor)","2012","","Lean Six Sigma; Reorganization; Expert interviewing; DMAIC","en","master thesis","","","","","","","Campus only","2013-04-19","Technology, Policy and Management","Energy & Industry","","SEPAM","",""
"uuid:7ed8d408-c83f-40bd-896b-fd1ecbf4c74a","http://resolver.tudelft.nl/uuid:7ed8d408-c83f-40bd-896b-fd1ecbf4c74a","Hybrid Buildings - Transport hub Istanbul","Aalders, B.J.T.","Cavallo, R. (mentor)","2012","","","nl","master thesis","","","","","","","","","Architecture","Hybrid Buildings","","Transport hub Istanbul","",""
"uuid:62191f9b-4749-447b-a657-ad3d72f214ce","http://resolver.tudelft.nl/uuid:62191f9b-4749-447b-a657-ad3d72f214ce","Haptic feedback on the steering wheel to maximize front axle grip","Van Gerwen, J.","Holweg, E.G.M. (mentor); Happee, R. (mentor); Katzourakis, D. (mentor); Schwab, A.L. (mentor)","2012","Traditional Electronic Stability Control (ESC) systems influence planar vehicle motions to better match these to the driver’s intention. These systems use the Anti-lock Braking System (ABS) hardware to generate the needed tire forces. This has a large impact on longitudinal vehicle motions. A second method of altering the front wheel tire forces is Active Front Steering (AFS), which alters the steering angle of the front wheels and therefore has a lower impact on longitudinal motions. A combined braking and AFS ESC system can ensure the braking action is postponed, or not executed at all. Haptic feedback on the steering wheel has proven to be helpful in vehicle control for lanekeeping systems. If a feedback torque can be designed that will achieve the same steering angle change an AFS system would, the benefits of a combined braking and AFS ESC system can be obtained without installing extra hardware. It is exactly such a feedback torque that is investigated in this research. It will guide drivers to the maximum front axle grip to help them achieve their desired vehicle motions. The corresponding steering angle will be selected from a range of steering angles, based on the lateral front axle force that will be generated at that steering angle. To find the front axle lateral force, a Pacejka tire model will be used. The feedback system is tested on a real vehicle. Nine test drivers drove the test vehicle with and without feedback on a circle with low friction surface (skid-pad) and on a small test track to test the effect of the feedback torque on their driving behavior in constant and dynamic circumstances. They were given instructions to follow the tracks as fast as possible, so that the desired yaw rate will be the maximum possible yaw rate and the feedback torque will guide towards the maximum front axle grip. On the skid-pad the feedback controller worked as intended: drivers managed to achieve a higher yaw rate. The analysis of the behavior on the track was hampered by changed circumstances between the tests with and without feedback. The analysis did show that the controller made the vehicle ‘eager to steer’; the feedback torque advised drivers to steer more. This led to quicker corner entries, but slower corner exits. The most noticeable change was found in road position, where the haptic feedback resulted in changed and more constant driving lines. There is room for improvement of the controller: it is recommended to ensure that any feedback torque will not work against steering straight to prevent drivers from problems with exiting corners.","haptic feedback; axle grip","en","master thesis","","","","","","","","2012-06-07","Mechanical, Maritime and Materials Engineering","Precision and Microsystems Engineering","","","",""
"uuid:51b1ed83-c6c7-470d-823f-3aef7ef10b80","http://resolver.tudelft.nl/uuid:51b1ed83-c6c7-470d-823f-3aef7ef10b80","Fulfilling Brand Aspirations with Sustainability - Bruynzeel Home Products","Dam, J.C.","Santema, S.C. (mentor); Wever, R. (mentor); Van Leeuwen, R.J. (mentor)","2012","Introduction The central question in this report is: How can Bruynzeel successfully integrate sustainability in its business? Sustainability is generally getting more attention and Bruynzeel’s customers (DIY-chains and expert-dealers) sometimes take inventory of sustainable products or start other sustainable initiatives. Bruynzeel now wants to know how sustainability can be integrated in their business so it can contribute to the company’s results. Integrating sustainability should lead to positive results rather than lead to losses. Three research subjects have been the foundation for composing an advice: sustainability, Bruynzeel and the context of Bruynzeel. Sustainability What is sustainability? The most used interpretation of sustainable development is that from the Brundtlandt commission (1987): a “development that meets the needs of the present without compromising the ability of future generations to meet their own needs”. This general definition needs an interpretation for Bruynzeel. Bruynzeel must realize that sustainability is not an attached subject to the company and is time consuming and loss-making. Sustainability is a balance between people, planet and profit. Profit can only be realized on the condition of people and planet. The balance requires a full integration of sustainability, only than can sustainability contribute to profits. Concerning sustainable results, sustainable development should be regarded as making small steps in the right direction that are relative improvements of a certain situation. Sustainability implementation programs have to be tailor-made for each company and each situation, there is no general solution or strategy on how to implement sustainability successfully. It is a combination of the right elements and circumstances. First Bruynzeel need to be clear and of the same mind on the motivation why sustainability has to be integrated. That is a determining factor in finding the right content but also in being successful with sustainability. Than, it must become clear what the steps are that Bruynzeel makes if it applies sustainability. The combination of the SWOT-elements form the basis for a strategy in which sustainability adds value to the company. Bruynzeel The strongest points of Bruynzeel are: its brand name, the expertise in developing and selling quality sanitary and fly-screen products and long relationships with DIY-chains. Its weakest points are an illogical product portfolio, a too little brand awareness of Bruynzeel as a sanitary brand and the lack of formal innovation and product development processes. A research to the motivations for sustainability reveals that there is no agreement at this moment on an ambition level for sustainability. The main drawbacks are priority and the business perspectives of sustainability. The drawbacks are the result of a wrong interpretation of sustainability. The strategy should respond to these counter arguments and reveal a right interpretation of sustainability. Context Bruynzeel possesses a modest position in its context and sustainability does not play a big role in it. The company is too small to put serious pressure on suppliers. Customers of Bruynzeel are few, big and able to choose from multiple different suppliers. DIY-chains raised the bargaining power on their suppliers last year by applying tenders on product categories. Suppliers like Bruynzeel are required to offer additional value and to show vision on product categories in the DIY-chains. Besides that the pressure to lower product prices is enormous. Sustainability does not play a big role in the context of Bruynzeel. Especially in the specific product categories of Bruynzeel sustainability is hardly an issue. Sustainable initiatives of Bruynzeel’s customers are very accessible and focus on compliance, responsibility and brand image. The pressure on Bruynzeel to integrate sustainability is therefore relatively low. It can be expected that coming years Bruynzeel satisfies customer’s sustainability requirements with applying certified wood and applying for BSCI (guidelines for suppliers concerning mainly human-rights and working conditions). However, several stakeholders of Bruynzeel wonder why Bruynzeel is not already engaged with sustainability as it belongs to an A-brand to respond to trends and developments. It can be noticed that many other A-brands are engaged with sustainability and use it as a differentiation tool to respond to the increasing demand to sustainable products, but also to show innovativeness and foresight and to create differentiation. Strategic advice The best way for Bruynzeel to integrate sustainability is to incorporate it in an A-brand strategy. A strategy that focuses on the brand Bruynzeel and the innovative character of the brand. It lets Bruynzeel fulfil to its A-brand aspirations. With this strategy, Bruynzeel becomes a front runner with new innovations and developments and gets a leading role on the markets and achieves a strong differentiation from competition. Besides, Bruynzeel acquires a clear and distinct brand image. People confronted with Bruynzeel should automatically relate the brand to high-quality and innovative sanitary products. To achieve this two subjects need to be adjusted and improved: Innovation and Communication. 1. Innovation If Bruynzeel extends the innovation scope from specific products to the bathroom as a whole, it meets the expectations of an A-brand much better. An A-brand is expected to be innovative, a focus on the bathroom as a whole creates a foundation for bathroom innovations rather than a focus on specific bathroom products does. Innovations of Bruynzeel than have to be categorized in three subjects: Technology, Experience and Sustainability. Basically every new innovation fits one of these categories, but the distinction provides possibilities for a clear brand position towards consumers. Besides, it makes the innovation processes of Bruynzeel more convenient. Technology With technology, Bruynzeel is able to warrant quality and to follow / setup new technological developments. New production processes, but also the application of audiovisual products fit in this subject. Experience The extension of innovation focus to the bathroom as a whole includes an increased emphasis on the experience and perception of a bathroom by users. Colours, rituals, functionality, materials, light and more belong to this subject. Collaboration with other suppliers to realize a wide range of product offers is an important part of this innovation field. Sustainability Sustainability has become one of the three innovation fields and this is how sustainability can optimally contribute to the company’s results. Basically, sustainability imply two implementations: The basic variant of sustainability that is a response to sustainable developments from the context and implies accreditation for FSC/PEFC, the appliance for BSCI guidelines. DIY-chains regard this together with service, reliability and responsibility as sustainability. This way of interpreting sustainability will become more and more a license to operate and is not a differentiation tool. The extended implementation of sustainability implies products and new innovations. This form of sustainability opens up a new solution space for products, creates differentiation from competition and enriches the brand image. Bruynzeel should not only apply for a basic variant of sustainability but make optimally use of it and use it as a differentiation tool. The value of sustainability in this strategy is an intangible value. Sustainability raises the brand image of Bruynzeel and innovative sustainable product concepts prove brand ambitions and create differentiation. Together with the innovations in the two other fields, a strong brand is positioned on the market. 2. Communication Improved communication programs respond to the weak brand awareness of Bruynzeel as a sanitary brand. The brand Bruynzeel is generally well-known, however Bruynzeel is barely known as a sanitary brand. Higher budgets are part of a better brand communication towards customers and consumers. Two results are achieved if Bruynzeel uses an approach in which every product launch is accompanied with an extensive advertising campaign that addresses both the brand and the specific product. The first result is that the brand Bruynzeel is known for sanitary products. The second result is the association of the sanitary brand Bruynzeel with innovative products and increased attention to each innovation. The extended marketing programs also contain an improvement of the brand visibility in DIY-stores. The desired effect is that consumers, from a distance, recognize Bruynzeel products between other products. Conclusion The A-brand strategy elaborates on strengths of Bruynzeel by making optimally use of the department product development which is a competitive feature compared to competitors. Several weak points of Bruynzeel are solved: First, the brand visibility increases and makes Bruynzeel a well-known brand of innovative sanitary products. Besides the portfolio and the innovation process on term will be more structured by consistently applying the innovation pattern. This strategy is also an answer to arguments against integrating sustainability. Exactly by addressing the urging subjects of differentiation and brand visibility the arguments against integrating sustainability are contradicted. In this way, incorporated in an A-brand strategy, the business perspectives of sustainability are positive and simultaneously the priority of it is proven. The biggest benefit of this strategy is achieving differentiation and offering additional value. This is a major threat from the market, but is responded with improved innovation and communication programs. In several years Bruynzeel will reach a major position on the markets and the company has grown due to a decent bathroom innovation program and increased marketing and advertising activities.","Sustainability; Sustainable Development; Strategy; Value Creation; Bruynzeel; Bruynzeel Home Products","en","master thesis","","","","","","","Campus only","","Industrial Design Engineering","Product Innovation Management","","","",""
