"uuid","repository link","title","author","contributor","publication year","abstract","subject topic","language","publication type","publisher","isbn","issn","patent","patent status","bibliographic note","access restriction","embargo date","faculty","department","research group","programme","project","coordinates"
"uuid:453c4f9b-1d9f-4f34-b0e2-a048c5f9a365","http://resolver.tudelft.nl/uuid:453c4f9b-1d9f-4f34-b0e2-a048c5f9a365","Designing a portable document reading device for the blind","Gudadhe, A.S.","Hajian, M. (mentor); Rusák, Z. (mentor)","2012","Situation: The World Health Organisation (WHO) estimates that worldwide, 285 million people are visually impaired due to various causes; 39 million of them are blind, a majority of them living in developing countries (WHO June 2012). This project stems from reflection into their lives. Literature forms one of the integral medium of acquiring knowledge and information for the blind. Currently, the system widely employed by blind people across the globe to read and write is the Braille standard. The difference in characteristics of this standard from the normal English language results in the need for literature to be reproduced in Braille; which is both time and resource-consuming. Hence, the number and diversity of Braille-translated books available is very limited; in-turn, limiting accessibility to information. Furthermore, the current braille literacy levels amongst the blind and visually impaired are very low, around 10% in USA (NFB 2009) and even lower in developing countries. Even today, despite the fast advance in technology, very few products in this category of reading aids exist in the market, which are especially designed and developed for the blind. Additionally, most of these products are either bulky, not portable, uncomfortable, expensive, partially useful or not designed/suitable for use by a blind person i.e. not user friendly. The high prices of such devices further render them unaffordable to a large section of the blind in developing nations, where the majority of blind reside; thus, catering only to a very small market of developed regions like US, Europe, etc. The project: The aim of this project is to enhance the daily life of the blind by developing a portable, affordable product utilising modern technology, which enables them to access everyday documents and books currently unavailable or difficult to obtain in Braille. Another aspect is to make the most of the expertise of the supervisory team in areas of electronics, image processing and user research, to develop a practical and functional test model. The project involved extensive rounds of interviews, modelling and testing with participants (user-centred and participatory design approach) along with a sound technical analysis. A typical reading device involves thee steps: image capture, processing (image correction algorithms and optical character recognition) and user interaction (buttons, text-to-speech audio output). Scanner is found to be a better image capture module in comparison to small camera found in smartphones, giving a clearer, sharper image and also easy to use. The proposed design comprises of two overlapping scanner heads. The scanned images from each of the scanners are matched, stitched together and then processed into an audio output using open-source Optical Character Recognition (OCR) and Text-to-Speech (TTS) algorithms. The various features and overall integrated design make the device portable (handheld), affordable (< 180 euros) and easy to use.","blind; reading device; portable; scanner","en","master thesis","","","","","","","Campus only","2014-08-21","Industrial Design Engineering","Design Engineering","","Master of Science Integrated Product Design","",""
"uuid:37ae1dfa-a0b7-480d-8060-3dbc702e7a59","http://resolver.tudelft.nl/uuid:37ae1dfa-a0b7-480d-8060-3dbc702e7a59","Incentives for deployment of electricity generation from renewable energy sources in Colombia","Ceballos Lopez, A.","Linares LLamas, P. (mentor)","2012","Colombia, despite having a well structuredlegal, regulatory and institutional framework, has not had a significant development of projects that take advantage of renewable resources for electricity generation, as RES-E technologies cannot compete with conventional technologies and there are no defined policies to incentivize them. This work inventories the available renewable energy resources and identifies the main motivations that would encourage Colombia to establish a renewable energy incentives policy. It also provides an analysis of different alternatives to promote the use of renewable energy sources, and proposes an auction for the construction of wind farms, as the main incentive mechanism, because it is identified as the most suitable taking into account the characteristics of the Colombian market. Additionally, this document proposes the most important changes required in Colombian law to meet the challenges introduced by an increase in the penetration of highly intermittent generation.","Renewable energy sources; Colombian electricity market; Economic incentives","en","master thesis","","","","","","","Campus only","2012-12-06","Technology, Policy and Management","Management","","EMIN Master on economics and management of network industries","",""
"uuid:9aa938da-35d1-457c-a2f5-9215cd068c9b","http://resolver.tudelft.nl/uuid:9aa938da-35d1-457c-a2f5-9215cd068c9b","The design of a global shutter CMOS image sensor in 110nm technology","Ge, X.","Theuwissen, A.J.P. (mentor)","2012","The goal of this work described in this thesis is to design a CMOS image sensor chip, implementing pixels with a 4.8?m pitch with a peripheral readout circuitry in a 110nm CMOS process. The architecture of the CMOS image sensor is presented, with a functional illustration for every block. The 8T global shutter pixel noise, circuit and layout are described and analyzed in the thesis. The simulation results of the pixel readout speed and the output swing are presented and some other performances are shown. The Analog Front-End (AFE) circuit design of a switched capacitor amplifier and a sample and hold stage are also presented. The layout of the AFE circuit for the important blocks is done and the practical concerns of the amplifier design are discussed. The Low Voltage Differential Signaling (LVDS) driver also is implemented in this thesis, the power efficiency and common mode feedback stability issues of it are tackled as well. The simulation results of the LVDS driver with extraction of parasitics are presented and the performance summary is given.","CMOS image sensor; global shutter pixel; AFE; LVDS","en","master thesis","","","","","","","","2012-08-31","Electrical Engineering, Mathematics and Computer Science","Microelectronics & Computer Engineering","","Microelectronics","",""
"uuid:02374125-d46f-4ef2-9d0d-c9f193af005b","http://resolver.tudelft.nl/uuid:02374125-d46f-4ef2-9d0d-c9f193af005b","Assessment of sustainability in product design at BK cookware","Zapata Mejía, J.E.","Wever, R. (mentor); Dehli, S.R. (mentor)","2012","BK (Berk Kampen) is a Dutch company part of the Royal Delft Group, which in the past 160 years has grown into a cookware brand that combines high quality with ease of use and prize-winning design. BK wants to deliver both convenience and inspiration for cooking through good products, specially developed for the needs of users through requirements that vary from cooking techniques and design to energy consumption and ease of use. In order to fulfil such goals, BK has a range of about 29 product lines of pots and pans, 7 lines of cooking tools and 3 lines of cooking knifes. BK’s product portfolio includes a wide range of processes and materials such as Tri-ply stainless steel, silicones, aluminium, and anti-adhesive coatings. These characteristics allow the company to offer a wide range of products for the Dutch and German markets and most of the production happens around Eastern Europe and Asia. The Corporate Social Responsibility (CSR) policy of BK has brought to the company a desire to find out about the environmental impact of their production processes, therefore there are a series of efforts in more sustainable practices inside the company. From the Corporate Social Responsibility (CSR) Policy of BK, there is an increasing interest to provide solutions in terms of environmental impact of products and processes. Although the company is established in the Netherlands, most of the production happens in Western Germany and Far East, which represents a challenge in the total control of the practices that the suppliers carry on during the different production processes. In order to contribute to the current CSR policies, BK wants to implement and assure more sustainable practices inside the company and within its stakeholders; therefore from the product design process it has to be considered multiple factors that will have an environmental impact in the future production process and the whole supply chain.","eco design; fryware; cookware; sustainability; sustainable development","en","master thesis","","","","","","","Campus only","","Industrial Design Engineering","Industrial Design Engineering","","Integrated Product Design","",""
"uuid:672a9aa7-6a77-4dbc-a135-03d3f5fa25f3","http://resolver.tudelft.nl/uuid:672a9aa7-6a77-4dbc-a135-03d3f5fa25f3","Impacts of Distributed Generation on remuneration of the Electricity Distribution Company in Spanish Electric System","Petrusic, A.","Domingo, C.M. (mentor)","2012","The contribution of Distributed generation (DG) to Electric Power Systems is evident, as it contributes to all major drivers of System´s sustainability (open market, security of supply and environment) propagated by EU directives. However, it is still not clear what impacts DG has on the Distribution System Operator´s (DSO) operations, which is in charge of providing a safe environment and technical conditions for their consumers and to DG as a newcomer in the system. This thesis addresses the issues related to Technical and Economic impacts of DG on remuneration of DSO. Using a Reference Network Model (RNM), an impact assessment is performed by analyzing changes in the grid´s operation through grid reinforcement costs, energy losses, and quality of service indices, under different scenarios of DG penetration in the Distribution network. Based on the obtained results recommendations have been made for alteration of DSO´s remuneration scheme for the case of a DSO in Spanish regulatory framework.","distribution; distributed generation; impact assessmen; Reference Network Model","en","master thesis","","","","","","","Campus only","","Technology, Policy and Management","Multi Actor Systems","","Erasmus Mundus Joint Master Programme in Economics and Management of Network Industries (EMIN): Engineering in Policy Analysis (TPM, TU Delft, Netherlands)","",""
"uuid:476aa816-4fe8-4b61-adf7-a8d25ade944b","http://resolver.tudelft.nl/uuid:476aa816-4fe8-4b61-adf7-a8d25ade944b","The Effect of Network Structure and Signal Settings on the Macroscopic Fundamental Diagram","De Jong, D.","Hoogendoorn, S.P. (mentor); Knoop, V.L. (mentor); Van Lint, J.W.C. (mentor); Taale, H. (mentor); Wiggenraad, P.B.L. (mentor); Schreuder, M. (mentor); Reijneveld, A. (mentor)","2012","Recently it has been proposed that the performance of a complete network can be represented graphically using only aggregated data for flow and density. The resulting graph is the macroscopic fundamental diagram (MFD), which relates the average flow (performance) to the number of vehicles in the network (accumulation). The resulting shape is often concave, meaning that the performance can be maximised if a fixed number of vehicles is maintained in the network (optimal accumulation). One of the most promising methods to achieve this, is by adapting signal timings. The objective of this thesis is to investigate if (1) a relationship between the shape of the MFD and the structure of the underlying network exists and on which factors this depends and (2) if the shape of the MFD of a subnetwork (neighbourhood) and its perimeter (ring of higher level roads (with signalised intersections) around a subnetwork) are affected by different signal timings and how this does affect the applicability of the MFD for control strategies. To assess the effect of the structure on the network, a tool has been developed to automatically generate fictitious networks with different structures, in which the amount of infrastructure and signal timings are matched dynamically to a randomly generated OD-matrix. The resulting networks are used as a base for the simulations, which are done in the microscopic traffic simulator VISSIM. Using various signal timings for signals located on the perimeter, the flow from the subnetwork to the perimeter is restricted and vice-versa, in order to assess how the MFD of both react to these changes. Regarding the relation between the shape of the MFD and the network structure, it is concluded that the structure of a network in itself does not have a strong influence on the shape of the MFD. Differences between MFDs are not caused by topological differences, but by the different characteristics of the roads (length, speed, capacity) and the amount and type of intersections in the underlying network. The different factors influencing the shape of the MFD could not be quantified – in order to construct MFDs based only on knowledge of the network and without the use of simulations - as the shape of the MFD is found to differ strongly, even for similar networks. As such it is concluded that the stochastic and dynamic nature of traffic has a strong influence on the shape of the MFD. Especially the accumulation is highly sensitive to differences in the distribution of traffic over the network, making the optimal accumulation particularly hard to predict. Regarding the effect of signal settings on the shape of the MFD of a subnetwork and its perimeter and its applicability for control strategies, it is concluded that a strong relation between the MFD of the subnetwork and its perimeter does exist, in which both react in the same way to changes in traffic demand and signal timings. The ratio between the performance of the subnetwork and perimeter is highly consistent and not strongly affected by changes in the signal settings, implying that signal timings exist, which optimise the performance of both the subnetwork and its perimeter. The optimal accumulation of the perimeter is found to be highly sensitive to changes in the signal timings. As a consequence it is concluded that the MFD is difficult to use for control strategies aiming to adapt signal timings to maintain the optimal accumulation in a part of the network, because these changed signal timings result in a different optimal accumulation.","MFD; Macroscopic Fundamental Diagram; signal settings; network structure","en","master thesis","","","","","","","","2012-08-28","Civil Engineering and Geosciences","Transport & Planning","","Transport and Planning","",""
"uuid:3d4832fb-53f3-4997-84b5-5c5d6bd265b9","http://resolver.tudelft.nl/uuid:3d4832fb-53f3-4997-84b5-5c5d6bd265b9","The Desigh of a High Dynamic Range CMOS Image Sensor in 110nm Technology","Liu, Y.","Theuwissen, A.J.P. (mentor)","2012","This thesis presents the design of a dual-transfer-gate high dynamic range CMOS image sensor. Several methods that can be applied to extend the dynamic range have been developed. However, all of these solutions have undesired problems, such as nonlinearity response, higher dark current shot noise and discontinues signal-to-noise ratio. In this thesis, a dual-transfer-gate pixel which can achieve 84.5dB dynamic range is implemented in a 110nm CMOS image sensor technology. The sensor provides 76fps speed in 12-bit digital format. The equivalent input noise is as low as 3.1e- by introducing correlated-double-sampling (CDS) technology.","High dynamic range; Image sensors; Ramp geneato; Column ADC; Bandgap; Multiplexer","en","master thesis","","","","","","","","2012-08-27","Electrical Engineering, Mathematics and Computer Science","Microelectronics & Computer Engineering","","Electronic Instrumentation Laboraoy","",""
"uuid:362367a2-d043-47b0-b10c-745faecf07ea","http://resolver.tudelft.nl/uuid:362367a2-d043-47b0-b10c-745faecf07ea","A multi-actor analysis approach in decision making: A framework to complement ISA-95 guidelines within manufacturing companies","Osorio, F.A.","Hermans, L.M. (mentor)","2012","Decision making in manufacturing activities is an everyday business. Manufacturing activities involve the interaction of different actors (i.e. departments) to provide information or activities that will serve as an input for decision making. The situation of dependency, network and cooperation in these activities calls in to question the suitability of today´s decision making processes, which more than enough do not actively and effectively include the several involved actors. A framework of a decision making process based on a multi-actor analysis approach was created and tested in manufacturing companies. This framework process proved with quicker and more effective decisions and suggests to have the potential to have great added value and more benefits to the companies using it. The thesis suggests that indeed, including the involved and affected actors at all stages of decision making, increases the chances to have succesful decisions and improves the support and better implementation of those decisions. The framework can be improved in several areas, most notably, by more empirical tests and research in different manufacturing companies among different regions.","decision making; multi-actor analysis; ISA-95","en","master thesis","","","","","","","","","Technology, Policy and Management","Policy Analysis","","Engineering and Policy Analysis","",""
"uuid:68c8e36e-5d0a-4ed1-ba01-283bf73d95d2","http://resolver.tudelft.nl/uuid:68c8e36e-5d0a-4ed1-ba01-283bf73d95d2","The Influence of Retention Basins on Tidal Dynamics in Estuaries","Lugt, D.","Schuttelaars, H.M. (mentor)","2012","The Ems estuary suffers from high concentrations of suspended sediment, which is harmful for the life in the river. Sediment import occurs because of tidal asymmetry, a difference between the velocity of the current during high tide and low tide. The use of retention basins are a possible measure to reduce the tidal asymmetry. An analytic model, using partial differential equations derived from the Shallow Water equations and Navier-Stokes equations, was used to investigate the influence of retention basins on the tidal dynamics and sediment transport in estuaries in general and the Ems estuary specifically. For these investigations, this analytic model is useful because system conditions can easily be changed. Results show that the locations of retention basins are of great importance for their performance. In the Ems estuary the location minimizing the sediment import is at the end of the estuary, near the weir. Enlarging the retention basin is better than placing a second basin at a different location in the estuary.","tidal dynamics; estuaries; Navier-Stokes; Shallow Water equations; retention basins; sediment","en","bachelor thesis","","","","","","","","2015-03-01","Electrical Engineering, Mathematics and Computer Science","Applied Mathematical Analysis","","","",""
