"uuid","repository link","title","author","contributor","publication year","abstract","subject topic","language","publication type","publisher","isbn","issn","patent","patent status","bibliographic note","access restriction","embargo date","faculty","department","research group","programme","project","coordinates"
"uuid:fd9407ea-2024-4849-8a9a-2e1f57a25d66","http://resolver.tudelft.nl/uuid:fd9407ea-2024-4849-8a9a-2e1f57a25d66","Kantoor Binnenste Buiten: Bedrijfshuisvestingsvoorkeuren creatieve industrie in Nederland","Arkenbout, R.B.","Remoy, H.T. (mentor); Van der Voordt, D.J.M. (mentor)","2012","Het afstudeeronderzoek: ‘Kantoor Binnenste Buiten’, bepaalt de gebruikervoorkeuren van de creatieve industrie op de schaalniveaus van locatie, gebouw en gebruik. Met behulp van de bepaalde gebruikersvraag is het praktijkinstrument: Transformatiemeter Creatieve Industrie ontwikkeld. Gebouweigenaren, projectontwikkelaars en overige initiatiefnemers kunnen met dit instrument eenvoudig bestaande leegstaande kantoorgebouwen toetsen of deze potentie hebben om te herbestemmen voor de creatieve industrie. Afbakening Dit onderzoek bepaalt de gebruikervoorkeuren van gebruikers uit de creatieve industrie, werkzaam in bedrijven met een bestaansrecht van minder dan 5 jaar, op de schaalniveaus van locatie, gebouw en gebruik. De creatieve industrie is op te delen in drie deelsectoren: creatieve zakelijke dienstverlening, kunst en media & entertainment. Voor iedere deelsector afzonderlijk zijn de gebruikersvoorkeuren bepaald. Aanpak onderzoeksmethodieken Dit onderzoek hanteert voor de beantwoording van de hoofdonderzoeksvraag vijf onderzoeksmethodieken: het literatuuronderzoek, bezoek aan drie creatieve clusters in Nederland, de delphi studie, enquête en toetsing van het praktijkinstrument op het bestaande kantoorgebouw: Trivium te Amsterdam. Bevindingen Bedrijven uit de creatieve industrie, met een bestaansrecht van minder dan 5 jaar, vinden bij de keuze van een nieuwe bedrijfshuisvesting de gebruikersvoorkeuren op het niveau van gebruik het belangrijkste. Men wenst dat de bedrijfshuisvesting voorziet in de facilitering van een gratis draadloze internetaansluiting, ontmoetingsplekken in het gebouw, de bedrijfsruimte is voorzien van goede beveiliging en er de mogelijkheid is om de huisvesting te huren via een maandelijks contract. Op het niveau van locatie zijn de gebruikersvoorkeuren met betrekking tot fysieke bereikbaarheid en de aanwezigheid van restaurants en café belangrijk. Indelingsflexibiliteit van de bedrijfshuisvesting en het gezamenlijk huisvesten in een kantoorpand met meerdere huurders zijn op het niveau van gebouw de belangrijkste voorkeuren. Verder volgde uit het onderzoek dat de drie deelsectoren van de creatieve industrie specifieke gebruikersvoorkeuren hebben voor de bedrijfshuisvesting.","communicatiemedia; kantorenleegstand; kantorenmarkt; hetnieuwewerken; creatieve industrie; herbestemmen; hergebruiken; gebruikersvoorkeuren; leegstand","nl","master thesis","","","","","","","","2012-04-18","Architecture","Real Estate & Housing","","Corporate Real Estate Management","",""
"uuid:450a6bb3-9ca0-4ced-a6cd-521d15e61c47","http://resolver.tudelft.nl/uuid:450a6bb3-9ca0-4ced-a6cd-521d15e61c47","Schakelpunt stedelijke ritmes in Scheveningen","Rietbergen, N.","Havik, K.M. (mentor); Engels, J. (mentor)","2012","","Scheveningen; Public Building; Ritmes","en","master thesis","","","","","","","","","Architecture","Public Building","","Public Realm","",""
"uuid:6aef10d5-5703-4f19-b1cc-44993d6a08d0","http://resolver.tudelft.nl/uuid:6aef10d5-5703-4f19-b1cc-44993d6a08d0","Virtual Prototyping in Laundry Products: Development of a Maxdiff and Conjoint Interface","Das, M.F.","","2012","The aim of this research is to find out how Fast Moving Consumer Goods companies can perform an effective and fast market research to investigate what excites consumers most in a laundry detergent product and what trade?offs are made between price and product attributes. A quantitative research method is developed for the laundry detergent market in which a conjoint and Maxdiff test are combined in a so?called virtual prototyping test.","virtual prototyping; conjoint; Maxdiff","en","master thesis","","","","","","","","2013-04-14","Technology, Policy and Management","Innovation Systems","","Economy of Innovation","",""
"uuid:38c0d41e-6676-405f-9378-89de88c80894","http://resolver.tudelft.nl/uuid:38c0d41e-6676-405f-9378-89de88c80894","Analysis of Pedestrian Crowd Movements at Lowlands","Duives, D.C.","Hoogendoorn, S.P. (mentor); Daamen, W. (mentor); Wiggenraad, P.B. (mentor); Gorte, B. (mentor)","2012","Several pedestrian crowd events that became disasters occurred in the last decade. Most of these events were either religious festivals, sport or music events. Even though these events are organized frequently, not a lot is known about pedestrian crowd movements. One of the key problems in the analysis is the lack of crowd movement data. Lowlands offered the Delft University of Technology the opportunity to gather a unique data set of undisturbed pedestrian crowd movements by means of a completely new recording technique using an octa-copter. The main objective of this MSc. Thesis was to build a theory that qualitatively and quantitatively describes the transition(s) between self-organizing crowd movements using this new airborne analysis method. To answer the main research questions equipment, software, theory and data analysis related issues needed to be solved.","pedestrian; crowd; movement; dynamics; Lowlands; helicopter; UAV","en","master thesis","","","","","","","","","Civil Engineering and Geosciences","Transport & Planning","","Transport and Planning","",""
"uuid:7c30200a-8742-4c82-bf84-f776626dc15e","http://resolver.tudelft.nl/uuid:7c30200a-8742-4c82-bf84-f776626dc15e","Evaluation of the One Variable Measured Boundary Condition Method WIN3VE","Gonon, Bastien (TU Delft Aerospace Engineering)","Schrijer, Ferdinand (mentor); Delft University of Technology (degree granting institution)","2012","This thesis is an evaluation of a wall interference correction program called WIN3VE. This program was developed in the 1990s by the National Aerospace Laboratory of the Netherlands (NLR) but never validated. WIN3VE is written for the High Speed Tunnel (HST) in Amsterdam. This wind tunnel is now run by the German and Dutch Wind tunnels (DNW). In order to provide their customers with more accurate results the DNW decided to investigate if WIN3VE could be used regularly during testing. To this end they started a validation process. This thesis is a step in the validation process, the goal given by the two following research questions: • What are the strengths and weaknesses of WIN3VE? • Where do the weaknesses come from?","","en","master thesis","","","","","","","","","","","","Aerospace Engineering","",""
"uuid:b8c3c3de-b50b-4bf8-a803-b843136390c2","http://resolver.tudelft.nl/uuid:b8c3c3de-b50b-4bf8-a803-b843136390c2","Experiencing Scheveningen, a public building","Prins, H.J.","Havik, K.M. (mentor)","2012","a design for a public building that focusses on the arrival of beach tourists in Scheveningen","Scheveningen; Public Building; Public Realm; The Hague","nl","master thesis","","","","","","","","2012-04-13","Architecture and The Built Environment","Architecture","","Public Building","",""
"uuid:6a444eab-bfa9-4275-8045-50394ad1b4d4","http://resolver.tudelft.nl/uuid:6a444eab-bfa9-4275-8045-50394ad1b4d4","At home in the city - Connecting Grounds","Van Rooijen, J.","Kuitenbrouwer, P. (mentor); Van der Zaag, E. (mentor)","2012","","urban farming; dwelling; social interaction; territory; connection; berlin","en","master thesis","","","","","","","","2012-04-25","Architecture","Dwelling","","","",""
"uuid:0c8dd0c8-3274-4e12-93d1-1661998f5cc0","http://resolver.tudelft.nl/uuid:0c8dd0c8-3274-4e12-93d1-1661998f5cc0","De straattaxidienst gereframed: De ontwikkeling van een ‘product-service system’ voor Taxicentrale Amsterdam","Uitendaal, T.J.","Gemser, G. (mentor); Manschot, M.A.J. (mentor)","2012","In de Amsterdamse straattaxi-industrie zijn vandaag de dag nog steeds verschillende problemen voor vooral de taxigebruiker te observeren: geweigerde korte ritjes, te hoge prijzen, ongehoord gedrag van chauffeurs. De dieperliggende oorzaken als informatieasymmetrie en marktmacht zorgen er uiteindelijk voor dat de consumenten de taxi negeren en zij deze uiteindelijk alleen gebruiken als zij niet anders kunnen. In opdracht van Taxicentrale Amsterdam (TCA) is er in dit afstudeerproject gezocht naar een tastbaar ‘product service system’, dat beter aansluit bij de belangen van voornamelijk de consument en de taxichauffeurs in het Amsterdam van 2016. Om deze opdracht te vervullen, werd tijdens dit project de ‘Vision in Design (ViP)’-ontwerpbenadering van Hekkert en Van Dijk (2011) geadopteerd. Door een coherentie te creëren in meer dan honderd geïdentificeerde factoren, verzameld vanuit verschillende perspectieven en bronnen in een combinatie van desk- en veldonderzoek, is er uiteindelijk inzicht verworven in de context van het domein straattaxivervoer in Amsterdam in 2016. In deze context zijn er drie sturende krachten opmerkelijk, die elkaar onderling beïnvloeden. Allereerst zien we een markt die volledig bevrijd en gefragmenteerd is. De consument voelt zich uniek, verwacht ook zo behandeld te worden en zal hierdoor ook meer initiatief tonen. Om deze reden trachten bedrijven en individuen elkaar beter te leren kennen. Niet langer kan de industrie voort op de ‘one size, fits all’ aanpak. Binnen deze markt zijn er twee type consumenten te herkennen: enerzijds de ‘prosument’, die online, kritisch en zelfverzekerd is en niet te teveel zal betalen; anderzijds de ‘passument’ die een veel passievere houding inneemt, zich dus niet breed oriënteert en zich vooral laat leiden door adviezen uit zijn netwerk. Ten tweede is er een structuur in de taxi-industrie te herkennen die karakteristiek is voor Amsterdam in 2016. Deze structuur, gedreven door een bepaalde wijze verbondenheid, heeft de vorm van een netwerk. Een netwerk waarin vanzelfsprekend een wisselwerking is; een wisselwerking waarbij men waarde geeft en neemt. Deze waarde kan genomen worden met collectieve en individuele doelen, maar bovenal is het een krachtige basis om waarde te creëren. Deze waarde kan geleverd worden vanuit het volume of vanuit de individuele kwaliteit. De cohesie tussen alle individuele chauffeurs in dit netwerk, vormt uiteindelijk het volumineuze netwerk. Een analogie die deze wisselwerking goed illustreert, is het motto van de Drie Musketiers: ‘Één (geven vanuit de individuele kwaliteit) voor alle (verkrijgen voor het collectieve doel)’ en ‘Alle (geven vanuit het volume) voor één (verkrijgen voor het individuele doel)’. Aangevuld met ‘alle voor alle’ en ‘één voor één’ zijn alle mogelijke relaties gerepresenteerd. Als derde worden beide voorgaande sturende krachten in de context onder druk gezet door het momentele karakter van deze context. De straattaxi-industrie presteert in momenten: klanten worden eenmalig, voor een paar minuten ontmoet en de vraag naar taxi’s is met pieken en dalen. Vooral het leren kennen van de klant om een product op maat te leveren wordt hierbij onder druk gezet. De consument wil uiteindelijk voorzien worden in zijn vervoersbehoefte, de taxichauffeur wil hierin voorzien en TCA laat deze twee bij elkaar komen – elkaar ontmoeten. Door de houdingen van de consument (actief of passief) en de taxichauffeurs (‘alle voor alle’, ‘alle voor één’, één voor één’ of ‘één voor alle’) te combineren, ontstaan er acht type ontmoetingen. Elk type ontmoeting behoeft een specifieke benadering van TCA om deze ontmoeting te stroomlijnen of zelfs te laten ontstaan. Als deze ontmoeting niet plaatsvindt in de gepaste relatie tussen de beide partijen, ervaart de consument de ontmoeting als negatief en zal hij op den duur niet meer terugkeren. TCA dient alle acht de type ontmoetingen te managen om de taxi chauffeurs zo van de best mogelijke exploitatiemogelijkheden voorzien. In de ‘alle voor alle’-ontmoeting met de prosument is het doel de consument vrije toegang te geven tot de taxidienst door én om ze te binden aan TCA - waardoor zij uiteindelijk vaker terugkeren. De taxidienst dient vrij toegankelijk te zijn. In dit geval wordt met toegankelijkheid een combinatie van betaalbaarheid en beschikbaarheid bedoeld, waarbij betaalbaarheid betekend dat de kosten geen belemmering vormen voor het gebruik ervan. Abonnementen kunnen in deze vrijere toegang voorzien. In de meest ideale situatie is het abonnement ‘simpel’ maar ‘compleet’, terwijl de relatie ‘open afgebakend’ en ‘vrijwillig vangend’ is. Op deze manier krijgt de consument exact wat hij zoekt: de taxi. Verder blijkt het belangrijk dat de vrije toegang voorbij het moment gaat, het dient altijd aanwezig zijn. Een ‘verwachtingsvolle’ en ‘herhalende’ relatie tussen de consument en het abonnement van TCA creëert dit. De dienst en de consument bouwen hierbij aan een relatie. Om dit te realiseren dient het abonnement ‘proefbaar’, ‘geduldig’, ‘empatisch’ en ‘kwekend’ te zijn. Daarnaast zou het interessant zijn als de relatie tussen de prosument en de passument ‘meetrekkend’ is, waardoor de toegang voor de passument ook vrij wordt. Dit karakter is gevat in een simpele, maar effectieve dienst voor TCA. Het abonnement maakt de dienst toegankelijk zoals het abonnement van de mobiele telefoon je vrijer laat bellen en het abonnement op een attractiepark je deze parken vrijer laat bezoeken. Voor TCA en haar aangeslotenen zorgen de gebonden klanten voor een vastere bezetting van de taxi – ofwel betere exploitatiemogelijkheden. Binnen het uitgewerkte abonnementenconcept zijn twee iteratieve processen vormgegeven. Enerzijds de iteratie van het gebruik van de taxi, waarbij de consument incheckt met zijn smartphone en vervolgens van A naar B gebracht wordt. Anderzijds de iteratie van het in eerste instantie registreren van hemzelf via de website, waarbij het juiste abonnement wordt gekozen. Maandelijks loopt hij door deze iteratie van begrijpen, analyseren en vergelijken heen, om het abonnement zo goed mogelijk naar zijn wensen aan te passen. De dienst komt met twee verrijkingen in het basisproces om de consument dichter bij de dienst te brengen. Allereerst dienen zij te bouwen aan hun relatie, waarna zij hiernaar kunnen handelen. Dit wordt gerealiseerd door de consument langzaamaan te laten proeven in de proefperiode, door hem te informeren, door hem van abonnement te laten switchen, door hem zijn persoonlijke gegevens te laten vertellen wanneer hij dit wil, door hem taxiritten aan te bieden, door hem te verrassen bij specifieke gebeurtenissen, door hem te vergeven als hij zijn smartphone is vergeten om in te checken, etc. Ten tweede kan de passument meegenomen worden aan de hand van de prosument door bij hem ‘op het abonnement’ te kunnen. Al met al kan TCA extra waarde leveren aan beide geïdentificeerde klantensegmenten door hen te binden via de abonnementendienst. Taxiconsumenten krijgen hierdoor een vrije toegang tot de taxi, terwijl taxichauffeurs een vastere bezetting van hun taxi hebben.","Taxi; Service design; ViP","nl","master thesis","","","","","","","Campus only","","Industrial Design Engineering","Product Innovation Management","","Master of Science Design for Interaction","",""
"uuid:a08e1175-c75e-4648-ac98-317c9963671b","http://resolver.tudelft.nl/uuid:a08e1175-c75e-4648-ac98-317c9963671b","Financiële haalbaarheid van herbestemming","Schmidt, R.P.E.","Remøy, H.T. (mentor); Koppels, P.W. (mentor)","2012","Financial feasibility of office conversions. Hoge leestand op de kantorenmarkt, afwaarderingen en demografische ontwikkelingen bieden kansen voor projectontwikkelaars; kansen op het gebied van herbestemming van leegstaande kantoren naar woningen. De praktijk wijst echter uit dat onder invloed van gebrek aan inzicht in financiele haalbaarheid, herbestemming nog maar weinig van de grond komt. De hoofdvraag luidt dan ook: Onder welke omstandigheden (locatie, markt en gebouw) is herbestemming van leegstaande kantoren naar woningen financieel haalbaar voor projectontwikkelaars? Theoretisch onderzoek, projectanalyses en interviews hebben geleid tot een rekenmodel dat antwoord kan geven op deze hoofdvraag. Een rekenmodel waarmee de financiele haarlbaarheid van herbestemming op basis van een beperkt aantal variabelen inzichtelijk gemaakt kan worden.","leegstand; financieel; haalbaarheid; rekenmodel; quickscan; herbestemming","nl","master thesis","","","","","","","","2012-04-17","Architecture","Real Estate & Housing","","Real Estate Management","",""
"uuid:35384562-68e4-4b7d-bd10-9dd2773f6300","http://resolver.tudelft.nl/uuid:35384562-68e4-4b7d-bd10-9dd2773f6300","Landschap als motor voor publieke interventie. Cultuur complex voor de Kompasbuurt in Scheveningen","Middelkoop, T.","Havik, K. (mentor); Engels, J. (mentor)","2012","Landschap als motor voor publieke interventie. Landschap kan voor steden een nieuwe locatie zijn waar een gemeenschap kan samenkomen. Het kan een nieuw publiek domein worden waar andere typische stedelijke publieke domeinen juist verdwijnen. Landschap is voor Scheveningen een belangrijk kenmerk van haar identiteit. Alleen is een probleem te constateren dat het landschap geen continu ervaring bied. Het is sterk gefragmenteerd in het stedelijk weefsel. De fragmentatie kan in een continue ervaring veranderen door toevoeging van landschappelijke kenmerken. Hierbij is er tevens een toevoeging aan het publieke domein van de stad. De Kompasschakel in Scheveningen is typisch zo'n plek waar de relatie met het landschap verdwenen is. Wat opvalt is dat hier de kwaliteit van het openbaar terrein tevens van behoorlijk slechte kwaliteit is. Het bouwblok welke zich in het centrum bevindt vormt een barrière voor omliggende wijken. De publieke domeinen van de haven, de visserswijk en Scheveningen dorp zijn van elkaar gescheiden. Door het openbreken van het blok en landschappelijke kenmerken toe te voegen wordt de algehele fragmentatie vermindert en worden de publieke domeinen weer gekoppeld. De Kompasschakel kan hiermee weer de centrum-/ schakelpositie innemen die het gebied vraagt. In het open terrein wat overblijft na sloop van schuurtjes en garages is plek voor een cultuurcomplex. Er is hier plek voor een buurttheater gericht op de jongeren van de omliggende wijken. Er worden workshops gegeven en theaterproducties opgevoerd. Hiermee wordt de centrumpositie van de Kompasschakel versterkt. De gemeenschap heeft weer een plek om samen te komen en elkaar te ontmoeten. Landschap is in het ontwerp een belangrijk thema. Het gebouw gaat de relatie aan met de nieuw geplaatste duinen. Het gebouw is in, tussen en op het duin geplaatst. Hierbij gaan landschap en architectuur in elkaar over.","Landschap; duinen; cultuur; theater; Scheveningen; publiek domein","nl","master thesis","","","","","","","","","Architecture","Architecture","","Public Building, Public Realm","",""
"uuid:58d4e9bc-925f-4c6f-a128-d1db4a0ea959","http://resolver.tudelft.nl/uuid:58d4e9bc-925f-4c6f-a128-d1db4a0ea959","Pastoe complex utrecht zuid studio Rmit","Siebelink, F.R.","","2012","","","nl","master thesis","","","","","","","","","Architecture","RMIT","","","",""
"uuid:09b89dd6-8b72-468d-8f90-ee69c710ac9c","http://resolver.tudelft.nl/uuid:09b89dd6-8b72-468d-8f90-ee69c710ac9c","Design of the eye-catcher: A device to increase the attention span of young children to support automatic strabismus angle measurements","Meijer, T.J.","de Ridder, H. (mentor)","2012","“Watch the birdie” Says the photographer to catch the attention of the child for a few seconds. My assignment was to design the “bird”. In this graduation project the photographer, the camera, the child to be photographed and the bird were replaced by the orthoptist, a device to measure angles of cross-eyedness (strabismus), the patient to be measured and the the “eye-catcher”. Strabismus Crossed eyed people can be operated on. The current trend is to perform this surgery in very young children which leads to a demand to also perform the measurement of the angle of strabismus at an early age. My assignment was to design an instrument aimed at children of age group 6 months to 3 years that can draw and keep their attention, and could lead their gaze into different directions during testing. Current method to measure strabismus angles Currently, the measurement of the angle of strabismus is performed manually by an orthoptist. During this test, the orthoptist is responsible for drawing the child’s attention. This additional task of entertaining complicates his work. DAISY- automatic strabismus angle measurement At the faculty of Mechanical Engineering of the Delft University of Technology, an instrument is being developed, the DAISY, which can measure the angle of strabismus in crossed eyed people automatically. This method requires of the patient to look in different directions of gaze for about 1 second per direction. In testing adults, this is no problem, whereas in working with young children this can be problematic. The essence of this project was therefore twofold: - To establish how to draw a child’s attention. - To establish how to have a child look into different directions of gaze. The eye-catcher and its functioning The eye-catcher will in the future be functioning together with the DAISY. Because of the fact that the latter is still being developed, it is not yet entirely clear what it’s looks and exact method of functioning will be like. What can be assumed as a basic starting point for the development of the eye-catcher is that a child’s attention needs to be drawn during a period of 30 to 60 seconds of which the child has to be looking at one specific point for approximately one second at a time. Ideally, measurements are being performed in 9 different directions of gaze. The DAISY has to be able to register exactly where the child is looking at. Also of importance is that the eye-catcher needs to be attractive to the child and can’t disturb the DAISY’s functioning, or the other way around. These basic thoughts and considerations formed the basis for my research. Automatic measuring and entertaining The final result will be that both the actual measurement as drawing the attention of the child, can be done automatically in stead of manually using the combination of the DAISY and eye-catcher. Process of the project The final design of the eye-catcher was designed after an in depth process of research of the human eye, spending time with different orthoptists and eye doctors, watching strabismus surgery, in depth study of the development of the DAISY, performing a survey among hundred orthoptists (one third of all orthoptists in The Netherlands), further development of ideas in a creative session and literature research on children in the relevant age group. The design that was made was then tested on the target group. Design of the eye-catcher The essence of the design consists of popular children’s comic book figures that are digitally shown, one after the other, in nine different directions of gaze. Results practical tests with the eye-catcher The main objective of testing was to establish whether the eye-catcher was able to draw the children’s attention. Results showed that the eye-catcher was definitely capable of doing so, as well as directing the children’s attention towards one of the nine directions of gaze and keep their focus there. The nine different directions were not always easy to distinguish. Eye versus head movements towards a stimulus The test results confirmed what is described in the current literature on this matter: a child first draws his eyes towards a certain direction, for example towards the left. Secondly, he will turn his entire head to the left so that he does still look at the same object but his eyes are not turned leftwards anymore.","eye-catcher; attention; young children; strabismus; DAISY; cross-eyedness","en","master thesis","","","","","","","Campus only","","Industrial Design Engineering","Industrial Design","","Master of Science Design for Interaction","",""
"uuid:542e3afe-4e8f-45ef-af06-fb2b98de475b","http://resolver.tudelft.nl/uuid:542e3afe-4e8f-45ef-af06-fb2b98de475b","Nieuwendammerhaven: A new gateway to the city","Kabel, D.","","2012","A marina hotel & spa by a pictureque harbour.","hybrid; hotel; spa","en","master thesis","","","","","","","","","Architecture","Architecture","","","",""
"uuid:00959342-09ed-45f0-b0b0-9f0afb7ff06a","http://resolver.tudelft.nl/uuid:00959342-09ed-45f0-b0b0-9f0afb7ff06a","Yolngu Aboriginal Architecture","Van Leeuwen, R.P.","Notrott, R. (mentor); Cuperus, Y. (mentor)","2012","Afstudeerwerk van de ontwikkeling van Yolngu Aboriginal Housing in Australia. Posters with drawings and concept drawings.","graduation","en","master thesis","","","","","","","","2012-06-23","Delft University of Technology","Bouwkunde","","Hyperbody","",""
