"uuid","repository link","title","author","contributor","publication year","abstract","subject topic","language","publication type","publisher","isbn","issn","patent","patent status","bibliographic note","access restriction","embargo date","faculty","department","research group","programme","project","coordinates"
"uuid:d441cb5f-9cb7-412c-9a6c-1e7f862625f0","http://resolver.tudelft.nl/uuid:d441cb5f-9cb7-412c-9a6c-1e7f862625f0","Interactive Design Studio: A spatial-computing framework fro non-IT specialists","Di Figlia, A.","Dulman, S. (mentor); Pruteanu, A. (mentor); Langendoen, K. (mentor)","2012","In recent years, application domains outside information technology such as architecture have shown an increasing interest in the capabilities of networked systems such as localized computation, reduced power-consumption, and distributed interaction. These capabilities incline the design of interactive environments towards the IT-domain. In particular the employment of large scale distributed systems in interactive designs bring along new challenges for architects/designer such as distributed algorithm design, programming skills, embedded platform knowledge. As a consequence of this new trend, adequate software tools to bridge the gap between the IT-world and the field of interactive design are scarce. In order to fill that gap we propose a framework called Interactive Design Studio(IDS) which aims to provide the necessary tools to hide the technological aspects from the end-user when designing interactive environments. To tackle the problem of handling large scale networks of embedded platforms we are convinced that spatial computing is a promising paradigm. The main reasons are the scalability(network size does not influence node behavior) and resiliency to network dynamics(network is hidden by space abstraction). Therefore we present a spatial computing framework for non-IT specialists. We provide a way to specify agent-level behavior and to generate the corresponding code for a specific embedded platform. In our case, we use the eLua VM enhanced with the necessary spatial computing capabilities. We show that spatial computing is a good methodology for Industrial Design and Architecture. Moreover, we show that spatial computing is possible using off-the-shelf virtual machines for embedded platforms. In conclusion, we demonstrate that IDS succeeds within a certain extent in abstracting or hiding the underlying technological aspects(spatial computing) from end-users.","spatial computing; interactive design","en","master thesis","","","","","","","","","Electrical Engineering, Mathematics and Computer Science","Embedded Software","","Embedded Systems","",""
"uuid:4b44e2b8-7ab2-4415-8c16-ba774273e4ad","http://resolver.tudelft.nl/uuid:4b44e2b8-7ab2-4415-8c16-ba774273e4ad","Correlation of fracture patterns, lithology and tectonic position in Mesozoic carbonate rocks","Van Oosterhout, D.; Ravestein, T.; Nolte, H.","Bertotti, G. (mentor)","2012","Analyzing core data for fracture analysis is restricted by costs and gives limited information. Outcrop studies with the software DigiFract give a more complete set of information about fractures. The aim of this research is to find correlations between fractures patterns, lithology and tectonic position in the area around Coldigioco, Marche, Northern Apennines, Italy. In this area the current topography consists of two anticlinal structures with thrust origins. These thrusts originated during the Miocene as a result of the Corso-Sardinia-Calabria/Adria collision. The formations in this region consist of limestone and some chert/marl layers. To analyze the fracture patterns there are different ways of statistical processing, including determining fracture density, fracture orientation, fracture height and mechanical unit distributions. By correlating these statistics with lithology and tectonic location, the following can be concluded: The difference in fracture densities between the eastern and western flanks of the eastern anticline are caused by an active axial surface fold. The dense fractured western flank of the anticline is part of a deformed panel and the less dense fractured eastern flank is part of a undeformed panel of the fold. Furthermore one could conclude that the fracture pattern in the undeformed panel of the fold tends to be irregular due to the presence of an axial plane just above this panel. Parts of this panel have already been influenced by this upcoming change of bedding orientation or some parts have already passed this axial plane. The final conclusion related to tectonic position is that on the axial plane of a fold compressive stresses can cause stylolites perpendicular to the bedding. Two prominent influencing factors in lithology are the hardness of the rock and the presence of marl and chert layers. The formations of middle hardness are fractured regular. The opposite can be seen in the other, harder or softer formations. Finally one can conclude that marl and chert layers act as non-fractured or less fractured boundaries and cause bed confined fractures.","fracture pattern analysis; DigiFract software; fracture density; chert/marl layer influence; mechanical unit distribution","en","bachelor thesis","","","","","","","","","Civil Engineering and Geosciences","Geoscience & Engineering","","Section for Applied Geology","",""
"uuid:90934aec-41ca-41f7-a51b-17590bcdfce9","http://resolver.tudelft.nl/uuid:90934aec-41ca-41f7-a51b-17590bcdfce9","Design and development of a dust collecting system full indicator for hand sanders","Salvemini, E.","Hajian, M. (mentor); Van Breemen, E. (mentor)","2012","Skil costumers focus on the quality-price relation at the moment of deciding, which tool they are going to buy. Therefore, Skil products are feature centred. In the case of hand held sanders a dust box is a sign of quality. However, the efficiency of this kind of collector is much lower than the one of a common dust bag. Skil came with the idea ofhaving a dust bag inside a dust box concept. This new concept will keep the efficiency of the bag while giving the user the aesthetics of a dust box. Nonetheless, a new problem arose. The user does not realize when the dust box is full,as the inside of the collector cannot be seen. The assignment for this graduation was to design a mechanical system, which makes the user aware of when the dust collector is full and that can be integrated in a current dust box. This report shows the process followed to came up with the solution to the problem. First, an extensive analysis phase, trying to cover all aspects related with dust collectors, is presented. The market, the user, patents, information from the company, scientific studies, self-performed tests and much more information, was gathered to obtain the criteria for the new tool. Secondly, the Ideation and conceptualization phase. In this section; ideas, their working principles test and their evolution into concepts are presented. Furthermore, those concepts were evaluated and tested as well, in order to see which one fit the current Skil situation. Finally the embodiment phase presents a CAD model, of the chosen concept, and its performance as a final prototype. The outcome of this project was a mechanism, which not only solved the stated problem, but it was also applicable to any Skill sander. Recommendations are given to make the company aware, weather or not, the system should be applied.","full indicator; hand sanders","en","master thesis","","","","","","","Campus only","","Industrial Design Engineering","Product engineering","","IPD","",""
"uuid:a5dc5441-0fa1-4a4e-8da1-2048ba3334e9","http://resolver.tudelft.nl/uuid:a5dc5441-0fa1-4a4e-8da1-2048ba3334e9","The Influence of Tar on the Performance of Solid Oxide Fuel Cells","Van der Kleij, A.","Aravind, P.V. (mentor); Boersma, B.J. (mentor)","2012","""As fossil fuels are depleting, polluting and an increasing source for global conflicts it has become important to find alternatives. It is essential to develop conversion chains that are able to compete with the non-renewable energy sources both technically and economically. Biomass is an upcoming flexible energy source, and has a close to carbon neutral life cycle. In case of combined heat and power production, high system efficiencies can be attained when biomass gasifiers are connected with solid oxide fuel cells. Contaminants form however a thread to successful performance and long-term operation. Tars are one of the main harmful contaminants as they cause carbon deposition, but can be made harmless and converted into heat and electricity using an SOFC. It was chosen to use a model tar (toluene) in combination with synthesized mixtures. Dry operation was compared with wet. The main variables were the temperature (973, 1073 and 1173K) and compositions. Open and closed circuit measurements were performed to evaluate the catalytic and electro-catalytic reactions. Ni/GDC cells were chosen for their resistance towards carbon deposition and placed in a single cell setup. Electrochemical impedance spectroscopy was used to evaluate material changes and polarisation losses. I-V curves were taken to evaluate the performance and degradation. Gas chromatography was used to analyse the anode-off gases and to give an indication of the mechanisms at stake. Syngas as well as biogas were successfully operated under dry and wet conditions, the voltage oscillated but the average remained constant. Power production was found to be possible, although within a voltage bandwidth. Dry syngas performed slightly better than wet syngas. During dry reforming of CH4 it was found that the closer to equimolar conditions the higher the produced power. Carbon deposition was suspected for all syngas conditions at all temperature levels, but it did not influence the short time operation (45 minutes). No degradation was found during a long term (24 hour) tar and syngas operation at 1073K.","","en","master thesis","","","","","","","","","Mechanical, Maritime and Materials Engineering","Process and Energy","","Energy Technology (SPE)","",""
"uuid:b7877dd3-3b11-4016-914f-488feec88bfc","http://resolver.tudelft.nl/uuid:b7877dd3-3b11-4016-914f-488feec88bfc","Numerical Investigations of Coherent Structures in Axial Flow in Single Rod-Channel Geometry","Gurunath, S.","Portela, L. (mentor); Rohde, M. (mentor)","2012","In order to ramp up the conversion ratios and burn-up of nuclear reactors, it is inevitable to go to tightly packed fuel rods in the reactor. These nuclear reactors with tightly packed rod-bundles are characterized by interesting flow patterns, different from the ones encountered in regular channel and pipe flows. The correct prediction and control of the flow distribution is essential for the reactor design and safety assessment, and has been an active area of research in reactor thermal-hydraulics. Apart from the axial flow of coolant parallel to the rod bundles, there exists cross-flow between the sub-channels. The cross-flow promotes homogeneous enthalpy distribution and enhanced mixing between the coolant flowing in the sub-channels. Turbulent mixing is an important phenomenon, which influences the flow and temperature patterns in the rod bundles. Large-scale coherent structures along with transverse flow pulsations have been identified in the rod-rod and rod-wall gap regions. This large-scale structure has a quasi-periodic behavior and is considered an important factor for high mixing-rate. The aim of this work is to get a better understanding of the flow in a rod-bundle. This is done by performing numerical investigations on a simplified rod-channel geometry. The Unsteady Reynolds Averaged Navier Stokes equations are solved using the Computational Fluid Dynamics software OpenFOAM. Extensive benchmark and validation studies were done in order to determine the simulation technique that offers a good balance between computational cost and accuracy. The flow dynamics and the transport and mixing of a passive scalar due to the coherent structures are studied. Different turbulence models were used to study their effect on flow dynamics, and no major differences were observed. Following this, the computationally cheaper k-epsilon turbulence model with wall functions was chosen for the simulations. The time required for flow development in this geometry was significantly higher than that in regular turbulent channel or pipe flow. This led to different results than the ones observed in the experiments and in previous simulation results published in the literature. It was concluded that the flow in the experiments was not fully developed and that probably not enough time was used to allow flow development in the previous simulations. Our results indicate that the shear-layer becomes thinner and the number of structures decreased with flow development, which would explain the higher number of structures found in previous simulations. High values of velocity fluctuations and the kinetic energy due to these fluctuations indicated the presence of structures in the near-gap region. Large-scale three-dimensional counter-rotating sledge-shaped structures were observed via the flow visualization of resolved velocity. These structures were not only restricted to the gap region, but encompassed the entire flow domain. The high periodicity and stability of these structures indicate that they are not turbulence structures. The effect of gap-size on the coherent structures was studied, and this study suggested that the presence of more than one mechanism for the formation of these structures. A critical gap-size was obtained, at which the intensity of the structures has a maximum value, and a cut-off gap size was identified, at which a transition takes place between the two mechanisms. The coherent structures were found to play a significant role in both the transport and mixing of the passive scalar. The contribution were similar to that of the turbulent diffusion. The simulations indicate that the effect of the coherent structures on the transport and mixing of a passive scalar is of the same order of magnitude of the effect of the turbulent diffusion.","turbulence; coherent structures; URANS; rod bundle; OpenFOAM; nuclear reactors","en","master thesis","","","","","","","","","Applied Sciences","Radiation, Radionuclides & Reactors","","Chemical Engineering","",""
"uuid:92f240dd-67ec-4f61-9210-4763d7b8a90a","http://resolver.tudelft.nl/uuid:92f240dd-67ec-4f61-9210-4763d7b8a90a","A low noise, low power dynamic amplifier with common mode detect and a low power, low noise comparator for pipelined SAR-ADC","Astgimath, S.P.","Long, J.R. (mentor); Bult, K. (mentor); Van der Goes, F.M.L. (mentor)","2012","This thesis presents a high gain, low noise and low power dynamic residue amplifier and a low power, low noise dynamic comparator designed in TSMC 28nm process for a two step Pipelined SAR-ADC. The cascoded integrator dynamic residue amplifier (CIDRA) achieves a gain of 30dB with THD of 47dB (11 mV pp input). The input referred noise across tem- perature and process corner is 55 µV and it operates at a frequency of 500MHz while the energy consumption is 390 fJ. The low power and low noise pseudo-latch preamp dynamic comparator (PLPDC) shows a delay of 250pSec for a differential input of 16 pV and consumes 91 fJ (current is 91 µA for 100 MHz clock) of energy. The input referred offset is 4 mV (?).","dynamic amplifier; dynamic comparator; pipelined SAR-ADC; noise analysis","en","master thesis","","","","","","","","","Electrical Engineering, Mathematics and Computer Science","Microelectronics & Computer Engineering","","","",""
"uuid:e5dcf5fd-564c-4c26-817c-da2d4cf21325","http://resolver.tudelft.nl/uuid:e5dcf5fd-564c-4c26-817c-da2d4cf21325","Greening Information Technology (IT) Infrastructures: Designing a green IT assessment methodology that supports IT decision-makers contribute to corporate responsibility strategy","Kalsheim, J.C.P.","Brazier, F. (mentor); Appelman, J. (mentor); Stougie, L. (mentor); Beulen, E. (mentor)","2012","Introduction There are several issues and opportunities with regard to information technology (IT). On the one hand, the IT industry is responsible for a large amount of global GHG emission, water pollution, depletion of scarce materials, growing volumes of e-waste and the largest release of hazardous waste worldwide. On the other hand, IT is an important source of cost efficiency and competitive advantage. Examples of economic opportunities of making IT greener are cost saving, risk reduction, innovation and prevention of resource restriction. Moreover, the social impact of the IT industry is immense. IT might be manufactured from minerals from military conflict zones or produced under derived working conditions. These examples of environmental, economic and social implications of IT illustrate that IT should constitute a significant part of an organisation’s sustainability policy and corporate responsibility (CR) strategy. But how can an IT decision-maker contribute to this? It is expected that a framework providing insights into the greenness of the hardware IT infrastructure of an organisation could support IT decision-makers contribute to the overall CR strategy of organisations. Consequently, the research question of this thesis project has been formulated as follows: What generic framework based upon environmental and economic life cycle assessment criteria could be developed to assess the relative greenness of the hardware IT infrastructure of an organization as a step towards a comprehensive corporate responsibility strategy? In essence this research addresses environmental and economic aspects of IT, often referred to as green IT. Emphasis is put on environmental sustainability and costs associated with the physical IT infrastructure supporting business applications through processing, transferring or storing computer programs or data. This is referred to as the greening the hardware IT infrastructure. The purpose of this research is to understand how an IT decision-maker can contribute to CR strategy by addressing several environmental issues efficiently. These environmental issues are related to water use, energy use and raw material use, greenhouse gas (GHG) emissions and generation of electronic and electrical waste (WEEE). Research methodology To structure and guide the explorative research of designing a new framework, the design science research by Hevner et al. (2004) is applied. The design science research is an outcome based research methodology that focuses on designing artefacts. Basically this methodology consists of three types of iterations; relevance, rigor and design. To establish rigor and relevance literature was reviewed from the knowledge base (rigor) and design requirements were analysed from stakeholder interviews (relevance). This information constitutes the academic and practical grounding of the new artefact. To design a new framework three design iterations were carried out; two formative validations by expert panels and one operational validation through a case study. Results The outcome of the design process was a new framework that can be used to assess the greenness of an organisation’s hardware IT infrastructure. The framework consists of several viable performance indicators related to energy use, water use, GHG emission and generation of raw material waste at organisational level (see Chapter 7). The operationalization of these can be found in the functional design in Chapter 8. The functional design describes how the performance indicator scores can be estimated and aggregated into assessment criteria scores and an index. The assessment criteria were defined as follows: 1. Water use over the life cycle of hardware IT (m3) 2. Energy use over the life cycle of hardware IT (MJ) 3. Generation of waste over the life cycle of hardware IT (kg) 4. Greenhouse gas emissions over the life cycle of hardware IT (ton CO2) 5. Costs over the life cycle of hardware IT (euro) The index is entitled the Hardware IT infrastructure Greenness (HITIG) index. The HITIG index can be determined by applying the weighted sum method. This requires normalization and weighing of assessment criteria. At the moment normalization is not possible as an unbiased reference score cannot be established. Evaluation, reflection and recommendations Although three design iterations were carried out to design the new framework, the framework design process and the artefact have several limitations. First, the expert panel reviews have several limitations. The panels were small and expert opinions about which design requirement constituted “core requirements” differed between the panels. Second, the case study research had several limitations. Data used to estimate some of the performance indicators in the case study was deprived. Moreover, the external validity of the framework is limited as only one case study was executed with a limited number of hardware IT infrastructure units. Third, a limited number of aspects related to sustainability have been incorporated in the new framework. Environmental issues have been limited resource usage (water, energy and raw materials), GHG emission and waste generation and economic aspects have been limited to costs. Social implications of sustainability have not been included at all. Fourth, measuring performance is challenging and using indicators to assess the greenness of hardware IT is a reductionist tool that possibly cannot encapsulate the complexity of sustainability and greenness of IT. Lastly, several experts from KPMG have been involved in the definition of design requirements and the expert panel reviews. This could have biased the framework, but this cannot be completely proven. To deal with the shortcomings of the new framework several things could be done. The external validity of the framework could be enhanced by carrying out additional case studies in which different units of analysis are investigated. The functional design could be improved by incorporating more accurate and up-to-date data. The framework could be further expanded to incorporate additional economic and environmental aspects and social implications of IT. Land use, hazardous waste, quality and working conditions are examples of four aspects that could be incorporated in the framework. Furthermore, the framework could be accompanied with a management process to ensure an organisations’ progress is measured over time. The management process could be based upon the plan-do-check-act (PDCA) cycle. Implementing a new management process or integrating the framework in an already existing environmental management process could require awareness of green and sustainable IT within an organisation as well as a clear governance structure. Conclusion and further research The new framework can be used to determine the greenness of the hardware IT infrastructure of an organisation as a step towards a comprehensive CR strategy when incorporated in a measurement process. The framework supports achieving the desired green IT assessment criteria scores. Organisations can use the outcome of periodical measurements from the framework to, if required, adjust their policies in order to achieve the CR goals as part of their CR strategy. The framework can be used to assess green IT progression related to energy use, water use, generation of raw material waste, GHG emission and costs over the life cycle of hardware IT. Assessing the relative greenness of the hardware IT infrastructure of an organisation would require implementing the framework in a continuous management process. Measuring the hardware IT infrastructure greenness with the purpose of benchmarking results, it is recommended organisations apply the same calculation methodology to ensure consistency and comparability of results. For further research it is recommended to investigate how social aspects can be incorporated in the framework to ensure a more balanced contribution to CR strategy. It is also recommended to improve the quality of certain data used in the functional design and to extend the scope of environmental and economic sustainability aspects in the framework. Furthermore, research should focus on improving the framework through additional refinement cycles. Particularly important are additional case studies to test the general applicability of the framework, further refine the functional design and evaluate the use of the framework over time as part of a continuous management process.","green IT; hardware IT infrastructures; corporate responsibility; IT decision-makers","en","master thesis","","","","","","","","","Technology, Policy and Management","Systems Engineering","","","",""
