"uuid","repository link","title","author","contributor","publication year","abstract","subject topic","language","publication type","publisher","isbn","issn","patent","patent status","bibliographic note","access restriction","embargo date","faculty","department","research group","programme","project","coordinates"
"uuid:5bfd2866-1c16-4fc9-ab94-b6e4f4b164ba","http://resolver.tudelft.nl/uuid:5bfd2866-1c16-4fc9-ab94-b6e4f4b164ba","Large Scale Fracture Distribution on the Latemar Platform Based on Aerial Photograph and LiDAR Data","Nasution, A.","Bertotti, G. (mentor); Hardebol, N. (mentor)","2012","Fracture reservoirs have many inherent obstacles to proper analysis, due to their difficulties in prediction, evaluation, and characterization. Moreover, fractures not only increase reservoir permeability, but also fundamentally alter reservoir connectivity and heterogeneity. Several subsurface data can be used for fracture distribution and characterization of the reservoir with some limitations. Well data can only be used in the near wellbore region and are not always easy to extrapolate away from the well. On the other hand, most fractures are subseismic dimensions. Minimizing the uncertainty of modeling naturally fractured reservoirs could be achieved by outcrop studies that are lithological and historical analogues to the reservoir, which could be used to extrapolate fracture data outside the well control. This project is investigating large structures of the Latemar isolate carbonate platform in Northern Italy by using aerial photograph and LiDAR data (Light Detection and Ranging). From these data, tens of meters to kilometer fractures in Latemar can be identified with two main fracture sets which are perpendicular to each other in the NNW-SSE and ENE-WSW orientation, respectively. On the other hand, one of the shortcomings of the field work which can be covered by LiDAR is that this technology has the capability to efficiently capture inaccessible areas. Furthermore, LiDAR data can give direct insight to the 3D distribution (e. g. fracture intensity, P32).","fracture; LiDAR; Latemar","en","master thesis","","","","","","","","","Civil Engineering and Geosciences","Geoscience & Engineering","","Reservoir Geology","",""
"uuid:070476e2-102e-42f3-a636-da5e922ef6fd","http://resolver.tudelft.nl/uuid:070476e2-102e-42f3-a636-da5e922ef6fd","Injectivity in Non-Newtonian two-phase flow","Latooij, C.A.","Rossen, W.R. (mentor)","2012","A recent study [Rossen et al., 2011] developed a fractional-flow model (an extension of the Buckley-Leverett theory for a waterflood) for non-Newtonian two-phase flow (surfactant solution and gas) around a well. In this fractional-flow model two effects are represented: the decrease in water saturation Sw during gas injection in a SAG process and the non-Newtonian mobility with respect to radial position in the near-wellbore region, respectively. An important implication of this model is the relationship between these effects and injectivity. In this paper we create a model which determines injectivity as a function of time from data for water saturation and radial position, for shear thinning foam, modeled as a power-law fluid, in the near-wellbore region. We take the results generated by Rossen et al. and recast them in a form from which injectivity can be calculated. We compare the results, with both changing water saturation and non-Newtonian rheology, to two simpler cases: the effect of non-Newtonian rheology alone (effective viscosity changes with radial distance but Sw is assumed uniform) and the effect of water saturation alone (Sw varies with radial position but non-Newtonian effects are ignored) on injectivity. From these results we analyse whether or not it is essential to model both effects as in Rossen et al. We observe that the effects of non-Newtonian rheology on injectivity are far greater than those due to changing water saturation Sw in the near-wellbore region and that it is therefore not necessary to model both effects; one only needs to account for shear thinning. One limitation of this fractional flow model is that it disregards foam collapse. We found that this collapse of foam near the well has a much larger effect on injectivity than shear-thinning behavior. In order to determine how much the non-Newtonian rheology and nonuniform water saturation really affect injectivity, the foam model needs to be extended to include foam collapse. Furthermore, the factor (rw/re) in dimensionless position xD should not be disregarded in the MOC calculations, as it was in Rossen et al. [2011]. Doing so affects mobilities very close to the well and therefore affects injectivity. The model described in this paper focuses on non-Newtonian “strong” (shear thinning) foam flow; however, the approach could also be extended to polymer injection.","fractional flow; MOC; injectivity; two phase flow; shear thinning; changing water saturation","en","bachelor thesis","","","","","","","","","Civil Engineering and Geosciences","Geoscience & Engineering","","","",""
"uuid:d01cc171-e691-4fb6-b258-5ef34952c697","http://resolver.tudelft.nl/uuid:d01cc171-e691-4fb6-b258-5ef34952c697","Developing a Winning Product Strategy","Peterson, R.K.","Smulders, E.H.M. (mentor)","2012","As a startup competing in a saturated market with large companies and established brands, Oto will need to effectively market itself to the targeted consumer. Part of Oto’s success will result from the brand’s product portfolio and design strategy. It is not only important for Oto products to be relevant to consumer tastes, but they will also need to appropriately represent the brand if Oto is to assert being a healthier and sustainable alternative to other enhanced water solutions. In addition to these drivers, products will also need to successfully distinguish themselves in the market and be feasible to produce from a technological and manufacturing standpoint, otherwise it may difficult to implement them.","bottle; water","en","master thesis","","","","","","","Campus only","2013-08-27","Industrial Design Engineering","Industrial Design","","Master of Science Strategic Product Design","",""
"uuid:88660d3f-76d3-4b98-abc4-c3db68b322fb","http://resolver.tudelft.nl/uuid:88660d3f-76d3-4b98-abc4-c3db68b322fb","Analysis of Grain Size Distribution for samples from the North Caspian Sea Basin","Lier, J.S.","Hoogendoorn, R.M. (mentor)","2012","The ultimate goal of this project is to identify the controls of the sedimentary systems of the North East Caspian Sea, in order to improve the capabilities for the assessment of the effects of the construction of future installations in the vicinity of Karain and Aktote islands on the coastal dynamics. Additionally, it is desirable to enable comparative analyses and the selection of more environmentally acceptable route of the future sealines/pipelines therefore assisting the planning of future production facilities such as artificial islands, platforms and pipelines. Grain size analysis is important in this context for several reasons. Not only is it a basic descriptive measure of the sediment, but it can also be characteristic of sediments deposited in certain environments. It may also yield information about additional properties such as the physical mechanisms acting during transportation and deposition or the permeability of the sediment. In order to obtain this information, cores from five separate boreholes were taken from the North Eastern Caspian Sea and analyzed. This was done using a Hiac Royco Model 3000, which employs the light blocking method of particle counting. This report discusses both the geology of the region and the various methods for particle size counting; and explain the choice for the light blocking method. Finally, the results of the analysis are presented and interpreted.","grain size distribution; Kazakhstan","en","bachelor thesis","","","","","","","","","Civil Engineering and Geosciences","Geoscience & Engineering","","Applied Earth Sciences / Applied Geology","",""
"uuid:fa7394c1-36ae-4b09-adca-d274d4dc12cb","http://resolver.tudelft.nl/uuid:fa7394c1-36ae-4b09-adca-d274d4dc12cb","Strategic Niche Management of Biogas technologies in the Netherlands","Roelse, B.","Quist, J. (mentor); Korevaar, G. (mentor)","2012","","natural gas; biogas; green gas; sustainable energy; transition management; strategic niche management","en","master thesis","","","","","","","Campus only","","Technology, Policy and Management","Innovation Systems","","","",""
"uuid:593ba177-be25-437d-aa4e-58bfab7cbdaf","http://resolver.tudelft.nl/uuid:593ba177-be25-437d-aa4e-58bfab7cbdaf","Control Architecture and Utility Maximization for a Smart Grid based Energy Community","Abegaz, B.W.","Kuipers, F.A. (mentor); Negeri, E.O. (mentor); Kluin, M. (mentor); Verhoeff, S. (mentor)","2012","This thesis presents a control architecture and utility maximization mechanisms for a smart grid based energy community. The particular focus is upon a central server based, utility-oriented energy community which is composed of producer-consumer (prosumer) households each having a home gateway, an energy management system, smart meters, production units and appliances. To find out how such an energy community could be optimally managed from a central server, the type of intelligence required for the different nodes in the energy network has been identified. In addition, different control mechanisms that enable the energy community to make an optimal use of its energy resources are explored. Moreover, utility maximization mechanisms have been implemented on the aggregate energy profile of the energy community targeting three main objectives namely maximizing the aggregate greenness, minimizing the aggregate energy cost and maximizing the prosumers’ comfort. Maximizing the aggregate greenness aims to maximize the level of consumption of renewable energy resources using a novel mechanism that reduces the difference between the supply of and demand for renewable energy resources. Minimizing the aggregate energy cost aims to reduce the peak to average ratio of the aggregate energy profile of the energy community using direct mechanisms for energy cost minimization and a novel appliance based pricing scheme. Maximizing the prosumers’ comfort aims to preserve the schedule preference of prosumers. The mechanisms above are designed and implemented under a research setting of a renewable energy company that manages an energy community composed of central servers which control household, building and/or industrial prosumers.","Smart Grid; Control Architecture; Utility Maximization; Optimization Mechanisms; Greenness","en","master thesis","","","","","","","","2012-08-31","Electrical Engineering, Mathematics and Computer Science","Telecommunications","","Network Architectures and Services","",""
"uuid:19c9de73-7aaa-48db-85ce-78395a5b1309","http://resolver.tudelft.nl/uuid:19c9de73-7aaa-48db-85ce-78395a5b1309","Solvent enhanced waterflooding in fractured reservoirs","Zholdybayeva, A.","Bruining, J. (mentor); Farajzadeh, R. (mentor); Chahardowli, M. (mentor)","2012","Oil recovery in fractured reservoirs by water flooding critically depends on the wetting properties of the matrix blocks between the fractures. The recovery from oil-wet reservoirs is almost negligible. In incompletely oil-wet systems, the presence of initial water may change the wettability characteristics so that very slow imbibition and some oil recovery can occur. The hypothesis in this thesis is that water soluble solvents enhance the wettability change and lead to enhanced recovery. Another mechanisms is that the water soluble solvent dissolves in the oil and oil is recovered due to swelling. The solvent may also decrease the oil viscosity and the interfacial tension between the oleic and aqueous phases. This thesis comprises of an experimental study into the recovery enhancement by water soluble solvents (diethyl ether). We used an Amott imbibition cell studying oil saturated samples of various wettabilities, permeabilities using oil of different viscosities and two different solvent concentration in the aqueous phase. In the first stage of the experiment the water-wet core was exposed to brine without solvent. In a second stage the core was put in a new Amott cell, which was filled with solvent/ brine mixture. The additional recovery was small. We found that the oil recovery is faster when the oil viscosity is lower, but the ultimate recovery is about the same. The recovery with higher permeable samples is faster, but ultimate recoveries are close. Low permeable samples benefit from the presence of solvent, but the effect is rather small. For the oil-wet samples we also started with exposing the core into pure brine without solvent. In spite of being oil-wet, oil was recovered from these samples. In view of the large inverse Bond number it would appear unlikely that this a gravity drainage effect; however the produced oil droplets are coming from the top. Contrary to the water samples there was a significant increase in recovery rate when the sample is transferred to another Amott cell where it is exposed to a mixture of solvent and brine. Now oil drops come from all sides. Therefore it is concluded that wetting alteration is the main mechanism of water soluble solvent enhancement in partially oil-wet cores. The effect of solvent on completely water-wet cores is less but significant.","solvent; spontaneous imbibition; fracture","en","master thesis","","","","","","","","","Civil Engineering and Geosciences","Geoscience & Engineering","","Petroleum Engineering","",""
"uuid:31d7efee-8b65-4dbe-bde2-20c07bec933d","http://resolver.tudelft.nl/uuid:31d7efee-8b65-4dbe-bde2-20c07bec933d","Design and Implementation of a Novel Force and Brake Pressure based Anti-lock Braking System","Kerst, S.M.A.A.","Holweg, E.G.M. (mentor)","2012","","ABS; anti-lock braking system; hydrolic circuit modeling; force sensing baring; brake pressure control","en","master thesis","","","","","","","","","Mechanical, Maritime and Materials Engineering","Precision and Microsystems Engineering","","","",""
"uuid:00a01596-3c53-4dbf-b47a-27c91985fd90","http://resolver.tudelft.nl/uuid:00a01596-3c53-4dbf-b47a-27c91985fd90","Data analytics at work","Meens, V.F.","Van den Berg, J. (mentor); Lukszo, Z. (mentor); Van Dijke, A. (mentor)","2012","Data mining promises to make life easier for business decision makers and analysts. Therefore data mining has a great history in the academic field and in the nowadays also in various other areas such as finance and retail there is a large amount of general data mining literature available. However, to be able to apply data mining to a business field where data mining is not used yet, like the purchasing and sales department, it is necessary to translate the business questions correctly to data mining tasks which is a difficult task. This research attempts to enable consultants to determine effective data analytics tasks for given business questions in order to answer those questions and be able to give companies advise. The result is a data mining process framework for consultants and advise on how this can be embedded in business.","data mining; process framework; business performance","en","master thesis","","","","","","","Campus only","2013-08-24","Technology, Policy and Management","Energy & Industry","","Systems Engineering, Policy Analysis and Management","",""
"uuid:acdd5013-19e3-4cc3-83e6-1e0736fbf46f","http://resolver.tudelft.nl/uuid:acdd5013-19e3-4cc3-83e6-1e0736fbf46f","Ultrafilters in de Combinatoriek","Smid, T.T.","Hart, K.P. (mentor); Coplakova, E. (mentor)","2012","Ultrafilters in de combinatoriek","","nl","bachelor thesis","","","","","","","","","Electrical Engineering, Mathematics and Computer Science","Applied mathematics","","","",""
"uuid:ecf0556d-d0e4-40f9-9f42-25228fb8688f","http://resolver.tudelft.nl/uuid:ecf0556d-d0e4-40f9-9f42-25228fb8688f","Improving the Algal Bloom Prediction on the North Sea by Dual Ensemble Kalman Filter in GEM Model","Zhang, D.","El Serafy, G.Y.H. (mentor)","2012","Increasingly, the phytoplankton blooms (algal blooms) become a public health concern and a worldwide ecological problem. The Generic ecological model (GEM) plays a very important role to assess ecological quality of the Dutch coastal waters and the southern North Sea. Algal blooms can also be predicted by the GEM model mainly through chlorophyll-a concentration. However, GEM contains large uncertainties caused by errors in both the model itself and the input. Data assimilation techniques are being used to reduce these uncertainties and improve the model forecast for chlorophyll-a concentration. In the meantime, data assimilation also provides an efficient approach to estimate the parameters. Several data assimilation schemes based on the dual Ensemble Kalman Filter will be compared with each other in this work. Based on the synthetic measurement, the superior scheme will be carried out to assess the data assimilation result for a longer period. The forecasting result from proposed data assimilation scheme will be compared with deterministic GEM forecasting output from different point of view. Based on the comparison result analysis, the proposed data assimilation scheme is proved to be successfully implemented and satisfactory results are achieved.","GEM Model; Data Assimilation; Ensemble Kalman Filter; Parameter Estimation; Chlorophyll-a Concentration","en","master thesis","","","","","","","","2012-08-21","Electrical Engineering, Mathematics and Computer Science","Applied mathematics","","","",""
"uuid:3c321045-2a4d-4fd9-984b-b60a6b0ff3bd","http://resolver.tudelft.nl/uuid:3c321045-2a4d-4fd9-984b-b60a6b0ff3bd","Computing the vertical density and seismic velocity profiles from multi-angle reflection data: Error analysis","Meijer, W.Y.","Slob, E.C. (mentor)","2012","Numerical models were used to recursively compute the density profile and the seismic velocity profile of three different artificial models of the underground from primary reflection images obtained from multi-angle incident plane wave reflection data. The aim is to investigate the effect of errors in the obtained primary reflection amplitudes on the recursive construction of the vertical density-velocity profiles. The reflection coefficients needed for the computations were obtained by solving the Marchenko equation for different angles of incidence. The recursive computation shows errors occur in every layer, but the error does not necessarily grow with each step. This implies the error does not propagate into the recursive scheme. Adding a random error to the reflection coefficients yielded results in a greater error in each individual layer with respect to the values obtained without an added error. Using a too large angle of incidence can result in too few primary events in the autofocused data, distorting the computed values.","autofocusing; error propagation","en","bachelor thesis","","","","","","","","","Civil Engineering and Geosciences","Geoscience & Engineering","","Applied Geophysics and Petrophysics","",""
"uuid:0ab476db-0ef3-4126-baec-bc59df800b9c","http://resolver.tudelft.nl/uuid:0ab476db-0ef3-4126-baec-bc59df800b9c","The effect of flocculant on the sedimentation and consolidation of fine tailings","Hijman, R.M.","Van Paassen, L. (mentor)","2012","Mixing fine mine tailings with flocculant is a method for water retention and accelerated sedimentation in the oil sand industry. One of the known effects of adding flocculants to soil is the resulting porous structure, which leads to fast dewatering but could possibly have a lower final compaction. The objective of this paper is to study the consolidation effect of adding the flocculant, compared with the natural tailings, too figure out the structural difference in final compaction state. In this paper, a river clay is studied instead of fine mine tailings, to avoid the effect of location distinct chemicals. Column studies were performed in which sedimentation and consolidation of the clay mixture, with and without flocculant were examined. CT-scans of the columns after 26 days of consolidation were carried out to evaluate the effects of the flocculant. The results lead to a consistent conclusion: final consolidation of the natural clay is significant lower volume, compared with flocculant mixture. Further (literature) research in the reliability and density relation of the CT-scans is recommended.","tailings; flocculant; consolidation","en","bachelor thesis","","","","","","","","2012-08-30","Civil Engineering and Geosciences","Geoscience & Engineering","","Geo-engineering","",""
