"uuid","repository link","title","author","contributor","publication year","abstract","subject topic","language","publication type","publisher","isbn","issn","patent","patent status","bibliographic note","access restriction","embargo date","faculty","department","research group","programme","project","coordinates"
"uuid:c7e7ade5-3c04-4268-b370-8e2c33e3e0ee","http://resolver.tudelft.nl/uuid:c7e7ade5-3c04-4268-b370-8e2c33e3e0ee","Self-extinguishment of cross-Laminated timber","Crielaard, R.","Van de Kuilen, J.W.G. (mentor); Terwel, K.C. (mentor); Ravenshorst, G.J.P. (mentor); Steenbakkers, P. (mentor); Noordijk, L.M. (mentor)","2015","Cross-laminated timber, or CLT, is currently receiving attention for its potential use in tall building structures. Timber being a combustible material, one of the main challenges for the construction of these buildings is the potential fire risk that results from its use in the structure. For tall buildings, there is an increased severity of the consequences of structural failure as result of a fire. In order to obtain the desired level of safety, building codes typically require tall buildings to have a high fire resistance rating. The Eurocode recognises the risk associated with failure of the high rise structure and indicates that it is to be designed according to consequences class 3: failure of the structure due to fire is highly undesirable and the structure needs to be reliably safe and robust. The design of tall buildings in consequence class 3 requires a high degree of insight into their structural fire behaviour. An in-depth investigation is needed of risks associated with the fire behaviour, and the structural fire response. In this research the effect of using the combustible material CLT as the main bearing structure is investigated. As a combustible material, unprotected CLT can burn along with the fuel load present in a compartment. Irrespective of its fire resistance rating, it is uncertain whether the structure will be totally consumed in the event of a fire. This can result in collapse of the structure. It is important to understand whether the timber structure continues burning or whether a fire would decay by self-extinguishment, possibly in combination with active fire safety measures such as sprinkler activation or fire-brigade intervention. However, self-extinguishment currently is not part of fire safety considerations for the structural design of tall timber buildings. This master’s thesis aims to increase insight into the fire behaviour of unprotected CLT structures in a compartment burnout, conservatively assuming no active measures. The main research question of this work is: “Under what conditions is there a potential for self-extinguishment of cross-laminated timber?” A model of self-extinguishment of CLT was created which consists of various phases of a compartment burnout. Under the influence of an initial fire due to burning of room contents, the exposed CLT becomes involved in flaming combustion. Once the room contents have been largely consumed and the initial fire decays, the CLT contribution is expected to decrease as well, transforming from flaming to smouldering combustion. Finally, there will be a transition from smouldering to self-extinguishment. Two series of experiments were conducted to investigate this model and the conditions under which the transitions can take place. The first series of experiments investigated two conditions at which the CLT can transform from smouldering to self-extinguishment: heat flux on the CLT and the airflow over its surface. This was done by exposing CLT to various heat fluxes and airflows in a cone calorimeter. It was found that smouldering CLT self-extinguishes when the externally applied flux is below 5 to 6 kW/m2. The additional airflow was also found to be of influence. At a heat flux of 6 kW/m2, an airspeed of 0,5 m/s resulted in self-extinguishment, while an airspeed of 1,0 m/s resulted sustained smouldering. It can reasonably be assumed that at a heat flux below 6 kW/m2, the speed of the airflow should be limited to 0,5 m/s. The second series of experiments investigated all phases of the model of self-extinguishment. Small compartments with one, two, or three CLT walls were subjected to a propane fire with a decay phase. Delamination was found to be important in the fire behaviour of the CLT. Delamination occurred when the charring front reached the polyurethane adhesive, which then lost bonding. This resulted in fall-off and exposure of new layer of wood to the fire, which could interfere in the transitions from flaming to smouldering and from smouldering to self-extinguishment. In two experiments, fall-off occurred when temperatures in the compartment were still relatively high. The newly exposed wood contributed rapidly to the fire and flaming was sustained, or smouldering was transformed back to flaming. The CLT in these two experiments continued burning. In two other experiments, fall-off occurred when temperatures in the compartment were lower. As a result, flaming was not sustained. The CLT smouldered and the heat flux on its surface during was below 5 kW/m2; these compartments extinguished. However, relying on fall-off to occur when the compartment has cooled down might be risky due to its unpredictable nature. Alternatively, delamination and fall-off were prevented in a fifth experiment by applying a thicker top lamella. The charring front seized within the thickness of this lamella before it reached the PU adhesive. In all five compartments, the exposed CLT increased the heat release rate and total energy released, and extended the duration of a fire. These were further increased when fall-off resulted in prolonged flaming. Self-extinguishment is currently not part of fire safety considerations for timber high-rises. With further research, self-extinguishment might eventually contribute to a total fire safety concept for tall timber buildings, in addition to active measures. This research extends to translating new insights with regards to self-extinguishment to design and regulatory implications. A suggestion was made for a method to assess the potential for self-extinguishment of CLT structures. The method is based on the experiments and their specific conditions, e.g. with regards to the fire development, fuel load, ventilation conditions, CLT build-up, type of adhesive, wood species, and compartment configuration and scale. It would require further research and verification before the method could be applied in practice. The method consists of two steps. First, a thickness is determined, to be applied to the outer lamella of the CLT in order to prevent delamination. This thickness is based on the calculation of a finite charring depth for a parametric natural fire exposure, taking into account the ventilation conditions and the contribution of the CLT to the fuel load. Second, to allow the transformation to self-extinguishment, the compartment configuration should be such that the heat flux on the CLT surface is limited to 5 kW/m2 during smouldering. This can be achieved by estimating the temperatures of various surfaces and calculating the heat flux on the CLT with the most unfavourable configuration. With regards to building regulations and approval, self-extinguishment might contribute in demonstrating compliance of a timber structure with the Dutch building code. Self-extinguishment, as part of an increased insight in the structural fire behaviour, reduces the probability of collapse as a result of the fire. Despite severe consequences of collapse in a high-rise building, this reduction in probability might contribute in achieving a level of risk and safety as intended by the Dutch building code. Furthermore, an assessment of potential self-extinguishment might be considered in the design of timber buildings according to the Eurocode consequence class 3, which requires a high degree of insight into the structural fire behaviour. Self-extinguishment, as part of an overall fire safety concept, might become part of the risk analysis and the advanced calculations in order to demonstrate the tall timber structure is reliably safe and robust. Finally, new insight can affect the perception of the material and the way it is treated in building regulations and approval. Due to lack of precedents, limited experience, code limitations, and uncertainties regards the performance in fire, there seems to be reluctance to saying tall timber buildings are sufficiently safe. Timber is perceived as a material less suitable for high-rise buildings. More insight into self-extinguishment, its role in a total fire safety concept for tall timber buildings, and its implications on the structural design, could affect this. A more pragmatic approach might be adopted in which any material poses unique design challenges, but can be applied as long as it contributes to safe buildings. While the combustibility of the timber structure will remain a point of attention, its risk should be managed properly, instead of used to discard the material for high-rise buildings. Eventually, insight in the structural fire behaviour of timber structures, including potential self-extinguishment, could contribute to making timber available as a material for high-rise buildings.","fire safety engineering; Timber; Wood; Cross-laminated timber; CLT; High-rise; Fire; Fire safety; Experiments; Self-extinguishment; Fire behaviour; Material; Tall buildings","en","master thesis","","","","","","","","2015-09-20","Civil Engineering and Geosciences","Structural Engineering","","Building Engineering, Timber Structures and Wood Technology","",""
"uuid:7145d7a6-25bb-42a4-ba48-240d70a68792","http://resolver.tudelft.nl/uuid:7145d7a6-25bb-42a4-ba48-240d70a68792","Early Detection of Rheumatoid Arthritis using extremity MRI: Quantification of Bone Marrow Edema in the Carpal bones","Roex, E.A.H.","Lelieveldt, B.P.F. (mentor); Stoel, B.C. (mentor)","2015","Visual scoring of magnetic resonance images for the early detection of rheumatoid arthritis is prone to human subjectivity and lacks sensitivity. In a bid to develop an objective and quantitative alternative using digital image processing, this thesis proposes automatic segmentation of the carpal bones, followed by the quantification of bone marrow edema, which is an important inflammatory imaging biomarker. Segmentation of the carpal bones is achieved using multi atlas-based segmentation. Compared to manual segmentations of the training data, an average Dice overlap of 0.85 was achieved. By examining contrast-enhanced MR images of the wrist, edematous bone is classified from normal bone marrow using knowledge based fuzzy clustering. Validation of the quantitative score against the existing RA MRI Scoring (RAMRIS) system showed a significant positive correlation. Segmentation error was seen to be a confounding factor, limiting the specificity of the BME measure. To increase agreement and maximise the available information, it is recommended that data from a complementary imaging plane is included.","MRI; Reumatoid Arthritis; Image processing; Biomedical; Segmentation","en","master thesis","","","","","","","","","Mechanical, Maritime and Materials Engineering","BioMechanical Engineering","","BioMedical Engineering","","51.999734, 4.375790"
"uuid:574c23d1-be05-408c-8069-e5de3330f7a2","http://resolver.tudelft.nl/uuid:574c23d1-be05-408c-8069-e5de3330f7a2","The feasibility research of standard quay walls for the port of Rotterdam","Tisheh, I.","Vellinga, T. (mentor); De Gijt, J.G. (mentor); Braam, C.R. (mentor); Taneja, P. (mentor); Broos, E.J. (mentor)","2015","Future-proof design of quay walls is an interesting issue in civil Engineering, because of the dynamic environment in which quay walls are operating. Designers are confronted with time-changing requirements such as larger retaining heights and heavier loads. However, a technical and financial analysis has revealed that the design of new quay structures can, under certain conditions, be made future-proof by standardization. By standardizing the design, this may achieve a certain degree of flexibility. This means that a quay wall can be converted for multiple types of vessels or multiple types of cargo and therefore becomes future-proof. Various standard principle solutions are applicable. However, it should be noted that the exact dimensions of quay wall components, for instance the substructure (the front wall) and the superstructure (the capping beam or relieving platform), can in principle not be standardized. The dimensions depend namely on major factors such as local geotechnical conditions, surcharges, retaining height and the presence of a relieving platform. Nevertheless, standardization is possible in two ways. Firstly, by driving the front wall to a deeper layer than it is necessary in the first instance and dredging the front side of the quay wall at a later stage. This can be done by constructing all quay walls at equal depth, by area. This is a decision based on the local depth of the navigation channels and the expected business activity in the different areas. Secondly, by making a strategic choice for a particular quay component or a particular port area. Both ways lead to higher initial investment costs but results in a quay wall which is significantly more future-proof. From a technical and financial assessment it can be concluded that when heavy loads and large retaining heights are involved, a combined steel quay wall with a concrete relieving platform (often used by deep-seagoing vessels) is suitable and for inland barges an anchored combined wall should be applied. In case of a relieving platform, the floor should be located at NAP-2m with a length of 15m. Quay walls used by inland barges should consist of a capping beam and a combined wall. This rather conventional cross-sections are the most economical ones.","quay wall; Rotterdam; port; inland vessels","en","master thesis","","","","","","","","","Civil Engineering and Geosciences","Hydraulic Engineering","","Hydraulic Structures","",""
"uuid:69afe2c6-99b5-4de8-96c5-29b9efdee531","http://resolver.tudelft.nl/uuid:69afe2c6-99b5-4de8-96c5-29b9efdee531","Improving fuel decisions by airline pilots in flight preparation and execution","Tramper, E.M.","Annema, J.A. (mentor); Van Wee, G.P. (mentor); De Jong, W.M. (mentor)","2015","High fuel prices and strong competition have put pressure on airlines to reduce costs and become more efficient. For KLM fuel costs were $3.9bn in 2013: 31% of the total expenses. Therefore, focus has been put on fuel efficiency programmes. The pilot in command, the captain, has the final decision about the fuel quantity taken on board of an aircraft. In flight preparation, this pilot can decide to order extra fuel when he or she thinks certain conditions require more fuel. The factors on which this 'extra fuel decision' is based have not been researched before and are not sufficiently known. Gaining insight in the underlying drivers of fuel decisions can contribute to find a solution in which high standards of safety are maintained, while fuel costs are lowered. The research question was therefore formulated as follows: How can fuel decisions by airline pilots during flight preparation and execution be improved? Data analysis was performed to calculate the costs and benefits of taking extra fuel. Interviews were conducted and questionnaires were filled in by 175 KLM pilots and 16 flight dispatchers to gain more insight in the underlying drivers for fuel decisions. Statistical analysis and literature of the Prospect Theory of Kahneman and Tversky were used to analyse the results and to explain the decision-making of the pilot in command. This information served as a base from which a proposal for improvements was created. [...] Fuel decisions by airline pilots during flight preparation and execution might be improved by offering digital flight specific information. To 'expand' the experiences of pilots, this information should include feedback and experiences from colleagues and statistical information of previous flights. This information should always be used as background information. In addition, a flight specific information-application might help to create more trust in the flight plan. Further studies are recommended to analyse extra fuel decisions on an individual level. It is also recommended to test a flight specific information-application to investigate if it serves its purpose: better supporting pilots in flight preparation and execution, creating more awareness and improving their fuel decisions.","KLM; fuel decisions; behavioural decision-making; prospect theory; fuel","en","master thesis","","","","","","","Campus only","","Technology, Policy and Management","Transport & Logistics","","Management of Technology","",""
"uuid:468dd43d-55df-4b06-b621-359a456f358c","http://resolver.tudelft.nl/uuid:468dd43d-55df-4b06-b621-359a456f358c","The shape factor of quarry rock: Reassessment of the value and study into parameters of influence","Witteman, D.","Stive, M.J.F. (mentor); Ngan-Tillard, D.J.M. (mentor); Verhagen, H.J. (mentor); Stam, C.J.M. (mentor)","2015","Quarry rock is a frequently applied construction material in hydraulic engineering. The main reason is its unique stability capacities in environments of high hydrodynamic activity. Furthermore, quarry rock is produced and handled relatively easily and available at numerous locations across the globe. The size, or more precisely, the dimension of rock plays an important role in the realization of granular hydraulic structures. In general, two definitions are applied for the dimension of quarry rock, viz.: the nominal diameter and the sieve diameter. The ratio of both diameters is referred to as the shape factor of quarry rock and is frequently applied to express the one diameter in the other. Quarry rock however consists of a practically infinite variety of sizes and shapes and as a result the material is typically graded. For quarry gradings therefore the shape factor is based on ‘median’ values for the nominal diameter and sieve diameter, which are related to the fifty percent cumulative mass percentage of the grading. In a report published by G.J. Laan (1981) the value of the shape factor for quarry rock was determined to be 0.84. Unfortunately, Laan passed away and the concerned report is missing from the libraries. Despite the resulting lack of theoretical background the value of 0.84 is still widely applied in hydraulic engineering practice, as is recommended by - amongst other literature - the Rock Manual (2007). In this thesis the value of the shape factor has been reassessed. By conducting experiments on 21 samples, consisting of 200-250 rocks, extracted from various gradings, it is found that the shape factor is reasonably well represented by means of a Gaussian distribution. The average value and standard deviation are 0.86 and 0.24 respectively. Furthermore, it is concluded that the value of the shape factor is not constant within a grading. The value of the shape factor slightly decreases for increasing rock size. Such relation is however not discerned over the coarseness of the tested gradings. According to the tested gradings, the value of the shape factor is independent from the shape of the rock, in terms of both elongation and blockiness. For individual rock however, on average the value of the shape factor slightly increases for an increase of elongation as well as blockiness. As a consequence it cannot be completely ruled out that, for gradings consisting of a significantly higher percentage of relatively elongated or blocky rock compared with the tested gradings, the shape factor will increase. Like the shape factor for rock gradings, the shape factor of individual rocks is also represented reasonably well by means of a Gaussian distribution. The average value and standard deviation are 0.84 and 0.083 respectively. Moreover, it is found that the shape factor of an individual rock may exceed the value of 1.0. For such rock the nominal diameter exceeds the sieve diameter. Subesequent research should focus on the shape factor value for gradings of significantly different coarseness and gradings that consist of a significantly higher percentage of relatively elongated or blocky rock compared with the tested gradings, the shape factor will increase. For uncrushed rock it is expected both interests are met.","shape factor; quarry rock; elongation; blockiness","en","master thesis","","","","","","","","","Civil Engineering and Geosciences","Hydraulic Engineering","","","",""
"uuid:21075b70-1e78-4d75-b472-329d4a2bcd33","http://resolver.tudelft.nl/uuid:21075b70-1e78-4d75-b472-329d4a2bcd33","'Making ultra-supercritical pulverized coal-fired power plants flexible': 'Assessment and optimization of sub-Benson turndown ratio'","Van den Berg, A.H.W.F.; Verkooijen, A.H.M.","Verkooijen, A.H.M. (mentor); Boersma, B.J. (mentor); Hellendoorn, J. (mentor)","2015","Large-scale coal-fired power plants are typically designed as base-load units. This means that they are traditionally run at continuous high loading levels, most often full-load. The current energy market asks for more flexibility as renewable energy sources continue to penetrate the energy market. Coal-fired power plants are forced to operate at part-loads more frequently, in order to complement changes in the difference between energy demand and intermittent energy supply by renewable sources. The focus of this thesis is on the identification of limiting mechanisms determining the minimum load operating point, and on the thermodynamic performance in sub-Benson operation of a Benson-type coal-fired power plant. An increase of the dynamic load operating window, by lowering the minimum load, increases the adaptability and economic competitiveness to future energy dispatch. This is expected to be of high value in the future. This study assesses the feasibility to operate continuously on non-designed sub-Benson loads. First, the limitations that restrict the minimum load operating point of a once-through supercritical pulverized coal power plant are identified. Secondly, the lower limit of the dynamic load operating window is defined. Thirdly, the thermodynamic performance in sub-Benson operation, in terms of efficiencies and process behavior, is determined. This method is applied to case study Maasvlakte Power Plant 3. It can be concluded that the following limiting mechanisms are critical for low load operation; (1) The minimum flue gas inlet temperature requirement for the NOx-removal system. An indication of 21.7[%boil] minimum (percentage of the maximum live steam production) is required to ensure the minimum DeNOx flue gas inlet temperature. (2) The limited potential to extract steam from the cold-reheat for internal use in sub-Benson operation. Below 20[%boil], the auxiliary steam demand exceeds the maximum potential of internal steam extraction from the cold-reheat, meaning the system cannot operate autonomously anymore. (3) The minimum thermal input supplied by the individual burners which determines the overall thermal input into the boiler. The operating window of the individual burners limits the system to ~17.9[%boil] minimum. (4) The minimum live steam mass flow rate to maintain the minimum required pressure level of 103[bar]. This pressure level ensures homogeneous cooling of the evaporator pipes. The live steam mass flow rate to maintain the required pressure level is 15.9[%load]. The first constraint encountered is the flue gas temperature requirement at the NOx-removal installation. When considering the current minimum load of 25[%boil], it is concluded that the minimum load operating point can be decreased to 21.7[%boil]. This results in a 3.3[%boil] increase of the dynamic load operating window. A model of the case study power plant is developed to simulate the thermodynamic performance, focusing on the sub-Benson load regime. In addition, the simulation obtains an understanding of the processí variable behavior at high turndown ratio. It is concluded that the net efficiency reduces from 46.3[%], at full-load, down to 36[%], at 21.7[%boil]. The loss of efficiency translates to an increase of ~22[%] of the specific raw coal input per megawatt hour produced. At 21.7[%boil], the net power production level is 206[MWe]. This is a relative power output reduction of 14.9[%] compared to the 242[MWe] net power production at 25[%boil].","supercritical; power; part-load; off-design; Benson; pulverized; flexible; performance; dynamic load operating window","en","master thesis","","","","","","","","2015-03-19","Mechanical, Maritime and Materials Engineering","Process and Energy","","Energy Technology","","51.9622346, 4.0210335"
