"uuid","repository link","title","author","contributor","publication year","abstract","subject topic","language","publication type","publisher","isbn","issn","patent","patent status","bibliographic note","access restriction","embargo date","faculty","department","research group","programme","project","coordinates"
"uuid:f16ee590-5804-4beb-b72c-a32346d0f175","http://resolver.tudelft.nl/uuid:f16ee590-5804-4beb-b72c-a32346d0f175","The Impact of 3D Printing on the World Container Transport","Ye, M.","Tavasszy, L.A. (mentor); Van Duin, J.H.R. (mentor); Wiegmans, B. (mentor); Halim, R.A. (mentor)","2015","Due to the recent hype around 3D printing technology regarding its disruptiveness for global manufacturing and supply chains, and thus transport in general, an attempt has been made to assess its impact on the global maritime container transport for the next 20 years. The first step was to gain insight of the 3D printing technology and its sector using literature and market reports. It appears 3DP is still mostly in its infancy. Only basic plastic processes are at the most advanced level. High quality plastic and metal processes are around the pre-production phase, while other material processes are still undergoing experiments. The market and its technical capabilities will surely grow steadily in the next decades. Several improvements can already be expected in terms process improvements, speed, quality control and materials for the coming decade. The second step involves the assessment of how 3DP relates to current manufacturing and supply chain theories, and to subsequently develop a score model to quantify the current impact of 3DP on manufacturing and supply chains. 3DP provides manufacturing firms a unique set of attributes. As firms aim for increasing competitiveness, they will do so by upgrading their competitive capabilities. 3DP influences these capabilities differently (compared to conventional manufacturing) depending on the product that the firm makes and the market in which the firm operates. The 3D Competitiveness Score Model was developed to assess and quantify its competitiveness (or impact) for different markets. It shows to be capable of predicting market potential for a type of product, but not exactly the market penetration. The location of 3DP deployment impacts the supply chain and its logistics. The analysis shows that 3DP has been deployed in centralized as well as decentralized manufacturing setups. Case studies of the dental implants and hearing aid industry suggest a high 3DP market penetration also leads to the decentralization (localization) of manufacturing. Market data from the case studies have been used to formulate the relationship between score model scores and the decentralization level, which will be used to derive transport flows. Due to its extensiveness in terms of variables and statistics used, the World Container Model will form the basis for assessing the future 3DP impact on the world container transport. Five different future scenarios are formed based on varying technological advancement rates of 3DP. Based on the notion that the decentralization level equates to the percentage of transport volume reduction in tons for NSTR 9 commodities (final goods), and allocation of this volume to the supplying NSTR group based on the raw material composition of the NSTR 9 subgroup, the new O/D matrix containing TEUs distribution between countries can be compiled. The WCM results show that 3DP is not likely to cause a threat, in the form of significant throughput or transport flow reduction, for the global container transport in the next two decades. As the GDP and world population is not likely to decline the next 50 years, the global trade will likely continue to generate a high global transport demand, including container transport. This partly neutralizes the threat of reduction in container transport demand. Any reduction will be masked by the stronger growth of container transport activity. The Port of Rotterdam will remain among the top 11 of the largest ports in the world in terms of container throughput. As a major port, the change of container flow in several links caused by 3DP is likely compensated by an increase of transport flow on other links, and the high global growth of container transport demand.","3d printing; wcm; world container transport; world container model; freight modelling; gravity model; logit model; logit choice; 3DP; am; additive manufacturing; rapid manufacturing","en","master thesis","","","","","","","","","Technology, Policy and Management","Transport and Logistics","","Transport, Infrastructure & Logistics","",""
"uuid:facb0b78-50bf-4e58-9976-27e97ec8863e","http://resolver.tudelft.nl/uuid:facb0b78-50bf-4e58-9976-27e97ec8863e","Changed mobility behaviour of young adults in the Netherlands - Improving the mobility image of young adults based on the OVG 2002/2003 and MON 2007/2009 dataset","Bosman, D.","Van Arem, B. (mentor); Annema, J.A. (mentor); Pel, A. (mentor); De Bok, M. (mentor)","2015","In recent literature an emerging need of understanding the changed mode choice of young adults (aged 18 to 29) is revealed. International literature reveals different characteristics that influence the modal split of young adults, but a quantitative research on the changes in preference of these young adults, as basis of a deeper understanding of the changed in modal split, is lacking. The presence of different influential characteristics on the modal split imply the presence of different segments with different modal splits within the population young adults. However, these segments have not been specified yet. The research has focussed on filling these two knowledge gaps by defining 7 segments based on their modal split and revealing the mode specific preference parameters of 15 significant characteristics. The mode preference and modal split of the segments are examined, as well as their change between the two datasets, creating a more complete mobility image of the young adults in the Netherlands.","young adults in the Netherlands; segmentation based on modal split; mode specific preference parameters","en","master thesis","","","","","","","","","Civil Engineering and Geosciences","Transport & Planning","","Transport Infrastructure and Logistics","",""
"uuid:b9f13d4f-a1bf-4a52-85c6-bd961f1ccd0e","http://resolver.tudelft.nl/uuid:b9f13d4f-a1bf-4a52-85c6-bd961f1ccd0e","Modeling Of Radiative Heat Transfer In Solid Oxide Fuel Cells","Stam, J.N.","Roekaerts, D.J.E.M. (mentor); Aravind, P.V. (mentor)","2015","Solid Oxide Fuel Cells operate at high temperatures, which places stringent requirements on the ceramic materials in these devices. Optimizing the design by thermal stress minimization could increase the life expectancy of a fuel cell. In order to do this it is important to have a detailed understanding of the heat flows and temperature profiles in SOFCs. Because of the high temperatures it is expected that radiative heat transfer plays an important role in the thermal behavior of the cell. This phenomenon is however often neglected in SOFC modeling. Arguments often used for neglecting thermal radiation is the lack of knowledge of material properties or to save computational time. A literature study on thermal radiation in solid oxide fuel cells shows that the results from past research are not always in agreement. Some articles about radiation in the anode, cathode and electrolyte (or PEN-structure) even show completely contradictory results. Modeling studies have been performing in multiple steps, all simulations are performed using Ansys Fluent. The SOFC models are all hydrogen fueled. To study the effects of thermal radiation in the anode, cathode and electrolyte simplified 2D representations of the PEN-structure were developed. Because the material properties are not well known the results are obtained for a wide range of optical properties, on two different geometries. The results show that in the limit of high optical thickness of the anode and cathode the entire PEN-structure can be considered opaque, which means only radiation emitting from the anode and cathode surface will be important. Thermal radiation in the electrolyte has a negligible effect on the temperature profiles in the PEN-structure. To study the effect of surface-to-surface radiation a 2D model of a planar SOFC is developed. In this model uniform heat sources are used to account for the heat released due to electrochemical reactions and irreversibilities. Since the surface properties are not well known the temperature profiles throughout the domain are obtained for a wide range of optical properties, for both a co-flow and a counter-flow arrangement. The results show that thermal radiation has a very small effect on the temperature profiles in the domain. It was also found that the results are not very sensitive to the surface emissivities. The results are also obtained with the PEN-structure participating in radiative heat transfer, which verifies the statement that these materials can be considered opaque. To obtain more accurate results and to check the assumption of uniform heat sources a 3D-model of a single channel planar SOFC is developed. This model is also used to study the influence of participating gases. Instead of assuming uniform heat sources the ‘Fuel Cell and Electrolysis’ add-on module is used to model the relevant fuel cell phenomena. The model outputs show that using uniform heat sources is not an accurate assumption. The results also show that radiation has a very small effect on the temperature profiles in the domain, and that the ratio of radiative heat flux to total heat flux is not higher than 9%. Similar to the 2D planar cell model, the results are not sensitive to surface emissivities. The effect of participating gases is studied by considering water vapor as a participating component for the radiative transfer equation. The results show this participating gas has a negligible effect on the temperature profiles in the domain. The reason for small radiation effects is because temperature gradients are small in the direction were radiation has the most effect. Temperature gradients are shown to be dominant in axial direction, or in the direction of the flow, which is important for further studies on thermal stress minimization. To study the effect of radiative heat transfer in a completely different fuel cell design, a 3D model of an anode supported tubular SOFC is developed. The ‘SOFC with Unresolved Electrolyte’ add-on module is used to model the relevant fuel cell phenomena. It is expected that radiation effects are slightly more important in this tubular SOFC model. However this model does not work optimal yet, and no results with radiative heat transfer have been obtained yet. The results in this thesis show that radiative heat transfer in single channel SOFCs can be neglected when the temperature field has to be determined for thermal stress minimization.","Solid Oxide Fuel Cell; Radiative Heat Transfer; Computational Fluid Dynamics; Thermal stress","en","master thesis","","","","","","","","","Mechanical, Maritime and Materials Engineering","Process and Energy","","Sustainable Process And Energy Technologies","",""
"uuid:4183feeb-c3da-45cf-8e61-bede61bdca56","http://resolver.tudelft.nl/uuid:4183feeb-c3da-45cf-8e61-bede61bdca56","Comfortable bicycle saddle for a moderate sportive cycling posture","Bakker, T.S.","Jansen, A.J. (mentor); Zijlstra, J.J.M. (mentor)","2015","Saddle sores are common. A study on saddle discomfort lead to a new saddle design that has as goal to improve comfort perception of cyclists. This saddle is a one size fits all through its large width and contains a channel design. This channel eliminates tail bone pressure and optimises perineal pressure.","bicycle saddle; comfort","en","master thesis","","","","","","","Campus only","","Industrial Design Engineering","Design Engineering","","Integrated Product Design","",""
"uuid:09f5dfed-5185-401c-9bbd-065130fe2bda","http://resolver.tudelft.nl/uuid:09f5dfed-5185-401c-9bbd-065130fe2bda","Dimension-adaptive sparse grid for industrial applications using Sobol variances","Desmedt, S.G.L.","Dwight, R. (mentor); Shoeibi Omrani, P. (mentor)","2015","The area of interest for this study is the field of uncertainty quantification in computational fluid dynamics. The goal is to contribute to a new method to perform uncertainty quantification analyses for industrial, computationally expensive CFD simulations. To this end, an adaptive grid refinement method is developed. The existing sparse grid procedure introduced by Smolyak is combined with Clenshaw-Curtis quadrature rules. Starting with a low level grid, more points are added based on the values of the Sobol variances, which are estimated values. The Sobol variances provide an indication of the importance of each variable and interactions between variables. The method is applied to an industrial atmospheric flow case, where a heavy gas is released upstream of a barrier. The quantity of interest is the effect distance, the distance from the barrier where the molar concentration drops below 1 percent, which is important for safety. The results show that, for this case, the new adaptive grid refinement method reduces the computational cost to one third of a conventional sparse grid, while providing similar results.","Sparse grid","en","master thesis","","","","","","","","","Aerospace Engineering","Aerodynamics and Wind Energy (AWE)","","Aerodynamics","",""
"uuid:7d0f198d-61aa-413f-9851-6a0688b46041","http://resolver.tudelft.nl/uuid:7d0f198d-61aa-413f-9851-6a0688b46041","Self-organization in Urban Renewal","Kuitert, L.","Franzen, A.J. (mentor); Lousberg, L.H.M.J. (mentor)","2015","","self-organizaton; urban renewal; process model; process principles; system world; life world","en","master thesis","","","","","","","","","Architecture and The Built Environment","Real Estate & Housing","","Urban Area Development","",""
"uuid:755b1378-70c9-446c-a2c0-7eb871959ec0","http://resolver.tudelft.nl/uuid:755b1378-70c9-446c-a2c0-7eb871959ec0","IMS messaging gateway in the Cloud","Lopez Barbosa, P.I.","Houben, G.J.P.M. (mentor); Hidders, A.J.H. (mentor); Zaidman, A. (mentor); Martinez, T. (mentor)","2015","For mobile messaging service providers to endure in a competitive and dynamic market, it is vital to be flexible, which involves keeping up to date to technological developments, and to be cost effective. In order for service providers to provide highly available service, the use of Cloud computing technology is a well-suited solution. Cloud computing allows resources to be provided as general utilities, which users can lease and release in an on-demand fashion through the Internet. In this thesis an HTTP based mobile messaging solution is designed, implemented and described and deployed in the Amazon Cloud, with the main goal of determining to what extent the availability of mobile messaging services improves when deployed in the Amazon Cloud. Three testing environments are proposed for deploying mobile messaging services, i.e. using a proprietary server, Auto Scaling service and the Elastic Load Balancing service provided by Amazon. The architectures for all three scenarios are described and illustrated, and a description is provided of their implementation. Based on performance tests executed in all three scenarios the improvement in availability is determined. Also stress tests are executed in all scenarios with the purpose to compare the performance, i.e. the average response time required to process a subscriber’s request for service, of each scenario with each other. A comparison of the test results provides insight into the availability of the tested messaging service, and the relationship that exists between each scenario’s performance.","IMS; cloud computing; SMS; HTTP; performance test; availability; auto scaling; load balancing","en","master thesis","","","","","","","","","Electrical Engineering, Mathematics and Computer Science","Computer Science","","Information Architecture","",""
"uuid:57225141-7ec1-44c6-babe-3a5ae799f9cd","http://resolver.tudelft.nl/uuid:57225141-7ec1-44c6-babe-3a5ae799f9cd","Theoretical Modelling of Grass Drying in Deep Beds","Dorai, W.","De Jong, W. (mentor); Joshi, Y.V. (mentor)","2015","Verge grass is being considered to replace expensive wood pellets (thus reducing imports) as potential bio-energy resources for use in co-firing. However, drying of these verge grass resources is very important because of its high moisture content (almost 60 % wt.) and also results in an increased heating value for the fuel. Drying is the first process which occurs before torrefaction of biomass (which serves as an important pre-treatment step before co-firing with coal). Though fixed bed drying models have been studied in the past, development of drying models for drying verge grass have so far not been investigated. The drying of verge grass in fixed bed using a system of coupled differential equations in the gas phase and algebraic equations in the solid phase have been used to setup mass and energy balances has been investigated. The system of differential and algebraic equations has been solved by the Runge-Kutta method using ordinary differential equation solvers available in MATLAB® and by using finite difference techniques. The behaviour of the process variables (air humidity, air temperature, solid moisture content and solid temperature) with time and height has been investigated. Further a sensitivity analysis has been performed to study the effect of the influence of varying process parameters such as inlet air flow rate and temperature on the drying process. To validate the model, data from experiments performed with grass on a lab-scale drying and torrefaction setup were used at the Energy Technology research group have been used. With increase in the inlet air flow rate and the air temperature the drying time period was reduced due to an increase in the drying rate. Under certain conditions the model was insensitive with regard to increase in the number of grid points used in modelling in space and time. The simulation results however weren’t in agreement with experimental results and need to be further to investigate the validity of the assumptions or correlations used in the process of modelling.","drying; fixed beds","en","master thesis","","","","","","","","2015-03-10","Mechanical, Maritime and Materials Engineering","Process and Energy","","","",""
"uuid:25257be6-a37f-4f94-8d05-f16c4039c15d","http://resolver.tudelft.nl/uuid:25257be6-a37f-4f94-8d05-f16c4039c15d","Longitudinal reinforcement in tied arch bridges","Dzihan, D.","Hordijk, D.A. (mentor)","2015","The thesis focuses on the optimization with respect to the longitudinal reinforcement amount of bridge decks of tied arch bridges. The possibilities for the purpose of minimizing the longitudinal reinforcement has been considered from the perspective of 4 optimization sub domains. Those are the sub domain of the crack width models, the combination methods, the constructive characteristics and the restrained imposed deformations.","","en","master thesis","","","","","","","","","Civil Engineering and Geosciences","Structural engineering","","","",""
"uuid:c713cbef-2dac-4833-bdff-e4ef18f43637","http://resolver.tudelft.nl/uuid:c713cbef-2dac-4833-bdff-e4ef18f43637","Lane Difference Prediction Model","Mani, N.S.","Stive, M.J.F. (mentor); De Schipper, M.A. (mentor); Van der Hout, A. (mentor); Huijsmans, R.H.M. (mentor)","2015","Summary report. This study evaluates the feasibility of a prediction model for lane differences in rowing.","lane differences; fairness; LDPM; rowing","en","master thesis","","","","","","","","2020-03-06","Mechanical, Maritime and Materials Engineering","Marine & Transport Technology","","Offshore & Dreging Engineering","",""
"uuid:61088702-20b8-41f5-ad32-15d608a0bc21","http://resolver.tudelft.nl/uuid:61088702-20b8-41f5-ad32-15d608a0bc21","GaN enabled OLED Driver for Automotive Lighting Application","Palaiogiannis, F.","Popovic, J. (mentor)","2015","The impressive features, both in a design and technical aspect, of the Organic LED (OLED) lighting technology have attracted the interest of the research and commercial world and have recently be in the spotlight of the automotive industries, like the Lighting Department of Audi. Some of the most exciting features of these lights are the exibility, transparency and the very small thickness. It is reasonable, therefore, that in order to take full advantage of this new technology the electronics that drive these lights, that is the dc/dc converter, should also be characterised of low prole, exibility and small size. A boost towards the direction of the converter minimization and high power density operation could be the recently commercialised power switching technology of Gallium Nitride (GaN) devices. This technology, which exploits the advantages of the wide band gap semiconductors, offers high frequency, high power density, low switching losses operation and low profle design, as well. As every newly commercialised technology, the areas of application that at most exploit the advantages of these switches are still to be found, but it is expected that applications that require high power density or low profle features, like the OLED applications, could benefit the most from the GaN technology. This area is the exact topic of the current master thesis. At this project a dc/dc converter based on GaN switching devices is designed and built. The converter is purposed for the driving of Organic LED lights that belong to the tail light system of a vehicle. As such, the electrical, mechanical and thermal specifications of the converter are based on the guidelines of the Lighting Department of the Audi automotive industry and the nature of the Organic LED lighting. At this thesis, the required dc/dc converter is designed, built, measured and assessed for its adequacy to the defined requirements. During the design part of this project the necessary simulations are conducted. For the purpose of estimating the losses of the GaN device a detailed analytical model for the switching transients is used. Also, both the possibilities of using a planar and a discrete coil are investigated during the simulations and the two components, which were built in the lab, are compared experimentally. A final prototype of the converter is also built in the lab and the experimental and simulated results are then compared and assessed. The assessment of the results showed that the features of the GaN device can be fully exploited at this application and can offer the low profile and high power density requirements. In order, however, to achieve the minimization of the magnetic component more advanced and wider range of core materials are required, especially if a planar coil is desired. Finally, full exploitation of the detailed analytical GaN loss model requires specialised software tools or accurate analytical models in order to determine the values of the various parasitics and the thermal resistance of the component, both strongly related to the PCB layout. This, also, means that during the design procedure in order to achieve better accuracy -which is required at applications which push the frequency to the limits - the PCB design layout parameters should be included in the iterative process of the parameter specification","GaN; Gallium Nitride; Organic LEDs; OLED; Buck Boost; Boundary Conduction Mode; Valley Switching; Switching Model; Analytical Model; Planar Coil","en","master thesis","","","","","","","","","Electrical Engineering, Mathematics and Computer Science","Electrical Sustainable Energy","","","",""
