"uuid","repository link","title","author","contributor","publication year","abstract","subject topic","language","publication type","publisher","isbn","issn","patent","patent status","bibliographic note","access restriction","embargo date","faculty","department","research group","programme","project","coordinates"
"uuid:f433a5ce-8249-4976-a43f-a741b4ce2bf9","http://resolver.tudelft.nl/uuid:f433a5ce-8249-4976-a43f-a741b4ce2bf9","Design opportunities for flash flood reduction by improving the quality of the living environment: A Hoboken City case study of environmental driven urban water management","Cruijsen, A.C.","Van de Giesen, N.C. (mentor); Van de Ven, F.H.M. (mentor); Hooimeijer, F.L. (mentor); Dolman, N.C. (mentor)","2015","The overarching aim of this research project was to establish a sustainable urban water management design for Hoboken City to decrease vulnerability to extreme precipitation and improve urban quality. By carrying out a functional analysis of the area and the technical analysis of the water system, recommendations were made for soft and natural spatial solutions (i.e. blue-green measures). The base of the design is the existing urban environment, which is characterised by low area elevations, dense urban development, and high impermeability. The gravity based sewer system drains storm water into the Hudson River through combined sewer overflow valves. During high tide, the overflow valves close, preventing the storm water to overflow, whereby the surplus water remaining in the sewer pipes overflows in low-lying areas. Natural processes were used to recreate a naturally oriented water cycle. The main goals of the urban design were to reduce storm water floods, reduce the number of combined sewer overflows into the Hudson River, and improving the urban living environment. Urban quality was indicated by air quality, public green- and recreational space, and the reduction of urban heat island effects. The research question as a guide for the thesis reads: ‘What system of blue- green adaptation measures is most beneficial for Hoboken in terms of flood reduction and improving the urban quality?’ Various research methods are used to answer this question. To gain knowledge regarding urban water management and nature based flood adaptation measures, a literature review is conduced. tudies towards flooding and flood reduction in Hoboken were used as input for the water assignment. To design sets of blue-green measures, a functional analysis of the area is done using the six-layer approach for urban areas. With the approach, design opportunities and constraints for different layers are identified. The design strategies of appropriate blue-green measures for Hoboken are tested in a hydrology-hydraulic water management model. Results Hoboken suffers both flash flooding overwhelming the sewer system and storm surge. Low elevations and high groundwater levels influence infiltration capacity and efficiency of the drainage system. Combined sewer outlets with valves to the Hudson River carry excess water directly into the river during storms. When heavy rainfall coincides with high tide, excess water backs up in the sewer, causing flood nuisance in particular the low-lying areas. In terms of the required storage and drainage capacity, the water assignment for Hoboken is calculated. This technical assignment provides a rough measure of the required delay and storage capacity in urban areas for given rain events that exceed the existing storage and pumping capacity. With a basic hydrological model, the storage is determined on the basis of 100 years of precipitation data. The water assignment isn’t normative. It does not take detailed area characteristics, elevation profile and sewer layout into account and therefore cannot determine the locations where flooding occurs. With statistics afterwards, the storage volumes for 1, 2, 10 and 50 years design storms is determined. The table below shows the water assignment for these storm events. The volumes of water in the water assignment show the pressure on the current drainage system. During a T1 storm event, the required storage capacity is already twice the available sewer storage of 8.3 MG. For a T10 the excessive volume is 40.9 MG, corresponding to 62 Olympic swimming pools spread over the city. Based on the current storage capacity of 0.5 inch/day, SDF curves show that for a T10 storm, a pumping capacity of more than 15 inch per day would be needed. Due to interconnections, the calculated volumes per sub basin may differ from the actual volumes. Future regulations may require the North Hudson Sewerage Authority (NHSA), to reduce the flooding frequency on average once every 4 years or a T4 return period (HobokenNJ, 2013). The preferred T10 drainage capacity (5.0 inch in 24h) as set out in the US urban drainage design manual even corresponds with a required T10 storage capacity. A number of blue-green adaptation measures have been selected for Hoboken based on site suitability. The six-layer approach, which integrates urban planning and subsoil characteristics, gives an overview of the opportunities and constraints for blue and green measures in the area. Well-fitting measures appeared to be subsurface detention storage in the higher elevated areas, storm water flow-through planters, (storm water infiltration) trees and permeable pavement in infrastructure. In public space, parks, water squares, green squares, detention below sports fields, open water and urban farming would fit well. The buildings in Hoboken found to be suitable for rainwater harvest tanks, blue- and green roofs, green facades and urban farming on rooftops. To maximize blue-green benefits, a citywide network of waterways, green areas, green streets and common gardens is proposed. Five design strategies were developed with combinations of blue-green measures, applied to different layers in the urban system. The first (1) design strategy improves the current situation with the application of subsurface adaptation measures. With a functional analysis, storage possibilities beneath parking lots and sports fields are determined. Two deep storage basins will are proposed. The remaining sports fields and parking lots will be equipped with shallow storage facilities. The second (2) design strategy improves the current situation with the application of infrastructural adaptation measures. This includes surface measures like permeable pavement, storm water infiltration planters and trees along major roads, and green in the streetscape. The third (3) design strategy applies adaptation measures on public space. Undeveloped public areas suitable to rain gardens, storm water trees and flow-through planters, water squares, detention below sport fields, parks, retention ponds (in new/existing green space), urban agriculture, bio retention swales, rainwater harvest cistern and seasonal storage are here for identified. For the fourth (4) design scenario, adaptation measures were applied on private space and buildings. Buildings suitable to place green roofs in the area are analysed. The fifth (5) strategy in the end, combines the proposed measures into an urban blue-green metabolism. Additional green is applied to the public space. Hollow roads discharge storm water towards open water bodies and green in the streetscape connects green area and open water in the city centre to green belt. The mitigation performance of every design strategy regarding the water assignment is tested on the basis of a Storm Water Management Model (SWMM). The five design scenarios were added to the basic model by Low Impact Development controls (i.e. green roofs, permeable pavement, bio swales). To quantify the contribution of the design strategies to the water assignment, a number of criteria and parameters are identified. The criteria for design performance are (a) flood volume reduction during heavy rainfall events, (b) CSO reduction, (c) vulnerability reduction of critical public buildings and infrastructure (f.e. Hoboken terminal, hospitals, wastewater treatment plant, electricity distribution locations), and (d) improvement the urban quality of living. Four parameters to evaluate the to evaluate the contribution to flood mitigation and overflow reduction are (1) the flood volume in the drainage area (internal outflow), (2) the runoff per sub-basin, (3) the total storm water storage per sub-basin (excluding sewer storage), (4) critical facilities threatened by flash floods. All strategies showed contribution to flood volume reduction and creating urban quality, but not all strategies were as effective. Strategy 1 can store about 10% of the total flood volume. It has the least contribution to urban quality, since only subsurface storage, and no vegetated measures were used. Strategy 2 on the other hand, has a very broad effect on the green experience of the city. It includes the greening of three major roads. Strategy 3 uses undeveloped space to create a green network throughout the city. It has the least effect on total flood reduction of all strategies, but uses space that would otherwise lie fallow. In strategy 4, green roofs are applied on all suitable buildings throughout the city. This had a positive effect on both flood reduction, reduction of the urban heat island effect, and air quality. When the roofs are large enough, they can even function as a roof garden, roof restaurant or private kitchen garden. Design strategy 5, the city-wide metabolism and people design strategy, combines all design strategies into a citywide system of blue-green measures. Modelling showed that Hoboken benefits most from this city-wide design strategy (5) in terms of quantitative flood reduction. This design strategy also has the most additional green through a citywide network of vegetated measures. The proposed spatial typology of the city-wide metabolism and people design strategy is elaborated with a number of illustrations. Green roofs, permeable pavement, bio-retention gardens, storage basins, an urban farm, urban wetlands and water squares are included in the adaptation design. Through the urban grid system, vegetated areas are connected to create a pleasant experience throughout the city. The riverbeds in the east and the areas at the bottom of the cliff are surrounding the city with a green belt. The green belt along the cliffs serves for both storage and infiltration of water. The three major roads with trees and plants create green veins through the heart of the city. In every part between the major roads parks, urban farms or wetlands can be found. A solid footpath or bicycle lane can be applied along the city borders to create an uninterrupted route. This citywide system of flood prevention measures provides a pleasant, physical appearance. Recommendations For future work, a number of suggestions can be presented towards the reliability and effectiveness of this study. To fill up data gaps in the current model, a follow up study regarding the costs and support of the proposed design is meaningful. The suggested design strategy 5 is the most extensive urban design is the most extensive one and therefor also the most costly. Historical research on blue-green measures resulted in implementation costs indications. These results need to be revised for the proposed design and with up to date financial taxes. Support for the design is needed when it comes to realisation. Inhabitants, businesses, landowners, the NJ transit and the governance are important stakeholders. Based on the outcome of this research, the improvement of the storm water management model is of biggest interest.","urban water managment; blue-green measures; urban planning; SWMM; flash floods","en","master thesis","","","","","","","","","Civil Engineering and Geosciences","Water Management","","Water Resources Management","",""
"uuid:6a264a60-bce8-4129-b335-9ebae67aba71","http://resolver.tudelft.nl/uuid:6a264a60-bce8-4129-b335-9ebae67aba71","An innovative design of a pop-up store: Using the unique properties of pop-up stores in the financial sector","Schwering, J.J.A.","Kleinsmann, M.S. (mentor); Gerritsen, B.H.M. (mentor)","2015","The ING pop-up store Pop-up stores, were once considered an adventurous experimental retail strategy, but today it has become a more established channel for driving sales, generating buzz, building brand awareness, testing or co-creation of products. This innovative channel also raised attention at the ING Customer Experience Centre (ICEC) as they recognize the need for a solution that fulfills user demands driven by a changed societal and banking perspective. The concept of using a pop-up store to deliver value to the user is new for the ING, the financial sector and the society. Expert views on the changing society indicate that the bank has to fulfill a different role. The target group (students) has no interest in visiting ING branches and does banking digitally. This creates a distant relation and introduces the need to re-connect with the customers. The pop-up store is therefore introduced as a new channel and offers user value in their personal context. For the introduction of this radical new innovation, the focus is on managing user expectations with the design in the blink of an eye. Iconic shapes of ING are analysed and used in the design. Contrast in material, colour and form are key variables to realize recognition of the brand and managing user expectations. A concept is created that focuses on facilitating co-creation of mobile apps and enabling interaction with touchscreens. The user will be motivated to continue co-creating off-site via existing channels.","pop-up store; co-creation; ING","en","master thesis","","","","","","","Campus only","","Industrial Design Engineering","Industrial Design","","Master of Science Integrated Product Design","",""
"uuid:b2e26f07-623c-4b36-89ff-5f8de18a6c67","http://resolver.tudelft.nl/uuid:b2e26f07-623c-4b36-89ff-5f8de18a6c67","The created value of an Urban Consolidation Centre differentiated in last-mile and network-associated value","Van den Berg, S.G.","Van Duin, J.H.R. (mentor)","2015","The last few miles when transporting goods are often the most expensive. This is called the `Lastmile' and is under increasing attention in literature and with decision makers. In addition to being expensive the last mile frequently runs through urban areas and contributes to local pollution and congestion. One possible method to increase efficiency in the last mile, whilst keeping pollution and emissions low, is the Urban Consolidation Centre. In spite of the high number of projects started, there is still relatively little known on what value this concept can generate. The objective of this study is to explore the potential sectors in which the UCC can add value and how much value is actually created. We found that the construction sector can be a suitable sector for the UCC to pursue, although it necessary to do more research to determine how much value this sector can generate. The waste sector has some potential, but also has some drawbacks on suitability of waste ows for consolidation and legislation. The actual value of two cases, shipper and carrier, were studied and shows a last-mile savings between e7 and e8 per stop consolidated for most scenarios. The network effects increase this value to e12,65 for the shipper when 35 cities are included. For the carrier this value is only increased to e8,42 when 35 cities are included. These results provide the necessary basis for an accurate business model to be further developed and tested. The network effects were not previously reported and therefore add significantly to the value proposition of the UCC's business model.","UCC; last-mile; logistics; consolidation; value; VRP","en","master thesis","","","","","","","","","Technology, Policy and Management","Transport, Infrastructure and Logistics","","Management of Technology","",""
"uuid:b5bbac47-23e4-42cd-a212-2ae67ce39950","http://resolver.tudelft.nl/uuid:b5bbac47-23e4-42cd-a212-2ae67ce39950","Designing intimate touch technology","Kuo, C.Y.","Pasman, G.J. (mentor); Kooijman, A. (mentor)","2015","This assignment features the development of a prototype of a female teledildonic device. The assignment is sponsored by KIIROO and aims to meet the needs of a growing market for sex-toys. The counterpart of this product, which is a male teledildonic product, has already been developed. This female product not only needs to fulfill the function of a normal dildo but also able to interact with its male counterpart via Internet connection in real time. The process of the development involves researching existing teledildonic products, holding sessions with focus groups, investigating and evaluating usable internal mechanisms, building the prototype, and determining the final evaluation. Since there are few teledildonic products available on the market, the conclusion drawn from the prototype is valuable to KIIROO for the development of a real product.","Intimate; teledildonic","en","master thesis","","","","","","","Campus only","","Industrial Design Engineering","Design Engineering","","integrated product design","",""
"uuid:5912a174-6e74-4ea9-a96d-118f2c65c000","http://resolver.tudelft.nl/uuid:5912a174-6e74-4ea9-a96d-118f2c65c000","Hamiltonian Discontinuous Galerkin Finite Element Method for Internal Gravity Waves: An exactly energy conserving discretization","Van Oers, A.M.","Maas, L.R.M. (mentor); Van der Heul, D.R. (mentor)","2015","A DGFEM discretization has been developed for the Hamiltonian dynamics of stratified incompressible linear fluid flow. The developed discretization can handle the numerical challenges posed by wave attractors: the three dimensionality of the domain, the focusing of wave energy and the incompressibility of the flow. The discretization is unconditionally stable. The conservation of phase space and energy ensure that the numerical error is physically more correct since an unphysical numerical error that changes the total energy is not possible.","Hamiltonian dynamics; DGFEM; internal gravity waves; wave attractor; discretization; Euler equations; fluid dynamics; energy conserving; structure preserving; phase space","en","master thesis","","","","","","","","","Electrical Engineering, Mathematics and Computer Science","Numerical analysis","","","",""
"uuid:c5868f18-305c-497d-bc84-023c9875e8cd","http://resolver.tudelft.nl/uuid:c5868f18-305c-497d-bc84-023c9875e8cd","Improving Change Management: ""A response to growing complexity in managing offshore equipment""","Mulder, A.","Hertogh, M.J.C.M. (mentor); Schoenmaker, R. (mentor); Groenleer, M.L.P. (mentor)","2015","","","en","master thesis","","","","","","","","","Civil Engineering and Geosciences","Structural Engineering","","Integral Design and Management/Construction Management and Engineering","",""
