"uuid","repository link","title","author","contributor","publication year","abstract","subject topic","language","publication type","publisher","isbn","issn","patent","patent status","bibliographic note","access restriction","embargo date","faculty","department","research group","programme","project","coordinates"
"uuid:cfe65952-c445-4aac-aa73-b28c066c5224","http://resolver.tudelft.nl/uuid:cfe65952-c445-4aac-aa73-b28c066c5224","social housing on the move","Venema, C.T.","Elsinga, M.G. (mentor); Boumeester, H.J.F.M. (mentor); Pruyt, E. (mentor)","2016","Both the public and the European Commission have criticized the past actions of Dutch housing associations. A new housing act has become applicable, which would force housing associations to change their conduct on the rental housing market. Important developments include the allocation of households with a low income to social dwellings, a distinction between the social and commercial rental market, and lastly, a landlord levy. A system dynamics model was developed to identify whether the rental housing market would become a more dual rental market in the future. The model was made for one specific housing association: Havensteder, a large housing association in the region of Rotterdam. The position of Havensteder and some objectives are taken into consideration for the system dynamics model. The outcomes of the system dynamics model show that the structure of the social housing market tends towards a more dual rental market, although not all indicators point to this result. Therefore, it cannot be concluded that the social housing market is in fact transitioning to a dual rental housing market.","social housing; housing systems; housing associations; dual and unitary rental housing market; system dynamics; the Netherlands","en","master thesis","","","","","","","","2016-01-28","Technology, Policy and Management","OTB","","System Engineering, Policy Analysis and Management","",""
"uuid:f14861d0-c2cb-4822-9183-0c11a7a77b2e","http://resolver.tudelft.nl/uuid:f14861d0-c2cb-4822-9183-0c11a7a77b2e","Community Care","Vrugte, J.A.","Caso, O. (mentor); Van der Meel, H.L. (mentor)","2016","As hospitals became cleaner, they became colder, noisier, and less comforting. This led to the barrenness and stressfulness of today’s hospitals. This take on the MidCity community hospital is about the patient and about quality rather than pure efficiency. The project ranges from city scale interventions to architectural design.","Chicago; healthcare; community","en","master thesis","","","","","","","","","Architecture and The Built Environment","Architecture","","Complex Projects","",""
"uuid:89b24732-49c3-42a9-ad5b-6d228de3e515","http://resolver.tudelft.nl/uuid:89b24732-49c3-42a9-ad5b-6d228de3e515","A concrete school","Beelen, J.","Pietsch, S. (mentor); Scheurs, E. (mentor)","2016","In The Netherlands concrete as a building material doesn’t have a positive image. This is partly because of the fact that vocational education in concrete has disappeared from Holland. There is therefore little craftsmanship in concrete available. By building a vocational school for concrete, an institute for the making of concrete, craftsmanship in concrete can be brought into the Dutch building industry. Hopefully guaranteeing aesthetic concrete a fruitful future in The Netherlands. By designing a public school in the city centre of Breda, the craftsmanship that is taught to the students becomes visible to the passer-by. Some of the machine- and workshop rooms are located directly next to the street and connected with this street by a public colonnade. People walking through the busy city centre will in this way be confronted with a world of concrete that is unknown for them. Concrete can be divided in two types, depending on the way it is made, namely in-situ and precast concrete. In this design both types of concrete are used. The two entrances, with organic stairways, to both buildings are indicated by the use of in-situ concrete. This is where the student and visitor enter the building and directly feel the presence of the demolished formwork. The concrete shows the relics of its making process and with this evokes a curiosity about the material. To give way to making these big and expensive in-situ parts of the building, the rest of the building is designed in less expensive factory made precast sandwich elements, partly with a terrazzo finish. These elements consist of a load-bearing inner leaf, an insulation layer and an concrete/terrazzo outer leaf. Taking into account many practical and technical issues, like maximum transport measures and weight, a system of elements is designed. Because part of the reason to build this school is to enhance the image of concrete, some parts of the outer leaf are polished. These parts show the different types of natural stone used inside of the concrete, and give the building a shiny and exclusive appearance. Exactly the appearance that doesn’t come into mind when one thinks of concrete.","","en","master thesis","","","","","","","","","Architecture and The Built Environment","Architecture","","","",""
"uuid:b7a078b0-e35b-4506-985c-90e68b669390","http://resolver.tudelft.nl/uuid:b7a078b0-e35b-4506-985c-90e68b669390","The enclave of the Binnengasthuisterrein","Coerant, R.","Meijers, W.L.E.C. (mentor); Koopman, F.W.A. (mentor)","2016","Redevelopment of an ensemble of buildings, varying from being built in the early 17th century to the late 20th century, to a university campus in the city center of Amsterdam. Research on the city, buildings and relevant theory on public space come together in a building design where old and new meet","heritage; Binnengasthuisterrein; experience; threshold; layering","en","master thesis","","","","","","","","","Architecture and The Built Environment","Architecture","","Heritage & Architecture","",""
"uuid:bdd407bc-f2f7-47f9-9a02-fe22c3fdea34","http://resolver.tudelft.nl/uuid:bdd407bc-f2f7-47f9-9a02-fe22c3fdea34","Who teaches the teacher? A data-driven education innovation platform","Niesten, M.","Sonneveld, M.H. (mentor); Hendriks, E.A. (mentor)","2016","Teachers Network is a digital platform for open-source education innovation. It is a place where teachers can come together, share their ideas, methods and results, and collaborate to create new education. Besides that, it is an online research platform for educationists and education enthusiasts, and an education reference for all teachers. In order to collect data for the development of education, it is connected to a virtual learning environment. Teachers Network is linked to an online learning environment that provides quantitative data as a base for education development. This environment receives new tools and possibilities from Teachers Network in return. FeedbackFruits is the online learning environment the Teacher Network is linked to. Teachers Network is unique in combining a sharing platform with an education development platform. These two reinforce each other; discussions can be started on new developments and these discussions can be used to fuel innovations. Existing education innovations usually come from educationists, education enthusiasts, or commercial learning companies. Teachers Network aims to give education innovation back to the educators.","Education; Education innovation; User Interface Design; Sharing Platform; Teachers; Self-development","en","master thesis","","","","","","","Campus only","","Industrial Design Engineering","Industrial Design","","Master of Science Design for Interaction","",""
"uuid:1e2d2c04-cf91-4324-b0f0-df5049192d61","http://resolver.tudelft.nl/uuid:1e2d2c04-cf91-4324-b0f0-df5049192d61","Super Sinan","Jin, Z.","Marzot, N. (mentor)","2016","In such design, a simple logic of form appears to be the repetition of inhabitable wall depicting a hybrid system of market, workshop and education, would represent the idea of unity that is required by the position of the site against the fragmented reality. Meanwhile devoted, on a wider level, to reducing the functionality and metaphorical forms of architecture, to an architecture reduced to its barest form – a ""typical plan"" aimed only at staging the production of everyday life through the most basic architectural practice that has been testified by the ""Elementi Primari"" of Istanbul. Upon dramatic different scales, it created a various hierarchy space within which where all activities are housed by one simple, consistent architectural gesture. A gesture that stems from the primary elements in the city, faded through time, albeit more pervasive in actuality. ""Enciclopedico""","typical plan","en","master thesis","","","","","","","","","Architecture and The Built Environment","architecture","","Public building","",""
"uuid:69abe306-db48-464e-8844-0032f753cb10","http://resolver.tudelft.nl/uuid:69abe306-db48-464e-8844-0032f753cb10","Beagle; 'a stimulating quest throughout the hospital'","Van Leeuwen, B.A.C.","Boon, M.J.B. (mentor); Rozendaal, M.C. (mentor)","2016","Beagle; ‘a stimulating quest throughout the hospital’ is a project that focuses on improving the quality of life and the development (physical, emotional and social) of hospitalised adolescents with CF within the Wilhelmina Children’s Hospital. This graduation project is positioned within the Meedoen=groeien! project of the Dutch Rehabilitation Fund, Princess Maxima Centre for Paediatric Oncology, and Delft University of technology. In general, the aim of this graduation project is to improve the quality of patient care by creating healthcare innovations and developing scientific knowledge in which design and technology play a central role. Cystic Fibrosis is an inherited chronic disease that causes slime to thicken. Various organs that use slime (such as the lungs and digestive system) are hindered and not able to function properly resulting in several complications. People with CF are often shorter of breath and quickly exhausted. The ‘Child Development and Exercise Centre’ of the Wilhelmina Children’s Hospital in Utrecht guides and aids the CF patient by providing physiotherapy. ‘CF patients are encouraged to engage in exercise programs’ (van Leeuwen; 2013). Having a proper physical fitness is of great importance in order to benefit from a better (physically and mentally) and longer life. CF patients are less able to remove filth (e.g. dust and bacteria) from their lungs as a result of the though slime (which cannot be coughed up effortlessly). This makes them vulnerable for infections. In case of an (severe) infection, patients need to be hospitalized. Inside the hospital special rules apply to prevent the patient from encountering new infections or transmitting their bacteria to other CF patients via cross infection. The patient is bound to his or her room (contact isolation) for a hospitalization that could take up to 3 weeks, depending on ones treatment. He or she is prohibited to leave the room, except during so called ‘stapuren’ (step hours) two times a day or when the patient wants (and is allowed) to go outside the hospital under guidance of a parent or health care worker. The segregation policy is not perceived as fun by the patients (next to the hospitalization itself); they are bound their room and there is not much to do. CF patients spend most of the time sitting on their bed passively. Physiotherapists would like to improve this situation by, for instance, activating patients in their room or to offer them the ability to exercise together (observe the segregation regulations). (figure I). The sooner the patients’ physical condition improves, the quicker he or she might feel better (physically and mentally) and hopefully is able to return home sooner (depending on other medical treatment as well). Any activity additional to the patients’ current activity level is welcome (favourably, the more active, the better). However ‘Physiotherapy is often experienced as tedious and time consuming amongst CF adolescents and its direct effect is not recognized’ (Pfeffer et al., 2003) Furthermore, out of the user research and meetings with pedagogical staff members appeared that there seemed to be no specific need for peer contact. Nonetheless participants like to do things together with familiar people (e.g. friends or family) or in some cases with unfamiliar people (e.g. other non-CF patients). Also, there is no possibility yet that enables and allows CF patients to (physically) be together safely inside the hospital. Hence the design goal comes into being: ‘Design a product service system that invites hospitalized adolescents (12-16) with Cystic Fybrosis to activate together while being (physically) segregated from each other.' Patients need to be motivated to become physically active. It was envisioned that the design should be an activity which is fun to do and by doing so, would activate the adolescent (without experiencing it as an obligation). It should also remain fun for a longer period. “ The design should ‘invite’ and ‘captivate’ adolescents to become active.” Various factors influence the motivation and ability of CF adolescents to become active. The segregation policy was perceived as an environmental factor that largely limited the freedom and activation space of CF patients. ‘What if the rules of the segregation policy could still be guaranteed but that patients are free to walk through the hospital?’ This challenge lead to the realization of two concepts that dared this policy (pushing its boundaries) in order to offer the patients more freedom, but still at a safe distance from each other with the necessary hygienic precautions. However during verification meetings with medical specialists became apparent that; the policy is strict and people are hazardous for the risk, resulting in that none of the two concepts were allowed to enable CF patients to exercise together in this form. The feedback resulted in a delimited scope and revised vision. The physical activity should take place after one another in the step hours or together with hospitalized non-CF patients. It should preferably be a small object that changes the hospital context into an enriched environment. Beagle is the result of the final design phase. It is a stimulating quest throughout the hospital. Beagle consists out of several Bluetooth beacons; ‘Beagles’ that are spread throughout the hospital. Hospitalized adolescents are able to install an app on their own smartphone after which they can search for the Beagles during their step hours. Once a Beagle is found, the finder can decide what to do with it. Leave it there, hide it on another spot, take it to their own room, put it at a fun place, do something sweet for the next finder etcetera. It is up to them. The design was tested with four young adolescents (11-12) and one older CF adolescent (16). In general can be said that on the short term all participants enjoyed the first time usage of Beagle wherein the young adolescents were motivated to search for Beagles and were thereby motivated to become active. The Older CF adolescent however would like to have a bit more of a challenge. Beagle transformed the participants’ view of the hospital; they were scanning the environment for Beagles or possible hiding places, observing and using the environment differently than they would do normally. Most of the participants liked to do the quest together with their roommate or friend. The older CF participant, however, did not need to have contact with other peers per se. On the short term, the design goal and interaction vision were met for the younger adolescents, for the older (CF) adolescent however Beagle needs to have adjustment.","Physiotherapy; Cystic Fibrosis; Adolescents; Segregation policy; Exercise; Connecting; Motivating; Contextmapping; Medisign; Research through design; Contact isolation; Activating","en","master thesis","","","","","","","Campus only","","Industrial Design Engineering","Department of Human Information and Communication Design","","Meedoen = Groeien","",""
"uuid:b4237cce-4e7e-4c9b-a5dd-62ef192b5f69","http://resolver.tudelft.nl/uuid:b4237cce-4e7e-4c9b-a5dd-62ef192b5f69","The potential for high rise envelopes as energy production units","Leeuw, A.","Van den Dobbelsteen, A.A.J.F. (mentor); Bergsma, A.C. (mentor)","2016","By using Ladybug and Honeybee for Grasshopper, the energy production potential of high rise envelopes was investigated. Together with a technical design and the formulation of a flowchart strategy for energy production on high rise, an answer to the question ‘How can high rise envelopes be utilized for energy production?’ was sought after. The results showed that high rise envelopes can be used as energy production units by implementing energy production systems into existing façade systems. By doing so, modern buildings can produce over 30% of their total energy demand on-site. This will increase the global and national share of clean energy production, reduce negative environmental impacts of energy production and keep fossil fuels available for longer time periods. Changing policies and regulation along our own comfort standards can further increase the potential of energy production on high rise. However, high rise with a high window to wall ratio will have no future in the built environment, unless transparent energy production technology will see great efficiency improvement in the next few years.","high rise; zero energy; renewable energy; energy consumption","en","master thesis","","","","","","","","","Architecture and The Built Environment","Building Technology","","","",""
"uuid:f4b105a2-9fd5-4039-aa6c-a3bf48c8728b","http://resolver.tudelft.nl/uuid:f4b105a2-9fd5-4039-aa6c-a3bf48c8728b","Improving Traffic Safety For Dutch Cyclists","Deun, M.S.","Van de Geer, S.G. (mentor); Minnoye, A.L.M. (mentor)","2016","This project has been focused on developing a product for cyclists to improve their safety. Cyclists are the most vulnerable traffic participants and are the group of road users with the highest numbers of accidents. Most of these accidents are caused by contact with passenger cars/motorized vehicles. The Dutch rural areas are the most dangerous areas for cyclists and are therefore set as context. More research has been conducted into the influences, distractions and situations of these types of accidents between cyclists and drivers of motorized vehicles, in order to develop a specific problem definition. It has been proved that most of these accidents are caused in situations where motorized vehicles overtake the cyclist while these cyclists are being distracted. The major part of these distractions is caused by electronic devices or music. The overall research has shown that these types of accidents are a significant problem in the Netherlands, which shows great opportunities for designing a product for improvement. After setting a specific problem definition, more research as been done among cyclists in the Netherlands. This research shows that the secondary school pupils are the largest group of cyclists that use electronic devices while cycling, plus they represent the highest rate of traffic cycle accidents. Because most parents are aware of the fact that their children are more vulnerable on their bicycles, they are willing to spend money to improve the safety of their children. To obtain more information on the specific needs and wishes of the target group, research has been done among these secondary school pupils, using questionnaires. This provided valuable input for this project. Because electric and non-electric city bicycles showed great market opportunities, it was decided to design a product that fits both types of bicycles. The beneficial aspect of the electric bicycle is that power could be drained from the battery of the bicycle. This power option is left as future recommendation. Entrepreneurship During the entire process the design decisions are made by a combination of an industrial designers perspective and an entrepreneurial perspective. Research has been conducted on different patents, and market opportunities have continuously been checked, and a rough future plan is developed. The product After all research a list of requirements and wishes was created, which has been continuously updated during the process. Multiple rounds of ideation have resulted in three concepts that meet all the requirements. Three different selection methods were implemented in order to make the legitimate decision of the final concept. The final product consists out of two sub-products: a sensing part and a receiving part. The sensing part is able to sense approaching vehicles up to a distance of 18 meters due to the integrated ultrasonic sensor. Once an approaching vehicle is sensed, a message is sent towards the receiving part through the wireless radio frequency transmitting module. Subsequently, the other part is able to receive this message through the wireless radio frequency receiving module, decode it and transmit it into warning signals. These warning signals are small pulses of vibration, created by a vibration motor that is located on the handlebar. The interval between these pulses increases as the vehicle approaches, which notifies the user of the exact distance of the vehicle. Both parts are attached to the bicycle by a permanent, commonly used mounting system. The sensing part is located at the rear part of the bicycle, at the tube that leads from the center of the wheel towards the carrier rack. The receiving part is located at the handlebar. This part contains a vibration motor, which is (when installed correctly) pressed tightly against the handlebar in order to let the user feel a strong vibration as warning signal. The material of the components is flexible enough to bend around the frame, while it is subsequently also rigid enough for a good transmission of the vibration in the handlebar. Most components of the product have been fully tested, validated and optimized. The conducted tests were mainly focused on the functioning of the sensors and the transmitted vibration, the experience of using the product while cycling, and on the aesthetics. All extreme situations and conditions have been considered and most solutions are implemented into the design. Eventually this project has resulted into a validated product, with opportunities for a future entrepreneurship. More tests should be conducted and some aspects should be developed further before the product is ready for production. Recommendations for these aspects are shown next.","safety; cyclist; design","en","master thesis","","","","","","","Campus only","","Industrial Design Engineering","Industrial Design","","Master of Science Integrated Product Design","",""
