"uuid","repository link","title","author","contributor","publication year","abstract","subject topic","language","publication type","publisher","isbn","issn","patent","patent status","bibliographic note","access restriction","embargo date","faculty","department","research group","programme","project","coordinates"
"uuid:010e4bdb-6162-4bb4-a7e2-7c9796281532","http://resolver.tudelft.nl/uuid:010e4bdb-6162-4bb4-a7e2-7c9796281532","Analysis of the impact of adjustments to the on board HVAC design by time domain simulations","Osté, J.G.A.","Hopman, J.J. (mentor); De Vos, P. (mentor); Pijnen, G.J.A. (mentor); Konings, H. (mentor)","2016","The system for heating, ventilation and air conditioning (HVAC) on board of passenger related ships is one of the biggest energy consumer. The system is vital to the comfort of the crew, passengers and can improve reliability of equipment. Since fuel prices keep rising and green credentials of a ship become more important it is necessary to have insight into the efficiency of the HVAC system. When a ship designer wants to analyse the potential of energy efficient measures, other HVAC layouts or needs to evaluate how the current system will behave in off-design conditions the behaviour of the system in actual service conditions is required. Power demand varies in time due to time dependent variables like ambient conditions and internal heat loads. These aspects can be investigated through time consuming on-site measuring, but this project investigates the possibility to generate this research data by time domain simulations with an HVAC system simulation computer model. The purpose of this project is to develop a tool which provides the ship designer easy access to data of energy consumption and HVAC system behaviour in different service conditions and operational areas, in order to analyse energy efficiency in the early design stage and to gain system understanding to enable the designer to act as smart customer towards HVAC experts and suppliers. The HVAC computer model is constructed from separate component models, each describing a physical discernible part of the HVAC process. These components are verified during extensive verification procedures, to make sure the model behaves as expected. The HVAC system of the AMELS 272 superyacht, a central variable air volume (VAV) configuration with reheating, is used as a benchmark for this project. A test case consisting of one air handling unit (AHU) and two conditioned rooms with dedicated local control is built from the component models. The benchmark simulation showed that the model is able to generate data of the energy consumption and the behaviour of the HVAC system and the separate components within a matter of seconds. From this data the energy consumption of the reheaters proved to be substantial during a one day cycle for every climate. The nominal local flow rate is determined based on the worst case design conditions and because the minimum flow rate of local supply air is limited at a certain percentage of the nominal flow rate, the local supply air provides too much cooling capacity the majority of the day. Therefore a substantial amount of reheating is required. From the system understanding gained with the results from the benchmark simulation several suggestions arose for case studies to increase the efficiency and demonstrate the capabilities of the model to investigate the impact of adjustments in the HVAC system. By raising the AHU supply temperature with one degree up to 14% energy reduction can be realized, with the consequence that less dehumidification occurs in the AHU, resulting in higher indoor relative humidity. Lowering the flow rate limit proved to reduce the energy consumption with up to 9% for decreasing the limit with 5%, with the consequence that possibly insufficient air mixing is provided to have homogeneous temperature distribution throughout the room. Increasing the recirculation ratio reduced the energy consumption with up to 3% for every 5% extra recirculation air. Because of the high reheating demand a measure to lower the solar heat gain through glass did not result in energy savings. To quantify the potential of the case studies more research needs to be conducted to the boundaries of the consequences of these energy efficient measures. If the consequences are found to be unacceptable, more research can be performed to measures to cope with the consequences.","HVAC; simulations; superyacht","en","master thesis","","","","","","","","2021-01-18","Mechanical, Maritime and Materials Engineering","Marine & Transport Technology","","Mechanical Engineering - Mechanical Systems and Integration","","52.0017, 4.3725"
"uuid:17dcfdf6-69e3-44aa-8ad0-4e55443faf85","http://resolver.tudelft.nl/uuid:17dcfdf6-69e3-44aa-8ad0-4e55443faf85","Building for the Neighborhood","Moretto, M.","Spoormans, L.G.K. (mentor); Quist, W.J. (mentor)","2016","The project is located in the Binnengasthuis area In Amsterdam. This part of the city of Amsterdam houses a mixture of buildings and architecture styles, a rarity where many famous Amsterdam architects have contributed to. The spatial structure of this part of Amsterdam is unique, the location is the result of a layered construction in which the buildings have been fitted in combination with green structures ( courtyards, streets and squares ). The project is a renovation of 80s social housing building in the heart of the binnengasthuis area. With my design I wanted to create programmatic social diversity that could be also reflected in the architectural image through a variety of forms, materials and facade elements in a social housing block of the 1980s which is lacking of these qualities.","tool kit","en","master thesis","","","","","","","","","Architecture and The Built Environment","Architecture","","Heritage & Architecture","",""
"uuid:b8f3db81-7143-4b93-a059-c9bd4d92210a","http://resolver.tudelft.nl/uuid:b8f3db81-7143-4b93-a059-c9bd4d92210a","Excess pore pressures near a slurry tunnel boring machine: Modelling and measurements","Steeneken, S.P.","Hicks, M.A. (mentor); Bezuijen, A. (mentor); Broere, W. (mentor); Bakker, K.J. (mentor); De Nijs, R.E.P. (mentor); Ruigrok, J.A.T. (mentor)","2016","In this thesis an investigation is performed into the rise of excess pore pressures in front of a slurry tunnel boring machine (TBM) during boring. Accurate prediction of excess pore pressures is particularly important when boring close to foundation piles or when boring with a small overburden. The existence of this phenomenon has been known for approximately two decades and several groundwater flow models have been derived since. Laboratory experiments are conducted to investigate the applicability of laboratory results as input for the existing groundwater flow models. Furthermore, a new relation to calculate excess pore pressures at the tunnel face is derived. The discharge from the tunnel face during boring is investigated as well. Calculations considering the cutter wheel configuration are compared with calculations considering a mean slurry infiltration time and show similar results. This research originated from the North/South metro line in Amsterdam, at which excess pore pressures presented a real challenge in crossing a historical bridge. Data from the Green Heart Tunnel is also used in this research to serve as validation.","slurry; excess pore pressure; TBM; tunnel boring machine; North South line; column infiltration test; groundwater flow models; cutter wheel; slurry infiltration; excess pore pressure prediction","en","master thesis","","","","","","","","2018-01-08","Civil Engineering and Geosciences","Geoscience & Engineering","","Geo-Engineering","",""
"uuid:e9829a5c-fb81-4a88-8ffc-750524d931e4","http://resolver.tudelft.nl/uuid:e9829a5c-fb81-4a88-8ffc-750524d931e4","Market choice opportunities for gas sweetening technologies","Bezerianos, G.","Scholten, D.J. (mentor); Rezaei, J. (mentor)","2016","The assessment of the external or macro-environment in which a company is operating plays an important role in its market research, when it is trying to find the most promising country to sell a new product. Nowadays, the increasing competition is forcing the companies to conduct rigorous market researches in multiple and different stages. In this paper, we focused on building an assessment framework, which will include factors affecting the market choice for an oil and gas treatment process. We have chosen as a case study, the Thiopaq O&G technology, which is a gas sweetening process. We conducted a literature review regarding the existing macro-environmental assessment frameworks in order to extract the most interesting factors for our case study and build a new framework upon them. Then we carried out a survey by sending a questionnaire to the employees working in the O&G industry in order to understand how they rank the identified factors, which are the Political, Economic, Environmental Laws and Competition. Moreover, we attached sub-criteria to each factor in order to have a better insight and be able to rate them from the most to least important. For the data analysis, we used the Best Worst Method (BWM) that is a Multi-Criteria Decision-Making (MCDM) method, so as to have valuable and reliable results. The result of the data analysis gave as the ranking of the sub-criteria according to their significance and then we used a likert-scale to decide which country is the most promising market to sell Thiopaq O&G. According to our respondents the most important factor is Economic while Competition is ranked last, but their sub-criteria showed an interesting variation. The developed framework is a valuable tool that can be used for other products in the O&G industry, while the sub-criteria can change according to the perceptions of the one who is constructing it. Thus, it is an addition to the existing literature related to the evaluation framework of the external environment.","external factors; macro-environment; PEST; Porters five forces; multi-criteria decision-making (MCDM); best worst method (BWM); Thiopaq O&G","en","master thesis","","","","","","","","","Technology, Policy and Management","Economics of Technology and Innovation","","Management of Technology","",""
"uuid:4929a4c4-5df2-4005-8792-2fd377ec68c8","http://resolver.tudelft.nl/uuid:4929a4c4-5df2-4005-8792-2fd377ec68c8","Mapping stocks and flows of neodymium: An assessment of neodymium production and consumption in the Netherlands in 2010 and 2030","Crock, W.D.","Huisman, J. (mentor); Kleijn, R. (mentor)","2016","The Master's programme Industrial Ecology is jointly organised by Leiden University and Delft University of Technology. Neodymium applications, especially the neodymium-iron-boron (NdFeB) permanent magnet, have substantially enabled continuous miniaturization in the electronics sector and have become increasingly vital to electric mobility and direct-drive wind turbines. With 86% of neodymium primary production, separation and refining monopolized by China combined with its significance to the global (decarbonizing) economy, neodymium has been identified as a critical raw material across virtually every non-fuel mineral criticality assessment hitherto. Through quantifying, modeling and characterizing neodymium stocks and flows using material flow analysis (MFA) and scenario mapping, this research aims to determine the theoretical potential of the neodymium urban mine using the an assessment in the Netherlands in 2010 and 2030 as a case study. Results demonstrate the salience of neodymium flows via the electronics sector in 2010 and 2030 and based on clean technology trends, the role of neodymium in the automotive and renewable energy waste streams beyond 2030.","industrial ecology; sustainability; critical raw material; neodymium; rare earth elements; circular economy","en","master thesis","","","","","","","","","Applied Sciences","","","Industrial Ecology","","52.1, 4.22"
"uuid:b3d3a4ce-8d10-4727-8300-202d5b2732c6","http://resolver.tudelft.nl/uuid:b3d3a4ce-8d10-4727-8300-202d5b2732c6","A sensitivity analysis of acoustic wave propagation through the ankle joint space.","Oosting, R.M.","Stijntjes, M. (mentor); Tuijthof, G.J.M. (mentor); Dankelman, J. (mentor)","2016","Ultrasound imaging is known to be non-invasive, fast, and cost-effective. However, a drawback is its reflection on bone. Therefore, an alternative acoustic wave propagating technique is being developed that eventually should be able to diagnose osteochondral defects (OCDs) that are now often missed with conventional imaging techniques. A novel technique is proposed that consists of acoustic wave propagation through the ankle joint space. The identification of OCDs is based on a presumed deviation between a reference signal (from a predicted model of the patient specific healthy ankle joint space) and a measured signal including the OCD in de ankle joint space. For the identification of OCDs, the diagnostic technique should be robust enough to cope with variation in acoustic parameters. To assess the influence of acoustic parameters, two dimensional finite-difference time-domain models of the ankle joint space were generated. A sensitivity analysis was performed to indicate the effect of variation in acoustic parameters of bone, the presence of soft tissues on acoustic wave propagation and the identification of OCDs. The minimal, maximal and mean values of the density, the Lamé’s constants, shear and bulk viscosity of bone were variated step by step. The values of acoustic bone parameters were derived from literature, those of the Achilles tendon and skin were determined experimentally. The output signals from the receiver that was placed on the outside of the ankle joint space were of main interest during present study. The output signals of the receiver in the middle and the anterior side of the ankle joint space were assessed to gain more insight in the behaviour of the acoustic waves within the ankle joint space. Variation in acoustic parameters of bone made noticeable alterations to the reference signal: variation in density resulted in normalized root mean square error (NRMSE) from 10%-16%, variation in the Lamé’s constants resulted in NRMSE from 8% -13% and variation in the bulk and shear viscosity ranged from 6% -10%. In comparison the NRMSE as a result of an OCD of 5 mm wide and 5 mm deep in the middle of the talus ranged from 5% to 7%. The receiver that was placed in the middle of the ankle joint space showed larger differences in amplitude and time shift between the healthy and defected ankle condition. The NRMSE caused by the variation in acoustic parameters of bone ranged from 1% - 10%, whereas the NRMSE caused by the presence of an OCD ranged from 10%-12%. The detectability of an OCD increases with the presence of Achilles tendon and skin. A slight difference in NRMSE and NMCC, the missing time shift and the least influence on the amplitude by the bulk and shear viscosity implies that acoustic wave propagation is less sensitive to variation in the shear and bulk viscosity than in density and Lamé’s constants. It is advised that the acoustic parameters of bone and soft tissues are estimated precisely when models of the ankle joint space for OCD identification purposes are developed.","Osteochondral defects (OCDs); acoustic wave propagatoin; sensitivity analysis; pulse echo method; density bottle method; 2d finite-difference time -domain model","en","master thesis","","","","","","","","2018-12-31","Mechanical, Maritime and Materials Engineering","Biomedical engineering","","Medical instruments and medical safety","",""
"uuid:1bde7f59-a491-4f53-8ac7-ea49a0eff43f","http://resolver.tudelft.nl/uuid:1bde7f59-a491-4f53-8ac7-ea49a0eff43f","Reduction of Computing Time for Numerical Pricing of European Multi-dimensional Options based on the COS Method","Hazenoot, D.","Oosterlee, C.W. (mentor)","2016","Numerical integration methods such as the Fourier-based COS method can be used for effciently and accurately pricing financial products. The COS method can be applied to options on one underlying stock as well as on multiple underlying stocks. However, this method suffers from an exponential increase in computational complexity as the dimensions increase. In this thesis we research how to reduce the computational time, especially for multi-dimensional options. Firstly, we discuss the COS method. Secondly, we program this method in three different languages, namely MATLAB, C and CUDA. Thirdly, we perform numerical tests: MATLAB- and C-code on a CPU and CUDA-code on a GPU. Lastly, we compare some options for the different computing times of these codes.","option pricing; European options; multi-dimensional options; COS method; Fourier-cosine series; Fourier-cosine expansion; Fast Fourier Transform; discrete cosine transform; C; CPU computing; CUDA; GPU computing","en","master thesis","","","","","","","","","Electrical Engineering, Mathematics and Computer Science","Numerical Analysis","","Computational Finance","",""
"uuid:36a5a381-bced-4b14-a776-aa7dcfdb26b5","http://resolver.tudelft.nl/uuid:36a5a381-bced-4b14-a776-aa7dcfdb26b5","Control of drilling fluid properties: Density & Viscosity","Schuit, T.E.","","2016","In the oil and gas industry, safety and efficiency are taken into high regard when obtaining new natural resources. An increasing demand for automation arises to meet with the new safety and efficiency standards. During drilling operations, drilling fluid maintenance has an important role in guaranteeing safety on the rig. Controlling the drilling fluid properties is still a man controlled process with limited actuation and measurement precision. The uncertainties and inconsistencies this brings causes major safety risk, drilling inefficiency and high costs. As the wells which are drilled are becoming deeper with each well drilled, the range in which the drilling fluid properties can fluctuate are becoming more narrow as-well. The task of controlling the drilling fluid properties is still a challenge for the most experience fluid engineers as these types of systems are typically large multi-variable non-linear plants containing internal time-delays and are subjected to input and output constraints. In this thesis, a Model Predictive Controller (MPC) application is presented to control the density and viscosity properties of an oil-based drilling fluid. A simulation model is utilized to investigate the effects of drilling on the fluid properties based on field drilling data. The thesis proceeds to show how a linear MPC application can be utilized to control the nonlinear plant, incorporating a disturbance model to account for the effect of drilling. Finally, the model-predictive control solution is compared to the current method of control in terms of closed-loop reference tracking and cost efficiency for density control.","drilling fluid; control; density; viscosity; mpc","en","master thesis","","","","","","","","2021-01-01","Mechanical, Maritime and Materials Engineering","Delft Center for Systems and Control","","Control Engineering","",""
"uuid:7df92cdf-5ffc-4afc-9a95-9d2437bda5f5","http://resolver.tudelft.nl/uuid:7df92cdf-5ffc-4afc-9a95-9d2437bda5f5","WipLoc: Perpetual Indoor Localization with RF Wireless Power Transfer","IJntema, Wieger (TU Delft Electrical Engineering, Mathematics and Computer Science)","Langendoen, K.G. (mentor); Pawełczak, Przemysław (mentor); Weber, J.H. (mentor); Liu, Q. (mentor); Delft University of Technology (degree granting institution)","2016","Indoor localization is a topic that has been investigated for more than a decade. Yet, no single system exists that is widely adopted as the de facto localization standard. From a research perspective the goal is to obtain a solution that is general, simple and accurate. As the number of devices in the Internet of Things grow, a new set of challenges are appearing: maintainability, low operational costs, and more importantly, energy autonomy. Considering the challenges above, the following problems are (among others) present in large scale indoor localization scenarios. The costs of replacing the batteries of thousands of anchor nodes (beacons, devices sending location inform-ation) and mobile nodes or tags (devices to be localized) is high.","Wireless Power Transfer; Indoor Localization; Radio frequency; Bluetooth Low Energy; Capture eﬀect; Orthogonal Codes","en","master thesis","","","","","","","","","","","","Electrical Engineering | Embedded Systems","",""
"uuid:03fb6490-33ac-4254-a80f-b5d99295ce0b","http://resolver.tudelft.nl/uuid:03fb6490-33ac-4254-a80f-b5d99295ce0b","Effects of Osmolarity on Osteoarthritic Human Articular Cartilage","Karthik Raman, H.","Holger, J. (mentor); Zadpoor, A.A. (mentor); Weinans, H.H. (mentor)","2016","Chondrocyte is the only cell type which constitutes the articular cartilage, is solely responsible for the turnover of extracellular matrix composed of proteoglycans, type II collagen and water. Chondrocytes experience a unique ionic/osmotic environment, which is attributable to the polyanionic proteoglycan, which carry a high fixed negative charge and attracts cations, (mainly sodium) into the interstitial fluid. Extracellular tonicity in healthy cartilage ranges between 350 – 450 mOsm. The osmotic environment of chondrocytes is dynamic and osmotic perturbations occur in response to loading regimen and in pathophysiology. Articular cartilage defects heal poorly and lead to catastrophic degenerative arthritis. Clinical experience has indicated that no existing medication substantially promotes the healing process and the cartilage defect requires surgical replacement, preferably with an autograft. Some models of articular cartilage regeneration have yielded good repair of cartilage defects, in animal models and clinical settings, but the overall results suggest that there is room for improvement of this technique before its routine clinical application. In this body of work, we hypothesize that the hyper-osmotic stimulus of 380 mOsm is chondro-protective, phenotype preserving and up regulates the gene expression of the critical genes necessary for the maintenance of homeostasis. To test this hypothesis we study the effect of hypo (280 mOsm) and hyper (380 mOsm) osmotic stimulus on chondrogenic markers such as COL2 and AGC1, TGF-? receptors such as ALK1 and ALK5 and members of BMP namely; BMP2 and BMP4. Additionally, we would study the effects of osmolarity on genes synthesizing the GAG molecules. Osteo-arthritic human articular cartilage is obtained from three patients undergoing TKR. The tissue is digested with collagenase to liberate to the cells. The de-differentiation experiment is performed, in which the cells are allowed to proliferate and parallelly, they are cultured in 6 well plates for seven days. The cells used would be from P0 up to P2. RNA isolation and purification, c-DNA synthesis and PCR is performed at each passage with both the osmotic conditions. The final results are tested for significance with SPSS. Chondrocytes cultured in the hyper osmotic environment, proved beneficial for the chondrocytes. The phenotype was preserved to a certain extent and also the up regulation of the aforementioned genes was observed. For the first time, sensitivity of genes responsible for synthesis of GAG molecules was established and was observed, an upregulation in those specific genes. In a nutshell, chondrocytes showed good adaptation to the hyper-osmotic stimulus. It proved beneficial because the 380 mOsm is chondron-protective as it enhances the gene expression of the critical genes and also the preservation of the phenotype is noted. This study opens up a new plethora for research with respect to osmolarity in combination with genes responsible for GAG synthesis. Targeting various critical genes, by varying osmolarity within physiological limits, would aid in engineering phenotypically stable in vitro cartilage constructs.","osmolarity; osteoarthritis; cartilage; glycosaminoglycans; transforming growth factor - beta","en","master thesis","","","","","","","","2016-06-01","Mechanical, Maritime and Materials Engineering","BioMechanical Engineering","","Master Biomedical Engineering/Specialization - Tissue Biomechanics and Implants","",""
