"uuid","repository link","title","author","contributor","publication year","abstract","subject topic","language","publication type","publisher","isbn","issn","patent","patent status","bibliographic note","access restriction","embargo date","faculty","department","research group","programme","project","coordinates"
"uuid:046c8e8e-34e8-4c92-a2d3-81e531997f0d","http://resolver.tudelft.nl/uuid:046c8e8e-34e8-4c92-a2d3-81e531997f0d","The effect of flooding along the Belgian Meuse on the discharge and hydrograph shape at Eijsden","Rongen, G.W.F.","Kok, M. (mentor); Maaskant, B. (mentor); Mosselman, E. (mentor); Morales Napoles, O. (mentor); Buiteveld, H. (mentor); Hegnauer, M. (mentor)","2016","The Belgian Meuse is a river with a relatively low flood risk. The floodplains are narrow, and the estimated impact is not large until the flood reaches a magnitude of a once in a 200 years event. Flooding along the Belgian Meuse could however have an effect on the flood safety in the Netherlands, since there the flood defences are dimensioned on such extreme events. In addition, the climate is changing, causing more extreme rainfall in the Meuse basin. Therefore, knowledge of what will happen in case of extreme floods is becoming more important. Accurate numerical models and better estimates of extreme rainfall and flood events give the possibility to research flooding on the river Meuse. The goal of this thesis is to analyse extreme floods on the Belgian Meuse: What happens along this river under extreme conditions, and what are the consequences in the Netherlands? To analyse what areas along the Belgian Meuse are prone to flooding and how severe the flooding in these areas can be, a terrain analysis is carried out. This analysis shows that the river reach between Namur and the Dutch border is prone to flooding. The spatial limit that the flood could potentially have is not more than a few kilometres from the river axis, due to the valley shape of the floodplains. These flood prone areas have a potential storage capacity of 70 million m^3, and can thus have a significant influence on the flood wave. The valley shape of the Meuse ensures that there is no upper limit to the conveyance capacity, so the discharge at Eijsden has no cut-off level. A numerical model of the Belgian Meuse is built to simulate extreme floods. The new SOBEK 3.4 software, which combines SOBEK 1D and Flexible Mesh 2D, is used to build the model. Although the software is still under development, it has sufficient possibilities to model the area of research. The created flood model gives good results; it can reproduce the results from a similar but more accurate 2D model of the University of Liege. The resulting impact of the flooding on the discharge is a few percent damping, increasing gradually from nothing for once in 50 years wave to 7% for a once in 50,000 years wave. A sensitivity and uncertainty analysis are carried out to examine the uncertainties in the flood model. The first describes the selection of the parameters with the largest influence on the result. Two of these parameters, the main channel roughness and emergency measures, are further analysed in the uncertainty analysis. The main channel roughness gives the largest spread in discharge at Eijsden: a variation of 100 m^3 up or down. Placing sandbags has a small effect on the discharge, since these emergency measures will likely not be sufficient to protect the floodplains. A third parameter, the timing of the inflow from the side branches has a large influence too. It is recommended to use a smaller GRADE time step for the extreme events on the Meuse, since the timing is important for the fast genesis of floods in the Meuse basin. When combined with the uncertainties in the rainfall and run-off models, the contribution of the hydraulic uncertainty is minimal. When all GRADE uncertainties are incorporated in the design discharge curve, the impact of flooding along the Belgian Meuse leads to a maximum reduction of 100 m^3 compared to the case of no flooding. Considering flooding when determining the exceedance frequency curve is recommended, it gives a more realistic estimate for the discharge extremes. The hydrograph shape plays an important role here, since the wider wave compromises the effect of retention basins. It is thus also recommended to use a different, wider, hydrograph when considering flooding. The water level reduction due to flooding is estimated to be up to 30 cm along the Dutch Meuse. The current method of determining discharge extremes, HR2006, gives lower discharges than GRADE. When switching to the GRADE frequency curve with (or without) flooding and with uncertainty, the same safety standards will give higher design conditions. By considering flooding, these higher GRADE values are mitigated.","flooding; flood risk; Meuse; GRADE; SOBEK 3.4; discharge extremes","en","master thesis","","","","","","","","","Civil Engineering and Geosciences","Hydraulic Engineering","","Hydraulic Engineering","","50.53554, 5.27882"
"uuid:9a5b9a89-d591-435a-b004-3b043166267b","http://resolver.tudelft.nl/uuid:9a5b9a89-d591-435a-b004-3b043166267b","New Bridge Keepers","Oskam, P.Y.","Van Loon, F.D. (mentor); Van den Burg, L.J.P. (mentor); Geraedts, R.P. (mentor)","2016","The project concerns a minimal spatial design that re-invents the watersystem in South-Holland by connecting waterways with roads through social use. The water system of Holland functions not only as a very imporant structure to keep our feet dry, as well as a vital transport organ and recreational layer. Because of the developments in the past century, the water system is mainly taken over by train and car infrastructures. As a result, vacancy and water systems correlate (such as: bridge control houses). The intertwinement of the Dutch water system with the geo-morphological, natural, social-economical and historical context of the Netherlands make the intersection of the water and ways (bridge) an interesting occasion to (re)root the urban layer (the Randstad) with its underlaying context. How can vacant areas be transformed into a valuable resource for this problem? In this thesis, a design solution will be presented that will clearify and reintergrate this lost connection.","minimal intervention; bridge houses; participation; social design; boezem system; Holland water kingdom","en","master thesis","","","","","","","","2016-07-01","Architecture and The Built Environment","Urbanism","","Landscape Architecture","",""
"uuid:96012a27-f9a7-4c59-9189-56e35291cb72","http://resolver.tudelft.nl/uuid:96012a27-f9a7-4c59-9189-56e35291cb72","Exodus Home – a halfway house for ex - convicts","Osipenko, J.","Van Bennekom, H.A. (mentor)","2016","Thesis proposes a new transitional facility between the prison and outside world. “Exodus Home” is a halfway house for ex - offenders and non - violent criminals, merged with educational facility for residents and ex-convicts.","halfway house","en","master thesis","","","","","","","","2016-01-23","Architecture and The Built Environment","Architecture","","Complex Projects","",""
"uuid:767baf60-8bf3-4c69-bec9-fb96a3437aa4","http://resolver.tudelft.nl/uuid:767baf60-8bf3-4c69-bec9-fb96a3437aa4","Suppliers going circular","Stigter, R.","Prins, M. (mentor); Straub, A. (mentor)","2016","The circular economy concept is gaining popularity. Especially in the recent years a lot has been written about the benefits and challenges of the topic. Despite the growing interest on both political and market level, the terminology is used diffused and incoherent. This research examines the circular economy concept as posed by the Ellen MacArthur Foundation. The aim of this research is to design financial section of a business model in a circular economy. Extensive literature review, interviews and aspect studies on both the circular economy concept and the construction industry have resulted in a new definition of circular economy with corresponding boundary conditions. With these boundary conditions, conventional business models of building product providers (suppliers) have been critically assessed. By doing this, 13 costs and risks have been identified and incorporated in the design of the financial section of a business model. At last, the business model has been assessed by means of a case study: providing the structure of a steel beam. It can be concluded that the key variable that determines the financial viability is the circular economy axiom of rising resource prices.","circular economy; supplier; practical implementation; construction industry","en","master thesis","","","","","","","","","Architecture and The Built Environment","Real Estate & Housing","","Design & Construction Management","",""
"uuid:a58c2242-f966-464c-acf4-142f79a1f86b","http://resolver.tudelft.nl/uuid:a58c2242-f966-464c-acf4-142f79a1f86b","Smart renovation of residential real estate and neighbourhoods: An exploratory research into the possibilities of open data to support the renovation process in the initiation phase","Kramer, I.","Chen, Y. (mentor); Zijlstra, S. (mentor)","2016","In this master thesis an exploratory research into the possibly of the implementation of open data in the renovation process of post-war serial built dwellings is described. A user need analysis has been conducted by means of literature review, expert interviews and case studies. This led to a description of the process, the involved stakeholders and bottlenecks in the process. 22 bottlenecks have been identified in the process, these bottlenecks can be put in the categories ‘stakeholder collaborations’, ‘knowledge level’, ‘funding’ and ‘context’. In the research synthesis a link between these bottlenecks and possible information input from open data is made. This led to an analysis of available open data sets in the Netherlands that might aid the renovation process. 57 data sets were identified to be useful for the process. Since none of the bottlenecks has the lack of data or information as its origin, it is unlikely that the implementation of open data would directly solve the bottlenecks. However, it could facilitate to reduce some of the bottlenecks. In this report a framework is presented which could be used by stakeholders in the process as a guideline to find useful data sets in the open data database of the Dutch government. To make the implementation possible the level of awareness and transparency in the process should be raised. Furthermore, both subjects, the renovation process with the focus on energetic sustainability and the availability of open data, should continue to go through the transition, which they are going through currently, before the implementation of open data in the process could be successful.","renovation; energetic renovation; energetic sustainability; open data; data use; data re-use; post-war serial built dwellings; residential real estate; residential neighbourhoods","en","master thesis","","","","","","","","","Architecture and The Built Environment","Real Estate & Housing","","Urban Development Management","",""
"uuid:e281a5f9-c763-4b6b-a930-6b2ad48b0d49","http://resolver.tudelft.nl/uuid:e281a5f9-c763-4b6b-a930-6b2ad48b0d49","On the border of Sweet and Salt: A research based design towards the adaptivity of the Southwest Delta","Janssen, M.E.","Meyer, V.J. (mentor); Hooimeijer, F.L. (mentor)","2016","Using the effects of climate change as a chance for nature, economy and spatial quality to offer new perspectives for the island of Goeree-Overflakkee and to use this as a case study for similar areas","delta; adaptive delta management; tourism; recreation; fresh water supply; climate change","en","master thesis","","","","","","","","","Architecture and The Built Environment","Urbanism","","Delta Interventions","",""
"uuid:4b894e69-e19a-48bc-83fa-7c0d60386e9b","http://resolver.tudelft.nl/uuid:4b894e69-e19a-48bc-83fa-7c0d60386e9b","Dutch Design Dock","De Groot, M.","Smit, M.J. (mentor); Jongert, J. (mentor); Meijs, M.H. (mentor)","2016","Redevelopment of the vacant Van Gendthallen in Amsterdam to the Dutch Design Dock by using reclaimed materials from waste flows of the city itself.","redevelopment; reuse; reclamation; flow Analysis; stock; mixed use","en","master thesis","","","","","","","","","Architecture and The Built Environment","Architecture","","Architectural Engineering","","52.22158, 4.55324"
"uuid:d3c77798-8c77-4e1e-9dcf-0a6840c245ea","http://resolver.tudelft.nl/uuid:d3c77798-8c77-4e1e-9dcf-0a6840c245ea","Kop op kop van Java","Holthuis, E.O.A.","Nottrot, R.J. (mentor)","2016","Design for Java Head, Amsterdam.","","en","master thesis","","","","","","","","","Architecture and The Built Environment","Architecture","","","",""
"uuid:a2a1cc06-c49d-4483-921b-a3287793bda0","http://resolver.tudelft.nl/uuid:a2a1cc06-c49d-4483-921b-a3287793bda0","Tide-induced currents in a phase-resolving wave model","De Wit, F.P.","Reniers, A.J.H.M. (mentor); Zijlema, M. (mentor); Bosboom, J. (mentor); Klein, M.D. (mentor)","2016","Alongshore currents are currents parallel to the coastline. In coastal areas they are driven by a combination of wave and tidal forcing. In this study, the validity of the non-hydrostatic, wave-flow model SWASH to predict these currents is investigated. This is done by comparing model predictions with measurement observations. Observations were obtained from the COAST3D data-set at the gently sloping barred beach near Egmond. It contains six weeks of wave and velocity measurements for a wide range of conditions. An initial study was performed to investigate model settings and parameter sensitivity for correctly capturing wave dynamics. From this study, it can be concluded that two terrain-following layers and 75 grid cells per wave length lead to accurate results for surf zone wave modelling. Although some discrepancies in mean water level set-up were encountered, this is assumed not to affect alongshore current predictions. The present SWASH model does not allow for the inclusion of alongshore tidal currents. Therefore, this study presents a method to include tidal forcing, which was implemented in the source code. This method enables the user to include the tide by imposing a water level gradient, which is assumed to be time averaged and spatially uniform. These assumptions are reasonable as spatial and temporal model scales are small compared to a tidal wave. Validation results demonstrate the capability of SWASH to correctly represent wave transformation in a surf zone. Furthermore, modelled velocity predictions are in good agreement with observations for cases with waves from southwest and northward flood tidal currents, which were not disturbed by instabilities. Cases with different forcing were influenced by instabilities due to a bug in the source code. Two cases, which were least influenced by the instabilities, have been analysed in more detail as well. Some discrepancies are observed between model and observations. Further study is required to evaluate whether this is caused by the instabilities, introduced by the bug in the source code, or whether other physical phenomena play a role in the mismatch. Inertia of a tidal wave and bottom friction and processes which could potentially be the cause of the discrepancies.","SWASH; alongshore current; numerical modelling; COAST3D; Egmond; validation study","en","master thesis","","","","","","","","","Civil Engineering and Geosciences","Hydraulic Engineering","","Environmental Fluid Dynamics","",""
"uuid:be0d5f67-72ad-46ba-94d3-c576482a9828","http://resolver.tudelft.nl/uuid:be0d5f67-72ad-46ba-94d3-c576482a9828","C3 - A Cloud Controlled Climator for the van Gendthallen Amsterdam","Hoeijmakers, P.A.","Schroën, J. (mentor); Meijs, M.H. (mentor)","2016","The industrial heritage the 'van Gendthallen' in Amsterdam are repurposed into a cultural convention center. To accomplish this while conserving the qualities of its monumental façade, a data center is introduced inside the halls to provide the space with a sustainable waste heat source and climate system. The interaction between the data center core and the architectural shell culminate into a showcase project for 'old meets new'.","data center; industrial heritage; waste heat recovery; repurpose","en","master thesis","","","","","","","","2016-01-28","Architecture and The Built Environment","Architecture","","Architectural Engineering","","52.37126, 4.92560"
"uuid:03c7e637-7f9f-4577-9165-ec300452c6a1","http://resolver.tudelft.nl/uuid:03c7e637-7f9f-4577-9165-ec300452c6a1","Obama Presidential Museum in Garfield, Chicago","Koh, K.","Van Bennekom, H.A. (mentor); Gremmen, B. (mentor); De Koning, S. (mentor)","2016","The main project -Obama Presidential Center- is located between the existing park and redevelopment area. It already officially announced that the center will be built in somewhere in Chicago. Garfield Park is an alternative for the location of the center and it can represent the new birth of the area that has been isolated for several decades. Furthermore, it will become a hub in western Chicago. The center is divided into two buildings and functions. One is the museum and the other is a library. Both projects give residences and visitors chance to meet cultural experiences. Obama Presidential Center and new urban development will increase economic value in Garfield. Through the project, the atmosphere of Garfield will be simultaneously changing.","","en","master thesis","","","","","","","","2016-01-27","Architecture and The Built Environment","Architecture","","Complex Projects","",""
"uuid:4d4a8da3-369d-4c06-92b8-d91f3522e7de","http://resolver.tudelft.nl/uuid:4d4a8da3-369d-4c06-92b8-d91f3522e7de","Understanding Communication Preferences of Banking Customers","Bouwmeester, A.","Verbraeck, A. (mentor); Cunningham, S.W. (mentor); Van Cranenburgh, S. (mentor)","2016","Banks and service companies in general are facing problems with multi-channel management, especially in the context of outbound communication. Problems are the high costs of the multi-channel systems, unsatisfied cus-tomers, and few customers who interact with companies. Personalization of the selection of communication channel to reach a customer is seen a solution to these problems. However, a complication is that currently no insight exists in what factors can explain channel preferences of customers. These factors are required for estimating the channel preferences of customer. In order to identify these factors a survey has been used to collect channel preferences of banking customers in the context of outbound contact. Furthermore, hypotheses about what factors are expected to explain channel preferences were constructed. These hypotheses have been tested through multinomial logistic regression models. Multiple relations between channel preference and predictors were identified. To assess the impact of the findings on the presented problems, it is recommended to start pilots in which the selection of a channel to reach a customer is based on the identified predictors.","multi-channel management; channel preferences; multinomial logistic regression; outbound communication; financial sector","en","master thesis","","","","","","","","","Technology, Policy and Management","Multi Actor Systems","","Systems Engineering, Policy Analysis and Management","",""
"uuid:cbcd33b8-4b0b-4c75-870c-fd647ff545f7","http://resolver.tudelft.nl/uuid:cbcd33b8-4b0b-4c75-870c-fd647ff545f7","Urban Oasis","Najem, Z.","Willekens, L.A.M. (mentor); Cuperus, Y.J. (mentor)","2016","Abstract The location at the head of the CzaarPeter-area. CzaarPeter-area makes part of the most north eastern part of the city center. There is a strict separation between private and public domain. In regard to the existing dwellings, they are small, shallow and unadaptable the public space.The buildings doesn’t provide the space where people can retreat from the very busy and noisy surrounding. There is a need for more green and an open space that compensate the high density. The building should contribute more vibrant to the area by focusing on small scale facilities, more green and avoidance of unused empty spaces. the main concept of creating an ‘urban oasis’ mainly for the residents where they can retreat from the busy surrounding. The result is an enclosed introverted building block with underground parking a plinth and four-layer houses. The different dwelling types are adaptable for future change and combining working with living,","urban oasis","en","master thesis","","","","","","","","2016-01-26","Architecture and The Built Environment","Architecture","","Dwelling","",""
"uuid:10475838-773c-4acf-bf5c-e00980f5315d","http://resolver.tudelft.nl/uuid:10475838-773c-4acf-bf5c-e00980f5315d","Under the Sea: An underwater habitat for the human exploration and research of our oceans","Geelhoed, J.","Schroen, R.J. (mentor); Van der Zaag, E. (mentor)","2016","The Great Barrier Reef is in danger of polution and the changing climate. In order to protect this UNESCO world heritage site we need to know more about it. Diving from the surface to the reef to conduct research is expensive and time consuming. This project is about the design of an underwater habitat capable of facilitating underwater research for aquanauts. The habitat is constructed of glass fibre reinforced components and combines the technical difficulties of constructing an underwater habitat with the dream like fantasy of what it's like to live and work underwater.","underwater; habitat; composite; GFRP; watertight","en","master thesis","","","","","","","","","Architecture and The Built Environment","Architectural Engineering and Technology","","","",""
"uuid:ab582a67-31a6-401c-8626-6f138897b067","http://resolver.tudelft.nl/uuid:ab582a67-31a6-401c-8626-6f138897b067","Een adaptief alternatief als reële optie: De toepassing van het optie-denken op de waardering van adaptief kantoorvastgoed","D' Hulst, M.S.","Koppels, P.W. (mentor); Geraedts, R.P. (mentor)","2016","","adaptiviteit; reële optietheorie; Monte Carlo; flexibiliteit; kantoorvastgoed; leegstand; kosten en baten; DCF; onzekerheid","nl","master thesis","","","","","","","","2016-01-27","Architecture and The Built Environment","Real Estate & Housing","","Design and Construction management","",""
"uuid:9c37eeb5-a4e8-4407-8d6b-d654c1711805","http://resolver.tudelft.nl/uuid:9c37eeb5-a4e8-4407-8d6b-d654c1711805","Intimacy and Nature: A healing environment for mother and child on basis of evidence-based architecture (Dutch: Intimiteit met Natuur: Een helende omgeving voor moeder en kind op basis van evidence-based architectuur)","Van de Ven, J.P.","Smit, M.J. (mentor); Koutamanis, A. (mentor); Meijs, M.H. (mentor); Nieboer, N.E.T. (mentor)","2016","This is my thesis research at the Architectural Engineering studio of the TU Delft faculty of Architecture and the Built Environment. The research paper proposes design directives by which an architect can foresee on the design for the new built and retrofit of a Neonatal Intensive Care Unit (NICU) for an academic hospital.","NICU; hospital architecture; healing environment; evidence-based design","nl","master thesis","","","","","","","","","Architecture and The Built Environment","Architecture","","Architectural Engineering","",""
"uuid:6fab5ee2-5dd4-49fc-af98-a1b0da9045e9","http://resolver.tudelft.nl/uuid:6fab5ee2-5dd4-49fc-af98-a1b0da9045e9","Reflow The Kampung","Wilders, J.A.","Smit, M. (mentor); Jongert, J. (mentor); Meijs, M.H. (mentor)","2016","A Urban plan for new water and waste flows in the Kampungs of Bandung, Indonesia.","kampung; water treatment; waste management","en","master thesis","","","","","","","","","Architecture and The Built Environment","Architectural Engineering and Technology","","AE","",""
