"uuid","repository link","title","author","contributor","publication year","abstract","subject topic","language","publication type","publisher","isbn","issn","patent","patent status","bibliographic note","access restriction","embargo date","faculty","department","research group","programme","project","coordinates"
"uuid:277d7143-1067-4f7f-9f3f-06a6daee3c80","http://resolver.tudelft.nl/uuid:277d7143-1067-4f7f-9f3f-06a6daee3c80","A Study into the Characteristics of the Cohesion Adhesion Relation and its Effect On Cutting Processes in Dredging Operations","van den Broecke, Jan (TU Delft Mechanical, Maritime and Materials Engineering)","Miedema, Sape (mentor); Chen, Xiuhan (mentor); Ngan-Tillard, DJM (graduation committee); Delft University of Technology (degree granting institution)","2018","In the last two decades, the global economy and population have been growing steadily. Due to these global trends the demand for dredging, trenching and deep sea mining activities have grown dramatically. In these engineering practices, underwater excavation is one of the major procedures which involves complicated physics. In dredging, operations with clamshell buckets in saturated cohesive soils often leads to a decreased production due to the highly adhesive properties of these soils. And, in offshore wind farm installation operations, the vulnerable power cables transporting the generated energy must be buried a couple of meters under the seabed for their protection, so trenching in saturated cohesive soils becomes indispensable. <br/><br/>Miedema has developed ""The Delft Sand, Clay and Rock Cutting Model"", in which several sets of equations are derived for each type of seabed soil. In the scenario of clay cutting, both the cohesion and adhesion should be known as the input parameters. However, very few information is available to define the relation between cohesion and adhesion. Yet, it is of great importance to get a better understanding of the relationship between cohesive and adhesive forces, because the large surfaces on dredging tools can generate a lot of resistance; limiting production for materials with increasing adhesion. <br/>First, literature is reviewed to get a better understanding into the relevant soil mechanical properties and cutting theories. Existing models for the adhesion factor, which is defined as the ratio between the adhesion or stickiness of a cohesive soil and its cohesion or internal shear strength, are analyzed and new models for the adhesion factor are constructed.<br/><br/>To validate these new models, a new dedicated test setup is constructed with the help of the National Engineering Research Center for Dredging Technology and Equipment based in Shanghai, China. Tests are performed on two different cohesive soils (clays) to obtain the adhesion and cohesion of the samples. Furthermore, the test data is analyzed and the data is used to validate the models.<br/><br/>Finally, the obtained relation between the adhesion and cohesion is implemented in a numerical discrete element model for clay cutting. Two models are constructed to validate the properties of the numerical clay sample, after which the full cutting model is validated using existing experimental data obtained by Chijiiwa and Hatamura . With this validated cutting model, it is now possible to simulate the cutting force on more complicated geometries.<br","Cohesion-Adhesion Relation; Experiments; Numerical Modelling","en","master thesis","","","","","","","","2023-12-05","","","","Offshore and Dredging Engineering","",""
"uuid:293a5061-ec16-44bb-80dc-d0d7adb3ff9c","http://resolver.tudelft.nl/uuid:293a5061-ec16-44bb-80dc-d0d7adb3ff9c","Behaviour of Suction Caisson subjected to Cyclic Loading in Tension","Sudhakaran, Kamaleshwar (TU Delft Civil Engineering and Geosciences)","Askarinejad, A. (mentor); Gavin, Kenneth (graduation committee); Lanzafame, R.C. (graduation committee); Galavi, Vahid (graduation committee); Delft University of Technology (degree granting institution)","2018","As countries around the world are in a race for clean energy, various renewable energy sources are harvested to meet the energy needs. In Western Europe, wind energy is the primary source of renewable energy. To meet the energy demand, higher capacity wind turbines are being installed in deeper waters. In deep waters, monopile foundations are ineffective due to its inability to withstand large overturning moments. Thus, multi-caisson foundations are preferred in deeper waters. Typically jacket or tripod foundations are preferred as multi-caisson foundation and these foundations are supported by either piles or suction caissons. Suction caissons are preferred due to the ease of installation and removal.Based on the literature, it was understood that various kinds of research are being undertaken throughout the world to better understand the performance of suction caisson foundations. Two main components of suction caisson are researched widely, first being the installation behaviour, and second being the behaviour of caisson during repeated cyclic loading. This thesis seeks to gain further insight on the installation behaviour of the suction caisson. For this purpose, a suction installation apparatus was designed to be used in centrifuge. Various installation characteristics such as flow rate, soil profile has been studied in this thesis and detailed analysis is provided. Extraction tests of caisson were also done at a slow rate to determine the drained tensile capacity, which was used for determining tensile amplitudes in cyclic loading tests.Tripod structures withstand load by ’push-pull’ system, where the windward caisson is pulled out of the soil due to the cyclic environmental loads. This movement is compensated by the push behaviour of the other two caissons. Thus, the tensile capacity ofcaissons plays an important role in the design of caissons in a tripod structure. Windward caisson of a tripod foundation was modelled in this thesis to study the behaviour of the caisson under cyclic loading in tension. Cyclic loading tests were done at 100g using the geo-centrifuge at Delft University of Technology. A series of tests was done for various cyclic loading characteristics such as the average load, frequency and soil profile. Settlement and stiffness response of the suction caisson were obtained for each scenario. A brief discussion of the results is made in this thesis report. Very high settlement was observed when one-way compressive load was applied on the caisson installed in layered sand. A test was also done to study the response of caisson to storm loading where very high tensile amplitudes were used. The results obtained from these tests show the complexity of the response under tensile loads. When the tensile amplitude was more than 50% of the tensile capacity of the caisson, significant uplift of the caisson was witnessed along with a significant reduction in the stiffness of the soil.Finally, Finite Element Modelling (FEM) was done using the geotechnical finite element software - Plaxis 2D to compare the cyclic loading results obtained from centrifuge modelling with FEM. It was observed that the initial settlement behaviour was captured well in plaxis. But after few cycles, no more accumulation of strain was witnessed in the centrifuge tests. However, plaxis failed to capture this behaviour and thus higher settlements were observed in FEM analysis.This thesis can be used as a basis for the design of tripod foundations for OWT using suction caissons. The results obtained from this thesis reinforces previous studies and adds confidence in understanding the tensile behaviour of suction caissons.","Suction caisson; Offshore Wind Energy; Sand layer; Cyclic loading; FEM","en","master thesis","","","","","","","","2020-12-31","","","","Geo-Engineering","",""
"uuid:8206a564-b22b-4469-b765-bb9be31d63a7","http://resolver.tudelft.nl/uuid:8206a564-b22b-4469-b765-bb9be31d63a7","Measuring plastic deformation of silicon as a result of thermal oxidation","Sweers, Korné (TU Delft Mechanical, Maritime and Materials Engineering; TU Delft Precision and Microsystems Engineering)","Tolou, Nima (mentor); Kuppens, Reinier (mentor); Herder, Just (mentor); Delft University of Technology (degree granting institution)","2018","Thermal oxidation in silicon microelectromechanical systems (MEMS) induces stress in the oxide film and silicon. Such residual stresses are usually unwanted, as it can influence performance or damage components. It can also cause unwanted plastic deformation in silicon, as was observed in previous research. Currentmeasurement methods inMEMSare not able to distinguish plastic and elastic strain as a result of thermal oxidation. This thesis presents a novel method to distinguish elastic and plastic strain in silicon beams, by removing the oxide layer to show the plastic strain. A lever mechanism is used as a mechanical amplifier. The plasticity model developed by Alexander and Haassen (AH) is<br/>used in a numerical model to predict the elastic and plastic strain. Experiments in epitaxially grown silicon show significantly less plastic strain than predicted by the model. We conclude that the AH model is not valid for epitaxially grown silicon with low or zero initial dislocations. As significant plastic deformation was observed in FZ silicon samples in previous research by P.R. Kuppens, it is<br/>concluded that epitaxially grown silicon is the better choice when plastic deformation is to be avoided.","silicon; silicon dioxide; Plastic deformation; thermal oxidation; MEMS; compliant mechanism","en","master thesis","","","","","","","","2021-01-01","","","","Mechanical Engineering | Mechatronic System Design (MSD)","",""
"uuid:023529e3-8e1f-43e1-be41-f4109f9bd5c2","http://resolver.tudelft.nl/uuid:023529e3-8e1f-43e1-be41-f4109f9bd5c2","Evolution of submerged mounds under hydrodynamic forcing: Construction of sediment pathways","SAXONI, IOANNA (TU Delft Civil Engineering and Geosciences; TU Delft Coastal Engineering)","Hopkins, J.A. (mentor); de Schipper, M.A. (graduation committee); van Prooijen, Bram (graduation committee); Aarninkhof, S.G.J. (graduation committee); Wengrove, M.E. (graduation committee); Delft University of Technology (degree granting institution)","2018","Coastal regions are more and more affected by changes in water levels, storm patterns etc. owing to climate change. Nourishments and other human interventions constitute common practice in order to maintain and secure these areas. However, many aspects, especially the hydrodynamics, are not yet fully understood due to the complexity of the acting processes. This study investigates the evolution of submerged sandmounds under wave, current, and combined flow conditions, and examines the relation between the observed morphodynamic response, and the imposed hydrodynamic forcing. It aims to provide insight towards a better understanding of the hydrodynamics and morphodynamics that will lead to more efficient design, and accurate behaviour prediction of the nourishments. A physical experiment (MODEX) provided a reference dataset of hydrodynamic and morphodynamic measurements (wave height, flow velocity, bathymetry). The extent to which the dataset covers the full spectrumof acting processes was examined via a literature study of the documented mechanisms under wave, current, and combined flow conditions. It was found that the data do not capture slope effects, flow separation, and ripple influence on flow velocity. The analysis of the data resulted in the quantification of the flow types effect on several geometrical aspects (mound height, footprint area and shape, ripple pattern), and the position of the mound. In order to examine the extent to which the measured velocities are responsible for the observed response, sediment transport rates were estimated using an energetics model that depends on total, and orbital velocity. The results provided evidence that the observed response can not be fully explained using mean and orbital velocities. For this reason the study suggests an interpretation of the sediment pathways under the various flow types. Nevertheless these are on based on reasoning, and thus are not considered to be proven. Moreover, the results revealed a relation between aspects of the morphological response and Umax2 (which relates to the instantaneous maximum flow energy). The mound height reduction rate (dHm/dt), and migration rate (dx/dt) scale linearly with Umax2 , while the mound footprint length/width ratio displays an inverse linear relation. Lastly, the relation betweenmound area change rate (dA/dt), and flow energy is linear for non-oscillatory, and combined flow, and a parabolic for oscillatory flow. Finally, despite the limitations and omissions, this study provides significant insight on the evolution of submerged mounds. It is first step in the direction of more accurate prediction of morphological change, and more efficient design of nourishments.","MODEX; morphodynamic response; sand mound; physical experiment; flow; hydrodynamics; nourishment","en","master thesis","","","","","","","","","","","","Civil Engineering | Hydraulic Engineering","Hydralab+",""
"uuid:401219e4-4a9b-486a-bb64-528c4ffe2852","http://resolver.tudelft.nl/uuid:401219e4-4a9b-486a-bb64-528c4ffe2852","Exploring Conceptual Variation by Design for the aQysta pump placement process","van der Gragt, Thom (TU Delft Civil Engineering and Geosciences)","Ertsen, M.W. (mentor); Diehl, J.C. (graduation committee); Hoes, O.A.C. (graduation committee); Michavilla, Jaime (graduation committee); Overgoor, Tei (graduation committee); Kersten, W.C. (graduation committee); Delft University of Technology (degree granting institution)","2018","aQysta is a company that has developed spiral pumps that can deliver water for irrigation through hydraulic energy (aQysta, 2018). That makes these pumps very dependent on the location where they are placed for their water delivery. Their dependency on hydropower also impacts the water supply of these pumps to surrounding irrigation fields (Lawrence et al., 2018). Besides technical boundary conditions these pumps also have to compete with traditional powered pumps and stakeholder opinions considering this is a new technology. All these factors contribute to a rather exciting process to find the right locations for these pumps, or Pump Placement Process (PPP). Since this PPP has to be adapted to many different regions around the world the PPP becomes very complex and time intensive. Context Variation by Design (CVD) is an approach that might offer a solution to this PPP. This approach lets the user utilize the strength of many different contexts, which coincide with the many regions where the pumps are being installed (Kersten, Crul, Engelen, van, &amp; Diehl, 2018). An Adaptive Framework (AF) has been constructed that allows the various projects in the PPP to be compared with each other according to the CVD approach. This AF was subsequently filled in by various people active in aQysta’s PPP, and by comparing different projects new patterns have arisen. These patterns offer new ways to investigate and improve the PPP. It has thus been proven possible to apply CVD to aQysta’s PPP and create new insights concerning the PPP.","CVD; spiral pumps; adaptive framework","en","master thesis","","","","","","","","","","","","Water Management","",""
"uuid:00b62422-54c4-4d4d-8c3f-1beebc398251","http://resolver.tudelft.nl/uuid:00b62422-54c4-4d4d-8c3f-1beebc398251","Learning kinematic models using a single tele-demonstration","Beeftink, Mart (TU Delft Mechanical, Maritime and Materials Engineering)","Kober, J. (mentor); Arkenbout, EA (mentor); Delft University of Technology (degree granting institution)","2018","To successfully perform manipulation tasks in an unknown environment, a robot must be able to learn the kinematic constraints of the objects within this environment. Over the years, many studies have investigated the possibility to learn the kinematic models of articulated objects using a Learning from Demonstration (LfD) approach. In the majority of these studies the assumption is made that the robot solely manipulates these articulated objects. In reality, however, robots often manipulate free-space objects that generally do not encounter any constraints. As a result, a human has to manually confirm which of the observed demonstrations concern articulated objects and which do not. Furthermore, the majority of these studies do not evaluate the quality of the kinematic models prior to learning them. As a consequence, incorrect or uncertain models can be learned by the robot, which could lead to task failure or even dangerous behavior.<br/><br/>In this report, the novel Kinematic Model Learner (KML) framework is introduced, which aims to solve both of these problems using a multi-modal approach. In doing so, special attention is given to the understandability of the created framework, and its ability to adjust to different robot applications. <br/><br/>The KML framework consist of two separate frameworks called KMLtraj and KMLforce. After the demonstration is given, the KMLforce framework first uses the force data to determine whether the manipulated object is free-space or constrained. If the object is recognized to be free-space, it will be classified as such after which the corresponding kinematic model is learned. If the object is classified as constrained, the \traj{} framework uses the observed trajectory data to classify and learn the kinematic models of the constrained objects. In order to prevent the robot from learning incorrect or uncertain models, a probabilistic classifier is used which only learns a kinematic model if the confidence level is above a certain learning threshold. <br/><br/>The designed frameworks are experimentally validated by performing a total of 27 demonstrations on the care robot Marco using tele-operation. From these manipulations the trajectory and force data were used as inputs to validate each framework separately. Additionally, the KMLtraj framework is also evaluated using the Cody dataset, which contains the trajectories of 35 different manipulation tasks.<br/><br/>It has been concluded that the KML framework can robustly recognize and learn the kinematic models of the free-space and articulated objects. Moreover, a robustness analysis showed that the KML framework is more robust than the current state-of-the-art acrticulation package. Additionally, the KML framework is able to asses the quality of the learned models and can prevent the robot from learning incorrect or uncertain models. Finally, the framework can be easily adjusted to different robot applications as the effects of the tuning parameters are easy to understand and can be determined by assessing the robot applications or by performing simple experiments.","","en","master thesis","","","","","","","","","","","","Mechanical Engineering | Systems and Control","",""
"uuid:a54bdb11-85a8-4d7a-8c73-9afdbda51ed8","http://resolver.tudelft.nl/uuid:a54bdb11-85a8-4d7a-8c73-9afdbda51ed8","Manoeuvrability and communication requirements for safe operation when manned and unmanned vessels meet","Wever, Ingmar (TU Delft Mechanical, Maritime and Materials Engineering; TU Delft Electrical Engineering, Mathematics and Computer Science)","Hekkenberg, Robert (mentor); Neerincx, Mark (mentor); de Vos, Peter (graduation committee); Brinkman, Willem-Paul (graduation committee); Cleophas, Toine (graduation committee); Delft University of Technology (degree granting institution)","2018","This thesis proposes two methods two solve the challenge of communication between manned and unmannd vessels. The first solution is to avoid communication by staying well clear. The second solution is to develop a protocol based on existing systems and protocols, to facilitate communication between manned and unmanned vessels.","Autonomous Shipping; Unmanned Shipping; Communication; Closest Point of Approach; Interactive Intelligence; Ship Design","en","master thesis","","","","","","","","","","","","Marine Technology","",""
"uuid:698cdc4d-8d4b-4e62-9dc8-bf12dc953166","http://resolver.tudelft.nl/uuid:698cdc4d-8d4b-4e62-9dc8-bf12dc953166","Conceptual Design of a Pile Installation Frame with Adjustable Footprint","Stins, Jack (TU Delft Mechanical, Maritime and Materials Engineering)","Sliggers, P.G.F. (mentor); Meijers, P.C. (graduation committee); Shahbazkhani, A. (graduation committee); van Dalen, K.N. (graduation committee); Delft University of Technology (degree granting institution)","2018","An offshore wind turbine is placed on a so called “foundation” to gain height above the sea surface level. One of the used foundations is the jacket structure, which is kept in place by pre-piled supports. The piles are hammered into the seabed first, after which the jacket legs are stabbed into the piles. A template is used to guide the piles during installation and to secure the relative distances as well as the straightness and depth of the piles with respect to each other. This template is called the Pile Installation Frame (PIF). Seaway Heavy Lifting has designed a PIF with a fixed footprint for the Beatrice offshore wind farm project. However, there is a need to make the PIF adjustable in order to use it in different situations (e.g. environmental conditions, pile designs and jacket configurations). Therefore, this thesis investigates the following two questions: “How can the current PIF be altered in order to make the footprint adjustable for various footprints?”, and: “What are the influences of variations in pile designs and conditions?”. A trade-off method is used to find the most feasible conceptual design. Resulted in interchangeable frames connected between the original pile supports and the center base frame (with equipment and a lifting point). The integrity of the concept is checked for one of the operational scenarios, namely, “the in-place scenario”, i.e., the PIF is at the seabed and the piles are stabbed into the sleeves with a hydraulic hammer on top of one of the piles. A model of the concept design is made with the structural simulation software SACS, that does not account for the second order bending effect of the pile. Therefore, a new calculation model is developed. This model calculates the reaction forces from the piles onto the PIF, and it is based on the linear wave theory, a linearized approached current profile, and the Morrison equation. The bending of the pile is computed using the Euler-Bernoulli beam theory, which is iteratively solved to take into account the second order bending effect. The PIF is checked for the minimum square footprint of 20 m, 24 m and the maximum of 32 m for a representative reference condition (Beatrice offshore wind farm). From the check, the maximum stress level in the members and braces is below half of the maximum allowable stress. Furthermore, the deformations at the pile supports in the sleeve are in the same order of magnitude than the current PIF. Hence, these are not critical for the installation tolerances in the same conditions. To show the influences of the variations per project in pile design and conditions, an analysis is executed. From the analysis, it is concluded that the forces on the frame are maximum when the hammer is at the seawater level. Moreover, a pile diameter of 2.2 meter is the optimum for the reference condition. It is also observed that, the influence of the pile thickness is not considerable with respect to the forces onto the frame. The forces in the members and braces of the frame are mainly caused by the pile reaction forces transferred to the PIF. Therefore, the calculation model can be used for a first estimation of the PIF integrity. When the reaction forces are lower than for the reference conditions, the PIF can be used; when they are higher, an additional analysis with SACS is required.","Offshore engineering; pile installation; Structural Design","en","master thesis","","","","","","","","2021-12-24","","","","Offshore and Dredging Engineering | Bottom Founded Structures, Arctic and Wind","",""
