"uuid","repository link","title","author","contributor","publication year","abstract","subject topic","language","publication type","publisher","isbn","issn","patent","patent status","bibliographic note","access restriction","embargo date","faculty","department","research group","programme","project","coordinates"
"uuid:bc31203c-1956-4665-a92a-8203881f22ce","http://resolver.tudelft.nl/uuid:bc31203c-1956-4665-a92a-8203881f22ce","Attitude modeling of the DelftaCopter: a system identification approach","Meulenbeld, Joost (TU Delft Aerospace Engineering; TU Delft Control & Simulation)","de Wagter, C. (mentor); Delft University of Technology (degree granting institution)","2018","Previous years have seen a rise in the use of Unmanned Aerial Vehicles (UAVs). Reaching a large endurance and range while being able to perform Vertical Take-Off and Landing (VTOL) landings allows a broad range of applications. For this purpose the DelftaCopter (DC) was developed, a tilt-body tailsitter UAV. It hovers using a single helicopter rotor for lift and transitions to forward flight by pitching its body down by 90°. In this forward flight state, wings generate the lift, while the helicopter rotor now provides thrust. The single rotor is more efficient than using multiple smaller rotors and helicopter swashplate is used for attitude and speed control. The heavy single helicopter rotor introduces significant gyroscopic moments, as is the case for all helicopters. In contrast with normal helicopters, the DC has a heavy fuselage putting the attitude dynamics between a helicopter and aircraft. In previous research, a controller based on a model incorporating the rotor as a rotating cylinder was implemented. This controller was unable to counteract the gyroscopic pitch-roll coupling, leading to the question of this thesis: how should the DC be modeled to allow control design. <br/>In this thesis, the previous model is called the Cylinder Dynamics (CD) model, and is compared with another model from literature. The latter model, in this thesis called the Tip-Path Plane (TPP) model, includes the flapping dynamics through the tip-path plane dynamics and is also a linear state-space model. In flight tests, chirps were used to cover a broad frequency range. Fitting both the CD and TPP models on this flight test data, it is shown that the CD model lacks accuracy in the high-frequency area, while the TPP is able to accurately model these dynamics. This shows that the flapping dynamics are important to the attitude dynamics of the DC. An Linear Quadratic Regulator (LQR) controller was implemented based on the fitted TPP model, and shows adequate tracking performance, further validating the applicability of the model to the DC. For forward flight, extensions to the hover models are proposed. The extension including the elevator and aerodynamic damping is shown to simulate key dynamics of the DC in forward flight with reasonable accuracy. The parameters and eigenfrequencies of this model are not significantly different from the hover model. Therefore it can be concluded that the gyroscopic effect plays an important role in forward flight attitude dynamics. Another extension which estimates of angle of attack and sideslip using high-pass filtered rotational rates, yields better accuracy, but significantly changes the model parameters also present in the hover model. More research with angle of attack and sideslip vanes could validate this modeling approach. It was also found that for a new version of the DC with a smaller, more quickly rotating rotor, the modeling done before resulted in much worse fits. It was shown that the CD and TPP model response is much more comparable for this version. Control performance also suffers due to this lower accuracy model fit. Further research is required to understand why this is the case.","DelftaCopter; System Identification; UAV; Control; Helicopter Model; Flapping Dynamics; Hybrid; Tail-sitter","en","master thesis","","","","","","","","2018-12-10","","","","Aerospace Engineering","",""
"uuid:648406dd-3e84-49e1-bd41-6fd26fc38fe5","http://resolver.tudelft.nl/uuid:648406dd-3e84-49e1-bd41-6fd26fc38fe5","Effects of Collagen Post-Translational Modifications on Bone Density and Mechanical Properties in Osteogenesis Imperfecta","Smit, Stefan (TU Delft Mechanical, Maritime and Materials Engineering; TU Delft Biomechanical Engineering; TU Delft Biomaterials & Tissue Biomechanics)","Weinans, H.H. (mentor); Pouran, B. (mentor); Nijhuis, Wouter (mentor); Zadpoor, A.A. (graduation committee); Dodou, D. (graduation committee); Delft University of Technology (degree granting institution)","2018","Osteogenesis imperfecta (OI), also known as brittle bone disease, affects 1 in 10.000 births. This disease is characterized by skeletal dysplasias, bone fragility and many secondary health issues. It is a heritable disorder affecting collagen type I, which is an essential protein in bone tissue. Post-translational overmodifications in collagen biosynthesis disturb the collagen packing and alter the mineralization process. This results in bone with poor structural parameters and inferior mechanical properties. In the current study, we have tested the hypothesis that the structural and mechanical properties in bone samples from OI patients are related to altered post-translational modifications in the collagen molecules.Hydroxylysine (Hyl) and the crosslinks hydroxylysyl-pyridinoline (HP) and lysyl-pyridinoline (LP) in bone samples from OI patients were measured with liquid chromatography. Bone quantity, in terms of volumetric bone mineral density (vBMD) and volumetric tissue mineral density (vTMD), was measured with micro-computed tomography. Hardness and Young’s moduli were derived from indentation experiments. Lysine was overhydroxylated in OI bone (p &lt; 0.001), which led to increased HP values (p &lt; 0.001) and higher HP/LP ratios (p = 0.013) compared to controls. OI tissue mineral density was more heterogeneously distributed, although average vTMD values were similar in both groups. The vBMD was significantly higher in controls compared to OI bone samples. Elevated Hyl levels were significantly related to decreased vBMD and vTMD in bone samples from OI patients. In both OI and control samples, an increase in LP crosslinks was associated with elevated vTMD values. Indentation with a spherical tip (r = 0.25mm) showed no altered mechanical properties in OI compared with controls. Unfortunately, we could not determine if impaired overmodifications in collagen are related to the poor mechanical properties of OI bone. Young’s moduli and hardness were not related to HP levels or HP/LP ratios. In control bone samples a negative correlation between Hyl residues and mechanical properties is observed. More mechanical experiments are necessary to address the hypothesis appropriately.","Osteogenesis Imperfecta; Collagen; Hydroxylation; Crosslinks; Indentation; Micro Computed Tomography; High Performance Liquid Chromatography (HPLC); Ultra Performance Liquid Chromatography","en","master thesis","","","","","","","","","","","","Biomedical Engineering","",""
"uuid:29f066b2-1e7c-4ab4-8ba8-3516032a8237","http://resolver.tudelft.nl/uuid:29f066b2-1e7c-4ab4-8ba8-3516032a8237","Workload Characterization and Modeling, and the Design and Evaluation of Cache Policies for Big Data Storage Workloads in the Cloud","Talluri, Sacheendra (TU Delft Electrical Engineering, Mathematics and Computer Science)","Iosup, Alexandru (mentor); Rellermeyer, Jan (graduation committee); Kuipers, Fernando (graduation committee); Delft University of Technology (degree granting institution)","2018","The proliferation of big-data processing platforms has already led to radically different system designs, such as MapReduce and the newer Spark. Understanding the workloads of such systems enables tuning and could foster new designs. However, whereas MapReduce workloads have been characterized extensively, relatively little public knowledge exists about the characteristics of Spark workloads in representative environments. In this work, we focus on understanding the behavior and cache performance of the storage sub-system used for Spark workloads in the cloud. First, we statistically characterize its usage. Second, we design a generative model to tackle the scarcity of workload traces. Third, we design a cache policy putting our insight from the characterization to work. Finally, we evaluate the performance of different cache policies for big data workloads via simulation.","Big Data; Storage; Cloud; Modeling; Performance Evaluation; Cache Policies; Characterization","en","master thesis","","","","","","","","","","","","Computer Science | Software Technology","",""
"uuid:c8eabdf4-ee65-4fdf-bf78-99d630d34cbb","http://resolver.tudelft.nl/uuid:c8eabdf4-ee65-4fdf-bf78-99d630d34cbb","The challenge of parameter uncertainty: Finding parameter distributions from hydrological field data for conceptual rainfall-runoff models","van der Tak, Nicolette (TU Delft Civil Engineering and Geosciences)","Hrachowitz, Markus (mentor); Bogaard, Thom (graduation committee); Heimovaara, Timo (graduation committee); van den Driest-van der Kruijs, S.E. (graduation committee); Delft University of Technology (degree granting institution)","2018","Conceptual hydrological model parameters represent characteristics of a catchment. They are an integration of spatial heterogeneous parts of the system. Finding adequate parameter values based on field observations, which represents the heterogeneity of a catchment on the spatial resolution and scale of the model, is considered challenging since the scale of the observations do not meet the scale of the parameters. <br/><br/>The objective of this thesis is to analyze the extent to which it is possible to make an estimation of parameter distributions based on field observations (the precipitation, evaporation and discharge) and a given hydrological model structure. The goal is to avoid the use of uninformed prior parameter distributions during calibration by using available field data to generate informed prior distributions.<br/><br/>In this research, six different expert-knowledge inverse modelling methods are developed to find four parameter distributions. Each method uses sub-periods in the data and is coupled to the parameter of the model component representing that specific type of sub-period. <br/><br/>To test the methods, the study was conducted in a synthetic environment, which made it easier to validate the parameter distributions obtained with the methods. In this synthetic experiment, discharge data was produced by a model driven by real rainfall data and potential evaporation data. All forms of uncertainty were excluded in this test.<br/><br/>The effect of data uncertainty in the methods was investigated separately by conducting a sensitivity analysis. The same synthetic data was used; however the synthetic data was corrupted to simulate data uncertainty. <br/><br/>Last, an application of the methods upon real measured data was completed. The performance of the methods to find parameter distributions can no longer be assessed since in the real world the “correct” parameter values are not known. However, a comparison of the informed prior parameter distributions of the methods with uninformed prior parameter distributions could be made with a Monte-Carlo sampling strategy calibration.<br/><br/>In the synthetic experiment, all parameter distributions of the investigated model were correctly determined using the expert-knowledge inverse modelling methods. The sensitivity analysis revealed that the method to determine the maximum percolation rate parameter (Pmax) distribution was sensitive to data uncertainty. The determined Pmax parameter distributions did not include the original parameter of the corrupted synthetic data. However, this issue does not lead to other parameter distributions that do not include the original parameters.<br/><br/>In real-world application, insight is gained into the performance of the developed methods to find parameter distributions. An uncertainty interval was constructed with the Generalized Likelihood Uncertainty Estimation (GLUE) method. The total area of the constructed uncertainty interval using the calibration results of the informed prior parameter distributions was less than half than the uncertainty interval constructed using the uninformed prior parameter distributions. The posterior parameter distributions of the informed parameter distributions was two to five times smaller than for the uninformed parameter distribution. The model performance of both calibrations did not deviate significantly, indicating a sufficient model structure for the catchment and an adequate performance of the methods to find parameters.","parameter distributions; Conceptual hydrological model; field observations","en","master thesis","","","","","","","","","","","","","",""
"uuid:5b8c07b9-cf59-4294-83a3-ca7ba8e80754","http://resolver.tudelft.nl/uuid:5b8c07b9-cf59-4294-83a3-ca7ba8e80754","Forming the Vahlkamp brand, a roadmap for coherence","Kuijt, Chelsey (TU Delft Industrial Design Engineering; TU Delft Product Innovatie Management)","Mooij, Sylvia (mentor); Willemen, Maurits (mentor); Delft University of Technology (degree granting institution)","2018","This graduation assignment is about Vahlkamp, a health care alarm manufacturer, which noticed that the appearance of its products doesn’t convey the right brand image: being a socially responsible and technically skilled manufacturer. <br/>As it is a small company, which is being strategically stuck in the middle in a big market with a lot of competitors, a way to make Vahlkamp more visible and distinctive and their message more clear is another challenge.<br/><br/>The goal of this assignment is: Update the Vahlkamp brand identity, so it will become a more visible and distinctive brand. Show how to convey the renewed image in a coherent way.<br/><br/>The process of this assignment is the following: By analyzing the company and it’s context, insights on the challenges were found and translated into a roadmap to get to this updated brand identity. This is close to the original one, but differs in the conveyed look and emphasizes the reasons to believe the brand. The roadmap shows three different implementations to come to this identity: a brand guide, a portfolio update and a niche market focus strategy.<br/>A brand guide is created first to set a standard, also for the coherence, and provides the company with an handhold for all future brand communication. An proposed homepage serves as example.<br/>The portfolio update consists of new cases for the core products (bed alarm, multisense, Epi-Watcher, Wet-Watcher and Teleroep). Three case designs with each different aspects are shown to employees of care organisations and their opinions about characteristics are collected. Based on their feedback, a final design is made and again shown to them. This is also 3D printed. Advice about changes of the design is given.<br/><br/>As the current brand essence is making simple but qualitative health care alarms for smaller disease groups and the current mission is to enlighten the burden of these people, the strategy is to focus on niche markets: small disease groups. <br/>Vahlkamp already has products for niche markets, like the Epi-Watcher and products for the blind and deaf, but also sell mass market products. These should remain in the background.<br/>By keeping research into the emerging niche markets and new technologies going, opportunities can be found. By contracting companies for their niche products or developing new niche products, the portfolio can be expanded.<br/>In this way, the strategy supports their caring character and makes them more visible and distinctive, especially in the smaller niche markets.<br/>As was found in the analysis phase, most competitors design for the majority and thus not focussing on the majority, but on the niche markets, is a good strategy for more visibility and distinctiveness. Also, the threat of substitution of multiple alarms by the use of cameras is a reason to comply with this strategy.<br/>By using a brand guide, updating the portfolio and following the niche focus strategy, Vahlkamp’s brand identity will be updated so Vahlkamp will be a more visible and distinctive brand while conveying this message in a coherent way.","Branding; brand identity; Strategic Roadmap; niche focus; Health care","en","master thesis","","","","","","","","","","","","Strategic Product Design","",""
"uuid:40c2f0f8-adec-44d1-93ef-d33ae1cff0fe","http://resolver.tudelft.nl/uuid:40c2f0f8-adec-44d1-93ef-d33ae1cff0fe","The design of a single-insertion multiple specimen biopsy instrument: The development and evaluation of a novel core-needle biopsy device","Kuipéri, Josette (TU Delft Mechanical, Maritime and Materials Engineering; TU Delft Biomechanical Engineering)","Sakes, A. (mentor); Breedveld, P. (mentor); Plettenburg, D.H. (graduation committee); Delft University of Technology (degree granting institution)","2018","Background: When a suspicious lesion is detected, a thorough examination is essential for the diagnostics of the lesion. Information about the nature and character of the lesion is crucial for the determination of the disease and an appropriate corresponding treatment plan. Taking a biopsy plays an important role in this examination. A biopsy is the removal of a tissue sample from a living organism. The aim of the biopsy is to provide a sufficient and representative part of a lesion, which will enable a thorough examination. Unfortunately,<br/>the diagnostics of a biopsy is not always as accurate as desired. Core-needle biopsy is a commonly used minimally invasive biopsy technique. This technique uses a needle, with a varying size between 1.3mm to 2.1 mm, to cut away a tissue sample from a lesion. Biopsies taken with core-needle instruments do not<br/>always represent the lesion sufficiently. It is often hard to determine the exact lesion site, and to know if the needle has indeed taken a biopsy from the lesion. To prevent non-diagnostic results from the biopsy, multiple samples should be taken from the lesion site. Common core-needle methods currently obtain a single biopsy sample per insertion. As multiple specimens must be obtained, multiple insertions of the biopsy instrument are required. The aim of this research is to design a single-insertion multiple specimen biopsy instrument.<br/>This design will be developed and evaluated on its performance and functionality.<br/>Methods: A list of requirements was setup to determine the conditions which comprise the design. Next to the requirements, a functional analysis was carried out which divided the functions of the design into three main functions. A, the insertion of the device into the lesion, B, the actions required to obtain a multitude of samples, and C, the retraction of the instrument from the body. The actions to obtain a multitude of samples, are subdivided into five actions: (1) the instrument must collect a tissue sample, and (2) enclose this tissue<br/>sample into a container. (3) This container must be transported through the instrument. And subsequently stored inside the instrument, (4). Finally, (5) the instrument must be reloaded. This sequence of actions can be repeated until a number of specimens have been obtained. Using these five actions as a lead of the design process, conceptual designs were created. During the design process inspiration was found in firearms. The storing of bullets and reloading mechanisms found in guns could help find solutions to the storing and<br/>reloading functions of the biopsy instrument. For each action a conceptual design is developed, and finally these five conceptual designs are combined and elaborated, resulting into one final design. A prototype of the final design was developed and evaluated. The prototype was validated on three different aspects: the ability to obtain multiple biopsy samples through a single insertion, the ability to use the prototype in accordance to the intended use, and a comparison between the prototype and an existing biopsy instrument in terms of<br/>procedure duration. For each of these aspects the prototype was validated in three different proof of concept experiments.<br/>Results: The prototype proved to successfully be able to take a multitude of biopsy specimens through a single insertion. Next to this initial evaluation, the intended use of the instrument is also successfully performed by the prototype. The last evaluation of the prototype, has shown that the procedure time of the<br/>prototype to take a multitude of samples is longer than the procedure time to take a multitude of samples using and existing biopsy instrument (TruCore II). The prototype took 5 minutes and 7 seconds, whereas the existing biopsy instrument took 3 minutes and 50 seconds to obtain multiple tissue samples.<br/>Discussion and Conclusion: The fabricated prototype has proven that it is able to take multiple tissue samples through a single insertion. This multitude of samples can be used to improve the diagnosis accuracy of core-needle biopsy. The functionality of the prototype is in accordance to the intended use. This<br/>intended use provides an indication of the possibilities of use of the prototype. The procedure time of the prototype can be decreased by further improving the usability of the design. Future research can focus on a more elaborate evaluation on the accuracy of the instrument. Furthermore, future work can be carried out<br/>on decreasing the instrument length of the current design. Another research can be done on possible ways to implement a semi-, or even a fully-automatic reloading and transportation mechanism on the now manual operable instrument. With these additional future improvements, this initial proof of concept prototype has the potential to become a fully functioning biopsy instrument.","Biopsy; Medical instrument; Core-needle; Single-insertion; multiple","en","master thesis","","","","","","","","2023-12-07","","","","Mechanical Engineering | BioMechanical Design","",""
"uuid:9db3e196-3c70-45b7-b652-67d0c5563de6","http://resolver.tudelft.nl/uuid:9db3e196-3c70-45b7-b652-67d0c5563de6","Analysis and control design of a cable-suspended parallel robot under consideration of non-linear effects","Oosterloo, Dabian (TU Delft Mechanical, Maritime and Materials Engineering)","Hellendoorn, J. (mentor); Schiele, A. (graduation committee); Ferranti, L. (graduation committee); Delft University of Technology (degree granting institution)","2018","","Parallel robot; Cable system; Motion compensation","en","master thesis","","","","","","","","2023-12-07","","","","Mechanical Engineering | Systems and Control","",""
"uuid:74143194-7174-4bcb-98c7-632e24b70d88","http://resolver.tudelft.nl/uuid:74143194-7174-4bcb-98c7-632e24b70d88","Rocket engine inducer design optimisation to improve its suction performance","Lubieniecki, Marek (TU Delft Aerospace Engineering)","Lettieri, C. (mentor); Cervone, A. (mentor); Delft University of Technology (degree granting institution)","2018","This thesis presents the results of a design optimisation of an inducer for a rocket engine turbopump. Its main goal was to optimise a shape of the inducer blades to enlarge an operating range of the entire pump that is limited by cavitation. The blade was parameterised with four parameters: sweep angle, sweep radius, incidence angle and blade solidity at the tip. The performance of the given pump design is evaluated with a two-phase CFD simulation. The optimisation process is based on a surrogate model that interpolates the simulation results in the entire design space from a fixed number of samples. The results show 17% improvement of the suction performance, which is caused by reduced vapour volume in the flow channel and higher inducer head. Sweep radius proved to be the most important parameter as it increases the minimal pressure at the leading edge.","Cavitation; Turbopumps; Optimisatiom; Inducer","en","master thesis","","","","","","","","","","","","Aerospace Engineering","",""
"uuid:9b62bef7-b3a0-4dd3-8a84-462bdd07b720","http://resolver.tudelft.nl/uuid:9b62bef7-b3a0-4dd3-8a84-462bdd07b720","Seismic analysis of Mars using gravitational potential stresses - InSight","De Backer, Lisa (TU Delft Aerospace Engineering)","Root, B.C. (mentor); Delft University of Technology (degree granting institution)","2018","The 26th of November 2018, NASA's InSight mission successfully landed on Mars. InSight has a seismometer on board with as main science goal to determine the current level of seismic activity and the impact rate of meteorites on Mars. To process the incoming data of InSight as fast and efficient as possible, a-priori models of seismicity on Mars are needed. This thesis work consists out of making such models by using gravitational potential theory. Multiple interior density models of mars (crust and upper mantle) are created by use of isostatic assumptions, the Bouguer gravity or derived from literature. For each model, gravitational potential stresses are calculated which can be compared to the yield stress of the Martian lithosphere. Conclusions about the most likely sources of seismicity of Mars for varying interior density models are made.<br","Mars; InSight; seismicity; stresses; gravity","en","master thesis","","","","","","","","","","","","Aerospace Engineering","",""
