"uuid","repository link","title","author","contributor","publication year","abstract","subject topic","language","publication type","publisher","isbn","issn","patent","patent status","bibliographic note","access restriction","embargo date","faculty","department","research group","programme","project","coordinates"
"uuid:d41c9f09-3ae2-4348-bbe6-93b5c4ab8894","http://resolver.tudelft.nl/uuid:d41c9f09-3ae2-4348-bbe6-93b5c4ab8894","Simulations and experiments on coplanar waveguide resonators intersected by capacitively shunted Josephson junctions","van de Veen, Tim (TU Delft Applied Sciences)","Kounalakis, M. (mentor); Steele, G.A. (graduation committee); Steeneken, P.G. (graduation committee); Thijssen, J.M. (graduation committee); Delft University of Technology (degree granting institution)","2019","A single photon interacting with a single atom is the most fundamental form of light interacting with matter and has been extensively studied in the field of Cavity Quantum Electrodynamics (cavity QED). Here, a non-linearity like an atom is coupled to a single mode of the electromagnetic field in a cavity. Another field which explores the quantum mechanical nature of photons is Circuit Quantum Electrodynamics (cQED) where photons are the quantized excitations of a superconducting microwave resonator and non-linearity is introduced by the Josephson junction. Like this, setups analog to that of in cavity QED can be copied to cQED, with a number of differences. For example, the photons propagating in a transmission line are more confined and the circuits are made with conventional lithography techniques, allowing for more freedom in engineering the system parameters.<br/>In the first part of the thesis, we build a numerical model in order to examine the feasibility of quenching the ground state of a coplanar waveguide (CPW) interrupted by a tunable coupling element. Next, by means of experiments and simulations we considered the feasibility of observing experimentally a synchronization effect in a driven CPW with its central conductor interrupted by equally spaced capacitively shunted Josephson junctions (Josephson crystal) based on a recent proposal. Finally, we made a first step in understanding the<br/>synchronization from a classical perspective by modelling a Josephson crystal of two junctions as two degenerate non-linearly coupled Duffng oscillators.<br/>Concerning the quenching experiment, we found that the plasma frequency must be tuned faster than 1/f with f the resonance frequency of the CPW, which is in the sub-nanosecond regime and therefore unfeasible with current state the art electronics. We also found that, in contrast to what was claimed in the proposal, the synchronization effect cannot be observed for the parameters common in cQED. One way would be to push the limits of the capacitances to several picofarads. Finally, we found that the non-linear coupling causes the two degenerate non-linearly coupled Duffng oscillator to synchronize, which is a first step in understanding the proposed synchronization effect in a fully classical way.","Josephson junctions; Duffing oscillators; quenching; synchronization; non-linear coupling; cQED; resonators","en","master thesis","","","","","","","","","","","","","",""
"uuid:1ba2cd89-9b8e-469c-8cb0-9f8b5a21e803","http://resolver.tudelft.nl/uuid:1ba2cd89-9b8e-469c-8cb0-9f8b5a21e803","Development of an innovative demountable floor system: Structural design and verification","van Glabbeek, Laura (TU Delft Civil Engineering and Geosciences)","Abspoel, Roland (mentor); Stark, Rob (mentor); Gard, Wolfgang (mentor); Veljkovic, Milan (mentor); den Hollander, Jan-Pieter (mentor); Delft University of Technology (degree granting institution)","2019","Today, society is becoming more and more aware of the environment and the (negative) influence we have on it. Especially the current workings of our economy have a detrimental effect on the environment. To reduce these effects, a transition is being made towards a circular economy. The construction sector plays a big role in the degradation: in the Netherlands the sector accounts for 50% of the raw material use, 40% of the energy consumption, 40% of the waste production and 35% of the CO2 emission. For the construction sector, one of the changes to establish a more circular economy, is the adoption of a circular design method. This method consists of the construction of buildings, building systems and building elements being designed for disassembly and reuse. This reduces raw material use and the expel of harmful emissions. While we see some developments being made in the construction sector regarding circularity, not many developments can be found in the field of reusable floor systems. For the sizable use of raw materials and expel of harmful emissions during the manufacturing process of floors, a more circular design for floor systems can (eventually) contribute to the sectors transition to circularity. Therefore, this research is focussed on developing demountable connections which can be used in such a circular floor system. The result is a system comprising a prefabricated timber-concrete composite (hereafter: TCC) floor slab connected to steel edge beams with toothed-plate connectors. An important aspect taken into account in the development of this design is the efficiency of erecting, disassembling and reassembling the floor. A multi-criteria analysis is conducted to determine floor slabs viable for use in a reusable floor system. A timber-concrete composite floor slab is chosen and designed. The slab is verified using analytical calculations. Design variants are made for demountable connections at the slab-beam positions at the head end and the side of the slab and for the slab-slab position. A choice between design variants is made by reviewing the fabrication and assembly tolerances and by assuring a non-destructive disassembly procedure. Analytical calculations are performed to verify the chosen connections. A case study building is used for the development of the floor system. The TCC floor slab spans 10.8m, has a total height of 510mm and a width of 1800mm. The used edge beam is an L-section. On the web a toothed-plate connector is adhesively bonded onto which the timber beams are placed to enable shear force transfer between the timber beams and the edge girder. At the top of the web a compression bolt is installed which is fastened after instalment of the floor slabs to ensure force transfer between the bolt and the concrete slab. Two angle sections are screwed to the outer sides of the outer timber beams and bolted to the edge girder to guide the slab to its intended position and to ensure structural soundness by vertically fixing the floor slab to the girder. Lastly the limits of the developed floor system are determined by performing a parameter study of the floor slab and the connection. The floor slab can be designed to span 12.6m. The connection still meets the structural requirements when the system is used in a building of maximally 70m high. This is applicable on many combinations of the building length (10m to 70m) and width (6m to 12.6m), if the right cross-sectional dimensions are used.","Demountable; Reusable; Structural design; Connections; Timber-concrete composite; Floor system; Tolerances","en","master thesis","","","","","","","","","","","","Civil Engineering","",""
"uuid:ee1876bd-1748-492f-9608-0b16ae045919","http://resolver.tudelft.nl/uuid:ee1876bd-1748-492f-9608-0b16ae045919","An Integrated Planning Approach: Maintenance Task Scheduling Optimization","Peschier, Daan (TU Delft Aerospace Engineering; TU Delft Flight Performance and Propulsion)","Verhagen, Wim (mentor); la Rocca, Gianfranco (graduation committee); Curran, Richard (graduation committee); Lopes Dos Santos, Bruno (graduation committee); Delft University of Technology (degree granting institution)","2019","Aircraft base maintenance consists of hundreds of tasks including preventive, corrective and modification tasks which have to be scheduled to a few check moments per year. The allocation of tasks to checks represents a complex scheduling problem due to the constraints involved. A mixed integer linear programming model was developed to optimize the allocation of the complete base maintenance workload and maintenance checks over a four year period. The model optimizes for resource capacity and interval efficiency. CPLEX has been used as solver. An iterative solution technique loops around the model which yields an approximate optimal solution. The model was developed for a large MRO service provider. Its outcome provides the MRO with an integral insight into the complete workload distribution over a tactical planning horizon for all checks. This insight can help to optimize the allocation of maintenance tasks and resource capacity which will contribute to a higher fleet availability.","Aircraft Base Maintenance; MRO; Resource Constrained Project Scheduling Problem; Mixed Integer Linear Programming; CPLEX; Task Scheduling; Resource Allocation; resource efficiency; interval efficiency","en","master thesis","","","","","","","","2024-02-08","","","","Aerospace Engineering","",""
"uuid:92ce1f5d-b8cb-4c44-9f63-b59a5f13057e","http://resolver.tudelft.nl/uuid:92ce1f5d-b8cb-4c44-9f63-b59a5f13057e","Polymer nano manufacturing of a biomimicking surface used for kidney stone crystallization studies","Pleeging, Richard (TU Delft Mechanical, Maritime and Materials Engineering; TU Delft Precision and Microsystems Engineering)","Staufer, Urs (mentor); Sasso, Luigi (graduation committee); Fan, Daniel (graduation committee); Eral, Burak (graduation committee); Verbiest, Gerard (graduation committee); Delft University of Technology (degree granting institution)","2019","Kidney stone disease is an increasing worldwide issue. There is a current lack of understanding of the exact mechanisms involved, partially due to the need for experimental instrumentation able to mimic the microenvironmental conditions present in vivo. As crystal nucleation often initiates at liquid-solid interfaces, the interface morphology plays a significant role in the rate of nucleation. Within the nephron, the functional unit of the kidney, four distinct segments can be distinguished that contain different surface morphologies. Particularly, the cells lining these segments contain protrusions in the shape of nanopillars that vary in length, diameter and spacing. Exploiting the opportunities provided by organ-on-chip technology, we designed and manufactured a microfluidic device proposed to increase our understanding of the exact mechanisms that drive kidney stone crystallization. We used two-photon polymerization to fabricate surfaces that contain these morphologies in materials possessing a Young’s modulus matching the value of the biological structures. After optimizing design and process parameters like laser power and scanning speed, we manufactured nanopillars with diameters in the range of 150-250 nm and aspect ratios up to 100 with which we can mimic the protrusions in the nephron. Pillar arrays were printed on a glass slide, and assembled with a polydimethylsiloxane (PDMS) microfluidic component (channels 150 um wide). We used high-resolution 3D printing to create master molds used for PDMS soft-lithography. After precise alignment, the two components were brought together and clamped mechanically with a 3D printed holder to ensure a watertight seal between the glass and PDMS. This microfluidic device was used to study crystallization of the most common type of kidney stone, calcium oxalate monohydrate (COM). Because of the chip dimensions combined with a surface morphology this device closely resembles a human nephron.<br","Kidney stones; two-photon polymerization; biomimicking","en","master thesis","","","","","","","","2020-02-01","","","","Mechanical Engineering","",""
"uuid:26afed9f-7a6f-4b82-b72f-abe5caf37eab","http://resolver.tudelft.nl/uuid:26afed9f-7a6f-4b82-b72f-abe5caf37eab","Airport Demand Management Strategies: Discrete event simulation approach for evaluation of airport demand management strategies","de Roos, Sidney (TU Delft Aerospace Engineering)","Roling, Paul (mentor); Mitici, Mihaela (mentor); Curran, Richard (graduation committee); Ellerbroek, Joost (graduation committee); Delft University of Technology (degree granting institution)","2019","The master thesis is about testing the effectiveness of the Airport demand management strategies. Based on the problem of increasing pressure on airport capacity, due to the increase of the demand on flying. The goal is to find a system which supports planning of air traffic control by generating knowledge about the throughput of arrivals. A Discrete Event Simulation approach is used to simulate the behaviour of arrivals in case of capacity issues. The model uses random generated slot allocated schedules to test the effectiveness of several strategies. Eventually the result of the strategies is presented in an optimum ratio between delays and cancellations of the tested strategies. The main conclusion of the research is that the model is capable of testing the effectiveness of airport demand management strategies. It also provides knowledge on expected bottlenecks of the arrival operations by generating the average delay per hour and queue propagation for each strategy.","Discrete Event Simulation; Demand Management Strategies; Arrival Operations; Operation","en","master thesis","","","","","","","","","","","","Aerospace Engineering","",""
"uuid:bbe040ae-44f2-44d2-a4e4-867b6c7c2d4c","http://resolver.tudelft.nl/uuid:bbe040ae-44f2-44d2-a4e4-867b6c7c2d4c","Extensive application of a methodology to evaluate a tsunami-resilient transportation system","YASAKU, Toshiya (TU Delft Civil Engineering and Geosciences)","Pel, A.J. (mentor); Bricker, J.D. (graduation committee); Hooimeijer, F.L. (graduation committee); Delft University of Technology (degree granting institution)","2019","A methodology for an assessment of resiliency of a transportation system threatened by a disaster has been evaluated as to whether it is applicable in small coastal communities at risk of tsunamis. A case study was carried out in Otsuchi town in Japan. The result shows that, although the methodology is well-designed to apply in different cities in terms of the data collection, there are challenges in capturing the resiliency of the transportation system in the unique geography of the town and against the tsunami-specific impacts. Besides, it was found that the methodology fails to take disaster-counter measures into account, e.g. a higher dike and a land elevation for the future tsunamis, which also could enhance the resiliency of a transportation system. Nevertheless, it was discussed using Wegener's circle that the methodology captures well a transportation system threatened by a disaster from both demand and supply perspective. A conclusion was drawn by some recommendations to make the methodology more tsunami-resilience focused.","tsunami resiliency; transport systems; methodological research","en","student report","","","","","","","","","","","","Civil Engineering | Transport and Planning","The Interdisciplinary-International RESEARCH TSUNAMI RECONSTRUCTION-project",""
"uuid:415e02a6-0ea9-4562-8d1a-ce037ffc6a0e","http://resolver.tudelft.nl/uuid:415e02a6-0ea9-4562-8d1a-ce037ffc6a0e","Computational efficient robustness analysis of aircraft component distortion: Accounting for stochastic pre-stressed stock material in reductive manufacturing processes","Janssens, Yannick (TU Delft Mechanical, Maritime and Materials Engineering; TU Delft Structural Optimization and Mechanics)","van Keulen, A. (mentor); Munro, D.P. (graduation committee); Tichem, M. (graduation committee); van der Veen, Sjoerd (graduation committee); Delft University of Technology (degree granting institution)","2019","In this thesis, a methodology is developed that allows for both reliable and computational efficient robustness analysis of aircraft component distortion. This research applies to dis- tortion caused by reductive manufacturing processes that are used to obtain monolithic components from pre-stressed stock material. With the developed methodology, orienta- tions of any component within rolled plate stock material can be found where distortion is most robust. Part distortion is defined as a deviation in shape of an aircraft component from original intent as a result of the component’s reductive manufacturing process. As extreme precision is required in aircraft component assembly, the distortion phenomenon is highly undesired. The developed methodology in this thesis contributes to AIRBUS’ objectives to minimize part distortion related issues. In this thesis, the fundamentals of part distortion are studied. It is found that aircraft com- ponents distort as a result of residual stresses that are present in stock material from which the components are manufactured. As residual stress in rolled plate is subjected to substan- tial variation, part distortion is stochastic in nature. Positions of the components in rolled plate are searched for where distortion is most robust. The robustness of distortion refers to the insensitivity of distortion to uncertainty in residual stress. A mathematical stochastic representation of residual stress in rolled plate is developed showing high coherence with experimental measurement data provided by AIRBUS. For elementary geometries, the rela- tionship between distortion robustness and residual stress is derived analytically. The developed method for predicting distortion robustness is more than one hundred times more efficient in terms of computation cost compared to state-of-the-art methods and al- lows for reliable robustness predictions. In the developed method, three-dimensional po- sitioning of a component in rolled plate can be simulated where state-of-the-art distortion modeling tools usually stick to one dimension. The developed methodology is put to the test in a case study concerning an aircraft stiffener component. The case study emphasizes the significance of robustness predictions; distor- tion dispersion is found to be relatively large compared to the distortion magnitude and significant correlation is found between the component’s orientation in rolled plate and the level of robustness. Positions of components in rolled plate can be found where distortion is extremely robust. Moreover, a relationship is found between the component’s degree of symmetry and the level of robustness.","distortion; aircraft; component; residual stress; titanium; Robustness","en","master thesis","","","","","","","","2024-02-08","","","","Mechanical Engineering | Precision and Microsystems Engineering","",""
"uuid:396e5112-19a0-48d3-b83d-9341a9fad583","http://resolver.tudelft.nl/uuid:396e5112-19a0-48d3-b83d-9341a9fad583","Pumping when the wind blows: Demand response in the Dutch delta","van der Heijden, Ties (TU Delft Civil Engineering and Geosciences)","Abraham, E. (mentor); van Nooijen, R.R.P. (mentor); Palensky, P. (mentor); Lugt, Dorien (mentor); Delft University of Technology (degree granting institution)","2019","This thesis investigates the potential of a large pumping station in IJmuiden, the Nether-lands, for participating in Demand Response. Due to climate change, renewable energy is onthe rise. The intermittency of energy, together with its unpredictable supply, are a big hurdlefor the energy transition. Two methods are promising solutions to this problem; large scaleenergy storage and demand response. Since large scale energy storage is not yet economi-cally feasible, demand response has an important role to play in the early days of the energytransition.Using energy when it is generated requires a data-stream from the generation facilities onproduction, which is not (yet) widely available. The market price, however, is an indicationof the scarcity of energy, since it is based on the ratio between supply and demand. Besidesthat, there is a correlation between a low energy price and sustainable energy productionsince marginal costs of sustainable energy production are lower than fossil energy produc-tion. This makes using sustainable energy cheaper that fossil energy, and gives DemandResponse a business case.In this thesis, a Model Predictive Control is created that uses energy market data to minimizeenergy costs. Multiple energy markets are analyzed with respect for their suitability for thepumping station in IJmuiden to act on them. The day ahead market is called the APX inthe Netherlands, and this is where energy is bought and sold the day before consumption.The intraday market, also called the flexibility market, is where energy can be bought andsold up to 5 minutes before consumption. A strategy combining these two markets will beevaluated. This is done by using a predicted day ahead price, generated by a SARIMA model,to create a plan. This plan will then be followed, but deviations from the plan are allowedagainst intraday market price.Due to imperfections of the market (mismatch between supply and demand), imbalances areoccurring. These imbalances result in frequency deviations of the grid, and voltage devia-tions. Tenner, the Dutch TSO (Transmission system operator), is responsible for minimizingthese imbalances. In order to minimize the imbalance, TenneT gives a real-time indication ofthe imbalance on the grid, and positive contributions are rewarded while negative contribu-tions are punished. This is done through the use of the imbalance price; a price per volumeof imbalance caused or solved. The imbalance price is based on the aFRR market, wherebids can be done on possible activation. Since the imbalance market is a fast-acting market,it is not suitable for a large pumping station like IJmuiden. However, the aFRR market willbe analyzed in this thesis.The effects of expected future development, like sea level rise and energy market changes,will be analyzed and simulated as well. A higher sea level would result in more pumping, andless discharging under gravity. Which causes the the pump schedule to become less flexible.The results show that it is possible to apply demand response to a pumping station, and theintraday market makes it possible for the MPC to adjust its energy use during the day.The aFRR market analysis shows a lot of potential for the pumping station, possibly makingup for all energy costs made through the spot markets.The conclusion of this thesis is that Rijkswaterstaat can possibly save energy costs on pump-ing, based on the fixed energy price, provided by Rijkswaterstaat, they pay now. Based ona reference scenario where the MPC only minimizes energy use, and a fixed ENDEX energyprice, the proposed MPC makes about 10% less costs in the German market scenario. TheDutch market scenario does not show cost savings. In the Netherlands there is not muchcorrelation between low energy prices and renewable energy yet, since renewable energy isnot a big part of the energy mix in the Netherlands. This correlation is expected to becomemore present when the Dutch energy mix becomes more sustainable. This is expected toresult in lower CO2emission through the energy use of the pumping station. However, moreresearch is needed to confirm this.","pumping; demand; response; side; management; smart; grid; sustainable; energy; market; day ahead; intraday; optimization; pyomo; ipopt; NLP; mpc; model; predictive; control; schedule; water; ijmuiden; pumping station; ijsselmeer; markermeer; noordzeekanaal; amsterdam-rijnkanaal; rijkswaterstaat","en","master thesis","","","","","","","","","","","","Water Management","","52.470852, 4.601499"
