"uuid","repository link","title","author","contributor","publication year","abstract","subject topic","language","publication type","publisher","isbn","issn","patent","patent status","bibliographic note","access restriction","embargo date","faculty","department","research group","programme","project","coordinates"
"uuid:c000e021-9851-4405-b1a1-352502c7614f","http://resolver.tudelft.nl/uuid:c000e021-9851-4405-b1a1-352502c7614f","Calcification &amp; Fibrous Tissue Characteristics in Atherosclerotic Plaques: A Combined Analysis and Modeling Approach","Vis, Bas (TU Delft Mechanical, Maritime and Materials Engineering)","Zadpoor, A.A. (mentor); Akyildiz, A.C. (mentor); Zhou, J. (graduation committee); Ghatkesar, M.K. (graduation committee); Plettenburg, D.H. (graduation committee); Delft University of Technology (degree granting institution)","2019","Atherosclerotic plaque rupture is the main cause of acute myocardial infarction and stroke, the two leading causes of death worldwide. Rupture of plaque tissue is a mechanical event, where plaque stress or strain locally exceeds its strength. Biomechanical studies agree with histopathological findings that a large lipid pool and thin fibrous cap overlying the lipid pool increase the likelihood of rupture, by showing increased plaque stresses for these geometries. Another plaque morphological feature that is frequently encountered is calcification. However, its role in the vulnerability of plaques to rupture is not fully understood, and biomechanical modeling studies do not agree on the effect of calcifications on plaque stress. These studies used isotropic material properties for the anisotropic and collagen rich plaque tissue, and generally focused on the effect of calcification on lumen stress or cap stress. However, histopathological findings revealed tissue damage at the interface between calcification and surrounding tissue.<br/><br/>This study investigated stresses and strains at the interface between calcification and fibrous tissue, how these stresses and strains are influenced by local anisotropy of the fibrous tissue and how geometric features of the calcification are related to these metrics. A morphometric study was conducted first, to investigate and categorize different patterns of fiber alignment around the calcifications, and to measure the calcification geometric features including its location in the plaque, its shape and its size. Biomechanical models including the local anisotropic material properties were constructed next, based on the observations and measurements made in the morphometric analysis. Stress and strain metrics were investigated at the calcification boundary, and subsequently related to fiber patterns and calcification geometric features.<br/><br/>Hundred forty five calcifications were segmented and measured in the morphometric analysis, and surrounding fiber alignments were studied. The analysis revealed that four main fiber patterns in the fibrous tissue surrounding calcifications exist: the Attached pattern, Pushed Aside pattern, Encircling pattern and Random pattern. Collagen fibers are attached to the calcification in the Attached pattern, are pushed aside by the calcification in the second pattern, encircle the calcification in the third pattern, and show a disorganized alignment in the Random pattern. The Attached pattern was the most prevalent fiber pattern, and its corresponding calcifications had larger aspect ratios and were on average larger than the other three fiber patterns. Large peak stresses and strains at the calcification boundary were identified in the biomechanical models for the Attached pattern and Pushed Aside pattern, while these metrics showed generally lower peak values for the Encircling pattern and Random pattern. Peak values for all stress and strain metrics were attained at the tip of the calcifications. Multivariate analysis showed that stresses and strains are related to the calcification geometric features; calcification interface stress and strain increased if the calcification was closer to the lumen, had a larger length/width ratio and was larger in size.<br/><br/>Histopathological examination of plaques evidenced damage at the interface between calcification and fibrous tissue, potentially caused by an adverse mechanical state at this boundary. Most studies focused on stresses at the lumen or in the cap however, and this study for the first time specifically investigated stresses and strains at the calcification boundary while simultaneously introducing local fibrous tissue anisotropy in the computational models. Results show that peak stresses and strains can develop at this boundary, which will remain undiscovered if isotropic materials are used. This study was also the first to extensively analyze calcification geometric features and surrounding fiber alignment in relation to these interface stresses and strains. Peak values were found to be dependent on these features and fiber alignment patterns, indicating a relation between these characteristics and mechanical stability of the plaque. The findings of this study further increase the clinical relevance of finite element modeling in rupture risk prediction by showing previously undiscovered peak stress and strain values for interfaces and geometric configurations which already were deemed to be destabilizing in clinical and histopathological studies.","Atherosclerosis; Plaque; Calcification; FEM analysis","en","master thesis","","","","","","","","2020-02-19","","","","Biomedical Engineering | Biomaterials and Tissue Biomechanics","",""
"uuid:63f4fce9-3d74-4502-9507-76957c042ab9","http://resolver.tudelft.nl/uuid:63f4fce9-3d74-4502-9507-76957c042ab9","Thin Glass Cold Bent Sandwich Panel","Guidi, Marina (TU Delft Civil Engineering and Geosciences)","Nijsse, Rob (mentor); Louter, Christian (graduation committee); van der Linden, Lennert (graduation committee); van de Rotten, Peter (graduation committee); Delft University of Technology (degree granting institution)","2019","From the beginning of the 21st century, thin glass has been used as a screen protector for electronic devices and smartphones. During the last 10 years, several studies have been carried out to introduce the thin glass in the building industry. The advantages of this material are light weight, high strength and high flexibility. On the other hand, thin glass, due to its low thickness, has a limited bending stiffness. Therefore, it is challenging to apply this innovative material in the building field. Within this research, the stiffness of thin glass is increased by the realization of a thin glass cold bent sandwich panel.<br/>The proposed sandwich panel is realized by using thin glass faces and a 3D printed polymeric core. Due to the high flexibility of the glass, the material can be easily bent and glued to the core. The curved core hold the cold bent glass in shape without the use of any frame. <br/>To validate the numerical results, laboratory tests have to be carried out. The design of the curved sandwich panel revealed to be a feasible façade panel proposal. The feasibility is defined in terms of a structural façade element, which fulfill the limits of safety and comfort. The curved sandwich panel, proposed in the final design, results to be 280 times stiffer compared to a curved two layered thin glass laminated panel. <br/>Furthermore, it was demonstrated that the proposed sandwich panel could guarantee a weight reduction of more than 80% in comparison to the glass used nowadays in building façades. This characteristic not only facilitates the assemblage of the façade, but also can bring to the usage of a lighter support structure. This can bring advantages both in terms of cost of the total structure and energy required to assemble the building.","Thin Glass; Stiffness; Light-weight; Cold bending; Sandwich structures; Composite panel; Additive Manufacturing; 3D printed PETG; Finite Element Modeling; Laboratory experiment","en","master thesis","","","","","","","","","","","","Civil Engineering | Building Engineering","",""
"uuid:621c77c4-6764-4d17-9a0a-b3d3dd3025e0","http://resolver.tudelft.nl/uuid:621c77c4-6764-4d17-9a0a-b3d3dd3025e0","Guidance and Control for Spinning, Gun-Launched Projectiles","van der Geest, Lars (TU Delft Mechanical, Maritime and Materials Engineering; TU Delft Delft Center for Systems and Control)","van Wingerden, J.W. (mentor); Bouquet, François (mentor); Hellendoorn, J. (graduation committee); Keijzer, T. (graduation committee); Delft University of Technology (degree granting institution)","2019","This thesis report is focused on the design of a guidance and control system that is able to minimize the deviation from the desired impact point for a firing range of 1 kilometer, given a 30mm spinning gun-launched projectile with a novel actuator design. This actuator is fixed on the projectile and offers a single force that can only be switched on or off. <br/><br/>In order to test the effectiveness of the guidance, navigation and control (GNC) system, an accurate model for both the projectile and the proposed actuator are constructed. These models will serve as a substitute for testing with working prototypes. The model for the projectile dynamics is constructed based on existing nonlinear 6-DOF rigid-body models that are widely-used and validated. A new, simplified second order model that approximates the dynamics of the actuator, based on available measurements, is constructed.<br/><br/>The overall structure of the GNC loop is defined, with the guidance method of choice being the pre-calculation of a reference trajectory towards the intended target. This method serves to alleviate under-actuation and computation time problems. One of the most important contributions of the thesis is made with the description of a method for transforming the input from a single binary input signal towards two continuous virtual input forces. This method uses a discretization of the rolling motion of the projectile, such that an optimization can be done which results in a transformation from the binary on/off signal to two virtual force inputs. These two virtual force represent the steering forces in the directions perpendicular to the forwards motion that would have the same effect as the binary on/off signal if directly applied on the projectile.<br/><br/>The restructuring of the input allows for the use of PD-controllers to track the pre-defined trajectory. Using a grid-search method, the controller gains are found that best satisfy the design goal of minimizing the dispersion, which is defined by the sum of the mean error and the standard deviation of the impact points.<br/><br/>Analysis of the integrated solution shows that the proposed solution with the input transformation and the PD-controller is able to significantly reduce the projectile dispersion from standard deviations of about 50 cm to just a few cm. The exact performance depends on the frequency of the actuator and the spin rate of the projectile. The best performance is reached with high spin rates and actuator frequencies high enough to match these spin rates.","Guidance; Control; Projectile; PD control; Optimization","en","master thesis","","","","","","","","2024-02-21","","","","Mechanical Engineering | Systems and Control","",""
"uuid:8cead674-80b6-4b5e-b72b-3bf01534dd27","http://resolver.tudelft.nl/uuid:8cead674-80b6-4b5e-b72b-3bf01534dd27","Adapting a mosquito trap for future deployment in African communities","van de Geer, Cedric (TU Delft Industrial Design Engineering; TU Delft Industrial Design)","Kuipers, H. (mentor); Diehl, J.C. (graduation committee); Cribellier, Antoine (graduation committee); Muijres, Florian (graduation committee); Delft University of Technology (degree granting institution)","2019","Malaria is a major problem in sub-Saharan Africa, with as a result over 400,000 deaths each year. With pesticide resistance on the rise, new methods have to be developed that will reduce malaria transmission. The mosquito trapping method, in combination with bed nets, has been proved to be effective. The M-Tego is a mosquito trap embodiment designed with the user, sustainability and performance in mind.","Malaria; Vector control; Mass trapping; sustainable development; Sub-Saharan Africa; Mosquitoes","en","master thesis","","","","","","","","","","","","Integrated Product Design","",""
"uuid:8b4d0602-6045-437d-8167-09203f8ac6aa","http://resolver.tudelft.nl/uuid:8b4d0602-6045-437d-8167-09203f8ac6aa","Prediction of the added resistance in waves using CFD","Hulsbergen, Bas (TU Delft Mechanical, Maritime and Materials Engineering)","Mikelic, Andrea (mentor); Akkerman, Ido (mentor); Crepier, Pierre (mentor); Delft University of Technology (degree granting institution)","2019","Shipyards these days see an increase in customers that specify combined speed and seakeeping ability design requirements. This requires the shipyard to make a prediction of the additional installed power required to maintain a certain speed when waves are encountered. The additional required installed power is directly related to the average extra resistance that the vessel is subjected to when it’s sailing in waves. This extra resistance is known as the time-averaged added resistance in waves. In the maritime industry Computational Fluid Dynamics (CFD) is increasingly used for resistance predictions as it promises cheaper and faster predictions than model testing. The result does come without the comforting ’truth’ of the towing tank. In this study, the applicability of CFD for the estimation of the time-averaged added resistance in regular head waves is researched by assessing the error and uncertainty of the solution. For fast sailing vessels, no standard procedure for the estimation of the timeaveraged added resistance in waves using CFD has yet been developed. Therefore the secondary research objective is to establish such a procedure. For this research the resistance predictions are done for the Fast Displacement Ship (FDS) hull form. Extensive research was conducted on this hull form by the Cooperative Research Ships (CRS) organisation. Their model tests results are used for the validation of the solution. The discretisation error is determined through a procedure developed by L.Eça and M.Hoekstra [25] which is based on a grid refinement study. The time-averaged added resistance is estimated by simulating the vessel both in calm water and waves. The time-averaged calm water and total resistance in waves are determined from these simulations. The time-averaged added resistance estimate is then calculated by subtracting the calm water resistance from the total resistance. First a grid topology is optimised to simulate the incoming waves as well as the vessels response to them accurately and efficiently. Grid sensitivity studies of the simulation of incoming waves as well as simulations of the static vessel in waves and the vessel subjected to forced motion are used to determine an efficient topology. To determine if the vessel’s response is accurate, it is compared to the solution from potential flow code solver PRECAL. The comparison proved that accurately propagating waves and accurate vessel response to the waves and motions are achieved on grids with less than 3 M cells in total. Verification estimated an uncertainty that varies between 0.5 % and 1.3 % for the time-averaged total resistance in waves and between 15.1 and 36.2% for the time-averaged calm water resistance on grids with a total number of cells ranging between 1.3 and 6.6 M. Comparison with the results from the model test revealed that an error of 1.4 % was present in the timeaveraged added resistance estimate. This error is smaller than the uncertainty margin of the model test result. Using the proposed method, the time-averaged calm water resistance estimate didn’t converge well, resulting in a large discretisation uncertainty. As the added resistance prediction is dependent on the calm water resistance prediction, it is also affected by this uncertainty. Therefore it’s concluded that the proposed method for the estimation of the time-averaged wave added resistance using CFD is not yet applicable in its proposed form. However, by using the proposed method, it is possible to estimate the time-averaged total resistance in waves accurately and efficiently. Therefore it’s concluded that further research is required to improve the uncertainty present in the time-averaged added resistance due to the uncertainty seen in the calm water resistance for the used grids.","CFD; ReFRESCO; added resistance; regular waves; 2D waves; radiated waves; diffracted waves; FDS; discretisation uncertainties; verification; validation","en","master thesis","","","","","","","","","","","","Offshore Engineering","",""
"uuid:6d8a3cf5-aff9-49e6-b48b-8754aa3ac2d2","http://resolver.tudelft.nl/uuid:6d8a3cf5-aff9-49e6-b48b-8754aa3ac2d2","Nonlinear damping in graphene nanodrum resonators","Smid, Justin (TU Delft Mechanical, Maritime and Materials Engineering)","Alijani, Farbod (mentor); Dolleman, Robin Joey (graduation committee); Delft University of Technology (degree granting institution)","2019","Nanomechanical resonators made from graphene are widely researched for their potential applications due to their high sensitivity. Their atomic scale thickness makes it that these resonators exhibit amplitude-dependent damping at relatively small driving forces. To further increase the performance of these devices, it is essential to understand the dissipation process. Although many physical mechanisms that lead to linear damping have been investigated, the origin of nonlinear damping remains largely unknown. Nonlinear damping in nanomechanical resonators is typically studied using phenomenological models.<br/>In this thesis, a multilayer graphene resonator is studied that is electrostatically actuated. The graphene resonator is modeled as a viscoelastic membrane operating in the geometrically nonlinear regime. The amplitude-dependent damping term used in phenomenological models arises naturally in the equation of motion. The experimentally obtained nonlinear frequency responses are then fitted using a fully automated algorithm. Based on these fits, the viscoelastic properties of graphene and its loss tangent are found. When the same analysis is done for a single-layer graphene resonator coupled to an optical cavity, negative nonlinear damping is observed which turns positive with increasing laser power. The effect of the optical field on the nonlinear damping is then modeled. It is found that the change in equilibrium position of the graphene membrane due to laser illumination as well as geometric imperfections can lie at the root of the negative nonlinear damping behavior.","Nonlinear damping; Graphene resonators; Nonlinear dynamics; Viscoelasticity; Optomechanics","en","master thesis","","","","","","","","2020-08-15","","","","","",""
"uuid:48f63e87-2d94-4abd-9e87-e37060662095","http://resolver.tudelft.nl/uuid:48f63e87-2d94-4abd-9e87-e37060662095","Marinas in Argentina: A feasability study for a network of marinas in the Buenos Aires Province coast","Dijsselbloem, Stijn (TU Delft Civil Engineering and Geosciences); van Adrichem, Wouter (TU Delft Civil Engineering and Geosciences); Baas, Daniël (TU Delft Civil Engineering and Geosciences); Bartczak, Konrad (TU Delft Civil Engineering and Geosciences); Zeeuw van der Laan, chris (TU Delft Civil Engineering and Geosciences)","van Koningsveld, Mark (mentor); Norman, Cecilia (mentor); Ngan-Tillard, Dominique (mentor); Bosch-Rekveldt, Marian (mentor); Delft University of Technology (degree granting institution)","2019","According to themselves, Argentinians are living with their backs towards the sea. In order to turn this around, a feasability study has been done to find out how a network of marinas along the coast of the province would look like, based on a MCDA including all urban areas along the coast and a fleet analysis. A final network has been proposed and a conceptual design of such a marina has been made.","marina; Argentina; network; design; MCDA; Buenos Aires","en","student report","","","","","","","","","","","","","",""
"uuid:0cd4f9e3-faf3-4e65-995c-7dd401c8da4c","http://resolver.tudelft.nl/uuid:0cd4f9e3-faf3-4e65-995c-7dd401c8da4c","Decentralized Stochastic Optimal Control for a Swarm of Micro Aerial Vehicles","Bendriş, Bianca (TU Delft Aerospace Engineering)","de Croon, Guido (mentor); McGuire, Kimberly (graduation committee); Kappen, Bert (graduation committee); Delft University of Technology (degree granting institution)","2019","In this work, we model a multi-robot formation planning and control task as an optimization problem, which we solve on-line and in a decentralized manner using the Stochastic Optimal Control (SOC) framework. Typically, the solution of a SOC problem requires solving the Hamilton-Jacobi-Bellman (HJB) equation for all system states and controls. However, this operation becomes intractable when high-dimensional systems are used. In recent years, advances on a certain type of SOC problem, which can be efficiently solved by sampling from a diffusion process have been presented and are better known as path integral (PI) control. We build upon this theory and implement a decentralized formulation of the PI algorithm to compute the optimal controls of real Micro Aerial Vehicles (MAVs) flying in formation using solely on-board computational resources. One challenging aspect of the PI control method is the efficient sampling of useful trajectories. It is not clear how to guide the samples towards the optimal states. To this end, we propose a probe enhanced importance sampling (PEIS) method which performs a coarse exploration of the state space with the objective of identifying an optimal guiding trajectory around which the samples are taken. The feasibility of the proposed method is shown by means of simulation and real-hardware experiments with up to four MAVs in an indoor environment.","","en","master thesis","","","","","","","","","","","","Aerospace Engineering","",""
"uuid:aa09e42a-b148-468c-bd7e-0ec7cbfcdd97","http://resolver.tudelft.nl/uuid:aa09e42a-b148-468c-bd7e-0ec7cbfcdd97","Development of a transient CFD methodology for the optimization of CNG engines","Maselis, Robbe (TU Delft Aerospace Engineering)","Hickel, Stefan (mentor); Delft University of Technology (degree granting institution)","2019","Compressed natural gas (CNG) has been gaining attention in the automotive industry since it allows for a substantial reduction in carbon dioxide emissions. Recent advancements in direct-injection technology have contributed to an increase in volumetric efficiency and engine power, but the physical modeling of such gaseous injection with Computational Fluid Dynamics (CFD) is still challenging. This work describes the development of a CFD methodology for the simulation of CNG engines, an evaluates its predictivity by varying certain simulation parameters. <br/>Firstly, turbulence modelling has been investigated by comparing the RNG k-ε RANS, Dynamic Smagorinsky LES and Delayed DES approaches. The DES provides the best trade-off between computational cost and accuracy during fuel injection, but the model makes abrupt transitions between its RANS and LES-like regions, leading to inaccuracies during combustion. The expensive nature of the LES and the adequate accuracy of the RANS model lead to the preference of the latter. Secondly, the turbulent Schmidt number was investigated. By lowering the number, mixing is more dominant in the simulation and the mixture formation becomes more stoichiometric. The influence on combustion is even larger because of turbulent transport across the flame, with extremely low values even leading to falsely-predicted engine knock. Thirdly, by comparing multiple consecutive engine cycles to each other, it was found that the first cycle still contains a large amount of initialization error in the turbulent field. The second and third cycles show much better agreement to each other. Finally, the amount of turbulent fluctuations at peak power and their influence on laminar flame speed partially lead to flame extinction at the start of combustion. As a consequence, the G-equation model is not justified and does indeed provide inaccurate results for the heat release during combustion. Even though the SAGE detailed chemistry solver in conjunction with the Gri-Mech 3.0 mechanism is assumed to have a larger computational cost, it was found that the opposite is in fact true, and the latter should be preferred. <br/>The aforementioned conclusions are used to calibrate the simulation model against measurement data. The recommended settings are the RANS turbulence model, SAGE detailed chemistry and a turbulent Schmidt number of 0.6, while considering results from a second engine cycle. The Lower Heating Value (LHV) of the fuel was decreased in order to account for an unforeseen inconsistency with the measurement. This ad hoc solution showed that the predictivity of the RANS simulations can substantially be improved, and a good agreement between simulation and measurement was observed. The calibration is however not consistent with other operating conditions, as the part load analysis showed. Finally, the comparison between the peak power and part load operating point have revealed that the engine performance can potentially be improved by altering the piston bowl shape or the position of the injector and the spark plug.","CFD; CNG; Automotive; Engine; Methodology; Turbulence; Combustion","en","master thesis","","","","","","","","2024-02-14","","","","Aerospace Engineering","",""
