"uuid","repository link","title","author","contributor","publication year","abstract","subject topic","language","publication type","publisher","isbn","issn","patent","patent status","bibliographic note","access restriction","embargo date","faculty","department","research group","programme","project","coordinates"
"uuid:422d474e-ed71-4862-bee4-feb93879bc45","http://resolver.tudelft.nl/uuid:422d474e-ed71-4862-bee4-feb93879bc45","A study of an artificial viscosity technique for high-order discontinuous Galerkin methods","Cruellas Bordes, Marc (TU Delft Aerospace Engineering)","Hickel, Stefan (mentor); Magin, Thierry (graduation committee); Delft University of Technology (degree granting institution)","2019","Prediction of heat loads during hypersonic re-entry is of great interest in space exploration and in the topic of space debris as well. To date, there is no accurate method to reproduce either experimentally or numerically the physics in re-entry conditions. On the numerical side, high-order discontinuous Galerkin methods have potential to improve results achieved with state-of-the-art finite volume methods. However, they suffer from Gibbs-type oscillations around discontinuities such as shocks. This work uses artificial viscosity to tackle this issue.<br/>The artificial viscosity method used in this work contains three user-defined parameters which specify the magnitude, location and width of the artificial viscosity. A parametric study of these parameters on a steady inviscid wedge test case at Mach 2 showed that tuning their values is a non-trivial task and it appeared that in some cases shock smoothness and shock thickness need to be traded-off. Furthermore, it was observed that sufficient refinement in mesh size or polynomial order was needed to obtain satisfying results. The Sod test case was considered to test the method in an unsteady inviscid case. Good results were obtained, although the shock was better resolved than the contact discontinuity. The method was also tested on another unsteady inviscid test case, the Shu-Osher problem. The latter is more challenging due to the shock strength varying in time. Specifying the artificial viscosity parameters was challenging since the set had to account for variation of the shock strength in time. The test case also highlighted the need for a method that keeps variables within their physical bounds.<br/>Prediction of the heat flux on the surface of a half-cylinder in a hypersonic flow was attempted. However, this was unsuccessful and the Mach number was eventually reduced to 3.25. Strong non-physical oscillations appeared in the heat flux profile even with smooth contour plots and pressure profile at the surface of the half-cylinder. The key to obtain a smooth heat flux profile was to ensure no artificial viscosity at all is inserted in the boundary layer. Also, a symmetric mesh was needed to obtain a symmetric profile. Overall, the heat flux results showed that it is possible to simulate this challenging test case with discontinuous Galerkin and a combination of simple methods, including the Lax-Friedrichs flux and a basic smoothing of the artificial viscosity field.<br/>A new strategy to tune the user-defined parameter specifying the location of the artificial viscosity was implemented and tested on the Shu-Osher and half-cylinder test cases. It was found to be greatly beneficial in terms of stability and user-friendliness, but did not fully eliminate the issues in simulating these challenging test cases. This strategy allowed to run the half-cylinder test case beyond the Lax-Friedrichs flux and a polynomial order of 1. The heat flux profile with SLAU came very close to that with Lax-Friedrichs, whereas the difference was significant between first and second orders.","artificial viscosity; shock capturing; discontinuous Galerkin; supersonic","en","master thesis","","","","","","","","","","","","Aerospace Engineering","",""
"uuid:b026e1a8-c8ec-483d-890a-e5ca79e66d17","http://resolver.tudelft.nl/uuid:b026e1a8-c8ec-483d-890a-e5ca79e66d17","The First Circular Product Design with Dyneema®","van Zwet, Bram (TU Delft Industrial Design Engineering)","Bakker, Conny (mentor); Kersten, Wouter (mentor); Corakci Donato, Bengisu (mentor); Delft University of Technology (degree granting institution)","2019","DSM Dyneema produces an extremely strong fibre called Dyneema® consisting of Ultra High Molecular weight Polyethylene (UHMWPE). The Dyneema® material has been trademarked by its manufacturer as The Greenest strength™. This claim is based on the non-toxic chemical nature of the material and its production, as well as on having the lowest carbon footprint on a strength to weight ratio. Due to this strength of the fibre, less material is required than alternatives to achieve the same level of performance, thus a reduction in carbon footprint can be achieved. The Carbon footprint during manufacturing and use is lower than its competitors. <br/>However at the end of its product life Dyneema® fibre products are incinerated or landfilled. DSM Dyneema wants to have a circular alternative for the end of life of Dyneema® fibre products. In this thesis the design process is described to create a circular product from production waste material from Dyneema®.<br/>Using the context variation by design approach, requirements for a circular product are combined with material properties and possible contexts for applications. The result is a design proposal for a summer sleeping bag, that is well suited for the different types of use that befall a summer sleeping bag. It will be made from Dyneema® production waste and recycled materials, and allows user to send it back to the manufacturer after it has lived out its useful life, free of charge. The manufacturer can then re-use the materials for new sleeping bags, or recycle them otherwise, thus preventing the material from falling out of the loop.<br","Circular Product Design; Context Variation by Design; Outdoor gear; Sleeping bag; Circular Economy","en","master thesis","","","","","","","","","","","","Integrated Product Design","",""
"uuid:26c3b923-bd20-41da-839d-23794034a88f","http://resolver.tudelft.nl/uuid:26c3b923-bd20-41da-839d-23794034a88f","Forecast of the dynamic behaviour of FRP footbridges: Vibrations induced by pedestrians","Ligthart, Yorick (TU Delft Civil Engineering and Geosciences)","Veljkovic, Milan (mentor); Pavlovic, Marko (mentor); Tsouvalas, Apostolos (mentor); Kardas, Maurice (graduation committee); Delft University of Technology (degree granting institution)","2019","Fibre reinforced polymer (FRP) is a new construction material that often is used for pedestrian bridges. It offers a good strength-weight relation, a long-term durability and slender bridge shapes. Slenderness has effect on dynamic behaviour of the construction and vibrations are common for these bridges. Hand calculations are commonly used for the forecast of the dynamic behaviour, but this approach is not very accurate. Royal Haskoning DHV felt the need for a numerical model to be able to forecast the dynamic behaviour of pedestrian bridges of which accelerations, natural frequency and damping ratio are the most important. This thesis aims to fulfil this need. During a literature study relevant calculation methods were found and offered a better insight in the behaviour of bridges and the properties of FRP. FiberCore, manufacturer of FRP bridges, provided information of 15 different bridges all over the Netherlands. These bridges were all examined and vibrations were measured in the field. It was possible to bring 7 of these bridges in vibration using two test methods. To be able to measure accelerations and natural frequency mobile applications were validated in a case study in Puurs Belgium with the University of Leuven. A numerical model has been built for one specific bridge with a finite element method in SOFiSTiK and validated with the information provided by FiberCore. Furthermore, a dynamic load simulating a person walking over the bridge was designed. After having validated the model calculations were made to determine the natural frequency and the accelerations of this bridge as well without as with handrails. The results were compared with hand calculation according to the calculation method of the Joint Research Centre (JRC). Significant differences between the results of the model calculation and the JRC method were found and analysed. The main conclusions of the thesis are regarding the damping factor and the results from the numerical model. The damping factor of 1.4% to 5.4% is measured for 8 FRP bridges spanning 10-25m. The assumption of 1% damping, which is often used in design verifications in engineering practice is conservative. The maximum acceleration from the numerical model, 1.22 m/s2, is higher than the 0.43 m/s2 calculated from the SDOF method from the JRC, which is used in design verifications in engineering practice. The psi factor is a very dominant reduction in the latter calculation. The author concludes with some recommendations for further research.","FRP; Dynamics; Pedestrians; pedestrian bridge; Sofistik; Numerical modeling","en","master thesis","","","","","","","","","","","","Civil Engineering","",""
"uuid:b0221d1a-c7fd-4e79-9ed5-7e84987098e5","http://resolver.tudelft.nl/uuid:b0221d1a-c7fd-4e79-9ed5-7e84987098e5","The design of a compliant shape-preserving ring","Schreurs, Koen (TU Delft Mechanical, Maritime and Materials Engineering)","Radaelli, Giuseppe (mentor); Alijani, Farbod (mentor); Delft University of Technology (degree granting institution)","2019","Compliant shape-preserving mechanisms fullfil a tiny niche within the established research field of compliant mechanisms. To date no report exists on a compliant shape-preserving ring, that is while these mechanisms can give rise to a multitude of practical applications. They can essentially act as novel sealing mechanisms, compliant grippers or find use in medical applications. <br/> This thesis presents three compliant shape-preserving rings that maintain their circular shape up to 99% for their full range-of-motion. The best design can expand in diameter by 45%. A prototype of a compliant shape-preserving ring was constructed from PETG (Polyethylene Terephtalate Glycol-modified) using fused-filament-fabrication. The experimental evaluation of this prototype showed a good agreement with the numerical model describing the design. A novel compliant scissor mechanism was obtained in the design process and this mechanism can prove useful in the design of other compliant shape-preserving mechanisms.","Compliant mechanisms; Dilational mechanisms; Shape-preservation; Flexures; shape optimization","en","master thesis","","","","","","","","2020-06-01","","","","","",""
"uuid:0b211690-00e2-4b7c-9469-bc43bcf49e7e","http://resolver.tudelft.nl/uuid:0b211690-00e2-4b7c-9469-bc43bcf49e7e","Field inversion and machine learning in turbulence modeling","van Korlaar, Arent (TU Delft Aerospace Engineering)","Dwight, Richard (mentor); Delft University of Technology (degree granting institution)","2019","Turbulence closure models will continue to be necessary in order to perform computationally affordable simulations in the foreseeable future. It is expected that Reynolds-averaged Navier-Stokes (RANS) turbulence models will still be useful with the further development of the more accurate, but computationally expensive large eddy simulation (LES), especially in industry. The use of the robust but often inaccurate linear eddy viscosity closures is still widespread in industry. More complex closure models, such as Reynolds stress models and nonlinear eddy viscosity models, provide a more general description of the underlying physics of turbulent flows. Nevertheless, because of implementational difficulties or failure to provide consistent improvements over the more robust linear models, RANS turbulence modeling is considered to have reached a plateau. In the past few years, the availability of high-fidelity datasets, the increased accuracy of machine learning algorithms, and the rise in computational power led to the proposal of several data-driven approaches to turbulence modeling. The general idea is to use experimental and high-fidelity data to develop or enhance RANS turbulence models, instead of employing an approach purely based on physics. As in any emerging field, there are many possibilities for further developing the novel approaches to data-driven turbulence modeling. Recent work combined machine learning with statistical inversion. First, a spatially varying correction is applied to the RANS model and optimized by minimizing the discrepancy between the RANS output and the data for several flows. Machine learning is used to approximate a function between a set of flow features and the inferred corrections. The aim of this work is to further investigate this methodology, called the paradigm of field inversion and machine learning, in a broader set of test cases by inferring a spatially varying correction to the production term of the ω-equation in the k−ω model and to the eigenvalues of the Reynolds stress tensor. The gradients of this high-dimensional optimization process are obtained by implementing the continuous adjoint of the k−ω model in OpenFOAM. Gaussian processes and random forests are then used to approximate a function between mean flow features and the inferred corrections. It was found that both formulations are able to accurately infer the mean velocities and related quantities of interest, but that the inferred corrective terms are often non-unique or not physically interpretable. For several flow cases, the corrective terms were able to generalize to unseen Reynolds number and flow geometries.","adjoint; machine learning; field inversion; Gaussian process; random forests; turbulence modeling","en","master thesis","","","","","","","","","","","","Aerospace Engineering","",""
"uuid:e248b77d-f524-4732-be7c-3007f5a50326","http://resolver.tudelft.nl/uuid:e248b77d-f524-4732-be7c-3007f5a50326","Conceptual development of a wedge connection for offshore jacket foundations","Slingerland, Pieter (TU Delft Civil Engineering and Geosciences)","Veljkovic, Milan (mentor); Hendriks, Max (mentor); Xin, Haohui (mentor); Creusen, Koen (mentor); Winkes, Jasper (mentor); Delft University of Technology (degree granting institution)","2019","More offshore wind projects are being developed. Shallow locations are more occupied and a tendency to deeper water and to larger wind turbines is seen. These create more bending moment which can be more easily resisted by jacket substructures. The state of the art installation process of a jacket is as follows. The foundation piles are driven into the seabed. The jacket leg is installed by sticking a stabbing cone into the stick-up length of the foundation pile and fill the space between the cone and the pile with grout. In this situation a lot of grout, steel and installation time are used. An alternative connection could be a wedge connection which is considered in this thesis. A wedge connection consists of four parts: jacket leg, connector element, wedges and foundation pile. The challenge to apply this connection to jackets is to overcome the installation tolerances. Due to the inaccuracy of the driving of the foundation piles, the holes in the jacket legs and the foundation piles do not align and the wedges cannot be installed. The installation tolerances consist mainly of center-to-center distance, pile verticality and a vertical tolerance. The maximum translational tolerances are 75 millimeter while the maximum rotational tolerance is maximum 0.83 degrees. 23 different concepts have been developed to deal with the installation tolerances. All the concepts have some drawbacks and do not fully solve the problem without downsides. The magnitude of the installation tolerances is therefore reduced and from a multi-criteria analysis a screw thread connection is proposed. The advantages of the screw thread connection are: a reduced amount of material, no grout is required and the installation time of the jacket to foundation pile connection can be reduced up to 75 percent. The screw thread connection overcomes the vertical tolerance and the tolerance around the longitudinal axis of the foundation pile by rotation of the connector element. In case of an pile inclination, the connector element and the foundation pile do not fully align and a gap remains in between them. By applying a preloading force to the connection it is still not possible to close this gap. The space between the connector element and the foundation pile has to be filled with an epoxy resin. The screw thread connection does fulfill the requirements for the ultimate limit state based upon hand calculations for net stresses, bending stresses and contact stresses. The fatigue limit state of the wedge connection meets the requirements. Only the fatigue limit state of the screw thread does not fulfill the requirements based upon a hand calculation. The three largest issues of the screw thread connection are the fabrication of the screw thread profile, the fatigue in the screw thread and the installation of the epoxy resin between the connector and the foundation pile. The first step to develop the screw thread connection further is an more extensive investigation to these three issues.","Jacket structure; Wedge connection; offshore","en","master thesis","","","","","","","","2024-02-22","","","","Civil Engineering","",""
"uuid:347c4509-16bc-4728-acb2-32a8ccec1c10","http://resolver.tudelft.nl/uuid:347c4509-16bc-4728-acb2-32a8ccec1c10","Active Change of Permeable Material Properties for Low-Noise Trailing Edge Applications","Mayer, Jonathan (TU Delft Aerospace Engineering)","Ragni, D. (mentor); Kotsonis, M. (graduation committee); van der Zwaag, S. (graduation committee); Rubio Carpio, A. (graduation committee); Delft University of Technology (degree granting institution)","2019","For many aerospace applications, the dominant airfoil self-noise source is Turbulent Boundary Layer Trailing Edge (TBL-TE) noise. The replacement of solid airfoil trailing edges with permeable materials proved to be an adequate noise reduction mean in previous studies. This thesis project contributes to the development of innovative permeable materials by assessing the feasibility of actively influencing their noise mitigation characteristics. The proposed activation mechanism consists of heating up a polymerically coated, porous trailing edge and thereby influencing the material geometry and seepage fluid properties. Heating of the polymeric coating layer led to slightly decreasing pore diameters due to thermal expansion. The main limitation of actively changing the porous material geometry on a pore-scale level was the restriction of the coating layer thickness. Heating effects on the seepage flow through porous metal foams were analyzed experimentally. Characteristic material parameters, namely flow resistivity, permeability and form coefficient, were measured for varying fluid temperatures and it was shown that for low seepage velocities, the pressure communication across the material was negatively affected upon heating. The feasibility of actively changing far-field noise characteristics was demonstrated based on acoustic measurements in an anechoic wind tunnel. Increasing sound pressure levels were observed for both, coated and uncoated porous trailing edges upon heating. It is concluded that the dominant activation effect was the reduced communication across the porous trailing edge due to an increase in fluid temperature. The expansion of polymeric coating was not sufficient to alter the noise mitigation behavior of the porous trailing edge. Furthermore, no interactions between turbulent boundary layer wall pressure fluctuations and the soft coating layer were observed. However, it was shown that temperature control of the porous material offers a possibility to actively influence flow resistivity without modifying the geometrical structure.","porous material; trailing edge noise; polymeric coating; airfoil self-noise; trailing edge heating; aeroacoustic; permeable material","en","master thesis","","","","","","","","","","","","Aerospace Engineering","",""
"uuid:43801e38-9a89-4f54-9e2f-8c8ef8c2d8a8","http://resolver.tudelft.nl/uuid:43801e38-9a89-4f54-9e2f-8c8ef8c2d8a8","New Intersection Control for Conventional and Automated Vehicles without Traffic Lights: A combination of individual control and self-regulation","Cristofoli, Anna (TU Delft Civil Engineering and Geosciences)","Hoogendoorn, S.P. (mentor); Knoop, V.L. (graduation committee); Spaan, M.T.J. (graduation committee); Delft University of Technology (degree granting institution)","2019","This thesis aims to develop a novel control strategy that efficiently controls traffic with different penetration rates by relying purely on wireless communication to integrate the control of automated and human drivers. The new strategy uses the concept of induced platooning to use automated vehicle to indirectly control conventional vehicles. The control of these induced platoons is based on the combination of self-regulation and individual trajectory control. Results show that the new strategy is able to efficiently coordinate vehicles at an intersection and it can be considered as candidate solution to manage traffic during the transition phase where conventional and automated vehicles coexist.","","en","master thesis","","","","","","","","","","","","Civil Engineering | Transport and Planning","",""
"uuid:6adba014-b8b4-41ad-8e9e-2e7bef9bed86","http://resolver.tudelft.nl/uuid:6adba014-b8b4-41ad-8e9e-2e7bef9bed86","Cascade Anaerobic Digestion to enhance Waste Activated Sludge Degradation","Nair, Revathy (TU Delft Civil Engineering and Geosciences)","de Kreuk, M.K. (mentor); Guo, H. (mentor); van Lier, J.B. (graduation committee); Hagedoorn, P.L. (graduation committee); Tonin, F. (graduation committee); Delft University of Technology (degree granting institution)","2019","Large amounts of residual waste activated sludge are produced as by-products during biological wastewater treatment processes. Anaerobic digestion is a widely accepted stabilisation method for waste activated sludge (WAS) treatment. However, the application of anaerobic digestion is limited by the long retention time and low degradation efficiency of compounds. Structural extra cellular polymeric substances (EPS) are metabolic products released by microorganisms that play an important role in the disintegration of sludge structure. The limitations in anaerobic digestion mentioned above pertain to the hydrolysis step in anaerobic digestion. The cascade reactor (cascade AD) system i.e. continuous stirred tank reactor (CSTR) in series, is a robust reactor system that is expected to enhance the hydrolysis step and to show a superior performance at low solid retention time compared to a conventional CSTR. <br/>This research is aimed at observing the difference in performance of cascade AD and a conventional CSTR at shortened retention time. Various indicators were used to understand the performance enhancement of a cascade AD in comparison to a conventional CSTR. Moreover, the degradation of structural EPS by selected enzyme groups such as protease, cellulase and polygalacturonase were also studied. <br/>The cascade AD showed better performance than a conventional CSTR at a retention time of 22 and 15 days. This improved performance was enabled by the smaller reactors in cascade AD that provided higher hydrolysis rate. Higher removal efficiency of protein, carbohydrate and structural EPS was observed in cascade AD. Improved ammonium and phosphate release were also indications of better performance of cascade AD. Although the mass balance in nitrogen was maintained in the reactor system, phosphorous mass balance indicated possibilities of precipitation. <br/>The batch tests performed with the enzyme protease, cellulase and polygalacturonase were aimed at understanding the degradation of SEPS. It was inferred from the test that volatile suspended solids proved to be a better indicator for solubilisation compared to COD and ammonium concentration. Protease showed higher solubilisation compared to cellulase and polygalacturonase. Particle size distribution did not indicate a significant difference upon the addition of all three enzyme groups; indicating that a significant change in structure was not caused by the enzymes. Hydrolysis kinetics and SEPS degradation could not be derived from the test because of the variations in results based on the substrates used. Nevertheless, the tests proved to be useful in improving methodology for deriving hydrolysis kinetics of WAS. <br/>In conclusion, the novel cascade AD showed better performance at shortened retention time. The system also showed stable performance despite the shortened retention time compared to a conventional CSTR. Thus, the stable performance suggests the opportunities to further lower the retention time in cascade AD.","Cascade system concept; Anaerobic Digestion; waste flocculent activated sludge (WAS)","en","master thesis","","","","","","","","2021-02-20","","","","Civil Engineering | Environmental Engineering","",""
