"uuid","repository link","title","author","contributor","publication year","abstract","subject topic","language","publication type","publisher","isbn","issn","patent","patent status","bibliographic note","access restriction","embargo date","faculty","department","research group","programme","project","coordinates"
"uuid:a1b5b764-0ba0-42d1-8918-3e681a24a4a1","http://resolver.tudelft.nl/uuid:a1b5b764-0ba0-42d1-8918-3e681a24a4a1","Towards an Antarctic meteorite hotspot map","Tollenaar, Veronica (TU Delft Civil Engineering and Geosciences)","Zekollari, Harry (mentor); Lhermitte, Stef (mentor); Tax, David (graduation committee); Lindenbergh, Roderik (graduation committee); Delft University of Technology (degree granting institution)","2020","Meteorites contain information on the formation and evolution of the Solar System. Antarctica is the most productive region for collecting meteorites, as the visually contrasting meteorites are easily detectable and tend to concentrate at specific areas exposing blue ice. Blue ice areas act as meteorite stranding surfaces (MSSs) if the flow of the ice sheet and specific geographical and climatological settings combine favorably. Previously, possible meteorite stranding surfaces were identified by chance or through visual examination of remote sensing data, which have limitations in discovering new locations for future meteorite searching campaigns. In this study, datasets are combined in a novel machine learning approach in order to estimate the likeliness of a blue ice area to be a meteorite stranding surface. Input data consists of positive and unlabeled observations. The ca. 2,500 positive observations are defined as the centers of regularly spaced grid cells containing one or more meteorite finds. The ca. 2,000,000 unlabeled observations, for which the presence of meteorites is unknown, are defined as the centers of regularly spaced grid cells overlaying blue ice areas. The size of a grid cell is 450 by 450 meter. Features of the observations, such as the surface velocity, the surface temperature, and the ice thickness, are extracted from geospatial datasets. Individual features and correlations between features indicate that positive observations differ from unlabeled observations.<br/><br/>The unlabeled observations are classified as MSS or non-MSS by training a classifier with the nontraditional training set consisting of positive and unlabeled data. The obtained classification is validated and evaluated quantitatively with positive and negative observations, where the latter are defined after investigating fieldwork reports. With an estimated accuracy of 80%, the classification shows promising results. The influence of the different features on the classification does confirm the current, qualitative, understanding of the meteorite concentration mechanism and provides a quantification of how individual features affect the meteorite concentration. In the visualization of the as MSS-classified observations, the probabilistic character of the obtained results is considered by using a color scale ranging from yellow to red. These colors indicate how likely it is to find meteorites at a MSS-classified observation (i.e. the precision of the classification). This leaves the interpretation of the obtained meteorite hotspot map to the user.<br","Antarctica; meteorites; Remote sensing; Big Data Analysis; Machine Learning","en","master thesis","","","","","","","","","","","","","",""
"uuid:138874fa-32d2-4319-80fa-c089c3feef72","http://resolver.tudelft.nl/uuid:138874fa-32d2-4319-80fa-c089c3feef72","Hybrid boiler systems in the Dutch industry: A techno-economic analysis of the potential of hybrid boiler systems to cost-effectively decarbonise steam generation in the Dutch industry","Abdallas Chikri, Yasmine (TU Delft Electrical Engineering, Mathematics and Computer Science; TU Delft Technology, Policy and Management)","Ramirez Ramirez, Andrea (graduation committee); Cvetkovic, Milos (graduation committee); Stikkelman, Rob (graduation committee); Chakraborty, Shantanu (mentor); Gusain, Digvijay (mentor); Delft University of Technology (degree granting institution)","2020","The Netherlands aims to accelerate the energy transition. Accordingly, ambitious targets have been set for the industrial sector. This will require additional investments in the Dutch industry which is expected to reduce the CO2 emissions at limited costs in comparison with other sectors. However, the ambition to reduce the emissions can create a risk of loss of activity and jobs if the industrial businesses prospects are not ensured. Power-to-heat technology provides an opportunity to the industry to reduce the emissions for heating processes. This technology can be implemented in hybrid configurations to ensure the electrification of heat. Hybrid configurations are characterised by their ability to switch between natural gas and electricity which could cost-effectively reduce the emissions consuming electricity at low prices. In this research, a techno-economic evaluation of hybrid boiler systems is performed to analyse the potential of this technology to cost-effectively reduce the CO2 emissions for steam generation in a production process, in 2030. To this end, the operation of hybrid boiler systems was simulated and assessed. The performance of hybrid configurations was compared to alternative options. Finally, the hybrid systems were analysed under different scenarios for 2030. The results for the case study presented, showed that hybrid configurations saved operation costs and reduced the direct CO2 emissions by almost 20%. Therefore, the hybrid boiler could cost-effectively reduce the emissions. However the potential benefits of hybrid boilers are subjected to variation of electricity, natural gas and CO2 prices.","Hybrid Boilers; Power-to-heat; Industry; Emissions Reduction; Renewable Energy; Techno-economic analysis; Electricity Prices; 2030","en","master thesis","","","","","","","","","","","","Electrical Engineering | Sustainable Energy Technology","",""
"uuid:ae191dad-e925-481e-89e1-061d3271c921","http://resolver.tudelft.nl/uuid:ae191dad-e925-481e-89e1-061d3271c921","Process Chain Development of a ReSOC System with ammonia as fuel and steam electrolysis","Amladi, Amogh (TU Delft Mechanical, Maritime and Materials Engineering)","Aravind, P.V. (mentor); van Wijk, Ad (graduation committee); Boersma, Bendiks Jan (graduation committee); Posada Duque, John (graduation committee); Woudstra, Theo (graduation committee); Ramdin, Mahinder (graduation committee); Delft University of Technology (degree granting institution)","2020","Energy storage systems are an emerging field of interest for the future of electrical grids. With the rapid growth of renewable but intermittent sources of electricity, energy storage systems can help smooth the variations, making the grid more stable and reducing the need for maintaining an overcapacity of power production infrastructure. Among energy storage solutions, power-to-chemical storage is of particular interest due to the high energy density of chemicals and seasonal storage capabilities. Developments made in power-to-chemical technologies can also go a long way towards making the transportation and chemical industries sustainable. The chemical considered in this work is ammonia (NH3), which has advantages of being an easily liquefiable fuel, and has also been in industrial use for over a century. This thesis project aims towards the development of an efficient power-to-ammonia energy storage system using reversible solid oxide cells. The system designed in this thesis is based on direct ammonia utilisation in fuel cell mode, and steam electrolysis coupled with Haber-Bosch ammonia synthesis in the electrolysis mode. A steady state process model is designed in Aspen Plus. This is followed by extensive thermodynamic exergy analysis, used as the basis for the further design and optimisation of the system, with a goal to maximise the round trip efficiency. Exergy analysis is used to identify the sources with most scope for improvement.<br/> The final system can attain a maximum round trip efficiency of 61.20 %, improved from a basic system efficiency of 19.79 %. The maximum round trip efficiency is comparable to values reported in recent times for thermodynamically studied models from literature using other fuels, such as 56.72 % for methanol. The optimised system attains high efficiencies without the need for thermal energy storage or an afterburner. Further, it is demonstrated that the designed system is efficient enough that heat integration across modes with high temperature energy storage does not provide any significant benefit.","Energy storage; Reversible solid oxide cells; Solid oxide fuel cells; Ammonia; Reversible fuel cells; High temperature electrolysis","en","master thesis","","","","","","","","2021-02-25","","","","","Balance Project",""
"uuid:bbf91c8c-80e0-4395-8f7e-935a282a7690","http://resolver.tudelft.nl/uuid:bbf91c8c-80e0-4395-8f7e-935a282a7690","Supporting Discovery Learning in Air Traffic Control through Ecological Interfaces","Stoof, Jennifer (TU Delft Aerospace Engineering)","Borst, C. (mentor); Mulder, Max (graduation committee); Delft University of Technology (degree granting institution)","2020","In an effort to further evaluate the effects of Ecological Interface Design on acquiring expertise, this paper presents the results of an investigation into how Ecological Interface Design could possibly promote discovery learning processes in the Air Traffic Control domain through the application of an instructional design model, and how it could thereby support novices in picking up an implicit rule of thumb. A between participants experiment (N = 28) was performed through which participants, divided over two groups, were guided by means of a training script developed according to the Four-Component Instructional Design model. Participants from both groups had to perform a simplified Conflict Detection &amp; Resolution task in which the rule of thumb was implicitly integrated. In addition, one group received additional support from an ecologically designed cognitive tool that was unexpectedly removed after a transfer manipulation. Results show that applying an instructional design method to the experiment design indeed leads to a more structured learning process and participants making significantly more use of optimal strategies, corresponding to the execution of the rule of thumb. Additionally, being trained with the cognitive tool leads to an increased awareness of the implicit rule of thumb but does not lead to an increased use of this rule. It was furthermore found that participants, who were trained with the tool, showed increased dependency on this tool. It is therefore recommended to further extend the experiment design and investigate whether including additional instructional design elements, such as phased visual elimination of the elements of the cognitive tool, could reduce participants’ dependency.","Air Traffic Control; Ecological Interface Design; Solution Space Diagram; Air Traffic Control Training; Conflict Detection & Resolution; Instructional Design; Discovery Learning; Cognitive Tools; Air Traffic Control Strategies; Competencies; Learning Tasks; Scaffolding; Transfer of Learning","en","master thesis","","","","","","","","2023-02-25","","","","Aerospace Engineering","",""
"uuid:00cccde4-30c4-4548-a980-0cbcdfbcc705","http://resolver.tudelft.nl/uuid:00cccde4-30c4-4548-a980-0cbcdfbcc705","Diffusion MRI case study in epilespy: A Hemispheric Regional Based Analysis of Diffusion Tensor Imaging, Tractography and Connectome in patients with Focal and Genetic Generalised Epilepsy","Hogenhuis, Kiki (TU Delft Mechanical, Maritime and Materials Engineering)","van der Helm, Frans (mentor); Manoochehri, Mana (graduation committee); Visser, Gerhard (graduation committee); Delft University of Technology (degree granting institution)","2020","Background: Imaging in the field of epilepsy has been a lasting challenge. In genetic generalised epilepsy (GGE) patients, conventional neuroimaging methods such as the MRI often appear normal and even in focal epilepsy (FE) an obvious structural abnormality is not always visualised. The objective of this exploratory case study is to identify white and grey abnormalities in epilepsy patients based on diffusion weighted imaging in comparison with healthy subjects. <br/>Methods: Diffusion tensor imaging (DTI) and diffusion tensor tractography (DTT) at 3 Tesla is performed on 2 genetic generalised epilepsy patients, 1 focal epilepsy patient and 2 healthy subjects. Four DTI metrics (Fractional Anisotropy (FA), Mean Diffusivity (MD), Radial Diffusivity (RD) and Axial Diffusivity (AD) are compared based on the mean per region of interest between subjects and between hemispheres. A DTT map of the thalamo-cortical radiations is constructed based on a probabilistic tractography (iFOD2) as implemented in MRTrix. Based on this data the structural connectivity matrix is generated. A graph theoretical analysis is performed comparing node degree, global and local efficiency, characteristic path length, (average) clustering coefficient and (average) betweenness centrality. Constructed connectomes are compared for significant different connections between nodes using network based statistics. <br/>Results: Decreased FA and MD values are reported in the hippocampus of the FE patient. DTT showed decreased tract density in the thalamo-cortical radiations in one of the GGE patients and the FE patient, together with a decreased mean streamline length compared to the two healthy subjects, which can be interpreted as a reduced structural connectivity. Structural connectivity is decreased in the FE patient compared to the other four subjects based on graph analysis. This is demonstrated by the relatively high average clustering coefficient and characteristic path length, together with a low node degree, high local efficiency and high clustering coefficient in the thalamus, the basal ganglia and the hippocampus. Conclusion: These results are potentially of aid in identification of white and grey matter abnormalities in epilepsy patients. Especially in the FE brain several abnormalities in both DTI, DTT and graph analysis are observed compared to the healthy and GGE brain. However, for the use of DTI, DTT and graph analysis as a possible imaging biomarker, a standard processing pipeline with validated reference values ranges from the healthy population needs to be developed. Also the biological interpretation of changes in network measures needs to be validated.","Epilepsy; Diffusion MRI; Structural connectivity; Tractography","en","master thesis","","","","","","","","","","","","","VBMEG project",""
"uuid:ec05b5fa-d269-435c-9eaa-fbcbe772bb1e","http://resolver.tudelft.nl/uuid:ec05b5fa-d269-435c-9eaa-fbcbe772bb1e","Iron and arsenic removal in triple- and single-bed filters: The effect of pH, filtration velocity and filtrate recirculation","Flambouris, Stelios (TU Delft Civil Engineering and Geosciences; TU Delft Water Management)","Rietveld, L.C. (mentor); de Ridder, David (graduation committee); van Halem, Doris (graduation committee); Delft University of Technology (degree granting institution)","2020","Arsenic in groundwater can constitute a persistent nuisance for water treatment facilities when it exceeds the admissible limit of 10 μg/L. Recently, a stricter limit has been set as a new challenging target by many companies in the Netherlands, which is below 1 μg/L. However, most of the groundwater treatment plants have been conventionally designed solely for the removal of the most common undesirable groundwater constituents, namely iron, manganese and ammonium. The current research aimed at the investigation of the operational conditions facilitating As removal in biological rapid filters simultaneously with the required Fe removal. This improved As retention should be correlated with an extended length where its adsorption takes place, thus with the deeper Fe penetration inside the bed. Therefore, this was attempted in this research. The process water used throughout the experimental tests contained As(III) and Fe(II) in order to simulate a typical anoxic groundwater quality. For the most part, a triple-layer filter bed was used, consisted of anthracite, sand and garnet. The different settings under examination involved a range of pH values (7.8, 7.1 and 6.4), two filtration velocities (2.5 m/h and 5 m/h) as well as the recirculation of the filtrate back to the feed stream. Finally, the multimedia bed was compared with a single-layer sand filter. <br/> The results of the conducted pilot column filter experiments revealed that high pH values were accompanied with high oxidation rates and thus with the creation of Fe flocks, already in the supernatant water. Due to this, at pH 7.8 and 7.1 lower Fe concentrations were detected in the effluent, denoting a higher Fe retention as compared to pH 6.4. Interestingly enough, a relatively deep Fe penetration was observed for every pH value tested. Regarding As removal, it was evidently favored by high pH values owing to the oxidation-floc formation removal mechanism of Fe (homogeneous reaction), which prevailed under those conditions. On the other hand, at pH 6.4 the adsorption-oxidation mechanism was predominant (heterogeneous reaction), which obstructed the AsOB activity. As far as the tested filtration velocities is concerned, they didn’t seem to significantly impact both Fe spread over the bed as well as As removal at the higher pH levels. Nonetheless, this was not the case for pH 6.4, in which the slow flow rate enabled the generation of more and larger Fe flakes (due to sufficient residence time in the supernatant water), which were then retained in the top part of the bed. The high flow rate on the other hand allowed Fe to reach deeper in the filter. Surprisingly, As removal seemed to be improved at 2.5 m/h, despite the Fe flocks accumulation in the upper layers. Possibly, the short experimental times not allowing equilibrium to be reached could comprise a reasonable explanation of this unexpected result. Furthermore, the filtrate recirculation stream didn’t seem to positively influence As removal. The induced dilution effect resulted in a relatively large dispersion of Fe inside the filter bed, however the essentially halved incoming Fe concentration was not sufficient to adsorb the oxidized As(V). Finally, the comparison between the multimedia bed with the single-layer filter reveals a considerably wider Fe dispersion over the bed height in the former case, which in its turn promotes a more efficient As removal. The overall conclusion of the current study is that triple-layer bed filters facilitate a more gradual Fe removal and its deeper penetration in the bed as compared to single-layer filters. This fact stimulates As removal and additionally allows for longer filter run times. Moreover, heterogeneous Fe removal seems to obstruct As oxidation by AsOB and therefore homogeneous reaction can be considered as more favorable in terms of As removal. This specific removal mechanism becomes predominant at pH levels above 7, when sufficient oxygen is available. Lastly, the operational setting of filtrate recirculation back to the filter inlet, displays a negative impact regarding As removal.","Multimedia filtration, Arsenic removal, Iron removal,","en","student report","","","","","","","","","","","","Civil Engineering","",""
"uuid:ca303498-be53-4c8b-bd87-a6ee8b2ab724","http://resolver.tudelft.nl/uuid:ca303498-be53-4c8b-bd87-a6ee8b2ab724","Aerodynamic interaction effects present in tiltable over-the-wing propeller systems: A numerical study","Bölk, Sören (TU Delft Aerospace Engineering)","Veldhuis, Leo (mentor); de Vries, Reynard (graduation committee); Delft University of Technology (degree granting institution)","2020","This thesis studies the aerodynamic interaction effects in an over-the-wing (OTW) propeller system to contribute to the development of OTW propeller systems intending at reducing emissions. Previous research shows that an OTW propeller can affect the pressure distribution of the wing such that lift increases and pressure drag decreases. However, studies on the influence of the blade tip vortices on flow separation on a flap due to their interaction with the wing boundary-layer are missing. The results obtained from unsteady RANS simulations in this thesis show that the blade tip vortices significantly contribute to flow separation by causing an additional adverse pressure gradient. To prevent flow separation, the propeller can be inclined with the flap such that the slipstream increases the momentum in the flap boundary-layer. Furthermore, an increase in propulsive efficiency compared to a decoupled propeller-wing system can be achieved if a reduction in propeller thrust is prevented.","","en","master thesis","","","","","","","","","","","","Aerospace Engineering","",""
"uuid:ec5c0fff-54d1-4cf3-a3e2-fef2b38c3f2c","http://resolver.tudelft.nl/uuid:ec5c0fff-54d1-4cf3-a3e2-fef2b38c3f2c","Mimetic Discretization of the High Frequency Helmholtz Equation using Hermite Interpolating Polynomials","Lok, Peter (TU Delft Aerospace Engineering)","Gerritsma, Marc (mentor); Delft University of Technology (degree granting institution)","2020","Numerical modelling of high frequency waves is a complex and challenging area. Although the underlying equation seems simple, −∆φ − k2φ = f, the numerical challenges are not. This time harmonic wave equation is known as the Helmholtz equation. The main challenge to be studied is the pollution error, which is the difference between the actual and numerical wavenumber. Due to this error, the solution of most numerical methods deteriorates rapidly when increasing the wavenumber. So far, either problem specific solutions have been found or solutions which require knowledge of the solution itself. In this thesis a numerical method is developed to approach this challenge. A mimetic discretization of the Helmholtz equation using C1-continuous Hermite interpolating polynomials is developed to model the Helmholtz equation in 2 dimensions. Mimetic theory is briefly introduced after which the Hermite polynomials are defined and analysed for their interpolating properties. A least-squares variational problem is defined and discretized using 49 basis function at its lowest order. The model is verified using a single sinusoidal wave after which<br/>plane wave problems are solved and analysed for their wavenumber-dependence. A diffraction and interference problem is set-up and compared to analytical solutions. The proposed method shows no significant advantages over the use of C0-continuous Lagrange polynomials in terms of effectiveness. Both methods show deterioration at the same wave numbers and equal polynomial order. The Hermite polynomials require less unknowns to reach the same accuracy. In short, a p-accurate solution is found using Hermite polynomials<br/>at the cost of a p − 1 model using Lagrange polynomials. This benefit in efficiency does not outweigh the additional effort and boundary information necessary to construct the problem. However, the variety of coefficients offer an opportunity for further research to find relations to the numerical wavenumber in the search of a wavenumber conserving discretization.","mimetic discretization; Helmholtz equation; Hermite polynomials","en","master thesis","","","","","","","","","","","","Aerospace Engineering","",""
