"uuid","repository link","title","author","contributor","publication year","abstract","subject topic","language","publication type","publisher","isbn","issn","patent","patent status","bibliographic note","access restriction","embargo date","faculty","department","research group","programme","project","coordinates"
"uuid:de176138-2620-498d-91da-f5f727388287","http://resolver.tudelft.nl/uuid:de176138-2620-498d-91da-f5f727388287","""Precise Monitoring of Horizontal Displacement of Large-Scale Structures using Low-Cost Dual Frequency GNSS Receivers""","Lăpădat, Alexandru Mihai (TU Delft Civil Engineering and Geosciences; TU Delft Geoscience and Remote Sensing)","Tiberius, Christiaan (mentor); Veljkovic, Milan (graduation committee); Delft University of Technology (degree granting institution)","2020","Under urban sprawl the trend of new established complex structures has rapidly increased. In this context maintenance plays a major role and monitoring of such structures represents a first important step in combating disasters. Over the last years low-cost Global Navigation Satellite System (GNSS) equipment has faced rapid and important development opening a new door to reliable and high accurate positioning applications such as structural health monitoring. This study presents a methodology for gathering, processing and analysing 1 Hz dual frequency GNSS data acquired by a network of newly released low-cost dual frequency GNSS receivers installed on a 90 metres tall steel-concrete structure in order to sense possible wind-induced displacements. At the same time, it represents one of the first studies testing the positioning capabilities of low-cost dual frequency GNSS equipment for monitoring large-scale building infrastructure. The main tools exploited in this study are PPK relative positioning together with a multipath correction procedure based on GPS satellite constellation repeatability. In addition to these, several corrections are discussed and applied on the position estimates in order to achieve millimetre position accuracy, highly needed for sensing wind-induced displacements of large-scale structures. By artificially inducing some horizontal deformations it was found that the newly released low-cost dual frequency GNSS receiver can track centimetre order permanent deformations of tall buildings. In the context of not being able to identify strong statistical correlation between possible wind-induced deformations of the case study building and and wind data patterns, the study proves that wind-induced deflections of tall structures might be traceable only if they are larger than the magnitude of the carrier phase multipath effect that is “leaking” in the position estimates.","Low-cost GNSS; Structural Health Monitoring; Multipath; Wind-induced Deformations; Sidereal Day Repeatability; Satellite Geometry","en","student report","","","","","","","","","","","","Geoscience and Remote Sensing","","51.999059, 4.373468"
"uuid:df9f858f-cb75-47f8-8342-a64da55f0f5f","http://resolver.tudelft.nl/uuid:df9f858f-cb75-47f8-8342-a64da55f0f5f","Buckling analysis of sandwich composite cylindrical-conical shells","Bolton, Tara (TU Delft Aerospace Engineering)","Bisagni, Chiara (mentor); Delft University of Technology (degree granting institution)","2020","Cylindrical shells and conical shells have been analysed and tested separately for the last decade. However, due to new manufacturing techniques and the use of composite material systems more complex structures can be made. By combining a cylindrical shell and a conical shell one structural component can be created: a cylindrical-conical shell. This is a potential design solution for launch vehicle structures, but there is limited research available about it. Not much is known about the buckling behavior or imperfection sensitivity of these structures, especially not for sandwich composite shells. The objective of this research is to understand these two phenomena in cylindrical-conical structures, considering a sandwich composite. The buckling behavior is studied by using finite element analysis and the behavior of the individual shells are compared to the combined structure. Different shell geometries such as height of the cone, angle of the cone, and radius of curvature at the transition are considered. The imperfection sensitivity of the different shells is investigated by adding axisymmetric and eigenmode imperfections using different amplitudes. The results indicate that the buckling behavior of the individual components without initial imperfections can be captured by the linear eigenvalue analysis as well as by a postbuckling analysis using a dynamic implicit solver with non-linear geometry enabled. In case of the cylindrical-conical shell, the linear eigenvalue analysis is not able to capture the buckling shape and results in an overpredicted buckling load. This can be explained by the non-linear behavior at the transition area before buckling that can be observed in the dynamic implicit analysis. This non-linear behavior before buckling is mitigated when a reinforcement or radius of curvature is added to the cylinder to cone transition region. A similar sensitivity to geometrical imperfections is observed for the cylindrical shell and conical shell. The cylindrical-conical shell has a much lower sensitivity, because the non-linear behavior at the transition region is dominating the buckling behavior of the whole structure. The results obtained from the thesis show the importance of the non-linear behavior at the transition for the sandwich composite cylindrical-conical shell. This means that for further research it is important that the non-linear effects are included when analysing such a structure.","","en","master thesis","","","","","","","","","","","","Aerospace Engineering","",""
"uuid:1ba166c4-2656-4f39-a250-eec61258838c","http://resolver.tudelft.nl/uuid:1ba166c4-2656-4f39-a250-eec61258838c","Predicting the sea surface from high resolution multi-beam FMCW radar data","van der Geugten, Gerald (TU Delft Electrical Engineering, Mathematics and Computer Science)","Heemink, Arnold (mentor); van der Vlugt, Rolf (mentor); Dubbeldam, Johan (graduation committee); van Gijzen, Martin (graduation committee); Delft University of Technology (degree granting institution)","2020","In this thesis a deterministic wave model is used to reconstruct and predict the sea surface motion from FMCW (Frequency Modulated Continuous Wave) radar data, produced by Radac. The deterministic model that is used to do this is based on the linear wave theory. The radar is looking horizontally straight towards the waves in 5 separate beam directions of -40,-20,0, 20 and 40 degrees. Using the FMCW principle the backscatterd signal is converted into velocity and spatial range information. After some compensations (current for example) this velocity data can be treated as horizontal component of the orbital velocity of the wave. By using a least-squares solving approach (the trust-region reflective algorithm) on these orbital velocities and the expression that holds for them in the linear wave theory the model can be fitted to the measurements. The result of the least squares solver consists of a set of parameters for wave amplitude, phase and frequency. With these parameters the deterministic motion of the sea surface can be computed. This method is tested using artificial data and a generalized one directional case (using information from 1 beam under assumption of infinitely long-crested waves). For the experiments with artificial data consisting of waves with Hs = 2 meters (significant waveheight) the results are promising. A prediction time of 30 seconds over a range of 150 meters with an average error of 15 cm in the one directional model (fitted on 10 second data over 384 meters) can be achieved. For the multi directional model this lies between 20 and 30 seconds with an average error of 25 cm, depending on the spreading of the waves. Experiments with real data show less impressive results, an accurate reconstruction of the surface can be given, but the predictive capability is very limited.","FMCW radars; Sea Modelling; Inverse Modelling","en","master thesis","","","","","","","","","","","","Applied Mathematics | Applied Physics","",""
"uuid:9f8056e6-cfdf-4240-99e3-5f45947d1fa7","http://resolver.tudelft.nl/uuid:9f8056e6-cfdf-4240-99e3-5f45947d1fa7","Reproducing state-of-the-art schema matching algorithms","Ionescu, Andra (TU Delft Electrical Engineering, Mathematics and Computer Science; TU Delft Web Information Systems)","Lofi, C. (mentor); Houben, G.J.P.M. (graduation committee); Katsifodimos, A (graduation committee); van Deursen, A. (graduation committee); Delft University of Technology (degree granting institution)","2020","Schema matching has been a researched topic for over 20 years. Therefore, many schema matching solutions have been proposed to treat various problems such as: creating unified knowledge bases or mediation schema, data translation, data discovery, data curation. Such a wide variety of schema matching algorithms requires a benchmarking system that can evaluate to what extent one solution is appropriate for a given problem. However, creating the benchmark requires open source algorithms, which are not widely available in the data management community. One solution to this problem is reproducing the algorithms, although there is a reproducibility crisis which proves that the majority of existing research can not be reproduced. These circumstances have determined the goal of this research: conducting a reproducibility study on the state-of-the-art schema matching algorithms. This study supports the schema matching development and emphasizes the issues regarding the ability to reproduce the algorithms or the results. Moreover, we implement the selected algorithms and benchmark them in an industry case study.","schema matching; reproducibility; Data Management","en","master thesis","","","","","","","","","","","","Computer Science | Software Technology","",""
"uuid:972caf56-3621-414b-a582-2561e2a5ff54","http://resolver.tudelft.nl/uuid:972caf56-3621-414b-a582-2561e2a5ff54","Reduced Order Model Base Creation with Bayesian Optimization","Turan, Taylan (TU Delft Civil Engineering and Geosciences)","van der Meer, Frans (mentor); Rocha, I.B.C.M. (graduation committee); Bessa, Miguel (graduation committee); Delft University of Technology (degree granting institution)","2020","This research considers the offline training stage of the Reduced Order Models (ROM), that has been getting attention recently on the endeavor to come up with efficient solutions for the highly complex numerical models. In this work, a simply supported beam problem has been considered, for which a reduced basis creation has been investigated. Reduced basis creation is in utmost importance for the accuracy and reliability of the ROM. Main focus is on the efficient parameter sampling strategies to enrich the reduced basis, which brings forth computational burden. To decrease this burden, a statistical tool Gaussian Processes Regression (GPR) based Bayesian Optimization (BO) is utilized. These tools are used to create a surrogate function of error indicator that is used to select additional training points for ROM. Results of this work show that randomness in the proposed procedure influences parameter sampling but does not have an impact on the overall accuracy. Finally, this work suggests further work on creation of a stopping criteria and finding a method of storing previous information and combining it with current information regarding training points without losing information. With the help of proposed further research topics, this work intends to be used as a foundation for efficient reduced basis construction.","Bayesian Optimization; Reduced Order Model; Gaussian Process","en","student report","","","","","","","","","","","","","",""
"uuid:54b7e786-3802-496d-8c0a-f9d9f331995d","http://resolver.tudelft.nl/uuid:54b7e786-3802-496d-8c0a-f9d9f331995d","Measuring the transmission yield of ultra-thin membranes","Looman, B.A. (TU Delft Applied Sciences)","van der Graaf, H. (mentor); Delft University of Technology (degree granting institution)","2020","The goal of this research is to characterize thin membranes used as transmission dynodes (tynodes) for electron multiplication. A stack of tynodes could be used in a novel ultra fast soft photon counter. A combination of a charge sensitive TimePix1 CMOS chip and a pulsed electron gun were used as part of a setup deemed Tytest. The pixel chip was calibrated using a surrogate function that is fitted to the single pixel responses of 76 different pixels. The calibration is used to perform Transmission Secondary Electron Yield (TSEY) measurements on a 20 nm thick alumina membrane. The maximum TSEY value observed is 2.76 ± 0.64 for a incident energy of 1675 eV. The maximum TSEY value seems to be at higher incident energies which cannot be reached using our setup. A unexplained spread in electrons being emitted by the tynode is observed. <br/>The second part of this research was to create a stack of tynodes which can be used to convert a single electron into a measurable signal. The goal is to stack the tynodes using a self aligning mechanism and measure the misalignment. A ZEISS Axio-zoom V16 light microscope in combination with two µm precision manipulators placed in a clean room at Nikhef in Amsterdam is setup in this research used to stack tynodes. The aim was to have a misalignment better than 5 µm, and this setup a misalignment of 4.1±1.3 µm was measured. It’s important to note that only the misalignment between two tynodes is measured, since no more were readily available.<br","Photon counter; electron multiplication; timing detectors; Dynodes and Tynodes","en","master thesis","","","","","","","","","","","","Applied Physics | Imaging Physics","",""
"uuid:b30d3040-541a-41a8-9d56-0c4fb9baf332","http://resolver.tudelft.nl/uuid:b30d3040-541a-41a8-9d56-0c4fb9baf332","Bottom-up manufacturing of nanocrystalline diamond micro structures and components","Versluis, Floyd (TU Delft Mechanical, Maritime and Materials Engineering; TU Delft Precision and Microsystems Engineering)","Buijnsters, J.G. (mentor); Staufer, U. (graduation committee); Norte, R.A. (graduation committee); Delft University of Technology (degree granting institution)","2020","The exceptional material properties of bulk diamond like high stiffness, high thermal conductivity, wide optical transparency, chemical inertness and bio-compatibility make it the material of choice in many high-end applications. Most present-day diamond micro-devices are fabricated by costly and time-consuming top-down methods, such as focussed ion beam milling or reactive ion etching. Hence, bottom-up methods that incorporate selective seeding and chemical vapour deposition (CVD) to produce micro-patterned poly-crystalline diamond are of interest. The present work introduces two novel methods for the bottom-up synthesis of nanocrystalline diamond micro-structures. The first method is based on the precise dispensing of nanodiamond dispersions from a hollow AFM cantilever and is used to manufacture freestanding diamond micro-resonators which are analysed on their frequency response. The second method incorporates maskless lithography to create stencils for selective seeding and enables patterned diamond growth on the single digit micrometer scale. A future step of growing such micro-structures in electrically conductive diamond could open up a vast new range up applications.","diamond; bottom-up; patterning","en","master thesis","","","","","","","","2022-02-11","","","","Mechanical Engineering | Micro and Nano Engineering","",""
"uuid:63bdc236-6aac-47e0-a47d-faeed8523147","http://resolver.tudelft.nl/uuid:63bdc236-6aac-47e0-a47d-faeed8523147","A New Take on Prosthetic Wrists: The Development of a 3 DoF, Hydraulically Powered Wrist Prosthesis","Belet, Tom (TU Delft Mechanical, Maritime and Materials Engineering; TU Delft Biomechanical Engineering)","Smit, G. (mentor); Plettenburg, D.H. (graduation committee); Horeman, T. (graduation committee); Delft University of Technology (degree granting institution)","2020","Background: While new prosthetic hands are developed to increase functionality and allow more complex movements, prosthetic wrists are researched less. Although there are wrists available, primarily featuring 1 degree of freedom (DoF), only a few prototype 3 DoF wrists are currently known. These 3 DoF wrists usually have sufficient range of motion (RoM), but they fail in delivering high torques while being lightweight and compact, which can increase chances of rejecting the prosthesis. Objectives: The purpose of this study is to design and evaluate a conceptual 3 DoF wrist that is capable of replicating the RoM of the human wrist while keeping the size and mass as low as possible. Furthermore, the wrist needs to be able to deliver more torque than existing 3 DoF wrists. Results: A functional 3 DoF prototype was created. The design is actively controllable using three motors and pumps but can also adapt to different surroundings if the motors are off. The prototype is capable of a total range of motion of 142° for exion/extension and 90° for ulnar/radial deviation and can provide estimated torques of 4.52 Nm and 7.29 Nm respectively. Pro-/supination was not measured, but can provide a theoretical RoM of 134° and torque of 8.9 Nm. The complete wrist has a length of 150 mm and a diameter of 50 mm at the thickest part, and a mass of 166 g (including fluid). Conclusion: A 3 DoF wrist that is theoretically able to provide more torques than previously researched wrists is successfully designed and tested. The available RoM approaches the required RoM, except for pro-/supination. Future research should primarily focus on measuring the front part of the wrist using higher pressure. The 3D printed pro-/supination part of the wrist should be further researched to improve RoM and remove leakage while pressurized.","Hydraulic; Wrist prosthesis; Prosthesis; 3 DoF; 3 degrees of freedom","en","master thesis","","","","","","","","2022-02-11","","","","Biomedical Engineering","",""
"uuid:052353ef-46c6-4fa9-adc4-559eb4b56b9e","http://resolver.tudelft.nl/uuid:052353ef-46c6-4fa9-adc4-559eb4b56b9e","Extreme value analysis of complex wave systems","van der Kooij, Len (TU Delft Civil Engineering and Geosciences)","Morales Napoles, Oswaldo (mentor); Lanzafame, Robert (graduation committee); Antonini, Alessandro (graduation committee); Caires, Sofia (graduation committee); van der Lem, Cock (graduation committee); Delft University of Technology (degree granting institution)","2020","The design of offshore and coastal hydraulic structures is very much dependent on the hydraulic boundary conditions, such as significant wave height, mean wave period and wave direction, among other parameters. A proper design value of these parameters is required during the design process, based on the corresponding safety philosophy and the lifetime of the structure. In this context, an extreme event is characterised by a combination of unfavourable parameters. However, the interdependencies between the parameters are not always accounted for in the design process, despite the fact that some parameters are clearly related. This potentially leads to an overly conservative or optimistic design.<br/><br/>To complicate matters further, a given sea state might consist of a combination of wind wave and swell systems, sometimes coming from different directions and with different spectral shapes. Different combinations of crossing wave systems might lead to the same total significant wave height, mean wave period and mean wave direction. Only analysing the total wave parameters might oversimplify the situation in the presence of combined wave systems. In this thesis a methodology has been developed to establish extreme offshore wave conditions given the presence of these combined wave systems.<br/><br/>A time series that partitions the total wave into a wind wave- and swell component is used as input for the analysis. The location of interest being off the coast of southern Brazil, where combined sea states are observed regularly. The main objective is to compute design values for all wave parameters of interest. With these design values a number of extreme offshore sea states are described in terms of a single total wave system and equivalent combinations of two wave systems. The former resulting in a single-peaked wave spectrum and the latter in an equivalent double-peaked wave spectrum. The extreme offshore sea states are transformed to the nearshore and compared. The single-peaked and equivalent double-peaked wave spectra may result in very similar values for the wave energy nearshore, albeit with different spectral shapes and directions. For the investigated directional combination, this means that the more elaborate approach with two wave systems potentially affects the design of coastal infrastructure if it is sensitive to spectral shape and direction, although the uncertainty of the result is not quantified. Equivalent wave systems could be compared for other directional combinations in future research to investigate if the more elaborate approach results in a more cost-effective design of coastal infrastructure. <br/><br/>The quality of the multivariate vine copula model, used to compute the set of design values for the wave parameters of interest, is assessed in multiple ways. It is recommended not to pick a single set of design values at a point of high joint probability density. Instead it is suggested to use conditionalised samples from the vine copula model to determine the most unfavourable combination of load parameters, which has to be evaluated case-by-case.","Extreme value analysis; Multivariate analysis; Bivariate analysis; ERA5 data set; Vine copulas; swan modelling; Copulas; statistical analysis; Dependance modelling; Combined wave systems","en","master thesis","","","","","","","","","","","","Civil Engineering | Hydraulic Engineering","",""
"uuid:28c3a7b2-a0a6-4455-a52a-f43daf58bd49","http://resolver.tudelft.nl/uuid:28c3a7b2-a0a6-4455-a52a-f43daf58bd49","Research into the application of undrained analysis with critical state soil mechanics approach for the design of a quay wall","Leferink, F.H. (TU Delft Civil Engineering and Geosciences; TU Delft Hydraulic Engineering)","de Gijt, J.G. (mentor); Jonkman, S.N. (graduation committee); van Dalen, J.H. (graduation committee); Schweckendiek, T. (graduation committee); Pacejka, H.E. (graduation committee); Delft University of Technology (degree granting institution)","2020","The design and construction of quay walls are processes that exist for many centuries and have become more complex and challenging in current engineering practice. For the design of quay walls a number of guidelines and design codes have been developed over the years. These give the requirements that a quay wall structure should meet, but do also provide some guidance in which steps to take in order to arrive at a proper final design. The relevance of undrained soil behavior, described using critical state soil mechanics, for the analysis of quay wall stability is yet unknown. The main objective of this research is to investigate the possibilities to use the alternative design approach for modelling soil behavior in the design processes of a quay wall. For this, three case studies have been elaborated. The three case studies represents soil profiles consisting 1) predominantly sandy soils, 2) normally consolidated clay and 3) overconsolidated clay. The differences between the analyses and outcomes of the conventional approach and the new approach have been compared for each case study. Based on the quantitative results of case study 1 and 3, the difference in outcome between the conventional and alternative design approaches is between 0 and 10% for both displacements and sectional forces. The outcome of case study 2 is not in line with the results of case 1 and 3. Based on the results of the first case study with sandy soil profile, the alternative design approach applied in this report is not a valid option for the design of a quay wall due to the absence of undrained soil conditions. <br/>For a soil profile consisting clay, the magnitude of preconsolidation of the soil plays an important role. For the alternative design approach, increasing values of pre-loading results in decreasing values of sectional forces and displacements of the wall. This effect is stronger in comparison to the conventional design approach. In further research the aim should be to increase the reliability of the alternative design approach. This can be done by using in-situ measurements of the displacements of the wall to validate if the model represents the reality accurately.","Quay walls; Plaxis 2D; Undrained behavior; Critical State Soil Mechanics; SLS; Hydraulic Engineering; Geotechnical Engineering","en","master thesis","","","","","","","","","","","","","",""
