"uuid","repository link","title","author","contributor","publication year","abstract","subject topic","language","publication type","publisher","isbn","issn","patent","patent status","bibliographic note","access restriction","embargo date","faculty","department","research group","programme","project","coordinates"
"uuid:29428b30-049e-4867-b48d-32d81124a4a1","http://resolver.tudelft.nl/uuid:29428b30-049e-4867-b48d-32d81124a4a1","Spatial Disorientation in a Hexapod Simulator: Evaluating the Effect of Expectation and Display Perception on Control Reversals for Experienced and Novice Pilots","van den Hoed, Annemarie (TU Delft Aerospace Engineering; TU Delft Control & Simulation)","Landman, H.M. (mentor); Groen, Eric L. (graduation committee); Mulder, Max (graduation committee); Mitici, M.A. (graduation committee); Delft University of Technology (degree granting institution)","2020","In previous studies, pilots made roll reversal errors (RREs) when responding to a ‘moving- horizon’ type attitude indicator (AI). It was argued that it was the ambiguity of this display leading to RREs. Later, using non-pilots, it was found that RREs were in many cases caused by expectation-induced misperception of the AI bank angle, which can arise from a pilot experiencing spatial disorientation. The current study evaluated the role of expectation in the control strategy of professional pilots using a hexapod simulator. First, an effective man-in-the-loop spatial disorientation scenario was developed, based on the ‘leans’ illusion. Here, the expectation of ten experienced and eight novice pilots was manipulated with the simulator motion without the AI, after which they had to turn the aircraft back level when the AI was shown again. An error was made in 16.7% of the runs where the bank angle on the AI was opposite to the earlier given physical motion cues, which is 2.9 times more compared to a baseline condition in which no motion, and thus no manipulated expectation, was present. In a third condition where a motion-induced expectation of the bank angle was present, but a level AI was shown later, no errors were made. It was also found that experienced pilots made slightly more errors than novice pilots and that their reaction time was on average half a second higher.<br/>It was concluded that an initially induced expectation about the bank angle does not directly influence the control strategy of pilots, but that it does make them more vulnerable to misinterpretations of the AI, leading to RREs being made. This should be taken into account when developing new displays and technologies, as it should at all times guide pilots in their decision-making, minimizing the chance of misinterpretations.","Perception; Roll Reversal Error; Hexapod; Spatial disorientation; Aerospace; Engineering","en","master thesis","","","","","","","","2024-02-09","","","","Aerospace Engineering","",""
"uuid:fbff8725-352a-40e4-bac6-6737a2ab5d3f","http://resolver.tudelft.nl/uuid:fbff8725-352a-40e4-bac6-6737a2ab5d3f","Minimising transportation and installation operation cost and time for offshore wind turbine farms with the use of the wind turbine shuttle","Stamoulis, Thomas (TU Delft Mechanical, Maritime and Materials Engineering)","Beelaerts van Blokland, W.W.A. (mentor); Polinder, H. (graduation committee); Frouws, J.W. (graduation committee); Delft University of Technology (degree granting institution)","2020","class=""p1"">In recent years, a rapid development of the offshore wind power market has taken place. The growing demand for more offshore wind farms and the desire to make this technology more cost-effective has created many challenges for offshore contractors and their technology, particularly for turbine installation vessels. Currently, the most widely used equipment is the jack-up type crane vessels. These vessels have been optimised for turbine installation operations but are now starting to reach their limits in performance, based on the further improvement of the wind turbines, the fact that the wind farms located further and deeper at the sea. As a result, new designs may be better suited to the challenging requirements of the wind farm developers. In practical terms, it is difficult to predict whether a new concept will perform better another. Operational data from past turbine installation vessel operations can be used to identify important parameters that influence performance but is not practical when applied to unconventional designs such as the concept ship, “Wind Turbine Shuttle” designed by Huisman Equipment in the Netherlands. An extensive study is necessary requiring perhaps the development of new analysis tools. This study attempts to identify the major parameters that influence the operations of turbine installation vessels. It investigates with the use of different operational scenarios, how the procedure of installation and transportation of these vessels are influenced by their parameters such as the pre-assembly method of the wind turbine or the wind turbine sizes and their operating environment, using a market and technology review of the wind farm market, a sensitivity analysis of various design parameters and different case strategies investigating the performance of different turbine installation vessels operating in a predefined wind farm location. Because several strategies have shown that weather delays have a major effect on the workability of the vessel, the simulation model uses wave height time series data from measurements made in the North Sea. For the sensitivity studies of design parameters, results show that for any scenario, an optimal value for both significant wave height tolerance and transit speed can be found. The optimal parameters for the scenario designed in this study are similar to the specifications of the Wind Turbine Shuttle. Overall, results show a definite advantage of using a turbine installation vessel such as the Wind Turbine Shuttle over traditional jack-up vessels. However, as the model is based on many assumptions, the accuracy of the results would be significantly improved with additional real life data. Regardless of this, the study has demonstrated the advantage of opting for a systems approach containing various models that are connected to each other. This methodology has many possible future applications, not only for the evaluation of wind turbine installation vessels but for any vessel type employed in the offshore construction segment.","","en","master thesis","","","","","","","","2030-02-19","","","","Mechanical Engineering | Multi-Machine Engineering","",""
"uuid:28157eaa-7b4d-456c-8402-db00f651a12f","http://resolver.tudelft.nl/uuid:28157eaa-7b4d-456c-8402-db00f651a12f","Hierarchical MPC for Energy Management of Multi-Energy Systems: Case Study Based on a Power-to-X Concept","Kaya, Oguzhan (TU Delft Mechanical, Maritime and Materials Engineering; TU Delft Delft Center for Systems and Control)","Keviczky, Tamas (mentor); van der Roest, Els (graduation committee); Vries, Dirk (graduation committee); Delft University of Technology (degree granting institution)","2020","All over Europe, the expansion of renewable energy sources is quickly proceeding, fueled by environmental and political motives. The power generated by renewables is heavily subject to the intermittency of the source, e.g. the availability of wind or solar irradiance. Consequently, electrical grids that rely on renewable sources alternate between periods of excess power availability and periods with lack of power production. Excess power is often curtailed or exported, whereas the shortage of power production must be imported or produced through the deployment of more expensive production units. Power-to-X strategies aim to utilise the excess power from renewables more effectively, by converting power to another energy carrier within the grid, e.g. heat or hydrogen. By allowing the transition of power to another energy carrier, the system is transformed into a so-called multi-energy system. Therefore, the system takes into account the multiple energy carrier's system characteristics and loads in an integrated way. This formulation allows for optimal scheduling of energy flows in the system while taking into account characteristics of each energy carrier, e.g., storage characteristics, time-varying costs or production emissions. The main focus of this thesis to deal with the tasks of an energy management system for the aforementioned system using Model Predictive Control. The Model Predictive Control framework allows real-time optimal scheduling while incorporating data-driven forecasts of future loads and generation in the grid. Due to the stochastic nature of these forecasts, this thesis also looks into extensions of Model Predictive Control that can cope with uncertainties. Furthermore, to handle the different timescales of the grid dynamics, Model Predictive Control for multi-timescale systems is investigated. In particular, the performance of a Heuristic Model Predictive Control scheme and a Hierarchical Model Predictive Control scheme on the control of a simulated Power-to-X based energy system are compared. The simulation is based on a conceptual Power-to-X system based on historical data of the Dutch energy sector. Based on this case study, a statement is made about the suitability of the Power-to-X principles to future Dutch sustainable neighbourhoods. Moreover, a statement regarding the economic viability of the presented concept is made based on the simulations.","Model Predictive Control; Power-to-X; Energy Management System; Aquifer Thermal Energy Storage (ATES)","en","master thesis","","","","","","","","","","","","Mechanical Engineering | Systems and Control","",""
"uuid:6322a8af-74be-4f89-954b-0717c8ac5c2c","http://resolver.tudelft.nl/uuid:6322a8af-74be-4f89-954b-0717c8ac5c2c","Visualising Conformational Changes in HSP90 Protein using Plasmonic Nanoapertures","Primavera, Christian (TU Delft Applied Sciences; TU Delft Electrical Engineering, Mathematics and Computer Science)","Yang, Wayne (mentor); Dekker, Cees (mentor); Dubbeldam, Johan (mentor); Joo, Chirlmin (graduation committee); Vermolen, Fred (graduation committee); Delft University of Technology (degree granting institution)","2020","In this thesis, we demonstrate optical trapping of HSP90 proteins in plasmonic nanoapertures to study the HSP90 conformational change. This technique is label-free and non-destructive. The resonance of the bow tie shaped plasmonic nanoaperture is used to create a very strong electric field gradient force able to trap proteins. The resonance phenomenon is also used for detecting the trapping events, using the change in transmission that results from the presence of a protein in the trap. HSP90 can be trapped very stably for upwards of 30 seconds. The signal resulting from trapping HSP90 significantly differs from signals from bead traps, especially in the low-frequency regime. We observe strong evidence for a two level system when HSP90 was incubated with AMP-PNP which should slow down the conformational change (fit with R^2=0.9988). More work is required to demonstrate whether this two level system results from the conformational change. We conclude that there is a need for more advanced statistical methods to more conclusively prove that the HSP90 undergoes conformational change between two main levels and suggest further improvements to the experiments.","plasmonics; nanoaperture; HSP90; conformational change; plasmonic","en","bachelor thesis","","","","","","","","","","","","Applied Mathematics | Applied Physics","",""
"uuid:e9a21128-83f8-4dce-bb4e-d0bf1f176a47","http://resolver.tudelft.nl/uuid:e9a21128-83f8-4dce-bb4e-d0bf1f176a47","The Effect of Prior Ferrite on Bainite Transformation Kinetics","Uittenbroek, Lennard (TU Delft Mechanical, Maritime and Materials Engineering)","Santofimia, Maria Jesus (mentor); Ravi, Ashwath (graduation committee); Delft University of Technology (degree granting institution)","2020","In this work the effect of ferrite on the formation of bainite is studied. Different ferrite fraction of up to 25% were obtained through the application of three different intercritical annealing treatments to an Fe-0.2C-3Mn-2Si (wt%) steel. Two of the heat treatments consisted of an isothermal hold at temperatures between 835°C and 950°C, which was followed by slow cooling to a bainite formation temperature of 400°C. A third heat treatment included fast cooling from top temperatures between 810°C and 950°C to the same bainite formation temperature of 400°C. The heat treated material has been studied by means of dilatometry, optical microscopy, scanning electron microscopy and Vickers micro-hardness tests. All of the involved ferrite fractions had an accelerating effect on bainite formation, when compared to samples where no prior ferrite was present. The accelerating effect was larger for smaller prior ferrite fractions. It is proposed that the amount of preferential nucleation sites for bainite is increased by the formation of prior ferrite and leads to an acceleration of bainite formation. The presence of a significant amount of silicon (2 wt%) prevented the formation of cementite and resulted in carbon enrichment of austenite during ferrite formation. For the evaluated ferrite fractions, the accelerating effect due to ferrite presence is greater than the decelerating effect caused by the carbon enrichment of austenite, the latter becoming stronger with increasing ferrite fraction. Additionally, it is proposed that, due to the increase in preferential nucleation sites, a large amount of bainite sheaves start to grow simultaneously. Together with the autocatalytic nucleation of new bainite sub-units, this could account for the high bainite formation rates that were observed in the presence of ferrite. A change in bainite morphology from degenerated upper bainite to granular bainite with increasing prior ferrite fractions was also noticed. No significant difference in hardness was observed between the samples that contained prior ferrite, but the fully austenitised samples were slightly harder. It is expected that increasing ferrite fractions will result in a decrease in overall hardness, when macro-hardness tests would be applied.","Bainite; Kinetics; Ferrite; Intercritical Annealing","en","master thesis","","","","","","","","2021-02-18","","","","","",""
"uuid:170ea7f8-7c21-447b-93b5-e9a88112c4a3","http://resolver.tudelft.nl/uuid:170ea7f8-7c21-447b-93b5-e9a88112c4a3","A fluid-multibody coupling for aeroelastic applications to rotorcraft and wind turbines","Boatto, Umberto (TU Delft Aerospace Engineering)","Viré, A.C. (mentor); Romani, G. (mentor); Delft University of Technology (degree granting institution)","2020","Accurate aerodynamic and aeroacoustic simulations of helicopters and wind turbines require the inclusion of the blade elasticity into the computational setup. If low-order aerodynamic models can be efficient for optimization purposes, they are often insufficient in predicting the complex flow phenomena responsible for structural vibrations and noise. For this purpose, high-fidelity Computational Fluid Dynamics solvers coupled with Multi-Body Dynamic tools can be exploited for more accurate simulations in the context of detailed design.<br/><br/>This thesis focuses on the development of a coupling methodology between the Lattice-Boltzmann flow solver PowerFLOW and the Multi-Body Dynamic tool Simpack for pitching and plunging airfoils featuring lumped structural parameters. This is achieved by verifying the fluid and multibody simulation setups separately against theoretical models. Then, the coupling is compared against analytical aeroelastic solutions for several amplitudes and reduced frequencies of motion. In addition, different approaches to model the airfoil motion in the fluid solver are assessed and compared favorably against each other. As a conclusive effort, the coupling is applied to a bi-dimensional airfoil flutter case returning a prediction of the flutter velocity within a 1% difference with respect to analytical methods.","Fluid Structure Interaction; Aeroelasticity; CFD; Unsteady Aerodynamics","en","master thesis","","","","","","","","","","","","Aerospace Engineering","",""
"uuid:f89e52d0-009d-4a69-9b06-f4216cc065db","http://resolver.tudelft.nl/uuid:f89e52d0-009d-4a69-9b06-f4216cc065db","Modelling refraction of waves over tidal channels: A numerical study focusing on the performance of spectral wave models with respect to bottom refraction","van der Reijden, Ineke (TU Delft Civil Engineering and Geosciences)","Zijlema, M. (mentor); Steetzel, Henk (graduation committee); Vuik, V. (graduation committee); Oosterlo, P. (graduation committee); Delft University of Technology (degree granting institution)","2020","For the design of coastal structures, the hydraulic loads that act on the coast should be known. These are often based on extrapolation of measurements. However, if the physical relation is unknown, large errors could be made. Therefore, a numerical model can be set up to take the most important processes into account.Yet, uncertainties are present in these numerical models as well. Taking for example the spectral wave model SWAN, it is hypothesised that the wave bottom refraction is not always properly modelled. Previous studies concluded that SWAN overestimates this refraction process near tidal channels, leading to an underestimation of waves entering the channel.This study uses the model SWAN in which different sensitivities are tested to assess the effect on refraction. The focus will be on the spatial and directional resolution as well as the wave propagation scheme that SWAN uses to discretise the propagation terms, which are the default SORDUP scheme and the optional BSBT scheme. From previous studies it is known that also physical processes could impact the bottom refraction, however these are only addressed shortly in this study. The aim of this study is to analyse the current performance of SWAN with respect to refraction and to assess how this performance can be improved.First, an analysis of a simple schematic channel case is made in SWAN, where waves propagate from shallow to deeper water. Physical source terms and wind wave-growth were deactivated in this part. It is found that a coarser spatial resolution can lead to a weaker wave refraction. This is caused by the way SWAN determines the turning rate, which is underestimated by SWAN compared to the theory of Snellius. On the other hand, an overestimation of wave refraction was observed for cases were waves should enter the channel. This is partly caused by the increased diffusion. These findings were taken into practice in a study of the Eastern Wadden Sea, specifically along the Ems channel, where waves propagated from deeper to shallower water. A coarser spatial resolution and the BSBT scheme showed less wave penetration from offshore into the Ems channel. The storm of January 2017 was simulated in SWAN after which a comparison was made to measurements. It was found that SWAN underestimated the wave energy for frequencies&lt;0.15Hz. However, this did not improve by refining the resolution in both spatial and directional domain or by applying a different propagation scheme. SWAN thus overestimates the wave refraction due to bottom gradients if waves propagate to shallower water. In case waves travel to deeper water, refraction can be underestimated. If all physical source terms are deactivated, the effects of resolution on refraction are clearly visible. Including the source terms diminishes this effect. Along the channel edges, effects of increased spatial resolution are notable giving a significant wave height of 12-14cm (6-9%) closer to the measured condition. However, the effects at the coast near Uithuizerwad are negligible.","Wave refraction; Spectral wave model; SWAN; Wadden Sea","en","master thesis","","","","","","","","","","","","Civil Engineering | Hydraulic Engineering","",""
"uuid:9f9505c0-d028-4a56-9ce9-036264c0db4b","http://resolver.tudelft.nl/uuid:9f9505c0-d028-4a56-9ce9-036264c0db4b","Bowthruster-induced flow on the bottom of a vertical quay wall: A field measurement","Cantoni, Irene (TU Delft Civil Engineering and Geosciences; TU Delft Hydraulic Engineering)","van der Hout, Arne (mentor); Hofland, Bas (graduation committee); Roubos, Alfred (graduation committee); Ruijter, Michel (graduation committee); Delft University of Technology (degree granting institution)","2020","During mooring operations, ships tend to make an extensive use of bowthruster in order to minimize the need for tug assistance. Jet caused by transverse thrusters directly impinges quay walls, and can cause scour on the bed, therefore threatening structural stability of quay walls. Presence of vertical quay walls induces reflection of bowthruster's jet, further complicating the already complex flow field. Despite extensive research has been conduced on free flow, several knowledge gaps are still present regarding propeller induced flow when confined, for instance by a vertical quay wall. In this research, focus is on flow field on the bottom of a vertical quay wall induced by channel-type bowthrusters, which are commonly used for inland vessels. Field measurements have been conducted at the Antarcticakade, Ports of Rotterdam, using inland vessel MTS Vorstenbosch. The vessel is equipped with a 4-channel Veth Jet type bowthruster system. Use of a combination of Acoustic Doppler Velocimeters and Acoustic Doppler Current Profilers allowed measurements of flow velocities on the bottom of the quay. Data from the measurements has been analysed to investigate influence of distance between outlet and quay wall, and keel clearance, on the flow pattern at the bottom. Results have then been contextualized within the literature framework, and their impact on design of bottom protection according to most used guidelines has been assessed.<br/>The results of this field measurement showed mean flow velocities near the quay wall generally in the order of magnitude of 1 m/s, with the exception of one test, where mean flow velocities in the order of magnitude of 2 m/s were recorded. This relatively low mean flow velocities were often correlated with large turbulent fluctuations, leading to values of relative turbulence intensities higher than the ones found in literature, and sometimes even equal to 1. Comparison with the theoretical calculations of velocities according to Dutch and German methods suggested by PIANC, showed both methods to be conservative if compared with data from most tests. Furthermore, it appeared that both formulae’s sensitivity to wall and keel clearance was not reflected by the data. Similarly, results from this measurement showed that the flow generated by simultaneous use of two bowthrusters was characterized by velocities on the bed lower than expected according to the guidelines. Recommendation would be to use either linear superposition or to multiply by square root of n (where n is the number of used propellers) when considering the use of multiple propellers, but this was not reflected by most of the data. However, two of the tests taken into exam represented an exception to these general observations: ADV1, the instrument nearer to the quay wall, recorded velocities higher than the theoretical values for tests 12 (use of bowthruster 2 at high water) and 22 (use of both bowthrusters simultaneously at low water). Results from this study showed how the use of a 4-channel bowthruster system induced a flow on the bottom of a vertical quay wall which is mainly divided in two zones. Near the quay wall is where the highest velocities have been measured, and where the flow is strictly influenced by use of the bowthrusters. There is a return flow beneath the ship, which is dissipated in the space of few meters. Underneath the suction points of the bowthrusters, it is the inflow to determine the flow characteristics on the bed. In this research, the extent of the bowthruster-induced flow was found to be less than 14 m from the quay wall. The instrument hereby located, in fact, didn't record velocities which were affected by the use of bowthrusters. This research represents a step towards filling the knowledge gaps about use of bowthrusters at a vertical quay wall. The unique dataset collected can be used in the future for validating numerical or on-scale models, working for a better understanding of the phenomenon and a more accurate and optimized design of bed protections.","Bow Thruster; Field measurement; Quay walls; Propeller jet","en","master thesis","","","","","","","","","","","","Civil Engineering","",""
