"uuid","repository link","title","author","contributor","publication year","abstract","subject topic","language","publication type","publisher","isbn","issn","patent","patent status","bibliographic note","access restriction","embargo date","faculty","department","research group","programme","project","coordinates"
"uuid:6d4d156b-8199-45c0-884b-e29a5c696567","http://resolver.tudelft.nl/uuid:6d4d156b-8199-45c0-884b-e29a5c696567","Social well-being in offices: A design intervention to enhance employees’ sense of belonging by stimulating informal social interaction","Morena, G. (TU Delft Industrial Design Engineering)","Mooij, S.C. (mentor); Colenberg, S.E. (graduation committee); Delft University of Technology (degree granting institution)","2021","The report describes the design process that led to an implementation strategy for a design intervention that fosters a sense of belonging and cohesion in working environments, by increasing opportunities of spontaneous face-to-face informal encounters. The research follows two different approaches: the classical double diamond process from the Design Council (Ball B. J., 2019) and the Empirical Research through Design (ERDM) in which a design hypothesis (expectation about the effect of the design on behaviour and well-being) is formulated and then tested (Keyson, D. V., &amp; Bruns, M.,2009). Since it was difficult to find an office physically open during COVID-19, the design process was developed at the IDE faculty involving IDE employees’, Team managers, experts in Social Sciences and Technology, the Human Resources and Facility Management department.The Discover phase of the project consisted of in-depth literature review and semi-structured interviews to explore the concept of social well-being in the workplace, and learn about the personal experiences and opinions of workers. The Define phase was devoted to scoping the problem, and the formulation of a design vision and hypothesis. The Develop phase aimed to explore several directions for the final design intervention, and consisted of three generative phases with different stakeholders involved through evaluation, co-creative and iteration sessions. The fourth Deliver phase, was aimed at defining the final design intervention in terms of feasibility, desirability and viability. This phase involved testing the prototype in the coffee corners of the IDE faculty (through observations and short interviews), and formulating an implementation strategy that emphasises the importance, methods and stakeholders’ benefits of adopting the final design solution.During the pandemic, the sense of cohesion and belonging between colleagues is significantly reduced due to the decrease of spontaneous face-to-face informal social interactions. As the hybrid working mode is expected to be the future of the way of working (de Klerk J. J., 2021), it is important that organisations emphasise the social aspect of the office by increasing the possibilities for social interactions between colleagues (Dahik, A., 2021). A sense of belonging and cohesion in the office benefits not only the well-being of employees, but also the performance of the organisation (Rosales, R. M., 2016). The final design is a demonstration that it is possible to increase the sense of cohesion and belonging among workers, by means of an interactive object that increases the chances of informal serendipitous encounters. For implementation, organisations need to maintain long-term contact with supplier partners (e.g. furniture companies) to produce, assemble and develop new design features. These change according to the evolution of the pandemic, and the insights generated by ongoing user testing. The organisation is responsible for monitoring and directing the social behaviour of the office (Team Managers and HR Department), and for the installation and maintenance of the object within the office café corners (Facility Management Department). The continuous sharing of research insights between companies and supplier partners contributes to the development of knowledge for a healthier and socially connected workplace in the post-pandemic era.","Social well-being at work; Post-pandemic; Sense of belonging and cohesion; Social collisions; Informal social interactions; Face-to-face social interactions; Design Intervention; Implementation strategy","en","master thesis","","","","","","","","","","","","Strategic Product Design","",""
"uuid:6a780003-cb20-4a8c-ac90-2867274a65d6","http://resolver.tudelft.nl/uuid:6a780003-cb20-4a8c-ac90-2867274a65d6","Pedestrian Detection and Tracking for Mobile Robots in Human Environments","Marcelis, N.H.H. (TU Delft Mechanical, Maritime and Materials Engineering)","Ferreira de Brito, B.F. (mentor); Alonso Mora, J. (graduation committee); Delft University of Technology (degree granting institution)","2021","With the performance of current motion planning methods being highly dependent on the quality of the perception system, robust 3D multi-object detection and tracking are vital for autonomous driving applications. Despite all the advancements in 2D and 3D object detectors, robust tracking of pedestrians in dense scenarios is still a challenging subject for small Automated Guided Vehicles (AGVs). Most research in the field of object detection and tracking focuses on autonomous cars, neglecting the design challenges that come with small AGVs.<br/><br/>This thesis presents a real-time multi-modal multi-pedestrian detection and tracking pipeline for small mobile robots. The framework integrates five RGB-D cameras and a LiDAR sensor to achieve real-time pedestrian detection and tracking. The system relies on state-of-the-art 2D and 3D object detectors, a sensor fusion and filtering scheme, and a 3D object tracker. Moreover, to improve detection and tracking performance, we have collected a pedestrian dataset tailored for small AGVs. We use this dataset to train the 3D pedestrian detector and evaluate the performance of the pedestrian detectors and tracker. Evaluation of the proposed framework demonstrated the ability to robustly detect and track multiple pedestrians up to a distance of 10 meters. We open-sourced our framework at: https://github.com/bbrito/amr_navigation.","Machine Learning; Deep Learning; Object Detection; Object Tracking; Computer Vision; Autonomous Vehicles; Intelligent Vehicles","en","master thesis","","","","","","","","","","","","Mechanical Engineering | Biomechanical Design - BioRobotics","",""
"uuid:b26de0e8-fd3f-4ad3-8af2-c7f519fc6901","http://resolver.tudelft.nl/uuid:b26de0e8-fd3f-4ad3-8af2-c7f519fc6901","Feasibility study on condition-based maintenance of bolts using ultrasonic waves","KANDASAMY NANTHAKUMAR, KAVIN KUMAR (TU Delft Mechanical, Maritime and Materials Engineering)","Pahlavan, L. (mentor); den Besten, J.H. (graduation committee); Kassapoglou, C. (graduation committee); Scheeren, B. (graduation committee); Riccioli, F. (graduation committee); Vollebregt, Arjen (graduation committee); Walc, Radoslaw (graduation committee); Delft University of Technology (degree granting institution)","2021","The safety of offshore assets such as wind turbines, offshore cranes, and turret mooring systems partly relies on the integrity of heavy-duty bolted joints. These critical connections can be of different dimensions and exposed to monotonic and cyclic loading. Despite being small components of a structure, bolts need to be maintained appropriately to ensure structural safety and reliability. The integrity of bolted joints can be assured by checking for adequate preload. In addition, fatigue failure resulting from preload loss is of primary concern, as it can occur suddenly without any visible changes. Hence, bolts should be re-tightened periodically to ensure sufficient preload. However, in offshore conditions, this countermeasure leads to high maintenance costs while exposing the crew to unfavourable conditions and risks. <br/><br/> This research focuses on the feasibility of condition-based maintenance of bolts using ultrasonic waves. An energy attenuation method has been implemented for this feasibility research. The main objective is to establish a proper methodology and hypotheses for preload detection. Furthermore, along with preload detection, the feasibility of crack detection was investigated. Finally, the proposed methodology and hypotheses were validated by performing experiments and numerical simulations. <br/><br/> The experimental and numerical results verify the proposed methodology by showing an increasing trend in the energy and the power of the transmitted ultrasonic wave for increasing preload. Also, the feasibility of crack detection using the same setup has been positively evaluated. <br/> <br/> The obtained results suggest that the ultrasonic waves can be employed to monitor bolts for condition-based maintenance. Additionally, a number of relevant research activities are recommended based on this study.","bolted joints; bolt preload; bolt crack; bolt monitoring; ultrasonic wave","en","master thesis","","","","","","","","","","","","Offshore and Dredging Engineering | Structural analysis and design","",""
"uuid:68729e20-9470-43ed-ac3e-e65656da6ba2","http://resolver.tudelft.nl/uuid:68729e20-9470-43ed-ac3e-e65656da6ba2","PILLARS UNITED: Improving the initiation of cross-pillar projects: Design of an intervention to initiate more cross-pillar projects","Timmermans, Britte (TU Delft Industrial Design Engineering)","Smulders, F.E.H.M. (graduation committee); Berghuis, G.H. (graduation committee); Delft University of Technology (degree granting institution)","2021","Accenture Interactive, the marketing arm of international consultancy Accenture, has been created to address the evolving needs of their clients in the field of design and technology. As a result, Accenture Interactive now consists of several pillars that together can deliver a meaningful end-to-end experience. Delivering value to the client and the organization in projects by collaborating across pillars are called cross-pillar projects.<br/><br/>However, Accenture Interactive encounters that the current collaboration between the different pillars in client projects is not at the level they would like it to be. In line with this observation, the purpose of this thesis was to explore what goes wrong in the current cross-pillar projects, with the aim to reveal the influencing factors of these projects. <br/><br/>Therefore, this thesis aimed to improve the cross- pillar performance by defining the definition of cross- pillar working in the context of Accenture Interactive, and resolving the barriers towards the envisioned level of cross-pillar working. As a result, an integrated solution was created, consisting of improvements in existing communication channels and adding a proposition development approach to the existing initiation process.<br/><br/>This was examined by conducting twelve in-depth interviews with different pillars, from six completed cross-pillar projects. The interviews defined the context of cross-pillar work in Accenture Interactive and the elements that make up all the studied cross-pillar projects. Then, a deeper look was taken at differences emerged between the performance of the studied projects. This led to the problem statement that the performance of a cross-pillar project is influenced by the presence of awareness and willingness in the initiation of the projects.<br/><br/>A deeper study was conducted to determine which barriers are present during initiation preventing awareness and willingness. The design goal, was to develop means and approaches that could help employees to facilitate cross-pillar collaboration during the initiation of new projects. To facilitate implementation, it is proposed that existing activities, like Chapter Zero and Friday morning meetings, could help serve that purpose. The end goal of this approach is to learn to initiate cross-pillar projects by experiencing how to bring value to clients by collaborating between pillars. <br/><br/>Furthermore, a roadmap is created to guide Accenture Interactive in bridging the gap between the results of this project and the new practice of cross-pillar working. This roadmap aligns the different development processes within Accenture Interactive, reflects how this thesis’s outcomes fit within the intended timeline, and provides direction to Accenture Interactive’s vision.","Collaboration; Initiation Phase; organizational changes; Co-evolution","en","master thesis","","","","","","","","","","","","Strategic Product Design","",""
"uuid:373638db-4395-4397-8adb-0ca1f87ca466","http://resolver.tudelft.nl/uuid:373638db-4395-4397-8adb-0ca1f87ca466","Evaluating Macroscopic DTA Models – For Who, When and How?","Nandakumar, Aswin Menon (TU Delft Civil Engineering and Geosciences)","Hoogendoorn, S.P. (graduation committee); Taale, Henk (mentor); De Schutter, B.H.K. (graduation committee); Brederode, Luuk (mentor); Brandt, Feike (graduation committee); Delft University of Technology (degree granting institution)","2021","Over the past few decades, transport authorities globally have resorted to transport models for testing policy interventions and simulating the results as part of the ex-ante analysis. Within the domains of traffic assignment, there is a greater focus on the dynamic representation of traffic, which has proved to be more accurate when compared to their static counterparts. This has put Dynamic Traffic Assignment (DTA) Models at the forefront of development. Departing from the classical traffic flow theories Macroscopic DTA’s simulates aggregated traffic analogous to the flow of fluids or gases. This aggregation enables high-speed computation with the ability to achieve a stable equilibrium state within feasible model run times. Due to the large number of Macroscopic DTA models developed worldwide, the model user is posed with the problem of using the correct model for the correct application. The current research aims to provide an answer to this problem through the design, development, and validation of an evaluation framework for Macroscopic DTA’s. The objective evaluation of the DTA’s is performed through certain Measures of Performances (MoPs). The subjective side of evaluation showcases the differences in importance associated with model features which vary from model users to application domains. Three macroscopic DTA models popular in the Netherlands are used for the application of the framework: the MARPLE (Model for Assignment and Regional Policy Evaluation), StreamLine: MaDAM (Macroscopic Dynamic Assignment Model), and StreamLine: eGLTM (event-based Generalized Link Transmission Model). From the results, it is observed that For a Strategic Planning application, both MARPLE and StreamLine: eGLTM proved to be better alternatives, as they performed exceedingly better in achieving a stable state of convergence. However, as the time horizons of application became smaller as is the case with Tactical and Operational planning, the final score for StreamLine: MaDAM improved substantially due to its accuracy involved in link-level propagation and queuing. The evaluation scores also showcase the fundamental trade-off between model complexity and computational speed was visible from the results. We can observe variations across model users, which validates our original hypothesis that the right choice of a model primary depends on the person using it and the application it is deployed for.","dynamic traffic assignment; macroscopic modelling; Evaluation Framework","en","master thesis","","","","","","","","","","","","Civil Engineering | Transport and Planning","",""
"uuid:cd8dc4d4-12f7-4267-bcdc-f355321dd6a8","http://resolver.tudelft.nl/uuid:cd8dc4d4-12f7-4267-bcdc-f355321dd6a8","Barilla Sustainable Farming: Implementing an educational framework to increase farmers’ application of sustainable practices","Schieppati, Gabriele (TU Delft Industrial Design Engineering; TU Delft Design, Organisation and Strategy)","Calabretta, G. (mentor); Willemen, A.M. (graduation committee); Ruini, L. F. (graduation committee); Delft University of Technology (degree granting institution)","2021","Dealing with agriculture is challenging for companies like Barilla because of several uncontrollable factors, such as climate change.<br/>Purchasing from the spot market constitutes a high economical risk for the company, which decided, in 2010, to launch the Barilla Sustainable Farming Projects.<br/><br/>Barilla Sustainable Farming projects support and promote the adoption of more efficient and sustainable agricultural practices while increasing the economic advantages of farmers. Accordingly, farmers sign agricultural contracts with the company, that in exchange for the security to buy the product ask for sustainable practices' application. <br/><br/>The Barilla Sustainable Farming project spread throughout the Italian farmers successfully; then, the company decided to expand these sustainable projects abroad. One of the two scopes of this graduation project is to export the Barilla Sustainable Farming projects abroad to increase the number of contracted farmers further.<br/><br/>However, despite many contracted farmers, Barilla still faces a significant issue: the tools and the Sustainable Farming practices developed by the company are not understood and thus adopted by farmers holistically. The scenario creates relevancy for this graduation project that aimed to apply the design methodologies to find a creative solution. <br/>Then, the problem is defined in exporting the Sustainable Farming projects abroad while convincing farmers to adopt the Sustainable Guidelines developed by the company. <br/><br/>The project started from in-depth research on the countries' agricultural systems where Barilla could export the Sustainable Farming Projects and passed through semi-structured interviews with farmers to gain insights on possible design directions to convince them to apply the sustainable practices. <br/><br/>Then, with a conjoint definition on the two pieces of research (one for each scope), the final design direction was defined: creating an educational framework that aims to create engagement, understanding, and participation on the Barilla Sustainable Guidelines. Accordingly, the solution is a platform that allows farmers to learn, via different activities, all the company's guidelines, which should be applied while cultivating.<br/><br/>In the end, in compliance with the educational model, the company's interest would be relevant in implementing the Barilla Sustainable Farming in countries with a rearward agricultural level. Therefore, the most relevant countries have a lower educational and technological level among the studied countries. Consequently, after developing the educational framework, namely how farmers should learn the guidelines, a roadmap has been developed for implementing the educational framework in two different countries: Turkey and Russia.<br/><br/>Besides the academic core of the project, the main goal is to create a creative direction to investigate new possibilities further to expand the Barilla Sustainable Projects abroad. Then, the primary aspiration of the project for an actual application would be to create inspiration to explore new possible strategies Barilla may consider in the future.","Sustainability; Sustainable agriculture; Roadmapping; Strategy development; Facilitation; Education","en","master thesis","","","","","","","","","","","","Strategic Product Design","",""
"uuid:66f2c43e-19c7-46f6-8333-8ef7e99b407a","http://resolver.tudelft.nl/uuid:66f2c43e-19c7-46f6-8333-8ef7e99b407a","The impact of atmospheric stability on the global blockage effect of offshore wind farms","van Til, Justin (TU Delft Electrical Engineering, Mathematics and Computer Science)","Allaerts, D.J.N. (mentor); Delft University of Technology (degree granting institution)","2021","This thesis research is set up to increase the knowledge on the influence of atmospheric stability on the Global Blockage Effect (GBE) of offshore wind farm flows, thereby aiming to improve the accuracy of energy yield calculations and predictions of offshore wind farms.","Global Blockage Effect; GBE; WInd Farm; wind farm blockage; ORFEUS; Atmospheric stability","en","master thesis","","","","","","","","","","","","","",""
"uuid:966ab159-1fae-463f-a53c-b7b2d42d3690","http://resolver.tudelft.nl/uuid:966ab159-1fae-463f-a53c-b7b2d42d3690","Design implication and performance assessment of iron fuelled ships","de Kwant, Jochem de Kwant (TU Delft Mechanical, Maritime and Materials Engineering)","Kana, A.A. (mentor); de Vos, P. (graduation committee); Atasoy, B. (graduation committee); Yin, F. (graduation committee); Hermanns, R. (graduation committee); Delft University of Technology (degree granting institution)","2021","In order to meet climate change mitigation targets, the shipping industry must change to an alternative fuel. From a ship design perspective, the switch to an alternative fuel is often a downgrade with respect to the use of conventional fuels. For instance, most alternative fuels have a low energy density, rely on technology that is not fully developed or on systems with a short lifetime. The choice for an alternative fuel is therefore difficult to make, and many aspects from different disciplines must be considered. Though much research is being done on the implications of choosing different alternative fuels, iron powder as a marine fuel is not often considered. The use of iron powder as a fuel formaritime applications is only recently proposed and the technology is in its infancy. It has some suitable properties to be used as a marine fuel though. This research aims to investigate how the choice of iron as a fuel affects the ships design and performance.<br/><br/>To that end, a parametric design model is developed for container ships, with which the design space of these iron fuelled ships can quickly be explored. It was chosen to design the model specifically for container ships, because iron has good volumetric energy density, but poor gravimetric energy density. Because of that, iron suits volume carriers more than deadweight carriers. The model generates a multitude of preliminary ship designs as a function of some operational requirements. Using the results from the model, design trends can be identified withing the design space. The potential performance of the ship designs are assessed using some key performance indicators.<br/><br/>It is found that iron fuelled ships are feasible and can be economically viable for certain operational profiles.Based on contemporary freight rates, iron fuelled ships are best used for short voyages at low speed. This is mostly caused by the high mass of iron, which reduces the viability of operating the ship when a large<br/>energy storage capacity is required. The main dimensions of iron fuelled container ships are driven by the total weight of the ship whilst minimising resistance. That makes iron fuelled container ships deadweight<br/>carriers rather than volume carriers. Finally, the economic performance of iron fuelled ships is compared to that of other alternative fuels. It was found that iron fuelled ships are less profitable than ships running on other alternatives.","lternative fuel; Viability; Iron powder; ship design","en","master thesis","","","","","","","","","","","","Marine Technology","",""
"uuid:d870398b-49d1-472e-b839-a2ce39409b1d","http://resolver.tudelft.nl/uuid:d870398b-49d1-472e-b839-a2ce39409b1d","VPN Fingerprinting: Network protocol detection inside virtual private network tunnels","Graafmans, Roy (TU Delft Electrical Engineering, Mathematics and Computer Science)","Doerr, Christian (mentor); Zimmermann, P.R. (mentor); Erkin, Z. (graduation committee); Venkatesha Prasad, Ranga Rao (graduation committee); Delft University of Technology (degree granting institution)","2021","Virtual private networks are often used to secure communication between two hosts and preserve privacy by tunneling all traffic over a single encrypted channel. Previous work has already shown that metadata of different secured channels can be used to fingerprint various kinds of information. In this work, we will dive into the encrypted tunnels as used by VPNs. We have collected automatically generated data of 9 network protocols sent over 8 different VPN solutions with 3 different rates for mixed traffic each. Due to the single combined traffic channel of the VPN, this work had to focus on packet-wise features instead of stream-wise ones, requiring the development of new features compared to related work. Both Random Forest and Markov Chains are trained to distinguish the network protocols by finding the patterns of the protocols in the developed features. We show that it is possible to fingerprint network protocols in all different scenarios based on the metadata available. Moreover, it was found that size features are more important than timing-related ones, especially when padding comes into place. Lastly, we show that obfuscations methods focussing on distorting size or timing patterns solely are not effective enough and future obfuscation methods should incorporate both features.","Virtual Private Network; VPN; Fingerprinting; Network traffic analysis; Machine Learning; Network protocols","en","master thesis","","","","","","","","2022-12-15","","","","","",""
