"uuid","repository link","title","author","contributor","publication year","abstract","subject topic","language","publication type","publisher","isbn","issn","patent","patent status","bibliographic note","access restriction","embargo date","faculty","department","research group","programme","project","coordinates"
"uuid:0ca5da14-e894-41c2-a831-8b0ab1f32c43","http://resolver.tudelft.nl/uuid:0ca5da14-e894-41c2-a831-8b0ab1f32c43","Implementing dynamic boundary conditions with the material point method","Đo, Chinh Phuong (TU Delft Civil Engineering and Geosciences)","Hicks, M.A. (mentor); Vardon, P.J. (graduation committee); Pisano, F. (graduation committee); Gonzalez Acosta, J.L. (graduation committee); Delft University of Technology (degree granting institution)","2021","The material point method (MPM) is gaining increasing amounts of attention due to its capacity to solve geotechnical problems involving large-deformations. While some problems require dynamic analysis, simulating the (infinite) continuous domain using typical Dirichlet (fixed) boundary conditions induce spurious reflections causing (1) unrealistic stress increments at the domain oundary and (2) the appearance of multiple unnatural stress waves in the domain. Aiming to eliminate this numerical artifact in MPM, two solutions for absorbing boundary conditions found in FEM are implemented and investigated; these are (1) a viscous boundary condition and (2) a viscoelastic boundary condition. The use of such dynamic boundary conditions in MPM is scarce and no validation of them has yet been presented in the literature. In this work, these absorbing conditions are implemented alongside other recent developments, which improves the numerical stability (Double-Mapping, Generalized Material Point Method, Composite Material Point Method), using two approaches: (1) directly imposing at the external active boundary nodes and (2) imposing via shape function interpolation. The proposed solutions are then validated with a one-dimensional benchmark: a soil column under dynamic load in small-deformation and large-deformation, and a 2D symmetric plane strain model under one loading pulse. The benchmark results demonstrate that the numerical reflections that lead to inaccuracies of stress and velocity can be removed using GIMP interpolation and, together with the other numerical technics, render high-quality and realistic results. A study of shallow foundation failure under repeated loading is also presented, showing the potential of applications of the proposed solution for modelling extreme geotechnical events.","Material Point Method; DM-GC; Absorbing boundary; Shallow foundations","en","master thesis","","","","","","","","","","","","Geo-Engineering","",""
"uuid:4c009113-5ee5-47a3-9858-36bc14cb3368","http://resolver.tudelft.nl/uuid:4c009113-5ee5-47a3-9858-36bc14cb3368","Transition Towards Sustainable Mobility in Disadvantaged Neighbourhoods: A Case Study in Rotterdam","van Gerven, N.P.C. (TU Delft Technology, Policy and Management)","Ersoy, A. (mentor); Annema, J.A. (graduation committee); Delft University of Technology (degree granting institution)","2021","Urban mobility is a complex socio-technical system. An important part is the behaviour of mobility users, which is in this study defined as being driven by mobility opportunities and perceptions of mobility. This case study in the Tarwewijk in Rotterdam explores what influences those opportunities and perceptions, with a specific focus on income and ethnicity. From mobility data and street interviews followed that income is most important to car ownership, while ethnicity is an important determinant of bike ownership. Other important factors for mobility behaviour include the travel time, the distance to important destinations like schools and shops, and the perception of ease of travel. Combining the diversity of driving factors with three pathways towards sustainable mobility leads to the conclusion that effective sustainable mobility policy is aimed at disrupting the car mobility system, designing a more walkable city and targeting groups based on their specific perception of mobility.","Mobility Behaviour; Urban Sustainability; Urban mobility; Mixed Methods","en","master thesis","","","","","","","","","","","","Industrial Ecology","","51.8932561, 4.4843942"
"uuid:53ff5559-3d18-4045-acb7-6f3407acd607","http://resolver.tudelft.nl/uuid:53ff5559-3d18-4045-acb7-6f3407acd607","The Influence of Grout Installation Parameters on Shaft Bearing Capacity of Screw-Injection Piles","Aguilar, Santiago (TU Delft Civil Engineering and Geosciences)","Gavin, Kenneth (mentor); de Lange, D.A. (graduation committee); Grunewald, S. (graduation committee); Pisano, F. (graduation committee); van Dijk, Simon (mentor); Admiraal, Bartho (mentor); IJnsen, Patrick (mentor); Delft University of Technology (degree granting institution)","2021","In modern piling technology screw piles are used as a type of deep foundation for engineering structures, with the principal benefit of using said piles is that they offer an installation method that is virtually noise and vibration free. This makes these piles ideal for construction works in urban areas where surrounding structures can be affected by vibrations that would be produced from the installation of a driven pile. Since their initial production in the 1980s in Europe, multiple variations of screw piles are on the market today. This Msc thesis focuses on the Screw-Injection piles (SI-piles) commonly known as Fundex piles. SI-piles are a type of partial ground displacement piles where only a portion of the soil surrounding the pile is being pushed radially outwards during the rotational motion of screwing in the installation process. The other portion is transported back with grout flowing to the surface. <br/><br/>The current Dutch practice already have NEN guidelines on how to predict bearing capacity for SI-piles. These guidelines consist of CPT-based methods with an empirical correlation factor, the $\alpha$ pile class factor, which helps to relate the bearing capacity to the soil surrounding the pile. Nevertheless, one aspect that is not well understood is the effect that different properties of the injected grout have at the soil-pile interface and for bearing capacity. In this thesis two grout properties are being manipulated which are the Water/Binder and W/C ratios of the grout mixture, and the injection flow rate of the grout with the purpose to see whether and/or to what extent a difference exists in the shaft bearing capacity for SI-piles.<br/><br/>A full-scale experiment was conducted on 15 piles in order to evaluate the effect of these varying parameters. This research is composed of four targeted variations of W/B ratio and two injection flow rates, 5 groups of 3 piles each to be more precise. The piles were subjected to a static pile load test in tension, which means that the bearing capacity is composed of mainly the shaft resistance of the pile. The analysis breaks down in four main parts to analyse the indirect relationships between the properties that are accounted for in the empirical parameter $\alpha$. These four parts include the assessment of the load-displacement behaviour of the SI-piles, assessment of radial soil stress (CPT data), assessment of the records during the installation process (torque, RPM), the grout properties during installation and after 28 and 56 days of curing, and lastly, the pile shape (volume) after extraction of pile. <br/><br/>The assessment of the load-displacement behaviour showed that the predictions using the NEN guidelines for bearing capacity were extremely accurate for most pile groups (above 0.970 measured/predicted ratio). But for the pile groups with higher W/B ratio and with the highest flow rate (Groups C and D respectively) the measured shaft capacity would be much lower. A direct relationship between the W/C and W/B ratio is difficult to conclude since for pile B2 and C1 that had the same W/C ratio, the difference in the measured/predicted ratio was about 21\%. In the case of flow rate it is entirely seen that a higher flow rate leads to a significant decrease in measured shaft capacity. The NEN suggests a value of $\alpha_t$ for SI-piles of 0.009, yet the shaft capacity for groups with a higher W/C ratio and flow rate could be better predicted with an $\alpha_t$ $\approx$ 0.00793. Additionally, another important research objective is to try to optimise the $\alpha_t$ parameter by comparing the $q_c$ values for the pre-installation, the average post-installation and minimum value of the post-installation CPTs. This resulted in the $\alpha_t$ derived from the pre-installation CPT to have a much lower Coefficient of Variation, CoV, of approximately 0.08 whereas the average and minimum post-CPT $\alpha_t$ had a CoV of 0.12 and 0.11 respectively. <br/><br/>The assessment of the soil stresses is comprised of an analysis of the changes in cone resistance, $q_c$, throughout the field. The analysed data collected shows that for varying W/B ratios there is no solid relationship that relates the change in $q_c$ after the grout installation. However, a higher flow rate seems to have a significant impact on the cone resistance, leading to a general decrease of $q_c$ after installation, having a decrease as low as -16.53\% for pile D1, whereas for all other pile groups there was an increase in $q_c$ after installation, increases as high as 30\% (pile A3).<br/><br/>The assessment of the records during installation include the analysis of the torque during the installation process. It is seen that in both cases, high W/B ratio and high flow rate, there is a decrease in torque, but the flow rate of 115 [l/min] had a more significant impact than the increase in W/B ratio.\\<br/>% Moreover, the 2D interpolation analysis aimed to see how post-installation CPT data should be considered. Pre-installation CPT data is sufficient to make a prediction on bearing capacity, but in this analysis both situations are being compared. This comparison resulted in that the difference between the two is minimal, the maximum difference found was in the order of $\pm$5 MPa.<br/><br/>The assessment of backflow grout resulted in higher W/C ratios having higher increases in density of the backflow fluid, and that high flow rate leads to a lower backflow density, this was supplemented with the sand transport data which suggests that higher W/B ratios lead to more sand transport out of the soil body. Furthermore, a inversely proportional relationship was found between W/B and W/C ratios and both the axial and bending stresses; the same inverse relationship is found with the flow rate. Additionally, the shear stress of the grout and of the soil were compared in order to determine if the failure is purely geotechnical or also structural.<br/><br/>The pile shape assessment resulted in a higher W/B ratio leading to a higher pile diameter, regardless of the flow rate during injection. There is also a very clear, almost perfectly linear, relationship between the mean diameter of the extracted pile and the measured shaft capacity. However not all piles were extracted and this includes piles installed with the highest W/C ratios (group C) and thus the aforementioned relationship has only been shown for a limited set of piles.","Geo-Engineering; Screw piles; Bearing capacity","en","master thesis","","","","","","","","","","","","Geo-Engineering","",""
"uuid:4206838a-eda5-4372-80d8-1a04ed24f810","http://resolver.tudelft.nl/uuid:4206838a-eda5-4372-80d8-1a04ed24f810","The effect of phase fractions and manganese content on the corrosion properties of Quenched and Partitioned Martensitic Stainless Steel","Crousen, Leon (TU Delft Mechanical, Maritime and Materials Engineering)","Gonzalez Garcia, Y. (mentor); Santofimia, Maria Jesus (graduation committee); Koleva, D.A. (graduation committee); Li, G. (graduation committee); Delft University of Technology (degree granting institution)","2021","A long standing research field in material science has been the trade-off between strength and ductility of steels. Advanced High Strength Steels (AHSS) aim to combine these two properties and provide steels that can increase safety and lower CO2 consumption in automotive applications, by decreasing weight. To further decrease the environmental impact, novel quenched and partioned (Q&amp;P) martensitic stainless steel is considered to prevent corrosion. Quenching and partitioning is a heat treatment that aims for a martensite/retained austenite microstructure with specific phase fractions to optimize strength and ductility. While mechanical properties are well researched for Q&amp;P treated martensitic stainless steel, the corrosion properties are not that widely documented. This thesis aims to discover the influence of the microstructural development in terms of phase fractions due to the Q&amp;P treatment, and the manganese content on the corrosion properties of martensitic stainless steel. Two alloys with chemical composition 0.2C-12.5Cr-0.35Si-XMn, where X stands for 0.7 for the low manganese alloy, and 3 for high manganese alloy, are considered for this study, and are compared to a commercial AISI 420 martensitic stainless steel. The microstructure was investigated by the use of optical microscopy, energy dispersive X-ray spectroscopy (EDS), electron probe microanalysis (EPMA), scanning Kelvin probe force microscopy (SKPFM). This was combined with electrochemical experiments including Open-circuit potential measurements, potentiodynamic polarization and electrochemical impedance spectroscopy (EIS). When compared to commercially available AISI 420 martensitic stainless steel, the novel Q&amp;P MSS showed improved corrosion properties. This can mainly be attributed to the lack of chromium rich carbides (Cr23C6 or Cr7C3) in the Q&amp;P treated MSS. However, this improvement in corrosion properties was only observed for the samples with low manganese content. The increase of fraction retained austenite did show an increase in corrosion potential, making the steel more cathodic, but the improvements in terms of pitting potential and passive film properties are limited. Samples with high fresh martensite fractions also showed an increase in corrosion potential, but only marginally increased in terms of length of the passive region. EIS data shows that the addition of fresh martensite reduces the passivity properties of the material. Volta-potential measurements done by SKPFM showed a clear difference between primary martensite and fresh martensite of up to 20mV and were overlapping with the topography maps. This can be an indication of increased tendency to form micro-galvanic cells between martensite phases. Manganese was found to be detrimental for the corrosion properties of the Q&amp;P treated MSS. A clear drop in the length of the passive region shows that the high manganese samples are more susceptible to pitting. EDS measurements and EPMA elemental distribution maps showed local zones of decreased chromium and increased manganese and silicon. This indicates that there are secondary phase particles present in the material in the form of manganese silicide or manganese sulfide. Volta-potential measurements done by SKPFM showed these particles behave more anodic in comparison to the matrix of the material. The number of particles per unit area was increased for the samples with high manganese content. These inclusions greatly reduce corrosion performance, showing that the addition of manganese is detrimental for corrosion performance. Several other microstructural features are discussed in terms of influence on the corrosion performance of the material. Which include prior austenite grain boundaries, elemental banding of chromium and manganese and Volta-potential differences between martensite laths.","Martensitic Stainless Steel; quenching and partitioning; Corrosion","en","master thesis","","","","","","","","","","","","Materials Science and Engineering","",""
"uuid:e5241516-1967-40a7-b6fd-db16725bcbd5","http://resolver.tudelft.nl/uuid:e5241516-1967-40a7-b6fd-db16725bcbd5","Evaluation on the Effect of Buoyancy on the flow, heat transfer and performance of a Printed Circuit Heat Exchanger A Numerical Study","Dimitriou, Neofytos (TU Delft Mechanical, Maritime and Materials Engineering)","Peeters, J.W.R. (mentor); Delft University of Technology (degree granting institution)","2021","One of the biggest threats that humanity is currently facing is the climate change. The amount of greenhouse gases emissions and specifically the amount of CO2 in the atmosphere has increased and is projected to increase even more in the next years. One possible solution is the use of supercritical CO2 as an alternative working fluid in power cycles (e.g., Rankine and Brayton cycle). Supercritical fluids operate at pressures and temperature higher than their corresponding critical pressure and temperature value. They behave as a single-phase substances with variable thermophysical properties. CO2 at supercritical conditions is denser than supercritical water and steam which can affect the efficiency and the design of multiple mechanical components. printed circuit heat exchangers due to their unique design are suitable for supercritical application. They are compact heat exchangers which can operate at high pressures and temperatures and they can achieve high effectiveness. Because of the rapid variation of the thermophysical properties, heat transfer and flow characteristics in supercritical conditions are affected. Three typical heat transfer modes can occur: 1) Normal Heat Transfer, 2) Deteriorated Heat Transfer and 3) Enhanced Heat Transfer. Furthermore, induced forces due to the density difference also known as buoyancy effects are observed in these conditions and can affect both the flow, the heat transfer of the fluid and thus the performance of the heat exchanger. <br/>The main focus of this study is the induced buoyancy effects inside a printed circuit heat exchanger at laminar flow. Initially, a printed circuit heat exchanger is designed based on the literature. Using this heat exchanger geometry two sets of simulations are conducted in OpenFOAM. In the first set of simulations the Reynolds number and the flow thermal capacity are kept constant while the Grashof number is kept nearly constant in order to determine the dependence of Grashof number on the buoyancy effects. In the second set of simulations the Reynolds number, the flow thermal capacity and temperature difference are kept constant to evaluate the performance of the heat exchanger under real working conditions. Three geometries are under investigation (0.015/ 0.03/ 0.06 m) in three different orientations. 1) Vertical Upwards (Assisted Buoyancy), 2) Vertical Downwards (Opposed Buoyancy) and 3) Horizontal.<br/>In the assisted buoyancy cases the induced buoyancy effects produce an M-shape velocity profile due to the acceleration of the flow near the walls and the deceleration of the flow in the centre of the channel. In this orientation the heat transfer coefficient and the Nusselt number increase and enhanced heat transfer is observed. On the other hand, in the opposed buoyancy cases the velocity near the walls decelerates and accelerates in the centre of the channel resulting to the formation of a Bell-shape velocity profile. Both the heat transfer coefficient and the Nusselt number in this orientation decreases and therefore deteriorated heat transfer is observed. It is also shown that in the opposed buoyancy cases the intense buoyancy effects can produce instabilities of the flow and recirculation zones inside the heat exchanger. Instead of the expected deteriorated heat transfer, the produced instabilities result in enhancement of heat transfer. In the horizontal cases, depending on the conditions, heating or cooling, the maximum streamwise velocity is shifted at the bottom surface (Heating conditions) and at the top surface (Cooling conditions). The formation of the secondary flow inside the horizontal heat exchangers produces an average increase of the heat transfer coefficient and the Nusselt number, thus enhancement of heat transfer. <br/>The performance of the printed circuit heat exchanger in the three orientations is also evaluated. It is shown that buoyancy effects can directly affect the effectiveness and the performance of the heat exchanger. In the cases where enhancement of heat transfer is observed (Assisted Buoyancy and Horizontal) the heat exchanger’s effectiveness increases. For the Opposed Buoyancy cases decrease of the effectiveness is observed due to the deterioration of heat transfer inside the heat exchanger. Important parameters when investigating buoyancy effects inside the heat exchanger are the diameter of the geometry (Directly proportional to the magnitude of the buoyancy effects) and the Grashof number (Differentiates between all the cases and can be used as an indication of the importance of the buoyancy effects). In all the aforementioned cases the overall heat transfer coefficient is affected which has a direct impact on the design (Length) and the cost of the heat exchanger. <br","Buoyancy Effects; Heat Exchanger; Flow Deformation; Heat Transfer; Assisted Buoyancy; Opposed Buoyancy; Horizontal","en","master thesis","","","","","","","","2021-12-31","","","","Mechanical Engineering","",""
"uuid:ed875285-3845-4ad8-bf83-fa63a7a1ceed","http://resolver.tudelft.nl/uuid:ed875285-3845-4ad8-bf83-fa63a7a1ceed","Synergies-Based Teleoperation of a Robot Hand by a Hand Tracking System","Lee, Chia-Fu (TU Delft Mechanical, Maritime and Materials Engineering; TU Delft Biomechanical Engineering; TU Delft OLD Biorobotics)","Della Santina, C. (mentor); Babuska, R. (graduation committee); Vardar, Y. (graduation committee); Delft University of Technology (degree granting institution)","2021","Hand pose tracking in 3D configuration is one of the popular components of human-computer interaction research, which can be seen applying in virtual reality (VR) and augmented reality (AR). Although the research field has been thoroughly studied in the past few decades, most methods emphasized recognizing hand gestures or joint locations. However, computer interaction these days requires numerous manual object interactions. The paper first reviews state-of-the-art hand pose estimation and tracking methods to achieve accurate hand tracking and control. Then we describe the general procedure for recovery 3D hand model. In the second place, the results of tracking whole hand kinematics using the extended Kalman filter (EKF) based on data recorded from the surface markers are presented. Finally, in the part of teleoperation, the paper presents a novel method for applying synergy-based mapping strategy for SoftHand 2 control. And we demonstrate the simulation results of telemanipulation with hand racking through Simulink.","Hand Tracking; Teleoperation; Principal Component Analysis; Synergies-based control","en","master thesis","","","","","","","","2021-11-26","","","","Mechanical Engineering | Biomechanical Design - BioRobotics","",""
"uuid:1f87b266-f0f6-4a29-a97d-886e64ab9342","http://resolver.tudelft.nl/uuid:1f87b266-f0f6-4a29-a97d-886e64ab9342","The influence of location on the profitability of a charging station","Arnoldus, Matthijs (TU Delft Electrical Engineering, Mathematics and Computer Science)","van Essen, J.T. (mentor); Heemink, A.W. (graduation committee); Delft University of Technology (degree granting institution)","2021","With the increasing number of electric vehicles on the road, the routing problem has become more complex. As charging electric vehicles takes longer than fueling non-electric vehicles, congestion can occur at charging stations. This might lead to the shortest route not being the fastest route, due to long waiting times at the stations. By communicating the intentions of each vehicle, the vehicles can spread out over multiple stations. This thesis investigates the eect of such a routing system on the profitability of charging stations. In particular, the influence of a charging station's location on its profitability has been researched. In order to do this, a pricing model has been developed to extend the routing model. It has become clear that due to the intention-aware routing, the number of visits at stations is harder to predict, and there is not always a clear pattern to be found between the location and the number of visits. This research does, however, propose an optimisation model, which can decide where to build a new charging station, such that the number of visits will be the highest.","EV routing; Graph theory; Optimisation; Pricing model","en","bachelor thesis","","","","","","","","","","","","Applied Mathematics","",""
