"uuid","repository link","title","author","contributor","publication year","abstract","subject topic","language","publication type","publisher","isbn","issn","patent","patent status","bibliographic note","access restriction","embargo date","faculty","department","research group","programme","project","coordinates"
"uuid:4b693437-e31c-4ef3-bc10-781cfd5b34d8","http://resolver.tudelft.nl/uuid:4b693437-e31c-4ef3-bc10-781cfd5b34d8","Humanising robot fingers: Design, prototyping, and validation of an anthropomorphic robot finger with humanoid joint-ligament systems, tendon configurations, and supporting ligaments","van Ooijen, Jacob (TU Delft Mechanical, Maritime and Materials Engineering)","Leijnse, J.N.A.L. (mentor); Smit, G. (graduation committee); Delft University of Technology (degree granting institution)","2022","Background: Current challenges in the design of anthropomorphic robot fingers is the implementing of anatomically accurate tendon-ligament structures, specifically for the collateral ligaments, volar plates, and the extensor apparatus. The development of robot fingers with these structures could aid in the further understanding of the functional anatomy and biomechanics of the human finger. It has been suggested that these fibrous structures can be emulated as a set of individual, non-elastic strings. The configuration of these tendon-ligament structures result in the specific motions of the finger. <br/>Aims: The aims of this thesis were to develop and manufacture an anthropomorphic finger prototype with fully anthropomorphic tendon-ligament systems. So the prototype could be functionally actuated as a human finger, and would perform humanoid motion mechanisms, such as the Interphalangeal joint<br/>coupling, an ab-adduction/axial rotation coupling.<br/>Methods: A parametric finger model was derived from CT images of human finger bones, with a focus on the soft tissue connection to the joints and the tendon pulley system attached to the phalanges. The finger segments were designed as a shell structures with functionally anthropomorphic shapes. The finger contained the metacarpal bone, the proximal, middle and distal phalanx and included<br/>humanoid joints, tendons, and ligaments. These finger bone shells had fine rosters of perforations for the attachment of joint ligaments and supporting ligaments, implemented as a collection of individually attached dyneema strings, allowing for the precise and iterative attachment of these strings. The strings<br/>had adjustment possibilities to accurately determine their functional lengths. This model was then produces by FDM additive manufacturing on a scale of 5:1 with PLA as a material. To reduce the friction around the joints, friction experiments were performed, where graphite in an epoxy resin was found to be an appropriate coating for the joint surfaces. The tendons and ligaments systems were developed as a collection of non-elastic Dyneema strings, where the string lengths and positioning were identified according to biomechanical finger models.<br/>Results: The result was the creation of a finger prototype with anthropomorphically realistic pulley systems for the tendons with joint surfaces of minimal friction, so that the finger could be actuated by the tendons to simulate realistic humanoid behaviour. The humanoid motion, and coupling mechanisms<br/>were verified with 2D motion tracking software and manual measurements by performing possible<br/>movements done by actuating the muscle tendons of the finger prototype and by comparing the resulting<br/>motion with that of a human finger. Where the finger prototype performed similar motions as a human finger.<br/>Conclusions: This research project successfully developed an anthropomorphic finger with humanoid joint-ligament systems connecting the finger segments, and tendon configurations. It showed the possibility of constructing these systems and configurations as a set of individual strings that could emulate the structures found in the human body. The resulting anthropomorphic finger can form a<br/>basis for further research in the complex mechanics, relation, and dependencies of the human hand and in doing so, aid in the study of a wide range of pathologies in the finger and the hand, as well as support surgeons in reconstructive surgery and rehabilitation.","anthropomorphic robot finger; Humanoid; Tendon-driven; Ligament structures; Interphalangeal; Abduction-Axial Rotation; Coupling mechanism; 3D Printing","en","master thesis","","","","","","","","2023-10-19","","","","Biomedical Engineering","",""
"uuid:d705268c-fb94-4406-8dd0-d213c5261232","http://resolver.tudelft.nl/uuid:d705268c-fb94-4406-8dd0-d213c5261232","Evaluating the Effect of Data Drift on Model Performance","Wang, Wenhui (TU Delft Electrical Engineering, Mathematics and Computer Science)","Houben, G.J.P.M. (mentor); Yang, J. (mentor); Decouchant, Jérémie (graduation committee); Delft University of Technology (degree granting institution)","2022","Data drift refers to the variation in the production data compare to the training data and sometimes the machine learning model would decay because of it. Some machine learning models face the problem when in production: they receive drift data while there’s no ground truth to evaluate model performance, thus no way of determining the effectiveness of the model. Most of the previous researchers either detect drift in a statistical way and don’t look into the meanings of the drift, or require ground truth when it’s often not possible.<br/><br/>In this research, we work with the inland shipping model from ILT, which is a random forest model that is used to predict whether a ship is likely to violate certain regulations. We are given an out-of-sample set, which contains ships that the inland shipping model can predict but with no labels, so no ground truth to validate. We aim to evaluate the effect of possible data drift of the out-of-sample set on model performance. We propose a novel framework that first takes advantage of expert knowledge to decide drift groups with real meanings; then, we apply pseudo labeling, a mechanism that can create approximate labels for the unlabeled data; finally, we use the pseudo-labeled data to evaluate model performance. Our work shows a possible way when facing the common data drift problem and no ground truth problem for a real dataset in a production environment.","data drift; pseudo label; semi-supervised learning","en","master thesis","","","","","","","","","","","","","",""
"uuid:0e079f8c-873f-4645-8c18-c381c0554ccb","http://resolver.tudelft.nl/uuid:0e079f8c-873f-4645-8c18-c381c0554ccb","Utilizing manufacturing-induced stresses for obtaining non-monostable compliant mechanisms","Linssen, Jonathan (TU Delft Mechanical, Maritime and Materials Engineering; TU Delft Precision and Microsystems Engineering)","Radaelli, G. (mentor); Herder, J.L. (graduation committee); Mirzaali, Mohammad J. (graduation committee); Delft University of Technology (degree granting institution)","2022","A broad range of bistable, multi-stable and neutrally stable compliant mechanisms have been developed over the years. These non-monostable systems show great potential for deployment in e.g. the medical, the manufacturing and the precision industry. Often the presence of prestress is a requirement for obtaining non-monostability within the realm of compliant mechanisms. This prestress is for example a strict necessity for neutrally stable behaviour, but also various types of bistable systems need it for correct operation. Systematic methods to induce prestress to these mechanisms do not yet exist. Currently, the application of prestress is most often achieved by manual assembly steps. The manual nature of these assembly steps poses problems onto the dimensional scalability, the production scalability and the design freedom of these mechanisms. In this research the possibilities of imposing prestress onto compliant mechanisms during their fabrication, solely by utilizing inherent features of the manufacturing method, are explored. With such a technique at hand, an accurate, scalable and tailorable method for prestressing is obtained. In this work the fused filament fabrication technique is used to create PLA monostable compliant mechanisms. By making use of the heat-induced shrinkage property of PLA, a distributed and variable material shrinkage field can be acquired. By the virtue of this variable shrinkage, elements within the system can selectively be prestressed. Results show that the mechanical stability behaviour of a demonstrator mechanism can permanently be changed from monostable to bistable. The influence of various design parameters on the shrinkage yield and the force-delivering potential of PLA is examined to tailor and maximize both factors. The result of this work provides the onset for the further creation of multi and neutrally stable compliant mechanisms in a systematic way.","Compliant mechanisms; Prestress; Stability alteration; Shape Memory Polymer; Fused Filament Fabrication","en","master thesis","","","","","","","","","","","","Mechanical Engineering","",""
"uuid:111db0c8-2230-4dbe-bce5-a802e62e860a","http://resolver.tudelft.nl/uuid:111db0c8-2230-4dbe-bce5-a802e62e860a","Studying the evolution of photochromic rare-earth metal oxyhydride films with UV exposure &amp; cycling using optical transmission, X-ray diffraction, positron annihilation &amp; ellipsometry","Beek, Melanie (TU Delft Applied Sciences)","Eijt, S.W.H. (mentor); Dam, B. (graduation committee); Schut, H. (graduation committee); Delft University of Technology (degree granting institution)","2022","The main goal of this thesis is to better understand the photochromic mechanism in rare-earth (RE) oxyhydride thin films. When illuminated, these materials have shown to darken, and bleach to a transparent state when the illumination source is removed. The RE oxyhydride thin films used in this thesis are deposited using magnetron sputtering and are YOxHy and GdOxHy films with different storage (air and vacuum) and oxidation (air and dry air) conditions. The films were probed using Doppler broadening positron annihilation spectroscopy, spectrophotometric (optical) measurements, X-ray diffraction and spectroscopic ellipsometry, measured before, during and after in or ex situ ultraviolet illumination. <br/><br/>Series of illumination and bleaching cycles have shown to permanently induce vacancy defects, which are most likely divacancies. The photochromic effect is seen as a reversible process, which leads us to believe that the changes seen in the defects are not directly responsible for the photochromic effect. During in-situ photodarkening and bleaching partially reversible changes are seen, whereby systematic shifts in the positron annihilation Doppler parameters are exhibited. This shift correlates with the photochromic effect, where the irreversible formation of vacancies is seen as a result of UV illumination. This leads us to the idea of the formation of metallic domains that may be attributed to H- ions that become mobile under illumination and may cluster to form metallic domains. Furthermore, the formation of the vacancy defects correlates with an increase in bleaching times seen from optical measurements, suggesting that they could play a role in the memory effect. Another optical property seen is a change in the band gap. We have seen that during photodarkening, the band gap tends to widen and decrease during bleaching. This phenomenon can be associated with the Burstein-Moss effect and can be used to estimate the photo-induced electron density in the conduction band. Despite the changes observed from positron annihilation techniques and optical measurements, no significant differences were observed by X-ray diffraction. The lattice constants of the film before and after illumination were shown to be constant.<br/><br/>There are two hypotheses explaining the photochromic mechanism: the segregation of metallic domains as a result of H- ion mobility and an Anderson-Mott insulator-to-metal transition as a result of overlapping electron wave functions. Using spectroscopic ellipsometry, these models were tested for YOxHy. It is shown that the mechanism leading to the darkening of the films is best described by the formation of Y or YHx metallic domains and voids. The percentage of metallic domains and voids grows with illumination time and starts stabilising after 90 minutes of illumination. The fraction of metallic domains (1.9-2.6% after 150 minutes of illumination) is similar in magnitude as seen in previous studies. Furthermore, the voids probed by ellipsometry are much larger than the vacancy-related defects probed by positrons. Such voids could give rise to the formation of positronium in the films, as could be examined in future positron annihilation lifetime spectroscopy (PALS) experiments.<br/><br/>Qualitatively GdOxHy and YOxHy behave similarly when it comes to optical measurements, XRD and DB-PAS data. For both systems, an increase in bleaching time as a function of illumination and bleaching cycles, a widening and shrinking of the band gap and a decrease in contrast are observed. However, there are quantitative differences between these films. The bleaching constant is shorter for GdOxHy and the contrast is higher, which makes it seem more attractive for potential applications. However, GdOxHy could not yet be satisfactorily modelled, in contrast to the case of YOxHy using spectroscopic ellipsometry. The GdOxHy film could not be described by a single homogeneous layer and therefore requires more complex models to describe the behaviour of the film in future work.","","en","master thesis","","","","","","","","","","","","Applied Physics","",""
"uuid:c1384a3e-1701-4235-8a3b-7cd206df6d9c","http://resolver.tudelft.nl/uuid:c1384a3e-1701-4235-8a3b-7cd206df6d9c","Experimental investigation of the effects of mudflaps on wheel aerodynamics by means of a simulated moving ground","GHOSH, SIDDHARTH (TU Delft Aerospace Engineering)","Sciacchitano, A. (mentor); Veldhuizen, Roy (mentor); Scarano, F. (graduation committee); Elsinga, G.E. (graduation committee); Delft University of Technology (degree granting institution)","2022","This work provides a foundation for designing aerodynamic mudflaps used in heavy-duty vehicles, which will help these vehicles become greener. First, a simulated moving ground consisting of a leading edge, roller setup and a novel tangential blowing system was devised as an alternative to the expensive conveyor belts necessary for pertinent experiments. The crucial design parameters, such as rounded, smaller support walls and uniform pressure inputs, were determined using two initial blowing slot designs. Next, a boundary layer analysis and tests on an isolated wheel using planar PIV demonstrated its ability to drastically reduce the effects of the boundary layer and accurately emulate wheel flow. Finally, mudflaps of different solidity and solidity locations were tested using stereoscopic PIV measurements on a simplified setup. Drag estimates showed that more solidity led to higher drag and wake skewing, and having lesser solidity on the top gave 15% lower drag than the bottom.","Mudflaps; wheel aerodynamics; moving ground; PIV; Heavy duty vehicles","en","master thesis","","","","","","","","","","","","Aerospace Engineering","",""
"uuid:434ed5e3-fe86-4fe4-a170-2f694c2433ae","http://resolver.tudelft.nl/uuid:434ed5e3-fe86-4fe4-a170-2f694c2433ae","The quantification of stability of kinematic couplings using robotic grasping measures","Resink, Jaap (TU Delft Mechanical, Maritime and Materials Engineering)","Herder, J.L. (mentor); van de Sande, W.W.P.J. (mentor); Wiertlewski, Michaël (graduation committee); Delft University of Technology (degree granting institution)","2022","Kinematic couplings (KCs) are a subclass of couplings known for reaching unmatched precision, through relatively simplistic designs. The 3-vee-groove and Kelvin clamp are the archetype designs, and are still being further investigated for their potential. One of the limiting factors in the field of kinematic couplings is the lack of proper knowledge on how to assure stability of newly designed couplings. In this paper, the theoretical gap between the field of robotic grasping and the field of kinematic coupling is researched. It is shown that by making small alterations in the way of modelling the design problem, one can lend the performance measures that are used in the field robotic grasping for quantification of grasp performance, and apply these on the design process of kinematic couplings. This allows a designer to quantify and predict performance of newly designed couplings. The measures analysed in this paper are compared and scored in a table, where a tool is presented to help guide future coupling designers in the process.","Kinematic couplings; Coupling design; Robotic grasping; Quantification of couplings; Exact constraint design; ECD","en","master thesis","","","","","","","","","","","","Mechanical Engineering | Mechatronic System Design (MSD)","",""
"uuid:bf676204-d0b3-4579-a4a0-7997e911c5fc","http://resolver.tudelft.nl/uuid:bf676204-d0b3-4579-a4a0-7997e911c5fc","Quality assessment of organic geotechnical samples","Oderwald Blázquez, Adrian (TU Delft Technology, Policy and Management; TU Delft Civil Engineering and Geosciences)","Zwanenburg, C. (mentor); Wolf, K.H.A.A. (graduation committee); van den Eijnden, A.P. (graduation committee); van der Made, Kees Jan (graduation committee); Delft University of Technology (degree granting institution)","2022","For certain geotechnical structures, such as dikes and levees, the design quality is heavily reliant on the sampling quality. In addition, the extent of consequences on geotechnical design of using parameters from samples with a certain degree of disturbance in laboratory tests is unclear. While the available literature has been mainly focussed on disturbance experienced by clay samples, the same empirical findings are not always applicable to organic soils such as peat and organic clay. The global objective of this thesis was to gain an understanding of sampling disturbance in organic soils using both established and non-destructive experimental methods. In order to achieve this, the traditional Dutch Ackerman sampling technique was compared to that of a recently developed sampler, the Deltares Large Diameter Sampler (DLDS). Non-destructive methods and 1D consolidation parameters were used to quantify disturbance in organic soil samples.<br/><br/>The results from existing databases showed that organic clay has a clear linear trend between <i>w</i> and <i>RR</i> and peat showed no definitive correlation, although the peat sampled by the DLDS had significantly higher water contents than the peats from the Ackerman sampler. Moreover, 37% of organic clay and peat Ackerman samples had an <i>∆e/e<sub>0</sub></i> below 7%. Meanwhile, all the DLDS results from the Deltares laboratory had an <i>∆e/e<sub>0</sub></i> of less than 4%. The use of this parameter is still questionable for peats, as the higher e0 found in DLDS peats is the cause for low disturbance measurements. However, the <i>∆e/e<sub>0</sub></i> index may be used in conjunction with other destructive and non-destructive disturbance parameters. Furthermore, the trend showed it becomes increasingly difficult to produce high quality samples with increasing in-situ vertical stress. <br/><br/>Using differences in shear wave velocity as a non-destructive disturbance determination technique, it was concluded that the increased shear wave velocity in Ackerman samples relative to the DLDS samples, although slight, was due to densification of the outermost volume of the sample being compressed by the sampling procedure. This effect was further observed in the other non-destructive method use in this investigation, CT scanning. Analysis of micro-CT scans showed that all specimens had higher greyvalue intensities at the perimeter than at the centre of the sample, however the observed effect was 7.4 times higher with the Ackerman specimens than with the DLDS specimens.<br/><br/>The main recommendation is to continue research on the effectiveness of using non-destructive methods to quantify sample disturbance in peats. For the sampling industry, it is advised to increase the diameter of the Ackerman sampling tubes to between 70 and 120 mm when sampling in peat. In addition, in light of the lesser disturbance caused by the DLDS, it is advised to deploy it in shallow peats instead of the Ackerman sampler with the current inner diameter of 67 mm. Furthermore, it is recommended to deploy both types of samplers side-by-side in sampling projects in order to diminish the effect of site-specific variables.","geotechnical sample; disturbance; CT scan; DLDS; Ackerman sampler; shear wave; oedometer","en","master thesis","","","","","","","","","","","","Geo-Engineering","",""
"uuid:9085e69b-be0c-41c1-86be-d63c7edc43d0","http://resolver.tudelft.nl/uuid:9085e69b-be0c-41c1-86be-d63c7edc43d0","Modelling stochastic volatility via factor models: An asymmetric approach","Vogel, Tim (TU Delft Electrical Engineering, Mathematics and Computer Science)","Parolya, N. (mentor); Delft University of Technology (degree granting institution)","2022","In this thesis, a factor model which estimates multivariate time series is extended to include an asymmetric relation between the returns of assets and the volatility of said assets. The model proposed in this thesis uses the classical factor model, with univariate logarithmic volatility equations to model the factors as well as the asset innovations. The volatility equations for the factors are extended to contain an asymmetric relationship with the factor returns of the day before. In this thesis, a method to estimate this asymmetric model is developed, the method of estimation mainly relies upon MCMC methods. A method to estimate the logarithmic likelihood for the model is provided as well. This method uses a particle filter to estimate the distribution of the volatility. Using the logarithmic likelihood, it is shown that the asymmetry in the data is identifiable, by comparing the likelihood of the model to the likelihood of the classical factor model, as well as to the likelihood of a factor model with a jump extension. Finally, the model is tested on a real data set of daily returns where its effectiveness is again compared to the classical model and the jump model.","","en","master thesis","","","","","","","","","","","","Applied Mathematics | Financial Engineering","",""
"uuid:04e32ffd-6334-4622-b4fc-71d2c1004ead","http://resolver.tudelft.nl/uuid:04e32ffd-6334-4622-b4fc-71d2c1004ead","Wave radiation from offshore pile driving for non-symmetric force fields","El-Ghalbzouri, Amal (TU Delft Civil Engineering & Geosciences)","Molenkamp, T. (mentor); Tsouvalas, A. (graduation committee); Peng, Y. (graduation committee); Delft University of Technology (degree granting institution)","2022","Monopiles are by far the most chosen foundation option for most off-shore activities. The installation of the foundation is commonly done by impact pile driving. The biggest issue of the traditional pile driving method is the sound emission, which reaches levels that are harmful to the immediate environment. Partly because of this, an alternative pile driving method is being developed, namely the Gentle Driving of Piles [1], where the hydraulic hammer is replaced by a GDP-shaker, which drives the pile toe into the ground by means of a torsional force. This is an additional incentive for developing a predictive model for the underwater noise radiation due to a non-symmetric force field. The model proposed in this thesis is similar to the existing symmetric semi-analytical model SILENCE [2], where the model consists of two submodules, namely a pile module and a module that describes the acousto-elastic medium. In both submodules the displacement field of the subsystem is described using its modal field. The procedure for both systems are derived and explained in further detail in chapter 3. To combine the submodules two different mode-matching methods, that account for the azimuthal direction, are developed in chapter 4. One of these methods is the so-called Orthogonality method, which is, similar to [3], based on the orthogonality relations of the acousto-elastic medium. The other is referred to as the Point-Collocation method, which is loosely based on the reciprocity theorem. Both methods have proven to be sufficiently stable to achieve good convergence at least for lower frequencies. The model is tested a small sized pile case study. The results are assessed in chapter 5 through the frequency spectra of the acousto-elastic medium as well as the metrics. The time evolution of the response is also looked at, even though these are considered less reliable, due to the limited frequency range.","","en","master thesis","","","","","","","","","","","","Civil Engineering | Structural Engineering | Hydraulic Structures","",""
