"uuid","repository link","title","author","contributor","publication year","abstract","subject topic","language","publication type","publisher","isbn","issn","patent","patent status","bibliographic note","access restriction","embargo date","faculty","department","research group","programme","project","coordinates"
"uuid:8cd6c71f-c641-4315-8a2a-dba3117d280b","http://resolver.tudelft.nl/uuid:8cd6c71f-c641-4315-8a2a-dba3117d280b","Restoration of Missing Data using a Human Adaptive Framework: The Cleansing Algorithm","Dijkstra, Sjoerd (TU Delft Electrical Engineering, Mathematics and Computer Science)","van Buuren, P. (mentor); Chen, P. (mentor); Jongbloed, G. (graduation committee); Papapantoleon, A. (graduation committee); Delft University of Technology (degree granting institution)","2022","class=""MsoNormal"">Improving data quality is of the utmost importance for any data-driven company, as data quality is unmistakably tied to business analytics and processes. One method to improve upon data quality is to restore missing and wrong data entries.  </p><p class=""MsoNormal"">The goal of this research is construct an algorithm such that it is possible to restore missing and wrong data entries, while making use of a human adaptive framework. This algorithm has been constructed in a modular fashion and consists of three main modules: Data Transformation, Data Structure Analysis and Model Selection. Data Transformation has concerned itself with conversion of raw data to data types and forms the other modules can use. </p><p class=""MsoNormal"">Data Structure Analysis has been designed to deal with correctly missing data and dichotomy in the target feature by making use of three clustering algorithms: DBSCAN, K-Means and Diffusion Maps. DBSCAN is used to determine the necessity of clustering as well as the initialisation of the K-Means algorithm. K-Means and Diffusion Maps have been used as clustering methods in the one-dimensional target feature and the two-dimensional input-target feature pairs, respectively. Data Structure Analysis has further been designed to perform feature selection through three filter methods: CorrCoef, FCBF and Treelet.</p><p class=""MsoNormal"">Model Selection has proposed a novel approach to selection of the best model of a candidate set through the optimisation of a conditional model ranking strategy based on the prior construction of theoretical testing. Our candidate set consisted of Expectation Maximisation, K-Means, Multi-Layer Perceptron, Nearest Neighbor, Random Forest, Linear Regression, Polynomial Regression, ElasticNet Regression.</p><p class=""MsoNormal"">In terms of restorability, it was shown that the optimal configuration of the Cleansing Algorithm for the restoration of missing data, was provided by opting not to use clustering, using a custom alteration to the Treelet algorithm for feature selection and making use of the model selection strategy. This not only lead to the greatest restorability of 56.90% on Aegon data sets, which was an improvement of 44.83% when compared to not using the Cleansing Algorithm, but also to the reduction of computation time by over 400%. A more realistic restorability due to the presence of correctly missing data, was given by the same configuration making use of one-dimensional output clustering. This resulted in a restorability on Aegon data sets of 43.10%. As such it was deemed possible to restore missing data on Aegon data sets.</p><p class=""MsoNormal"">With respect to the human adaptive framework, it was determined that the construction of the algorithm be modular in the sense that any alternate feature selection or clustering approach can be implemented with ease. Furthermore, the model selection module allows us to customize the theoretical testing and choice of regression or classification models for the restoration of missing data. In doing so, the algorithm has laid the foundations for human adaptivity of the Cleansing Algorithm.","Missing Data; Restoration; Clustering; Feature Selection; Model Selection","en","master thesis","","","","","","","","","","","","Applied Mathematics","",""
"uuid:45bffaf0-5ae0-48a2-9fe7-5ebfe2594cb5","http://resolver.tudelft.nl/uuid:45bffaf0-5ae0-48a2-9fe7-5ebfe2594cb5","Machine learning for cardiovascular modelling: Predicting time-dependent, aortic blood flow","Hoogeveen, Sylle (TU Delft Electrical Engineering, Mathematics and Computer Science)","Heinlein, A. (mentor); Möller, M. (graduation committee); Heemink, A.W. (graduation committee); Delft University of Technology (degree granting institution)","2022","The increase in complexity of mathematical models in an attempt to approximate reality and desire to have near real-time results have emphasized the need for fast numerical simulations. Especially in areas where classic numerical methods struggle to produce valid solutions in reasonable computational time due to their<br/>complex behaviour on multiple temporal and spatial scales, such as (cardio-vascular) fluid modelling, machine learning techniques can be of help. The aim of this study is to construct a single reduced order model, based on neural networks, for time-dependent incompressible blood flow through the aorta that can account for varying velocity inlet conditions, material parameters and geometries (computational domains). The objectives are to minimize the reduction of accuracy of simulated time series with OpenFoam, and to obtain speedup compared to the OpenFoam simulations.<br/><br/>In this study, aortic blood flow during one heartbeat is modelled by Navier-Stokes equations for incompressible, Newtonian fluids. Data for training and testing the neural networks was generated using the finite volume method. The network architecture consists of a convolutional encoder and decoder model for dimensionality reduction, with an additional neural network for time evolution inserted between the encoder and decoder. The network takes one time step as input and predicts five consecutive time steps ahead. Three different networks for time evolution were tested. The best performing network was tested on increasingly complex computational domains. Thereafter, the network’s ability to generalize to varying inlet velocity patterns and new variations of the computational domain was tested, for which the network for time evolution was adapted to take into account varying inlet velocity patterns. The performance of the networks was evaluated on predicting one to five time steps ahead from one input time step, and using the prediction of one time step ahead recursively to obtain the prediction of one entire heartbeat.<br/><br/>The best performing architecture found was an encoder, recurrent neural network with long-short term memory units for time evolution, decoder model combination. The generalizability for the tested material parameter, blood viscosity, while keeping the inlet velocity pattern fixed, appeared quite good. A relative mean absolute error (MAE) of around 10% was obtained for straight, bent and bifurcated channel geometries. When testing the network on varying inlet velocity patterns, the relative MAE in the domain increased considerably to<br/>around 25%. In general, the relative errors were significantly higher in comparison to the absolute errors, and mainly increased by low velocity parts of the domain and time series. In addition, the full height of the velocity peak was not always captured and a spike in the domain MAE was seen for rapidly decreasing inlet velocities. Also, the network was unable generalize to new geometries. <br/><br/>Various attempts to improve the accuracy, including altering the loss function and augmenting the data, were not successful. However, many choices of data augmentations, normalization techniques and loss functions were not tested and could improve the performance. The generalizability to different computational<br/>domains could be improved by adding more geometries and more variation to the geometries in the data. Nonetheless, the prediction of one heartbeat was obtained in approximately 20s, which is equivalent to an achieved speedup of around 20 compared to OpenFoam simulations. In conclusion, this research should be seen as a basis for time-dependent blood flow predictions in the aorta, from which a multitude of different paths can be explored.","Machine learning; Computational Fluid Dynamics (CFD); cardiovascular modeling; Time Series Forecasting","en","master thesis","","","","","","","","","","","","Applied Mathematics | Computational Science and Engineering","",""
"uuid:4c2443a6-cf3d-4ab1-95b4-8c11a89b5cfd","http://resolver.tudelft.nl/uuid:4c2443a6-cf3d-4ab1-95b4-8c11a89b5cfd","Recycling of Blast Furnace Sludge through Carbochlorination and Direct Reduction: Increasing Material Circularity in Ironmaking","Muhammad Dzikri Ahira Soefihara, S (TU Delft Mechanical, Maritime and Materials Engineering)","Yang, Y. (mentor); Xiao, Yanping (mentor); Abrahami, S.T. (graduation committee); Welink, J.H. (graduation committee); Delft University of Technology (degree granting institution)","2022","br","Recycling; Blast Furnace Sludge; Carbochlorination; Direct Reduction; Heavy Metals","en","master thesis","","","","","","","","2024-10-27","","","","Materials Science and Engineering","",""
"uuid:f40875ba-a601-445d-a78a-57e3e135ce69","http://resolver.tudelft.nl/uuid:f40875ba-a601-445d-a78a-57e3e135ce69","An Evaluation of Next Generation Rocket Engines for VT SSTO RLV","Sonneveldt, Douwe (TU Delft Aerospace Engineering)","Mooij, E. (mentor); Naeije, M.C. (graduation committee); Zandbergen, B.T.C. (graduation committee); Delft University of Technology (degree granting institution)","2022","Observing that the majority of SSTO programs failed due to the propulsion system being far ahead of its time. Furthermore, acknowledging the that the private launch markets is increasingly dominated by partly reusable TSTOs. This thesis aims to evaluate whether next generation rocket engines make an SSTO viable within a foreseeable economical time frame, for the increasingly privatised space industry. From the market analysis it follows that the VT SSTO RLV developed by the private launch industry, with a payload capability of 15- 20 tons to a LEO with an altitude of 200-400 km, is most likely. The evaluation is performed by a two level trade-off. Initially, a literature trade-off is preformed on elaborate range of potential next generation rocket engine, which are subdivided into pure rocket engine and breathing engine. All engines are evaluated on the market requirements, performance, and achievability. Only three engine types are selected. Upon evaluating the propulsion literature it was noticed that no literature cross evaluated advanced propulsion systems with high performance propellant pallets. Therefore, a literature propellant trade-off is performed. For the aerospike, the pulse detonation engine and the precooled hybrid airbreathing rocket engine with the propellant pallets H2/O2, CH4/O2, C2H2/O2, and C2H4/O2 a performance analysis is performed. The performance analysis is done by both optimising the engine configurations and the ascent trajectory for a 15 ton payload delivery to an orbit of 400 km altitude. To simulate each engine, three performance analysis are developed, which are all derived from the continuity equations to ensure a consistent comparison. The aerospike is simulated as a continuous optimal convectional via the frozen equilibrium method, although it is found an alternation is needed to account for directional losses. The open-end of the PDE is simulated via a CJ-detonation wave followed by an exponential decaying blowdown phase. The DC nozzle expansion is iteratively simulated via the frozen equilibrium method. The intake and HPC of the precooled hyrbid airbreathing engine is simulated with convectional aero engine performance analysis, while the precooler is simulated ass a counter-flow heat exchanger. The CC and CD nozzle are simulated via the frozen equilibrium method. From the optimised trajectory the representative performance of each engine is extracted and five engine configurations are identified as viable VT SSTO RLV engines. These are the H2/O2 powered aerospike, the pulse detonation engine and the precooled hybrid airbreathing rocket engine operating on an H2/O2 pallet, and the C2H2/O2 powered aerospike and pulse detonation engine. The H2/O2 powered PDE is found to be the most promising, as it offers the best performance gain relative to its achievability. Therefore, it advocates that future VT SSTO RLV research utilises the H2/O2 powered pulse detonation engine as the main propulsion system","Single-stage to orbit; Reusable Launch Vehicle; Aerospike; Pulse detonation engine; Precooled hybrid airbreathing rocket engine; literature trade-off; performance trade-off; Market research; Next generation rocket engines","en","master thesis","","","","","","","","","","","","Aerospace Engineering","",""
"uuid:d9a1260f-1550-4bdf-be79-03d97632e6e5","http://resolver.tudelft.nl/uuid:d9a1260f-1550-4bdf-be79-03d97632e6e5","Empirical battery degradation modelling: similarities, differences and shortcomings of various models","Prasad, Surya (TU Delft Electrical Engineering, Mathematics and Computer Science)","Chandra Mouli, G.R. (mentor); Bauer, P. (mentor); Cremer, Jochen (mentor); Delft University of Technology (degree granting institution)","2022","Renewable energy sources, although they are quickly increasing their share in the energy mix, face a major barrier to more widespread adoption. Energy storage solutions overcome this hurdle, and lithium-ion batteries are at the forefront of this. The need for lithium-ion battery degradation studies arises due to the ever increasing use of these batteries in a wide variety of applications.<br/><br/>There exist a large number of empirical and semi-empirical battery degradation models in literature, however their usage with irregular, real world profiles has not been explored. Moreover, understanding where different models can be used and comparing these models is also an area that has not been looked at.<br/><br/>A real world power profile was created in MATLAB based on the WLTP drive cycle. Simultaneously, each model considered was verified against the experimental data for that same model to make sure model predicted degradation values matched the experimental observations. In three models, the verification procedure revealed errors and inaccuracies that were corrected. Implementing an irregular<br/>power profile posed two challenges, first, the stress factors of time and throughput required linearized versions of the model equations to be properly accounted for. Second, the identification of cycles in the irregular power profile is usually done using the rainflow counting algorithm, however, an alternative method is proposed in this study.<br/><br/>The real world power profile was applied to each calendar and cyclic ageing model and it was noted that although the power profile was equalized for each cell based on the model in question, the results were widely differing. In some cases, it was possible to explain the differences but in some cases the differences were not easily explained. Apart from the comparison, each model was individually analyzed to understand how degradation phenomena and stress factors affect the accuracy and use case of a model.<br/><br/>Finally, a toolbox was built in MATLAB to summarize the findings of this study, to help users understand where each model studied is likely to be accurate and useful. It was concluded that empirical and semi-empirical models are highly dependent on the testing conditions of the experimental data they<br/>are built on, and there are extremely limited scenarios in which these models are applicable outside these conditions. Moreover, accelerated testing conditions which are often used in the experimental phase usually cover different degradation phenomena than those which occur under regular use cases.<br/>With respect to the application of irregular (real-world) power profiles to these models, this study details a unique method used to obtain accurate predictions.","lithium-ion battery; battery degradation; Empirical models","en","master thesis","","","","","","","","","","","","Electrical Engineering | Sustainable Energy Technology","",""
"uuid:7601470d-b2c8-4678-aa2a-1cbaa6e61503","http://resolver.tudelft.nl/uuid:7601470d-b2c8-4678-aa2a-1cbaa6e61503","Explaining the FLASH Effect: Investigating the Oxygen Hypothesis of the Proton FLASH Effect in Zebrafish","de Groot, Chiel (TU Delft Applied Sciences)","Perko, Z. (mentor); Carroll, E.C.M. (mentor); Rovituso, M. (mentor); Delft University of Technology (degree granting institution)","2022","This thesis investigates the tissue sparing effect of FLASH (&gt;40 Gy/s) radiation, as opposed to CONV (conventional, dose rates typically between 0.01­0.1 Gy/s) radiation. We irradiated zebrafish embryos (4 days past fertilisation) with 116 MeV protons. The aim was (1) to measure the effect, and (2) if the effect were significant, see whether it depended on the oxygen concentration in the tissue, as the oxygen depletion hypothesis (a popular theory on the underlying mechanics of the FLASH effect) predicts. We irradiated embryos with either FLASH or CONV, where a possible FLASH effect would reduce toxicity of the FLASH radiation. We did the same for zebrafish which were deliberately put in a hypoxic condition prior to irradiation. In that case, the depletion hypothesis would predict that the difference between FLASH and CONV disappears. Our biomarkers for radiobiological damage were the survival rate and γ­H2AX foci formation. In our experimental conditions, the radiation effect on the survival rate was<br/>eclipsed by other factors which could not be isolated. We did confirm the possibility of using γ­H2AX foci formation as a marker for radiobiological damage in full­body irradiated zebrafish embryos. There were individual samples that showed clear and localised specific γ­H2AX signal, but these were too<br/>scarce and the signal was too inconsistent across samples to gather meaningful statistics. This was most often caused by limited antibody penetration in the embryo. We were therefore unable to draw conclusions about the FLASH effect. Better and more consistent antibody penetration, e.g. by longer digestion in collagenase before antibody staining, could change this in the future. We further custom­built and validated a hypoxic aquarium to produce hypoxic zebrafish tissue, as well as a computational model of the irradiation setup to simulate the dose distribution in the zebrafish container. We found the dose distribution to be sufficiently homogeneous for our experiment, at least 91.47% uniform for CONV and 90.72% uniform for FLASH.","FLASH proton therapy; FLASH; FLASH radiotherapy; Zebrafish; Proton Beam Irradiation; Proton therapy; TOPAS; Dosimetry; Radiotherapy; Cancer; Health; Hypoxia; Oxygenation; Oxygen","en","master thesis","","","","","","","","","","","","Applied Physics","",""
"uuid:f3562e5f-d12e-4145-a9fc-4ee5a886c8f3","http://resolver.tudelft.nl/uuid:f3562e5f-d12e-4145-a9fc-4ee5a886c8f3","Mooring system design, related to Pioneering Spirit: Improvement of a mooring system to secure a barge alongside Pioneering Spirit in offshore conditions, including an evaluation of the dynamic loads","Sinke, Bram (TU Delft Mechanical, Maritime and Materials Engineering)","Colomes, Oriol (mentor); Schreier, S. (graduation committee); Marón Blanco, Daniel (graduation committee); Mallon, Niels (graduation committee); Delft University of Technology (degree granting institution)","2022","Continuous development in the wind turbine industry leads to increasing size of wind turbines. Allseas investigates the possibility to enter the offshore wind turbine installation industry with Pioneering Spirit.<br/>For Allseas’ preliminary wind turbine installation design, wind turbines are assembled offshore, requiring wind turbine components to be brought from shore to Pioneering Spirit by means of a cargo barge. This operation requires a proper mooring procedure of which the mooring system is an essential part. The mooring system secures the barge alongside Pioneering Spirit where it has to stay for multiple days. <br/><br/>In this research a pre-defined vessel orientation is analysed where the barge stern is extended 40m in longitudinal direction from Pioneering Spirit stern, to increase the barge area reachable by the unloading crane. <br/>This barge position is challenging due to limited shielding from Pioneering Spirit, leading to excessive environmental loads acting on the barge. Due to the barge extension, also properly connecting the mooring system to Pioneering Spirit is a challenge.<br/>The above leads to the main objective of this thesis: improve the mooring system to secure a barge alongside Pioneering Spirit in offshore conditions, including an evaluation of the dynamic mooring loads.<br/><br/>The main mooring system design requirements are that the system Safe Working Load and motion limits are not exceeded. <br/>Evaluation of the mooring systems starts with a multi-body diffraction analysis with hydrodynamic matrices and other hydrodynamic properties as output. This data is imported in a time domain model which enables capturing non-linearities, e.g. the mooring system and wind and current loads. Validation and verification steps are required to assure realistic outcome and understanding limitations of the numerical models.<br/><br/>Before new mooring systems are introduced, a base case mooring system is defined and modelled in the time domain.<br/>Finding the limiting sea state for which the Safe Working Load limit is reached enables to compute the workability for the reference location defined. Two reference locations are considered: a wind sea area and swell sea area. Wind and current speed is assumed to be constant over time and independent of elevation. Workability is defined as the percentage of time the mooring system is able to operate.<br/><br/>Evaluating the base case mooring system shows performance of 67% workability for wind sea areas and 16% for swell areas. Next to the base case, four mooring improvement concepts are evaluated from which the Cavotec Moormaster® system shows most promising results. This system consists of three main components: ‘fixed structure - hydraulic cylinder - vacuum pad’ (Figure 2) that connects the barge to Pioneering Spirit. This system is modelled as a link with constant stiffness and damping properties within its operational limitations.<br/><br/>The Moormaster system, shows perspective to improve the workability for both wind and swell seas. Besides workability, the Moormaster system improves the entire mooring procedure by quick connection and safe disconnection upon exceeding operational limits.<br","Side-to-side mooring; Pioneering Spirit; Diffraction analysis; Time domain modelling; Cavotec MoorMaster","en","master thesis","","","","","","","","2024-10-26","","","","Offshore and Dredging Engineering","",""
