"uuid","repository link","title","author","contributor","publication year","abstract","subject topic","language","publication type","publisher","isbn","issn","patent","patent status","bibliographic note","access restriction","embargo date","faculty","department","research group","programme","project","coordinates"
"uuid:a081c876-44d3-4664-b3ae-8f86aeb4171c","http://resolver.tudelft.nl/uuid:a081c876-44d3-4664-b3ae-8f86aeb4171c","From Drowning to Swimming: A resilient and liveable city in Prins Alexander polder","Chen, Kuei-Tso (TU Delft Architecture and the Built Environment)","Tilie, Nico (mentor); Aalbers, K.P.M. (graduation committee); Delft University of Technology (degree granting institution)","2022","The city of Rotterdam has a long and interesting history. It began as a small settlement on the River Rotte, at the place where the river met with the Nieuwe Maas. In 1270, the long dam was built in an attempt to reclaim the swampy land for development. In another word, since its origins, Rotterdam had to adapt to the natural circumstances of the delta, the threat of the rivers and sea waters. Now, according to NASA (2017), there is scientific consensus about the fact climate change trends over the past century are very likely a consequence of human activities. And one of the major consequences of global climate change is more extreme weather events. For example, global warming and accompanying sea-level rise are threatening many of the world’s lowland areas which have the Dutch nervous about the future of their country. Moreover, predictions indicate that there will be more extreme weather conditions, such as heavier rainstorms, longer periods of drought. Within the dikes, the inner-dike city of Rotterdam is mostly well below sea level (The Rotterdam Climate Initiative 2013) which means it is vulnerable to sea-level rise and some related issues like flood and salinization. Moreover, the current defenses are adequate up to 2050 and only allowed it to deal with around 40 centimeters of sea-level rise. Especially in Prins Alexander polder, with the lowest point being as much as 6.67 meters below NAP (the National Amsterdam Level, is an agreed ordnance measurement that is almost equal to mean sea level), the pumping stations are regulating the water levels and keep the polder dry. The project will explore the possibility of the existing polder system to face extreme rainfall, flood, and salinization in an urban area for a better living environment and enhance biodiversity. The result of the design assignment can be described as follows. - Based on the current system to come out with a set of typologies of small-scale design interventions which can generate interrelation between the informal settlement, the dynamic of the landscape, and water. Analysis- - Illustrate the timeline of climate change events from the current situation to the future with section/ typologies. - Map the threats to find out the most vulnerable area. - calculate the adequate amount of daily use water and purification area to build a circular water system. Design- - An ecological masterplan to show the relationship between the site and the surroundings. - Specific site design of a chosen area with more elaborate detail design of materialization and flows. - Come out with the principles that can be applied for the other places facing the climate change effect in the urban area.","Urban Ecology; Climate Change Adaptation; Water storage; Polder; Water nuisance; Drought; Salinization","en","master thesis","","","","","","","","","","","","Architecture, Urbanism and Building Sciences | Landscape Architecture","Urban ecology and eco-cities","51.954466884664065, 4.600137373792433"
"uuid:5d7b743a-58f6-4445-94ca-aa680b854eff","http://resolver.tudelft.nl/uuid:5d7b743a-58f6-4445-94ca-aa680b854eff","Sustainable 3D printing using eggshells","Donders, Ennio (TU Delft Industrial Design Engineering)","Faludi, Jeremy (mentor); Ghodrat, S. (graduation committee); Middendorp, Jasper (graduation committee); Delft University of Technology (degree granting institution)","2022","While Additive Manufacturing is famed for its ability to create complex geometries, sustainability of the technologies is given less attention. Due to the need to melt filament and heat up the printbed, FDM requires a considerable amount of energy. On top of that, valuable and non-renewable resources are used for the production of the commonly used filaments. There is a need for materials that are suitable for FDM printing, while being less detrimental for the environment than commonly used plastic filaments. In this project, paste-like material mixes are developed and tested for their suitability for FDM printing in order to see whether they have the potential to make FDM more sustainable.","FDM; 3D printing; eggshells","en","master thesis","","","","","","","","","","","","Integrated Product Design","",""
"uuid:61beceb7-102f-40c8-9617-d3ad27fbc7f8","http://resolver.tudelft.nl/uuid:61beceb7-102f-40c8-9617-d3ad27fbc7f8","The investigation of animal burrows in levees: Using experimental data to develop a probabilistic model that aims to improve the efficiency of manual inspection of animal burrows on levees","Idsinga, Johannes (TU Delft Civil Engineering and Geosciences)","Lanzafame, R.C. (mentor); Rikkert, S.J.H. (graduation committee); Delft University of Technology (degree granting institution)","2022","Animal-induced anomalies on a levee surface negatively affect the erosion-resistance of a levee, leading to rapid failure of the inner slope in case of overtopping and/or overflow during high water. Where active prevention techniques of burrows from large animals, such as muskrats, are applied in and around levees in the Netherlands, the identification of smaller burrow holes made by voles and moles and the evaluation of the severity of the damage rely solely on the assessment and experience of the levee inspector. <br/>The Polder2C’s project aims to quantitively assess the impact of animal burrows on the levee surface by conducting experiments at the Living Lab Hedwige and Prosper Polder (LHPP) and this thesis aims to contribute in this by analyzing the experiment results and developing a model for levee inspection that includes uncertainties of the geometrical characteristics of vole and mole burrow systems. <br/>This thesis distinguishes two phases, the first of which focuses on the question: ‘How do animal burrows influence levee performance?’, and it aims to form a foundation for the second phase of the report by focusing on the behavior of burrowing animals and the geometrical characteristics of their burrows by conducting a literature review on existing research on this topic. Guidelines were set up that contribute to the identification of mole and vole burrow system by investigating the main differences between them, with the aim to easily identify separate burrow hole groups in the experiment data. These conclusions could then be used to identify different vole and mole burrow hole groups in data that was collected from several experiments at the Living Lab Hedwige and Prosper Polder (LLHPP) between October 2021 and February 2022 and answer the research question for the second phase, which was: ‘Based on data from levee inspection experiments, which probabilistic model can assess the inspection success rate of animal burrows?’.","Mole burrows; Levees; Vole burrows; Animal burrows","en","student report","","","","","","","","","","","","Civil Engineering | Hydraulic Engineering","",""
"uuid:805c9227-ce84-42bf-bb73-9008ab32ad4b","http://resolver.tudelft.nl/uuid:805c9227-ce84-42bf-bb73-9008ab32ad4b","Physics-Guided Deep Learning for Volumetric-Modulated Arc Therapy Treatment Planning Quality Assurance","van der Hoeven, Thijs (TU Delft Applied Sciences)","Perko, Z. (mentor); Janssen, Tomas (mentor); Simoes, Rita (mentor); Lathouwers, D. (graduation committee); Goorden, M.C. (graduation committee); Delft University of Technology (degree granting institution)","2022","Treatment planning for radiation therapy is a complex process, as there are many machine parameters to determine for a treatment. To decrease the required labour and improve the plan quality, auto-planning systems have been developed, which can automatically generate high-quality treatment plans. These plans still have to be checked to ensure their quality, which means an independent and automatic quality assurance method is needed. This is where deep learning comes in, as recent advancements in computer hardware and artificial intelligence make it possible to quickly train neural networks for fast predictions of dose distributions based on the anatomy of a certain patient. Even though these models have proven capable of generating predictions comparable to the actual delivered dose, there is no guarantee that the distributions are actually deliverable. Therefore, this study is conducted to develop a novel deep learning model that uses physical information of how dose is delivered to constrain the neural networks and force realistic and deliverable dose distributions. The models presented in this study are implemented on prostate cancer patients treated with the Volumetric-Modulated Arc Therapy (VMAT) delivery technique.<br/><br/>First, the conventional Anatomy-based dose prediction model is further developed to improve the quality of the predicted dose distributions. The goal is to assess how accurate the predicted dose is from a deep learning model without any physical constraint. The model with U-net architecture has shown to be capable of predicting dose distributions of very high quality with average DVH differences of less than 1 Gy and errors in the dose coverage statistics on the PTV of less than 1\%. Furthermore, the lack of deliverability was confirmed due to the missing ray effects in the dose distributions, showing no clear entry points of the external photon beam. This lack of ray effects was quantified and confirmed using the dip in the S\o rensen-Dice Index around the 30\% isodose contours, where the ray effects are most apparent.<br/><br/>Second, the Physics-guided prediction model was developed by combining the Anatomy-based dose prediction model with the newly developed Segment prediction model, which predicts Multi-Leaf Collimator (MLC) positions and beam intensity values for all directions from which the dose is delivered. These predictions are based on the prediction from the Anatomy-based dose prediction model and the Beam's Eye View images of the CT and the delineated structures. The segment prediction is used in a stand-alone dose engine, based on the Matrad dose calculation algorithm, to calculate a dose distribution from the predicted treatment plan, which is deliverable by definition. The performance of the Physics-guided prediction model is underwhelming, scoring considerably worse on most evaluation metrics compared to the Anatomy-based dose prediction model. The lack of performance is mainly caused by the poor performance of the Segment prediction model component.<br/><br/>To circumvent the issue of the Segment prediction model, a dose mimicking model has been developed and investigated, where a dose mimicking algorithm is used to mimic a prediction from the Anatomy-based dose prediction model by optimizing the segments on which the dose is delivered. This model has only been tested on a single patient but seems to be performing better than the Physics-guided prediction model, with the downside that an optimisation process is involved. Still, the performance is not on par with the Anatomy-based dose prediction model.<br/><br/>Further investigation on the Segment prediction model will be needed before the Physics-guided prediction model can be considered as a serious quality assessment tool. Once performance of the Segment prediction model has increased, it could prove an interesting model that could even replace an auto-planning system in the far future.","radiotherapy; Deep Learning; Treatment Planning; Quality Assurance","en","master thesis","","","","","","","","2024-04-19","","","","Applied Sciences","",""
"uuid:4885cd26-755d-4693-8543-58c70c70bd40","http://resolver.tudelft.nl/uuid:4885cd26-755d-4693-8543-58c70c70bd40","Modeling of router structure for SNN-applicable NoC definitions","Zhou, Yongkang (TU Delft Electrical Engineering, Mathematics and Computer Science)","van Leuken, T.G.R.M. (mentor); Zjajo, Amir (graduation committee); Delft University of Technology (degree granting institution)","2022","Spiking neural networks (SNN), as the third-generation artificial neural network, has a similar potential pulse triggering mechanism to the biological neuron. This mechanism enables the spiking neural network to increase computing power compared to the traditional artificial neural network to process complex information. However, a large number of interconnection resources is required. This requirement is highly consistent with the characteristics of the network on chip (NoC). This thesis is aimed at developing a scalable cycle-accurate simulator based on Noxim, which provides a configurable NoC that can simulate neuron-to-neuron communication for delivering spiking traffic. This simulator achieves several configurable metrics including topology and routing schemes, network size, the number of channels, and neuron mapping methods. This thesis then evaluates the effects of these metrics on performance for two kinds of traffic patterns. To take power consumption and area into account, this thesis also provides an approximate estimate of area and power consumption for trade-offs in the early-design stage.","Spiking Neural Networks(SNNs)); Network-on-chip(NoC); Router design","en","master thesis","","","","","","","","2024-04-20","","","","Electrical Engineering | Circuits and Systems","",""
"uuid:43c09de9-39c4-46a5-9d30-e071f9e7ad1d","http://resolver.tudelft.nl/uuid:43c09de9-39c4-46a5-9d30-e071f9e7ad1d","Subspace Predictive Control for Vertical Axis Wind Turbines","Wen, Haoyue (TU Delft Mechanical, Maritime and Materials Engineering)","van Wingerden, J.W. (mentor); Liu, Y. (graduation committee); Boskos, D. (graduation committee); Brandetti, L. (graduation committee); Delft University of Technology (degree granting institution)","2022","To extract energy from wind, both Horizontal Axis Wind Turbine (HAWT)s and Vertical Axis Wind Turbine (VAWT)s are used. Different from the HAWT, the axis of rotation of the VAWT is perpendicular to the ground. This vertical design offers some unique advantages for the VAWT. For example, the generator of the VAWT is located on the ground, hence the maintenance costs are lower compared to the HAWT. Furthermore, the VAWT can be upscaled easier than the HAWT to harvest more energy from a single turbine. These benefits demonstrate the potential of VAWTs for offshore applications. However, the VAWT’s blade suffers from periodic aerodynamic loads from the periodically varying Angle of Attack (AOA), and unsteady aerodynamic phenomena, which harm the durability and hence the economic feasibility of the VAWT.<br/><br/>This thesis aims at resolving the blade loads mitigation problem of the VAWT. For wind turbines, pitching the blade is a common way to reduce the loads on the blade. There have been studies done that focus on the power maximization for the VAWT. However, research on the pitch control system for load reduction is lacking. To tackle the blade loads mitigation problem, a data-driven approach called Subspace Predictive Control (SPC) is used to control the individual pitch actuation of a two-bladed 1.5 m H-Darrieus VAWT. <br/><br/>This closed-loop control strategy consists of two parts, an online identification block and an optimal control law based on the identified system. The online identification method applied is called Recursive Predictor-Based Subspace Identification (RPBSID). It can estimate the system parameters online by using the input and output data collected from the VAWT system. Then, two different types of controllers are designed to reduce the blade loads. In the first approach, the constrained Model Predictive Control (MPC) is used. The optimal control input is calculated by solving a finite horizon constrained optimization problem. The individual pitch control action can be automatically adapted based on the online identified model. In the second approach, a Linear-Quadratic Regulator (LQR) is used as a comparison to the first approach. The LQR solves an infinite horizon unconstrained optimization problem to obtain the optimal state-feedback law. The control gain can be calculated analytically. <br/><br/>Both approaches are first tested on a Simulink model, which is based on the interpolation of lookup tables computed by the Actuator Cylinder (AC) model and blade element theory. Under a stepwise wind condition, the SPC approach shows the potential to reduce the normal load on each blade. It is also found that the MPC is more robust and easier to implement, compared to the LQR. Then, the MPC based SPC is applied to a mid-fidelity simulation tool called Qblade to acquire more realistic results. The controlled pitch trajectory shows good load reduction results under both uniform and turbulent wind conditions. The work presented in this thesis provides a control strategy to reduce the blade loads on VAWTs following a data-driven manner and demonstrates the capability of MPC based SPC in VAWTs’ application.<br","Vertical Axis Wind Turbine; subspace predictive control; Qblade","en","master thesis","","","","","","","","","","","","Mechanical Engineering | Systems and Control","",""
"uuid:728a9f63-fb8c-49fe-a814-2b6dd44bcb28","http://resolver.tudelft.nl/uuid:728a9f63-fb8c-49fe-a814-2b6dd44bcb28","Physical and Virtual Spaces of Grieving: Redifining commemoration via digital tools in COVID-19","Sarra, Christina (TU Delft Architecture and the Built Environment)","Tanović, S. (mentor); Delft University of Technology (degree granting institution)","2022","Life is a linear progression of the past, present, and future. Death is an inevitable part of this sequence, signifying the end. As an emotional response to a loved one’s death, grief comprises several emotions and stages. Since antiquity, the commemoration of the deceased has been an integral part of emotion management for the bereaved. Northern European artists and writers perceived nature as a symbol of grief and death. Cemeteries such as the Woodland cemetery in Stockholm, Sweden, confirm this tendency. Funerary spaces interweave the physical and the spiritual world by containing grief in nature and experimenting with shadow and light and the presence or absence of materiality.<br/><br/>The recent COVID-19 pandemic and the massive deaths resulted in an emergency in funeral services worldwide. Restrictions such as social distancing, the use of face masks, isolation, a limit on the number of guests allowed, and not being allowed to touch the deceased’s body severely affected the way grief is experienced among the bereaved. The outburst of COVID-19 also affected the way funerary rituals were performed. Several funeral rituals were broadcasted digitally, making the body no longer the physical means of mourning. These practices have given birth to new grieving rituals on the Internet, an immaterial tool designed to instantly share moments of the users’ lives. However, are these emerging means of digital mourning as effective as material mourning? How should designers treat funerary architecture in the rapidly digitalizing age we live in? What can architecture learn from digital mourning rituals?","mourning; grief management; Cemetery; Digital Tools; Ritual; Digital mourning; death; memorial architecture","en","student report","","","","","","","","","","","","Architecture, Urbanism and Building Sciences","",""
"uuid:cfc1add4-3316-47a1-9560-799956e230ad","http://resolver.tudelft.nl/uuid:cfc1add4-3316-47a1-9560-799956e230ad","Long Work Hours: The Causes and Consequences of Long Work Hour Culture in the Architecture Practice","Kolmas, Mats (TU Delft Architecture and the Built Environment)","Panigyrakis, P.I. (mentor); Delft University of Technology (degree granting institution)","2022","In the field of architecture, there reigns a stigma of long working hours, in university, and practice. This paper sets out the causes of the long work hour culture that relate to the practice of architecture and the consequences and choices it may bring along. Based on existing research findings, seven major causes provoke long work hour culture, among which are primarily associated with the practice of architecture: joy and pleasure derived from work, striving for perfection, love for their job, and the function of hours of colleagues. Long work hour culture, which is working more than 49 hours a week, besides physical damage, reduces the well-being of its participants and thereby their productivity. Even though a long work hour culture sometimes feels imposed, it is ultimately the actor’s choice. Out of interviews deducted from practitioners of two architecture practices, the seven causes are examined, but the proposed hierarchy in terms of relatability, varied between the two firms, showing the variation of applicability in the wide range of different firms. The addition of alternative proposed causes by actors in the field shows the complexity and extent of the long work hour culture in the practice of architecture, and the stringent work ethics it brings along in the 21st century.","Work Ethic; Long Work Hour Culture; Practice of Architecture","en","student report","","","","","","","","","","","","Architecture, Urbanism and Building Sciences","",""
"uuid:5a463b79-9b9d-49f9-a0b2-9acc85043b58","http://resolver.tudelft.nl/uuid:5a463b79-9b9d-49f9-a0b2-9acc85043b58","Lessons From Yazd: Rethinking Iranian Traditional Courtyard Houses for Indoor Climate Comfort in Educational Buildings","Abbassi, Annasophie (TU Delft Architecture and the Built Environment; TU Delft History & Complexity)","Yerli, D. (mentor); Delft University of Technology (degree granting institution)","2022","In current times sustainability is a major priority in the building industry which contributes largely to country’s total energy consumption. Additionally, educational buildings make up a large part of building stocks around the world and these buildings are responsible for large part of energy consumption especially by heating, cooling, and ventilating these building. To reduce energy usage, we must look for preservation and sustainable new designs, especially for solutions relying on renewable and natural sources and passive systems. Besides, thermal comfort in educational buildings is important since it significantly impact student’s physical, mental health and productivity. Therefore, this research aims to investigate whether we can learn from the passive climate responsive architectural elements invented millennia ago, which form the traditional courtyard house typology of Yazd, for sustainable solutions regarding thermal comfort in educational buildings.<br/>This thesis starts with introducing the features by examining the different elements that play an important role in providing comfortable indoor climates of the residents. To find out the usability of these architectural typology and its features and whether we can learn from it for current times, a case study analysis was conducted which investigated the adaptive reuse project of the faculty of Arts and Architecture in Yazd.<br/>The results showed that it is evident this architecture and its knowledge has been of great importance for livability and will persist to be of great usefulness in times we seek for passive indoor climate solutions because climate will become more similarly to Yazd. To realize thermal comfort in educational indoor spaces innovative, adaptive, climate responsive, socio-cultural context and local material inspired solution should be implemented.","AR2A011; Thermal comfort; Yazd; Adaptive reuse; Courtyard houses","en","student report","","","","","","","","","","","","Architecture, Urbanism and Building Sciences","AR2A011","31.897423, 54.356857"
"uuid:86c02c56-2b42-4837-8df9-87652ba41774","http://resolver.tudelft.nl/uuid:86c02c56-2b42-4837-8df9-87652ba41774","To what extent has the architectural development in Qatar reflected its foreign policy with a focus on the period from 1995 to 2030?","Al-Muraikhi, Reem (TU Delft Architecture and the Built Environment; TU Delft History & Complexity)","Hanna, J.M.K. (mentor); Delft University of Technology (degree granting institution)","2022","The paper explores the fragile and complex relationship between modernization, nation-building and internationalism with a specific focus on Qatar. As an emerging powerhouse in the Gulf region, the young nation has proven its political legitimacy on the global stage. In this process, its urban development has played a vital instrument in conveying its foreign policies and ambitions.","AR2A011; Architecture; politics","en","student report","","","","","","","","","","","","Architecture, Urbanism and Building Sciences","AR2A011",""
