"uuid","repository link","title","author","contributor","publication year","abstract","subject topic","language","publication type","publisher","isbn","issn","patent","patent status","bibliographic note","access restriction","embargo date","faculty","department","research group","programme","project","coordinates"
"uuid:1428bd1c-eaf1-4309-88bb-247a59f541ae","http://resolver.tudelft.nl/uuid:1428bd1c-eaf1-4309-88bb-247a59f541ae","De architectuur van de Hanze","Kaasschieter, Thomas (TU Delft Architecture and the Built Environment; TU Delft History & Complexity)","Rutte, R.J. (mentor); Delft University of Technology (degree granting institution)","2022","De Hanze was een Noord-Europees handels- en stedenverbond in het Heilige Roomse Rijk met een netwerk dat ver over de grenzen van meerdere landen reikten. Ze hadden een grote mate van onafhankelijkheid. Ze wisselden vanzelfsprekend veel cultuur uit in de gebieden waar ze actief waren, zo ook in architectuur. De Hanze hebben een eigen bouwstijl ontwikkeld, welke ook wel de Hanze- of baksteengotiek wordt genoemd. Deze stijl bevat kenmerkende elementen die in geen andere stijl te herkennen zijn. Deze scriptie onderzoekt de verschillen over de tijd en verschillende gebieden. Over tijd zijn deze verschillen niet gevonden, maar op basis van geografie wel; de westelijke Hanzesteden hadden soberdere architectuur, waar men in het oosten veel meer ornamenten kon vinden.","Hanze; Gothic Architecture; Brick architecture; History; Architecture; Heritage; Hansa; Gotiek; Baksteengotiek; AR2A011","nl","student report","","","","","","","","","","","","Architecture, Urbanism and Building Sciences","AR2A011",""
"uuid:5e05599c-b7d9-4bc2-82c5-efd2b86e7c7a","http://resolver.tudelft.nl/uuid:5e05599c-b7d9-4bc2-82c5-efd2b86e7c7a","UrbanScraps: A local steel cycle for maritime manufacturing in South-Holland by 2050","Kalligeri Skentzou, Anna (TU Delft Architecture and the Built Environment); Verkleij, Charlotte (TU Delft Architecture and the Built Environment); Speulman, Manon (TU Delft Architecture and the Built Environment); Zhang, Yueqi (TU Delft Architecture and the Built Environment)","Sepulveda Carmona, D.A. (mentor); van der Veen, R.J. (mentor); Van den Berghe, K.B.J. (mentor); Dabrowski, M.M. (graduation committee); Rocco, Roberto (graduation committee); Delft University of Technology (degree granting institution)","2022","Mankind is exhausting natural resources. Therefore, the need to transform the linear material flows towards circular chains is increasing. Steel is a material that is produced and used globally and has high potentials for recycling. However, in the maritime sector, steel is currently barely recycled, let alone reused in a more direct way. Maritime manufacturing is a vital industry in the province of South-Holland, strengthened by a strong knowledge network. The aim of this project is to localise and extend the steel life cycle, to create an environmentally and socially sustainable province in which maritime manufacturing can grow in a responsible way. In order to close the loops, the R-ladder is used as a framework for circular material flows in the manufacturing industry and in the participation of the citizens. A local steel life cycle for maritime manufacturing will be achieved through the connection of the steel using maritime companies in Rotterdam and the Drecht Cities with the steel production company of TATA Steel in IJmuiden. Missing links in the cycle, a secondary steel processing company and ship disassembly companies, will be brought to the province, providing a new purpose to the Port of Rotterdam when fossil fuels phase out. The transition to material circularity will be made possible through innovations in modular shipbuilding and renewable fuels. Innovation centres in the maker's industry will bridge between knowledge and practice. The consumers will be involved in the material transition through community re-hubs in their cities, where they can share, reuse and recycle products. In this strategy, the extensive water network will function as a backbone along which spatial developments will take place. The water backbone will be a connector for both public transport and industrial transport. This strategy for a transition towards circular steel flows in maritime manufacturing, can be an incentive and inspiration for other manufacturing sectors to close their material cycles.","circular economy; maritime manufacturing; R-ladder of Circularity; steel; urban manufacturing; Participation","en","student report","","","","","","","","","","","","Architecture, Urbanism and Building Sciences | Urbanism","AR2U086 R&D Studio – Spatial Strategies for the Global Metropolis",""
"uuid:e27aad20-87d3-4265-ad4b-34ae97cbeaea","http://resolver.tudelft.nl/uuid:e27aad20-87d3-4265-ad4b-34ae97cbeaea","The Role of Architecture in the physical and cultural segregation of Riga in second half of 19th century","Kivlinieks, Jānis (TU Delft Architecture and the Built Environment; TU Delft History & Complexity)","Yerli, D. (mentor); Delft University of Technology (degree granting institution)","2022","This article offers a critical reflection on the impact of the urban development on the social lives of Riga’s population throughout the second half of 19th century by exploring the role of architecture in the social and physical segregation of the city. Like many typical East-Central European cities in this period, Riga was ruled by the Baltic German elite who had a complete control over the government and all mayor industries that shaped the cities daily life. At the same time the native Latvian population belong to rural peasantry who had almost no rights. However, as result of serfdom emancipation and the rapid industrialization of the 19th century, Riga’s population experienced massive growth as many rural peasants came to city in hope for better lives. With it the population growth came the urban developments that would shape the urban fabric of the city for ages to come. The cultural notions and physical struggles manifested themselves into the urban texture that can be observe even today. <br/><br/>Through investigating the social and political landscapes and their relationships with the physical development of the city, complex relationships can be presented that shape our daily lives. Through the ideas of space and power by Paul-Michel Foucault and the embedded relationships between physical space and urban inequality we can investigate how the city was shaped according to the ruling class. In addition, like Newton’s third law each action is met with equal counter action, the proletariat responded with increase in socialistic revolutionary ideas and a nationalistic awakening that would slowly find itself in the urban fabric of Riga.","AR2A011; urbanization; Urban segregation; Radical movements; 19th century Riga; Cultural hegemony","en","student report","","","","","","","","","","","","Architecture, Urbanism and Building Sciences","AR2A011","56.949600, 24.105200"
"uuid:fbc56d69-e2ca-444e-96bd-eec7b3d05b00","http://resolver.tudelft.nl/uuid:fbc56d69-e2ca-444e-96bd-eec7b3d05b00","The mixture of Ottoman, Dutch, and the architect’s features in the design of the Mevlana mosque","Karnosoehardjo, Laurent (TU Delft Architecture and the Built Environment)","Hanna, J.M.K. (mentor); Delft University of Technology (degree granting institution)","2022","This thesis investigates the features of the Rotterdam based Mevlana mosque designed by the Dutch architect Bert Toorman. It aims to clarify to what extent Ottoman and Dutch features are visible in the mosque, including the architect's signature. Extensive literature research has been undertaken to determine the origins of Ottoman architecture, which serves as the foundation for determining Ottoman features for mosques, which are subsequently discussed in the Mevlana mosque. Several Ottoman mosque features are discussed compared to the Mevlana mosque. Due to the mosque's location in the Netherlands, it is examined further to evaluate how it gained ground in Dutch society at the time. Finally, information about the Mevlana mosque's whole design process was gathered through an interview with the architect. As a result, although the mentioned factors certainly influenced the structure, the mosque is less Ottoman than the architect believes.","AR2A011; Ottoman architecture; Early mosques; Ottoman mosque features; Dutch architect; Dutch restrictions","en","student report","","","","","","","","","","","","Architecture, Urbanism and Building Sciences","AR2A011","51.924400, 4.477700"
"uuid:a9fc9d69-345d-4572-b552-8bb8aa678918","http://resolver.tudelft.nl/uuid:a9fc9d69-345d-4572-b552-8bb8aa678918","Ray Eames and An Exhibition for Modern Living: an exploration of collage technique through drawings and photographs of physical spaces, furniture","Khramova, Daria (TU Delft Architecture and the Built Environment)","Zeinstra, J.S. (mentor); Delft University of Technology (degree granting institution)","2022","br/>This thesis will examine a drawing made for An Exhibition for Modern Living at the Detroit Institute of Arts in 1949 by Ray Eames.The goal is to explore the relation bet ween the collage technic of the drawing and its relation to design process. Additionally, it will investigate Eames’ collage -like interior spaces and the preliminar y drawing of those spaces in collage technic, as well as some toy’s designs. The Eameses emphasised the importance of the visual image and its power to concretise abstract ideas as their major means of communication shif ted from architecture and furniture design to films, multimedia presentations, and exhibitions. Their reliance on the image, the juxtaposition of images, and the sequential movement of still images, in turn, required the viewer’s active engagement. Certain ideas transmit ted by the collage technique and this magnificent expression of the Eames Office is Ray Eames’s greatest achievement.","","en","student report","","","","","","","","","","","","Architecture, Urbanism and Building Sciences","AR2A011",""
"uuid:f4da1145-0977-4c1a-89f4-455cb5403ae0","http://resolver.tudelft.nl/uuid:f4da1145-0977-4c1a-89f4-455cb5403ae0","Caring for the Living Environment: The VAC Hengelo work on quality housing design (1957-2017)","Kloosterman, Nienke (TU Delft Architecture and the Built Environment; TU Delft History & Complexity)","Novas, María (mentor); Delft University of Technology (degree granting institution)","2022","In today's society, women are still not positioned as equals to men. This is no different in the field of architecture. When designing the built environment, the white man is still the norm and within the work field, the man still fills the majority of the higher positions in architectural firms. However, women have a different, more care-centric view of the environment than men, which enables them to look at buildings with a broader perspective and to enhance them substantially with other qualities. The feminist theory “ethics of care” explores the issue of how historically the primary responsibility of women has been taking care of others. This research connects the theory of ethics of care to the history of feminised domestic work and uses the historical progression of the women's advisory committee to examine the role of this theory within housing. In the Dutch housing sector, <i>Vrouwenadviescommissies</i> (Women’s Advisory Committees, VAC) of voluntary women have been set up since 1946 to assess the quality of use of dwellings and the living environment from the point of view of the residents, using their situated knowledge as housewives. The VAC Hengelo was founded in 1957 to provide housing quality advice within the major reconstruction task of this city, which was bombed in 1944, and was the first VAC in the region of Twente. This thesis aims to expose the difference between the male and female views on housing by giving examples of the female perspective through the case study of the VAC Hengelo during the years 1957 to 2017. Primary data collection has been done by interviewing former members of the VAC Hengelo and the housing association Welbions, and through archival research at the Municipality Hengelo. This secondary data was collected by doing literature research, with Carol Gilligan and her theory of the ethics of care, and Silvia Federici, with her theory of reproductive labour, being the leading sources. The case study of the VAC Hengelo is used to fill the research gap of the theoretical framework with the role that housewives have played in housing design through the Women's Advisory Committee. Background information on the origin of the VAC in general, the history of Hengelo during this period and the VAC Hengelo is provided to establish historical insight. The case study of the VAC Hengelo reveals, by examples, how the feminist concept of ethics of care could perfectly work as a background explanation of how women, through history, made choices in the design of housing in a different, broadening and more inclusive perspective than men.<br","AR2A011; housing; care; Women's Advisory Committees; gender; Hengelo","en","student report","","","","","","","","","","","","Architecture, Urbanism and Building Sciences","AR2A011","52.2574121, 6.7927725"
"uuid:f15417e8-1b30-49bf-bc4a-c2c29cb49078","http://resolver.tudelft.nl/uuid:f15417e8-1b30-49bf-bc4a-c2c29cb49078","Towards Unideal City - Berlin: Heterogeous Archipelago: Planning of West Berlin during the Cold War in Light of the Concept of Urban Archipelago","Kobayashi, Anji (TU Delft Architecture and the Built Environment; TU Delft History & Complexity)","Oxenaar, A.J. (mentor); Delft University of Technology (degree granting institution)","2022","The city of West Berlin after the construction of the Berlin Wall was in need for replanning towards declining environment. The research explores physical built fabrics as well as theoretical planning in West Berlin during Cold War period regarding the Concept of Urban Archipelago, developed by Oswald Mathias Ungers, Rem Koolhaas, Peter Riemann, Hans Kollhoff and Arthur Ovaska in 1977.","AR2A011","en","student report","","","","","","","","","","","","Architecture, Urbanism and Building Sciences","AR2A011",""
"uuid:063cff8b-7dec-4763-863c-1fa8b0feb0a9","http://resolver.tudelft.nl/uuid:063cff8b-7dec-4763-863c-1fa8b0feb0a9","A tightrope walk between art and memorial: On the example of the Memorial for Austrian &amp; Jewish Victims of the Shoa in Vienna and the Holocaust-Memorial in Berlin","Kleiner, Anna-Lena (TU Delft Architecture and the Built Environment)","Korthals Altes, E. (mentor); Delft University of Technology (degree granting institution)","2022","The following paper will elaborate on the basis of the memorial by Rachel Whiteread in Vienna, Austria and the memorial by Peter Eisenman in Berlin, Germany the meaning and position of memorials within the field of art. It will analyze the interplay between the memorials and their surroundings and the influence they had and still have among society. Furthermore it will respond to the artists personal execution of the topic, naming the Jewish persecution by the Nazi Regime. After all the paper will end by comparing the two memorials in terms of their appearance, meaning and reputation. The Conclusion will summarize and draw a line back to the initial research question - Can a memorial be assigned to the field of art, or can we distinguish a memorial as ‘art to remember’ and assign it to a separate, own field independent of art?","","en","student report","","","","","","","","","","","","Architecture, Urbanism and Building Sciences","AR2A011",""
"uuid:ea84aa94-5850-49dc-ab42-7c53e7595627","http://resolver.tudelft.nl/uuid:ea84aa94-5850-49dc-ab42-7c53e7595627","A House For Cheerful Living: an exploration of architectural representation in post-war housing competitions","Klijn, Dick (TU Delft Architecture and the Built Environment; TU Delft History & Complexity)","Zeinstra, J.S. (mentor); Delft University of Technology (degree granting institution)","2022","Post-war housing competitions were held during the second World War to provide solution for the housing shortage. Looking at the drawings made for these competitions we can see that a similar style is used.<br/>Through analysis and comparison of a drawing made by Jean Bodman and one made by Don Knorr, this thesis explores the similarities in drawing style. By comparing the education of the two architects we attempt to comprehend what could influence the similarities in drawing style.<br/><br/>The analyses shows that the drawing style and architectural style are similar, however a different emotion is depicted in the drawings. The fact that these architects were educated around the same period and were both mentored by famous modernist figures like Walter Gropius and Eero Saarinen is evidence for the similarities in drawing style. Furthermore, Norman and Donald worked both at SOM could also explain the similarities, while Norman also worked on the House for Cheerful Living project. However, it is difficult to say how the similarities came to be and if these arrived from related influences. The differences in depicted emotion could be explained by the fact that the drawings were made for a different audience.","AR2A011; Post-war housing Competitions; Architectural drawings; Drawing style; American Modernism","en","student report","","","","","","","","","","","","Architecture, Urbanism and Building Sciences","AR2A011",""
"uuid:f7c9faed-7e5e-4794-bd96-bd29c962e77f","http://resolver.tudelft.nl/uuid:f7c9faed-7e5e-4794-bd96-bd29c962e77f","Remembrance to Repression: Public Space, memorial landscape and collective memory in post-WWII Vienna","Michl, Maximilian (TU Delft Architecture and the Built Environment)","Yerli, D. (mentor); Delft University of Technology (degree granting institution)","2022","In his influential work ‘On collective Memory’, French sociologist Maurice Halbwachs described an intrinsic relationship between the past and present, a reconfiguration of the perceived past through the lens of its current generation’s ideas and experiences. This represents an increasing challenge in the urban realm due to the growing amount of historized fragments left within its fabric as a result of the modern societal obsession of leaving traces behind. This thesis therefore investigates what influence commemorative architecture has today as integral parts of our city and the negotiation necessary to work this historized palimpsest. To do this, the city of Vienna, Austria will be investigated as the turbulent decades following WWII led to a first reconstruction of national memory based on a founding lie in its ‘Opferthese’. Once that mythos crumbled in the 1980s, it resulted in palpable shifts of its collective memory which were materialised in a tangible form through monuments around the city. Through an excursion to Vienna, the circumstances leading to the construction of three prominent monuments, their performance and the broader developments of Vienna’s memory politics were studied. Local and foreign papers on Vienna’s past century and collective memory, historical photographs, newspaper reports, vocal reactions to the unveiling of the monuments, personal writings as well as archival research formed a supplementary background to the excursion for this study. The thesis investigates it through three parts, foremost, it creates an overview of the events shaping memory politics in Vienna post WWII. This historical understanding will be accompanied by a theoretical framework on the concept of collective memory based on predominantly on the theories of Maurice Halbwachs and Pierre Nora. The second portion will include thorough case studies of three important Viennese memorials: ‘Judenplatz Holocaust Memorial’ (2000), ‘Memorial against War and Fascism’ (1988) and ‘Deserter Monument’ (2014). This chapter will connect them to the context of their realisation, historical site context, design, and spatial performance. Thereby, understanding how collective memory forms public space and its perception through physical edifices. Lastly, the paper forms a connection between the theoretical ideas and their physical manifestations. Through a broader view of urban effects, the findings of the research and the dialogue between them, it hypothesises on the increasing historicization of our cities, its memorial landscape and the constant negotiation architects and inhabitants face in the context of our palpable past.","Collective Memory; Public Space; Memory and Space; 20th Century Vienna; Architecture and Politics; Commemorative Architecture","en","student report","","","","","","","","","","","","Architecture, Urbanism and Building Sciences","AR2A011","48.208200, 16.373800"
"uuid:2a3d929d-0ae0-476a-bafd-2b85623e67be","http://resolver.tudelft.nl/uuid:2a3d929d-0ae0-476a-bafd-2b85623e67be","Stacking Stories to Upgrade the City: The Role of High-rise Buildings in Rotterdam","Mastenbroek, Djamo (TU Delft Architecture and the Built Environment; TU Delft History & Complexity)","Panigyrakis, P.I. (mentor); Delft University of Technology (degree granting institution)","2022","With the exponential growth of high-rise buildings in Rotterdam over the past decades the city is now the 10th highest city in Europe. The role that high-rise plays in the city of Rotterdam has been developing throughout the years and started becoming more important. Through literature and municipal archival research, the significance of high-rise buildings and their role have been explored through three different aspects: cultural physical and economical. High-rise buildings emerged from the culture of congestion but were merely used as a tool for the densification of the city after World War II. While the early urban planning did not address high-rise buildings it laid down the urban foundation for the designated high-rise zones in the city. With the exponential growth the municipality set up policies for high-rise buildings to keep the built environment in check. Because of the lack of historic city value of Rotterdam, the high-rise buildings and structures form the iconic image of the city. While high-rise buildings fulfil their role of accommodating people it also functions as a tool for city branding to not only promote the city but also revitalize the built environment However, high-rise buildings can also have a negative impact on the social wellbeing of its users. Both anonymity and the lack of connection with the public realm high-rise buildings can bring more harm than good to its users. Although the municipality is already addressing this problem in their most recent high-rise policy and urban planning it appears from this research that it is important to explore how high-rise buildings can sustain communities and the future generations.","AR2A011; High-rise Buildings; Rotterdam; urban planning; city marketing","en","student report","","","","","","","","","","","","Architecture, Urbanism and Building Sciences","AR2A011",""
"uuid:7548c93b-1724-452f-9911-aaee688d1688","http://resolver.tudelft.nl/uuid:7548c93b-1724-452f-9911-aaee688d1688","Second Life Shelter: Freetown of Christiania as an Example of Affordable, Circular Housing","Melgalvis, Reinis (TU Delft Architecture and the Built Environment; TU Delft History & Complexity)","Lee, Rachel (mentor); Delft University of Technology (degree granting institution)","2022","This thesis investigates the squatting community Freetown of Christiania as a case of self-built housing that is both affordable and circular. Affordability of housing has been an existing problem in Europe, followed by a relatively recently identified need for transition from a linear to a circular economy. Squatting communities have emerged in Europe as a response to the lack of availability of affordable housing, while the conditions of their existence have also provided a stimulating environment for the circular reuse of materials. <br/><br/>To gain further insights into building processes and the origins of the used materials, I have visited Christiania, where I made observations and conducted interviews with its inhabitants. Additionally, the conducted archival and literature research provides the historical context of Freetown, demonstrating its development over time. The thesis begins with the analysis of changes in building policies and processes that have occurred in the last 50 years of Christiania’s existence, followed by an investigation of material availability in Copenhagen and general building considerations based on the experience of Christiania.<br/><br/>Although in recent years the use of secondhand materials in Christiania has reduced, its development has shown how self-built housing can be more affordable and at the same time also circular. It also presents the current challenges of reusing materials in buildings as well as the existing possibilities for solving them.<br","AR2A011; Circulair Economy; Affordable Housing; Self-built; Christiania; Material reuse","en","student report","","","","","","","","","","","","Architecture, Urbanism and Building Sciences","AR2A011","55.6734,12.5964"
