"uuid","repository link","title","author","contributor","publication year","abstract","subject topic","language","publication type","publisher","isbn","issn","patent","patent status","bibliographic note","access restriction","embargo date","faculty","department","research group","programme","project","coordinates"
"uuid:11557837-7e01-48f5-8257-b7f3a4641e84","http://resolver.tudelft.nl/uuid:11557837-7e01-48f5-8257-b7f3a4641e84","The repair maintenance cycle: Recommendations for housing associations on repair maintenance to maximize tenant satisfaction","Tsan, My-le (TU Delft Architecture and the Built Environment)","Hoekstra, J.S.C.M. (mentor); van Bortel, G.A. (mentor); Wilms Floet, W.W.L.M. (graduation committee); Delft University of Technology (degree granting institution)","2022","Social housing associations play an important role in providing affordable, adequate, and safe housing to their tenants. This requires constant maintenance of the real estate in their portfolio. There are different types of maintenance, but in this research, the focus will be on repair maintenance. Repair maintenance is carried out in response to complaints from tenants. Although housing associations often score satisfactory in the Aedes Benchmark for tenant satisfaction in the field of repair maintenance, in practice situations occur where housing associations struggle with carrying out and/ or managing repair maintenance, which leads to dissatisfied tenants. So, there are opportunities to maximize tenant satisfaction and investigate repair maintenance. The main research question of this study is, therefore: What contributes to tenant satisfaction at housing associations in the field of repair maintenance and how can this be improved? Based on literature research, analysis of benchmark data, case studies, and interviews, data will be collected to answer the main question. The study aims to gain insight into factors that contribute to tenant satisfaction and to create recommendations from this that can help housing associations in making choices to maximize tenant satisfaction.<br/><br","Repair maintenance; housing association; tenants; tenants satisfaction","en","master thesis","","","","","","","","","","","","Architecture, Urbanism and Building Sciences | Management in the Built Environment","",""
"uuid:a9e231dd-d9fa-4cb4-b135-226dba146ce6","http://resolver.tudelft.nl/uuid:a9e231dd-d9fa-4cb4-b135-226dba146ce6","Humboldt: Living with nature in Sloterdijk","Wildenberg, Ella (TU Delft Architecture and the Built Environment; TU Delft Architectural Engineering +Technology)","Parravicini, M. (mentor); Tomesen, P.L. (graduation committee); Tilie, Nico (graduation committee); Delft University of Technology (degree granting institution)","2022","Biodiversity is declining, urbanization is increasing, and the pressure on urban greenery is rising. Nature inclusive design can provide a solution. The research paper investigates the current trend of nature inclusive design, the architectural interventions that can be used in nature inclusive design and urban ecology in the Netherlands, to be able to answer the main research question: How does the integration of nature inclusive design interventions into the building envelope support local biodiversity in an urban environment? Connecting species to architectural interventions, the research provides parameters to guide the design of a mixed-use development in Sloterdijk. Creating private and public green spaces, with a selection of vegetation based on orientation and their value to the natural environment, Humboldt strives to be a natural hotspot that functions within new and improved green network of Amsterdam.","Nature inclusive design; Biodiversity; green architecture; Urban Ecology","en","master thesis","","","","","","","","","","","","Architecture, Urbanism and Building Sciences","","52.388051, 4.840195"
"uuid:af4f82b1-ef27-45d3-83f5-f62b978f10e7","http://resolver.tudelft.nl/uuid:af4f82b1-ef27-45d3-83f5-f62b978f10e7","We need to talk about the mall: Interventions in the public space","Oude Vrielink, Pelle (TU Delft Architecture and the Built Environment)","van de Pas, R.R.J. (mentor); Harteveld, M.G.A.D. (mentor); van der Meel, H.L. (mentor); Delft University of Technology (degree granting institution)","2022","This book explores how to reinvent, reposition, and refunction the public space in and around the suburban mall of Schiedam Hof van Spaland. It contains of two parts: first it explores the problems related to the mall, and how these problems influence the community. Second, the project explores through different design scales how these problems can be solved, and how social cohesion can be enhanced by design. The suburban Modernist mall is a widespread concept in the Netherlands that in its current form embodies problems with car-mobility, inside orientation, and monofunctional programming. Due to a dominant focus on consumers mentality, it dominantly focusses on serving the consumer in buying goods. This mentality directly undermines the indoor and outdoor public space and therefore indirectly weakens the strength of the community, as public space is vital for strong communal bonds. <br/><br/>In the second part the project aims to move beyond the single focus on consumers mentality and by design, transforms the challenges into opportunities for Hof van Spaland. Firstly, the design is encouraging biking and pedestrian movement, and with the dismantling of dominant car-mobility, it leaves space for other activities, as biking and people on foot need less space and place. Secondly, the inside orientation that generates backsides is transformed into a dual-side orientation with housing that activate the unsafe expedition streets. Thirdly, the monofunctional programming of shopping is extended with a cultural centre, a canteen, coffee corner, and other communal facilities, including plaza’s, pocket parks and a place for a weekly market. A crucial section in the design preposition, where many interventions collide, is worked out in further detail. It uses local materials and resources to serve the local people. It shows how public facilities can generate extra value, and how several interventions like this can help generating a bright new future for the suburban mall: A future where the mall becomes a buzzing meeting spot for all living in the neighbourhood.<br","Mall; public space; Interior urbanism; civic centre; Schiedam; Social cohesion","en","master thesis","","","","","","","","","","","","Architecture, Urbanism and Building Sciences","","51.93512119476605, 4.375944686914497"
"uuid:66ee3b48-6282-47c4-9fbc-f9290c0927e6","http://resolver.tudelft.nl/uuid:66ee3b48-6282-47c4-9fbc-f9290c0927e6","Eco-Cathedral xxx: Sloterdijk centrum reconnecting the brettenwedge","Kotaesh, Khalil (TU Delft Architecture and the Built Environment)","van de Pas, R.R.J. (mentor); Tomesen, P.L. (graduation committee); Tilie, Nico (graduation committee); Delft University of Technology (degree granting institution)","2022","We are living in a perfect storm of catastrophes; overpopulation, desertification, deterioration of biodiversity, and a weakened ecological system are threatening our current way of living. It is essential we look for new ways of living and building. This paper is an experimental research on how to use waste-based brick as a building material to strengthen the ecological system in the surrounding environment. The context is shortly introduced, followed by an overview of the experimenting on waste-based brick characteristics, building technology, and the composition of the material and the building process. Subsequently, experiments on the durability and liveability of the material are conducted. Lastly, a conclusion is conducted for designing with waste-based brick to maximize the ecological value of different building components. In the conclusion, I reflect on an example of waste-based brick.","Brick; Waste Based; Environment; Ecology; Biodiversity; engineering","en","master thesis","","","","","","This research took a place during the coronavirus pandemic and there were multiple difficulties.","","","","","","Architecture, Urbanism and Building Sciences","","52.385323, 4.832340"
"uuid:674a3a82-d738-42d2-8f8e-50c5992cba1e","http://resolver.tudelft.nl/uuid:674a3a82-d738-42d2-8f8e-50c5992cba1e","A hygiene ventilation renovation: Systematic partial engineering control for small sharing room with ceiling mixing ventilation for “corona-proof”","Cai, Wenyan (TU Delft Architecture and the Built Environment)","van den Engel, P.J.W. (mentor); Bokel, R.M.J. (graduation committee); Delft University of Technology (degree granting institution)","2022","Efficient local air recirculation at ceiling level promote the performance of purifiers and anti-epidemic efficiency of mixing ventilation in a small shared rooms","corona proof; hygiene ventilation; CFD; airborne transmission; particle; filter","en","master thesis","","","","","","","","","","","","Architecture, Urbanism and Building Sciences | Building Technology","corona-proof ventilation","52.164560, 4.456952"
"uuid:a1da3805-72df-4c63-82e8-ba89008cecbc","http://resolver.tudelft.nl/uuid:a1da3805-72df-4c63-82e8-ba89008cecbc","Peer Learning en Succescriteria: Leerlingen helpen bij het beantwoorden van de vraagstukken ‘Waar moet ik heen?’ en ‘Waar sta ik nu?’","van Rooijen, Rick (TU Delft Applied Sciences)","Spandaw, J.G. (mentor); Delft University of Technology (degree granting institution)","2022","class=""MsoNormal"">Het doel van dit onderzoek is om leerlingen te helpen bij het beantwoorden van de vragen ‘Waar moet ik heen?’ en ‘Waar sta ik nu?’ en gaandeweg factoren ontdekken die leerlingen hierbij belemmeren. De eerstgenoemde vraag gaat over het deel van het leerproces waarin leerlingen een compleet beeldmoeten vormen van de eindtermen: leerdoelen en bijbehorende succescriteria. De andere vraag slaat op het maken van een juiste inschatting in hoeverre een bepaald leerdoel, inclusief zijn eindtermen, is behaald. Naast het helpen beantwoorden van deze vragen, wordt belemmerende factoren zijn voorleerlingen om deze eindtermen te behalen, i.e. gericht op het opschrijven van een uitwerking geheel in overeenstemming met de succescriteria. In het geval belemmerende factoren zijn ontdekt, is middels het ontwerpen en uitvoeren van een klassenactiviteit, ook wel een interventie genoemd, onderzocht of en in hoeverre leerlingen hiermee geholpen zijn bij het beantwoorden van de twee eerder genoemde vragen. Zo’n klassenactiviteit beruste meestal sterk op peer learning. Dit vanwege de invalshoek van het onderzoek die zich richt op wat peers voor elkaar kunnen betekenen in eerder genoemde fasen van het leerproces. Hiermee is de onderzoekshoofdvraag uitgekomen op het volgende: <i><br/> Hoe kan een docent, door gebruik te maken van peer learning, de mate van inzichtelijkheid en begrijpelijkheid van de leerdoelen en SC bij leerlingen verhogen, zodoende dat hun geleverde werk in hogere mate aan SC voldoet en zij beter in staat zijn dit te kunnen beoordelen op correctheid en volledigheid in vergelijking tot die leerdoelen en SC? </i><br/> Deze onderzoeksvraag is iteratief beantwoord volgens de methodologie van een hypothetisch doceer- en leertraject… <b><br style=""mso-special-character:line-break""/> <br style=""mso-special-character:line-break""/> </b","peer learning; succescriteria; leerdoelen","nl","master thesis","","","","","","","","","","","","Applied Sciences | Science Education and Communication","",""
"uuid:94f40dd0-3975-4583-9fc9-bfed9fce2fcf","http://resolver.tudelft.nl/uuid:94f40dd0-3975-4583-9fc9-bfed9fce2fcf","Green Balcony Nijmegen","Boersma, Imkeliene (TU Delft Architecture and the Built Environment)","Stuhlmacher, M.E. (mentor); Parravicini, M. (graduation committee); Reinders, L.G.A.J. (graduation committee); Delft University of Technology (degree granting institution)","2022","A design proposal for urban densification in an area with a suburban setup, where social structures, ecological structures and architectural structures are equally important. Inspired by the characteristics of heterotopian places.","","en","master thesis","","","","","","","","","","","","Architecture, Urbanism and Building Sciences | Urbanism","",""
"uuid:b3905ed7-58ea-4b64-981b-02b6e486eefb","http://resolver.tudelft.nl/uuid:b3905ed7-58ea-4b64-981b-02b6e486eefb","Envisioning retreat: Managed retreat as transformative adaptation","van der Voorn, Amber (TU Delft Architecture and the Built Environment; TU Delft Urbanism)","Balz, Verena Elisabeth (mentor); Hooimeijer, F.L. (mentor); Zijlstra, S. (graduation committee); Delft University of Technology (degree granting institution)","2022","This thesis addresses the prospected future of climate-induced displacement in the Netherlands; managed retreat as part of a new flood defense strategy for the coastal region.<br/><br/>Climate change, sea-level rise and flood threat are relevant subjects for the Netherlands. However, unlike most delta regions, displacement of parts of the population is not part of Dutch culture anymore. An extensive delta system protects even the lowest parts of the country. Displacement, in this case, is not a direct consequence of sea-level rise, but rather a consequence of how the Dutch government decides to deal with it. The delta strategy is currently in transition, meaning it is unclear what the outcome will be.<br/>The Dutch Delta Programme deals with the uncertainty in sea-level rise predictions by laying out different conceptual scenarios, the most extreme being Move Along. Move Along suggests allowing the ocean to take back parts of the Netherlands. There are more explorative studies on the future of the Dutch coastline. However, none of them incorporate the human aspect in abandoning parts of the country; displacement of part of the population. As sea-level rise is slow-onset, there is time to plan ahead offering opportunity to deal with the displacement in a strategic way.<br/><br/>The project focusses on exploring the potential of combining a strategy for retreat with existing spatial planning goals as a means to deal with the uncertainty of sea-level rise. In addition, this combination creates a shared goal in order to preserve livelihood for the affected population.","Spatial planning and strategy; Managed retreat; Groningen","en","master thesis","","","","","","","","","","","","Architecture, Urbanism and Building Sciences","",""
"uuid:bb16cada-c56f-4703-aad2-93c0ad9e75bb","http://resolver.tudelft.nl/uuid:bb16cada-c56f-4703-aad2-93c0ad9e75bb","Multi-sector Water Allocation: The impact of nonlinear approximation network hyperparameters for multi-objective reservoir control","Witvliet, Mark (TU Delft Technology, Policy and Management)","Zatarain Salazar, J. (mentor); Kwakkel, J.H. (graduation committee); Warnier, Martijn (graduation committee); Delft University of Technology (degree granting institution)","2022","","Multi-objective optimization; EMODPS; MOEA; Reservoir Modeling; Python; Non-linear approximation networks; Radial Basis Function","en","master thesis","","","","","","","","2022-08-30","","","","Engineering and Policy Analysis","",""
"uuid:fea86b79-8bae-46f8-b245-83a869c085c4","http://resolver.tudelft.nl/uuid:fea86b79-8bae-46f8-b245-83a869c085c4","The Heineken LAB: a place to facilitate and accelerate innovation","Nieuwsma, Auke (TU Delft Industrial Design Engineering; Heineken)","Hultink, H.J. (mentor); Mulder, S.S. (graduation committee); van Hoff, C. (graduation committee); Delft University of Technology (degree granting institution)","2022","Over the past ten years Heineken measured a decrease in brand power, especially among younger consumers. Furthermore, Heineken lacks an experiential culture that fosters innovation due to daily workloads, mindset on global impact and scalability, immediate successful deliverables and business cases, and strict brand approval and brand mitigation. To increase the brand power among younger consumers and overcome the barriers this project is initiated, a project to create a place to open-mindedly explore the future of beer and beyond. The motive of this thesis was to advice Heineken in building an innovation lab. <br/><br/>A future oriented approach is chosen to create this place, called DIVE (Design, Innovation, Vision, Exploration). This approach is combined with the Vision in Product Design method, the dynamic capabilities framework, and the Design Driven Innovation method. Since the combination is new, there will be a reflection after every step. The steps are: 1. Understanding the present, 2. Approaching the future, 3. Imagining the future, and 4. Establishing final boundary object. <br/><br/>Understanding the present is achieved through analysing Heineken and the target group. Findings are that the world of beer is under pressure, that Heineken has not their fair share among the Gen Y and Z and that gen Z will bring disruption. For further research the domain is delimited to quality socializing among Gen Z.<br/><br/>Approaching the future results in a list of factors and together with knowledge from the previous step form a future worldview. This worldview is used to create a narrative about the place which indicates characteristics of the Heineken LAB. The place should be in an upcoming urban area where Heineken revamps an old building, look for combining nature, facilitating outstanding experiences, and repurposing old stuff. The place will have an amazing bar at its core to explore new drinking rituals, new production techniques, new beers and drinks and use new technologies.<br/><br/>The final boundary object, which is the result of this thesis, is a strategy including the aim, objectives, KPI’s, characteristics and a roadmap of four steps including planning, approach, allocation of resources, and accompanying themes for creating the Heineken LAB. The defined steps for developing the Heineken LAB are the brewery, the bar, the lounge, and the program. Through a workshop with both internal and external stakeholders the previous research and strategy is validated. Although the number of participants is low, the participants confirmed the research and agreed with the roadmap. After graduating, the strategy will still be in place.<br/><br/>The created framework in the beginning of the project needs more validation before concluding whether it works as an approach to create an innovation lab. Even though it worked for this project, there are limitations. Next to the approach, the ability to envision, inspire, simplify, structure, align, translate, embrace, and educate are needed.","Design; Innovation; Innovation lab","en","master thesis","","","","","","","","","","","","Strategic Product Design","",""
"uuid:49ff2e02-3250-46e6-983a-57de090a755d","http://resolver.tudelft.nl/uuid:49ff2e02-3250-46e6-983a-57de090a755d","Maneuver Prediction and Prepositioning for Lateral and Yaw Motion Cueing","van Veldhoven, Thijs (TU Delft Aerospace Engineering)","Mulder, Max (mentor); Pool, D.M. (mentor); Venrooij, J. (mentor); Kolff, M.J.C. (mentor); Delft University of Technology (degree granting institution)","2022","This study investigates the effectiveness of vehicle dynamics and road environment data for predicting lateral accelerations and yaw rates. This prediction is used to preposition a simulator in anticipation of this motion. A prediction model was created using the road curvature at a specific look-ahead<br/>time and the current vehicle velocity. The model was used to estimate future lateral accelerations and yaw rates for a predefined trajectory on a rural road. The proposed method was used in a human-in-the-loop experiment with 36 participants on a small hexapod. The lateral tilt and yaw gain could be doubled using prepositioning, increased the objective cueing quality, measured in cross-coefficient correlation and absolute difference. The subjective cueing quality was measured through perceived motion incongruence at different road sections and a posthoc questionnaire using a Likert scale. While higher subjective ratings were observed for conditions using lateral prepositioning, no statistically significant results were found. However, workspace management was improved using the prediction and prepositioning model. This allowed for less conservative tuning parameters, significantly improving the objective cueing quality. This method can increase cueing capabilities of a simulator and can be implemented in other driving scenarios, without the need for training data or large computation times.","motion cueing; maneuver prediction; prepositioning; driving simulation","en","master thesis","","","","","","","","2027-04-04","","","","Aerospace Engineering | Control & Simulation","",""
"uuid:406fc49d-76ba-471f-a4e9-325c18b3b398","http://resolver.tudelft.nl/uuid:406fc49d-76ba-471f-a4e9-325c18b3b398","How do we get the adoption of electric vehicles into a higher gear in Europe?","Muller, Steyn Jan Willem (TU Delft Technology, Policy and Management)","Schröder, E. (graduation committee); Blok, K. (mentor); Delft University of Technology (degree granting institution)","2022","The world is under the spell of the energy transition due to climate change. In 2015 197 parties agreed to the Paris-agreement, settings goals for limiting global warming. The transportation sector contributes for almost 25% of all global greenhouse gas emissions (GHG). A promising pathway to decrease emissions from fossil fuels in the transportation sector is to replace conventional internal combustion engines (ICE) with Battery Electric Vehicles (BEV).<br/>This thesis analyses how the introduction of BEVs in Europe can be accelerated. Five countries were selected and categorised, based on Rogers' diffusion of innovation theory.<br/>Based on a literature analysis, the factors influencing the adoption of the BEV were identified and selected. From these factors, an analytical research model was created. This analytical research model was applied to each country in order to compare the countries and draw conclusions. The analytical model consisted of the factors: government regulations and incentives, purchase price, total cost of ownership, charging infrastructure, model availability, consumer characteristics and BEV adoption.<br/>The study concluded that governments have two tools to stimulate the BEV adoption: make the BEV cost effective compared to the ICE and stimulate the charging infrastructure. If it is financially more attractive to drive a BEV in a country than an ICE, this will have a major impact on BEV adoption. Making the BEV financially attractive can be done with tax measures and subsidies. In general, countries with relatively high car taxes can make BEVs more financially attractive than countries with relatively low car taxes, which results in a higher BEV adoption<br/>In addition, a country must ensure that the charging infrastructure grows along with the BEV adoption. In general, it is a pre-condition to develop its slow charger network to stimulate BEV adoption. However, it depends on the country how the slow charger network should be set up. An indicator for this is the percentage of detached houses. If this percentage is high, a country must focus on private charging when setting up its slow charging network. With a low percentage of detached houses, a country must focus on public charging when setting up the slow charging network. Furthermore, it is expected that private parties will jump into the fast charging market. These private parties will only step in if a country has a relatively high BEV adoption, such as Norway and the Netherlands, because it is only then profitable. The study also shows that in countries with a large surface area, it is a precondition to develop its fast charging network. Therefore, when a country has a low BEV adoption, but a large surface, incentives are needed from the government to stimulate a fast charging network.<br/>A financial attractive BEV environment and a well-developed charging infrastructure has as consequence in increasing the number of BEV models. When more BEV models enter the market in a country, consumers have more choice, and this has a stimulating effect on BEV adoption in a country.","#electricvehicle; #adoption; #europe","en","master thesis","","","","","","","","","","","","Management of Technology (MoT)","",""
